division,title,abstract,subjects,publication,date,keywords
FISIP3,"Pemilihan Kepala Daerah Lampung Selatan: Telaah Pengaruh Pendidikan Politik, Komunikasi Politik dan Sosial Ekonomi terhadap Partisipasi Politik","The decreasing of public’s politics participation phenomenon on Regional Head Election of Lampung Selatan District was about 72 % on 2010 and 65% on 2015. Based on average counts of Regional Head Election 2015, Kalianda Sub District was the lowest. This is a quantitative study with explanatory method. The 250 samples were determined by using  proportional area random sampling. The result shows that the public’s political education was categorized low. Meanwhile, Kalianda Sub District has a high number for public’s politics communication or the other words publics have a good political communication to the candidates. The public’s economic status in Kalianda Sub District is categorized as high enough, on the other words that people already have a good living for both in economy and social. Based on statistical test result, Political Education  has an  impact to the politics participation partially by t count  > t table as 3,630 > 1,977, with 43,3% amount of  impact. The political Communication has an impact to politics participation about 4,260 > 1,977 on t count > t table, with 62,2% impact. Social Economics status has an impact by t count > t table  about 3,315 > 1,977, with 48% amount of  impact. Whereas, political education, political communication, and Social Economics status have an impact with the review  Fcount > Ftable (68,957 > 2,710 ) and 51,2%  amount of impact.","G1, JA, JC, JF","PEMILIHAN KEPALA DAERAH KABUPATEN LAMPUNG SELATAN: TELAAH PENGARUH PENDIDIKAN POLITIK, KOMUNIKASI POLITIK DAN SOSIAL EKONOMI TERHADAP PARTISIPASI POLITIK",2020-11-01,
FISIP3,Mengamati Koalisi Partai politik,"Tulisan ini sebagai bagian dari arbituari saya pada sosok Profesor David Beetham,seorang teoritikus sosial Universitas Leeds yang pada tanggal 5 Juli 2022 menginggalkan kita semua.Beetham banyak melahirkan teori dan konsep popular keilmuan sosial politik, mulai dari audit demokrasisampai dengan hak asasi manusia. Banyak sekali pemikiran Beetham yang sangat relevan dengan kondisi sosial politik Indonesia hari ini,setidaknya dalam konteks melihat bagaimana progres transisi demokrasi di Indonesia setelah lebih dari 20tahun reformasi politik berlangsung.","JA, JC",Mengamati Koalisi Partai Politik,2022-08-28,
FISIP3,"Reviewer Hasil Penilaian sejawat
Jurnal Wacana metro an Arizka Warganegara",hasil penilaian rekan sejawat,JC,Jurnal Wacana metro,2019-05-16,
FISIP6,"New Media, Incumbency and Malaysian Politics: The Defeat of the Barisan Nasional (BN) in GE14 (2018)","The Malaysian 14th General Election (GE14) has ended the political domination of Barisan Nasional (BN) of the last 61 years and resulted in a new discussion in Malaysian politics. The main purpose of this study is to explore the factors that caused BN to fail in the last election and to refine the incumbency theory posited by Hirano and Snyder Jr (2012) and Torcal (2014). We argue that various factors have contributed to the defeat of the BN government in the 14th GE, namely the 1MDB corruption scandal, the implementation of the progressive Good and Service Tax (GST), the rise of living costs, and the China-oriented foreign and economic policies, as well as the Mahathir factor. Our results also contribute to further developing incumbency theory. Instead of relying on traditional factor of incumbent defeat in election such as scandal and economic factors, the role of new media in spreading the news about the corruption scandal and the government’s economic underperformance have also contributed to a political shift in Malaysia.","J1, JA, JC, JQ","New Media, Incumbency and Malaysian Politics: The Defeat of the Barisan Nasional (BN) in GE14 (2018)",2023-01-22,
FISIP6,A post-tsunami sea change? Towards post-secular disaster response in Indonesia,"The role of religious actors in disaster response, an issue that is generally understood as being dominated by secular perspectives, is increasingly receiving attention. Surprisingly considering its likelihood to offer relevant insights, however, the concept of post-secularism has seldom been adopted as an analytical framework. In response, in this study we adopt a Habermasian lens to examine the relations between religious and secular actors in Indonesia with respect to the 2018 Sunda Strait tsunami, with particular focus on domestic faith organisations. Through interviewing representatives from three prominent religious organisations and a figure from a relevant independent statutory authority, we highlight these institutions' contributions to the disaster response, alongside their struggles to legitimise their leadership potential. Thus, by demonstrating the existence of constraints on religious groups playing a consequential role in a public concern that would benefit from multiple perspectives and competencies, we exemplify how Habermas’ vision of a post-secular society is playing out in a disaster context and identify areas in which collaboration between ostensibly secular and religious actors might be improved.","G1, GE, GN, H1, JA, JC, JF, JS",A post-tsunami sea change? Towards post-secular disaster response in Indonesia,2021-07,
FISIP4,Riviewer Kerya Ilmiah : BANTAHAN SALAFIYYUN TERHADAP KONSEP  DEMOKRASI YUSUF AL QARDHAWI,Riviewer Kerya Ilmiah : BANTAHAN SALAFIYYUN TERHADAP KONSEP  DEMOKRASI YUSUF AL QARDHAWI,"H1, JC",,2020,
