division,title,abstract,subjects,publication,date,keywords
,ISOLASI DAN APLIKASI FUNGI ENTOMOPATOGEN DARI LARVA Aedes aegypti L.,"Penyakit DBD ( Demam Berdarah Dengue) merupakan masalah serius di Indonesia. Pengendalian penyakit DBD sudah banyak dilakukan, salah satunya adalah penggunaan larvasida jenis temephos (abate). Larvasida merupakan insektisida kimiawi yang memiliki dampak negatif bagi kesehatan manusia dan menyebabkan resistensi. Oleh karena itu dilakukan pengendalian hayati dengan memanfaatkan fungi entomopatogen. Tujuan dari penelitian ini adalah mengetahui efektivitas fungi entomopatogen yang diisolasi dari larva Ae. aegypti terhadap kematian larva nyamuk Ae. aegypti dengan metode moist chamber. Penelitian ini menggunakan Rancangan Acak Lengkap (RAL) dengan pola faktorial dan dilakukan 2 kali pengulangan. Faktor A merupakan jenis fungi dengan 3 taraf yaitu A1: Aspergillus sp. 1, A2: Aspergillus sp. 2, dan A3: Syncephalastrum sp. Faktor B merupakan pengenceran dengan 7 taraf yaitu B0 : Kontrol, B1 : 100 (tanpa pengenceran), B2 : 10-1, B3 : 10-2, B4 : 10-3, B5 : 10-4, B6 :10-5 setiap perlakuan dilakukan 2 pengulangan. Pengamatan dilakukan  24 jam setelah perlakuan selama 3 hari. Data dianalisis menggunakan ANARA dan dilanjutkan dengan Uji Beda Nyata Terkecil (BNT) pada taraf nyata 5%. Hasil penelitian ini menunjukkan bahwa isolat fungi yang paling efektif dalam mematikan larva nyamuk Ae. aegypti adalah Aspergillus sp. 1 dan Aspergillus sp 2. 
Keywords: DHF, Aedes aegypti, Fungi Entomopatogen",QL,Jurnal Biologi Papua,2019,"DHF, Aedes aegypti, Fungi Entomopatogen"
FP3,Identification and Predictive Bioconversion of Cholesterol to Estran and Androst Hormones from Scalloped Spiny Lobster  (Panulirus homarus) Gonads,"Steroidal hormones process from gonadal maturation of scalloped spiny lobster (Panulirus homarus) not established due to undeveloped practice of hatchery technology. Two steroid hormones i.e. estran and androst were elucidated previously and involved on gonadal maturation of scalloped spiny lobster. This study aimed to identified and evaluate role of cholesterol as raw material of estran and androst hormones. Eighteen individuals of immature and mature female scalloped spiny lobster gonads were used and analysed with pyrolysis gas chromatography mass spectrometry (py-GCMS). Results found that cholesta-8,24-dien-3-ol, 4-methyl-3ß-4α (C28H46O) with molecular weight 368 assumed as raw materials for estran and androst hormones. Scalloped spiny lobster may process the enzymatic systems that able to catalysed the bioconversion of cholesta-8,24-dien-3-ol, 4-methyl-3ß-4α to estran and androst hormones.","Q1, QL","International Advanced Research Journal in Science, Engineering and Technology",2023,
FP21,The Effects of Thyroxine Hormone on Gonadal Maturation and Growth of Male Spiny Lobster (Panulirus homarus),"The present experiments were designed to find the optimum dose of thyroxine hormone administration to enhance gonadal maturation and growth of male spiny lobster (Panulirus homarus). Maturation study used 30 male spiny lobsters divided into two treatments of dose of weekly injection of thyroxine hormone i.e., 0 and 0.1 µg/g. Samples were taken to determine parameters of gonadosomatic index (GSI), anatomy and histology of gonads. Growth study used 44 male spiny lobsters divided into 4 treatments of doses of weekly thyroxine injection i.e., 0, 0.1, 0.2, and 0.5 µg/g during 70 days of culture. Growth parameters of specific growth rate (SGR), the growth of carapace length (GCL), the number of molted male spiny lobster, feed conversion ratio (FCR), and survival rate were observed. Results showed that injection of thyroxine hormone at a dose 0.1 µg/g supported optimum SGR and GCL, FCR, molted and survival rate. Moreover, male spiny lobsters injected with thyroxine at a dose of 0.1 µg/g increase GSI (P<0.05), showed a better gonad development and higher number of spermatogonia.","QL, SH",Malaysian Journal of Science,2020-02-29,
FMIPA2,The Diversity of Grasshoppers in Liwa Botanical Garden Based on Time Capture,"ABSTRACT
Grasshopper is one of the diurnal cosmopolitan insect, the existence of grasshoppers is very
influential for some other animal populations such as birds. It is still lack of information of
diversity, distribution, population, and other basic biological aspects of grasshoppers at
Kebun Raya Liwa (KRL). To monitor biodiversity, it is necessary to provide informations
about the number of individuals, their functions, and roles in the habitat and ecosystem.
Therefore it is necessary to conduct the research of these topics. This research was carried
out during November to December 2019, at the Taman Hias Kebun Raya Liwa.
Grasshoppers were cached in the morning from 06.00 AM to 09.00 AM, day from 10.00 AM
to 02.00 PM, and afternoon from 03.00 PM to 06.00 PM . The grasshoppers was cached
using a sweeping net by exploring the Taman Hias Kebun Raya Liwa. The caught
grasshopper was identified at the Zoology Laboratory of the Faculty of Mathematics and
Natural Sciences, Universitas Lampung. The result show that ten species of grasshopper
were found at the Taman Hias Kebun Raya Liwa, i.e. Phaleoba antennata, Phaleoba
fumosa, Phaleoba rustica, Atractomorpha crenulata, Atractomorpha sp., Phillium crurifolium,
Phillium sp, Trilophidia annulata, Oxya chienensis, and Melanoplus differentialentialis. The
index diversity of grasshopper at the Taman Hias Kebun Raya Liwa is categorized to
moderate with H' = 2.223. The best time to catch grasshoppers is in the morning from 06.00
AM-09.00 AM and afternoon from 03:00 PM – 05:00 PM .
Keywords: grasshopper, diversity, time of capture, Kebun Raya Liwa",QL,Jurnal Ilmiah Biologi Eksperimen dan Keanekaragaman Hayati,2020-07,"grasshopper, diversity, time of capture, Kebun Raya Liwa"
FMIPA5,"PREVENTION MODELS TOWARDS HUMAN - TIGER
CONFLICT (HTC) IN BUKIT BARISAN SELATAN NATIONAL 
PARK (BBSNP), LAMPUNG","The population of Sumatran tigers (Panthera tigis sumatrae Pocock, 1929) is having fairly high pressure because of the forest habitat reduction.  Human-tiger conflict (HTC) and its management in Sumatra have become a challenge in the means of tiger conservation because they generate material
loss and deaths, that eventually reduce community tolerance towards its conservation attempt.  Attack and predation towards cattle by tigers have made local community in some suburb villages of Taman Nasional Bukit Barisan Selatan (TNBBS / Bukit Barisan Selatan National Park) to develop some nonlethal control conventional approaches in order
to protect their cattle and to prevent higher conflict to
occur.Seven research location villages around TNBBS give important information in HTC prevention used by community in Bukit Barisan Selatan landscape.  Questionnaire survey and
structured interview have been done on 154 respondents.  Some general local prevention models are anti-tiger attack cage or Tiger Enclosure Proof (TPE), fireplace around the cage, lighting or lamp in the cage, high platform cage, and night patrol and guard.  From the questionnaire done, TPE model is evaluated effective in preventing tigers to enter the cage by local community.  From 48 respondents stating that they have built TPE, there are 4 TPE respondents (8.3 %, n=48) having disruption and predation after TPE is built.  The analysis result of Generalized Linear Model (GLM) shows that TPE model is the best modeling that reducing the number of conflicts with delta value of Akaike’s Information Criterion’(AIC = 28,638), which is the smallest criterion value.  Modeling interpretation defines that more TPEs built by a village of conflict area will decrease the number of occurring conflict frequencies.  
Keywords: sumatran tiger, human, conflict, TPE, GLM",QL,,2016-10,"sumatran tiger, human, conflict, TPE, GLM"
FMIPA2,"Birdwatching Potency at Liwa Botanical Garden, West Lampung","The Liwa Botanical Garden is located in Kubu Perahu Village, Balik Bukit District, West Lampung Regency. The Liwa Botanical Garden has an area of 86 ha, built in 2007 with the theme of Indonesian Ornamental Plants. The Liwa Botanical Garden is one of the destinations that is being developed for tourism activities and used as a recreational object. One of the functions of the Liwa Botanical Garden is as a tourist spot. Plants in the Liwa
Botanical Garden are so beautiful. The Liwa Botanical Garden is a bird habitat because it has an abundant source of food for birds. Therefore it is necessary to do an inventory of bird species by conducting research to find out potential bird species that are used as tourist
attractions (birdwatching) at the Liwa Botanical Garden. This research was conducted on October 2019. The method used was the point count method and rapid assessment. Based on field observations found 14 species of birds that are not protected and only 1 species of birds included in the protected category. And found 8 types of plants, namely 5 types of trees, 1 species of ferns, 1 species of bushes, and 1 type of reeds Keywords: Liwa Botanical Garden, bird species inventory, birdwatching, point count, rapid assessment.",QL,Jurnal Ilmiah Biologi Eksperimen dan Keanekaragaman Hayati,2020-04,"Liwa Botanical Garden, bird species inventory, birdwatching, point count, rapid assessment."
FMIPA2,UJI EFEKTIVITAS SKABISIDA EKSTRAK ETANOL DAUN SIRIH (Piper betle L.) SECARA IN VIVO TERHADAP TUNGAU Sarcoptes scabiei​  PADA MARMUT (Cavia porcellus​),"Unhealthy marmot environment is one of the factors that can cause disease. One such disease is known as scabies. Scabies is caused by Sarcoptes scabiei mites that attack animals, especially on the skin. The aimof the study was to determine the effectiveness of ethanol extract of betel leaf (Piper betle L.​ ) ethanol extract in vivo              
against S. scabiei mites in guinea pigs (Cavia porcellus​ ). This research was conducted in October - November 2019. Sample examination, treatment and observation were         
carried out in the Zoology Laboratory of the Faculty of Mathematics and Natural Sciences while the making of betel leaf extract was carried out at the Botany Laboratory of the Faculty of Mathematics and Natural Sciences. The method used in this research is              
an experimental method with RAL (Complete Randomized Design) experiments. For scabies sample selection, microscopic examination of skin samples is carried out on           
guinea pigs showing clinical symptoms of scabies to confirm the presence of S. scabiei mites. The samples used were 27 marmot scabs which were relatively the same. In this study were divided into 3 treatments, namely positive control, negative control, and administration of 100% betel leaf extract. Data obtained were analyzed using One Way ANOVA and the results obtained p = 0,001 which showed a significant reduction in the wide of the scab. Then proceed with the LSD test (Least Significance Different). Based on the results and discussion, it was concluded that the administration of betel leaf             
ethanol extract (Piper betle L.) in vivo to Sarcoptes scabiei mites in guinea pigs (Cavia porcellus​) had the highest effectiveness as scabidae compared to 0.5% NaCMC.

Keywords: Betel Leaf Extract, Guinea Pigs, Scabies",QL,Jurnal Medika Malahayati,2020-04,"Betel Leaf Extract, Guinea Pigs, Scabies"
FMIPA5,THE COMPARISON OF TOXICITY PURIFIED ISOLATE OF WATER AND METHANOL EXTRACTS OF PAWDER LEAF GLIRICIDIA MACULATA ON MORTALITY SOURSOP MEALYBUG PSEUDOCOCCUS CRYPTUS,"Soursop production in Indonesia continues to decline from year to year. One cause is the mealybug pest (Pseudococcus cryptus). The white lice suck the young fruits soursop to dry and stunted. To control the pest, using botanical insecticides more safety than synthetic insecticides. One of the plants that can be used is Gliricidia maculata. The leaves of G. maculata contain planty of an active compound flavonoid. The purpose of the study to compare the toxicity of the purified isolates of water and methanol extracts of G. maculata leaves on mortality soursop mealybugs (P.cryptus). Extraction was done by maceration series using various organic solvents (n-hexane, dichloromethane, methanol
and water). Fractionation and purification of flavonoids from polar extracts were done by Chromatography Coloum. A set of laboratory experiment was conducted by using block design.  Water and Methanol extracs (WE and ME) with 5 levels concentration i.e. 0%, 0.02%, 0.04%, 0.06% and 0.08%, and 3 replications. ANOVA was conducted to obtain the means and standarrd deviations of the experimental study, and Tukey’s test at α = 5% was peformed in order to obtain the different among the expelimental groups. Analisys Probit were used for compare the efectivities the exstracts.  The result indicated the was toxic to mealybug pest (P. cryptus) with LC50 72 hours water extract 0,061% and metanol extract 0,096%. Therefore water extract more toxic than metanol extract.

Keywords : extract water , methanol , powder leaves (G.maculata) , soursop mealybug (P.cryptus)",QL,Proceeding of 3rd International Wildlife Symposium,2016-10-18,
FMIPA2,"Histopathological Observation of The Qurban Goat’s (Capra Aegagrus Hircus) Lung Organs in Tulus Rejo Village, Pekalongan District, East Lampung 2019 Suspected Of Being Infected With Pneumonia","Placement of goats of various ages and the number of animals that exceed the maximum limit in one cage
can cause the spread of diseases caused by viruses, bacteria, etc. One of them can cause pneumonia. Dirt
and extreme temperatures in East Lampung are feared to increase the growth of bacteria that cause
pneumonia. The purpose of this research was to determine the type of pneumonia that infects and the
differences between the histopathological organs of the healthy qurban goats and those infected with
pneumonia. This research was conducted in October-November 2019 at the Pathology Laboratory of the
Veterinary Institute of Lampung. About 13 samples of lung organ of goat qurban (Capra aegagrus hircus)
were taken from the Baburahman mosque of Tulus Rejo Village, Pekalongan District, East Lampung. The
results of the study found 6 samples of positive qurban goat lungs infected with pneumonia, with the
characteristics of inflammatory cells accompanied by thickening of the septa alveoli, edema, and the
presence of hemorrhage. Based on observations, the most infecting types of pneumonia are pulmonary
edema and peri-bronchial edema. 

Keyword: Pneumonia in Goats; Goats; Hypatological of Pneumonia.",QL,IJIS Edu :Indonesian J. Integr. Sci. Education,2020,
FMIPA2,"Histopathological Observation of The Qurban Goat’s (Capra Aegagrus Hircus) Lung Organs in Tulus Rejo Village, Pekalongan District, East Lampung 2019 Suspected Of Being Infected With Pneumonia","Placement of goats of various ages and the numb  of animals that exceed the maximum limit in one cage can cause the spread of diseases caused by viruses, bacteria, etc. One of them can cause pneumonia. Dirt and extreme temperatures in East Lampung are feared to increase the growth of bacteria that cause pneumonia. The purpose of this research was to determine the type of pneumonia that infects and the
differences between the histopathological organs of the healthy qurban goats and those infected with pneumonia. This research was conducted in October-November 2019 at the Pathology Laboratory of the Veterinary Institute of Lampung. About 13 samples of lung organ of goat qurban (Capra aegagrus hircus) were taken from the Baburahman mosque of Tulus Rejo Village, Pekalongan District, East Lampung. The
results of the study found 6 samples of positive qurban goat lungs infected with pneumonia, with the characteristics of inflammatory cells accompanied by thickening of the septa alveoli, edema, and the presence of hemorrhage. Based on observations, the most infecting types of pneumonia are pulmonary edema and peri-bronchial edema. 

Keyword: Pneumonia in Goats; Goats; Hypatological of Pneumonia.","QL, QP",IJIS Edu : Indonesian Journal of Integrated Science Education,2020-07-21,
FMIPA2,Bisphenol-a (BPA) Menurunkan Diameter Tubulus Seminiferus Tikus Putih Jantan (Rattus norvegicus) Galur Spraque dawley,"Plastik merupakan bahan yang banyak dijumpai dalam kehidupan sehari-hari, baik untuk keperluan rumah tangga,
perkantoran, pertanian/ perkebunan, perindustrian, dan sebagainya. Salah satu jenis plastik yang umum digunakan adalah
plastik polikarbonat (polycarbonate/PC). Bahan utama pada pembuatan plastik polikarbonat adalah senyawa 2,2-bis (4hidroksifenil)

propan atau yang dikenal dengan nama bisphenol-a (BPA). Bisphenol-a dapat berpindah/bermigrasi ke dalam
makanan atau minuman, jika suhunya dinaikkan karena pemanasan. Apabila terpapar, BPA dapat menyebabkan berbagai
masalah kesehatan, salah satunya kesehatan reproduksi. Penelitian bersifat eksperimental selama 21hari. Sampel 24 tikus
Rattus norvegicus jantan galur Sprague dawley dibagi ke dalam 4 kelompok, yaitu K1 yang tidak diberi perlakuan, P1, P2 dan
P3 diinduksi dengan BPA, dengan dosis 100 mg/kgBB (P1), 200 mg/kgBB (P2), dan 400 mg/kgBB (P3). Parameter yang
diamati adalah histologi tubulus seminiferus. Data diuji dengan One Way Anova. Analisis menggunakan One Way ANOVA
menunjukkan terdapat pengaruh pemberian BPA, terhadap rerata jumlah spermatosit primer, rerata jumlah spermatid, dan
diameter tubulus seminiferous (p<0,05). Pemberian dosis 100 mg/kgBB BPA, memberikan pengaruh yang signifikan
terhadap penurunan jumlah sel spermatosit primer dan diameter tubulus seminiferus, serta dosis 200 mg/kgBB BPA,
memberikan pengaruh yang signifikan terhadap penurunan jumlah sel spermatid.",QL,Jurnal Agromedicine,2019-10-10,
FMIPA2,"Dua kelompok besar spesies Gekko di Indonesia
berdasarkan spesimen museum Zoologicum Bogoriense Puslit
Biologi Lembaga Ilmu Pengetahuan Indonesia (LIPI)","Reptiles is a group of the first land animal which throughout their lives breath with lungs, scaled, and has an egg
shell. There are three orders of Reptiles that can be found in Indonesia namely Crocodilia, Testudines, and
Squamata. Squamata is the largest order consisting of 722 species including the Lacertilia sub order and consist
Iguanidae, Agamamidae, Varanidae, Scincidae, Chamelonidae, and Gekkonidae families. Gecko is a common name
for large house lizard or lizard species from Gekkonidae family which narrowly refers to species from Gekko genus.
The aim of this job training is to determine the morphological characteristics of the members of Gekko genus based
on the speciments of the Museum Zoologicum Bogoriense Research Center for Biology Indonesian Institute of
Sciences (LIPI). This job training was held on January 2nd to February 9th 2020. Data were analyzed by Similarity
for Qualitative Data (SIMQUAL) procedure which clustered by Sequential Angglomerative, Hierarachial, and
Nested (SAHN) with Unweighted Pair Group Method with Aritmethic Average (UPGMA) method using Numerical
Taxonomy and Multivariate Analysis System (NTSYSpc) 2.02 to determine interspecies phylogenetic relationship.
Observation were carried out on 24 Gekko speciment from different 4 species, which is Gekko gecko, Gekko smithii,
Gekko monarchus, and Gekko vittatus with 14 morphological characteristics: Dorsal Tubercles (DTR), Gender
(GD), Granulars on Throat (GOT), Nuchal Loop (NL), Post-Mental (PM), Precloacal Pores (PP), PrecloacalFemoral Pores (PFP), Rostral-Nostril (RN), Snout Vent Length 100 (SVL), Subcaudal Devided (SCD), TailDepressed (TDR), and Tail Tubercles (TT). The result of morphological similarity matrix of Gekko species have the
highest phenotypic coefficient (Kf) value of 0.68 which indicating a moderate correlation.",QL,Jurnal Pendidikan Biologi Undiksha,2021-07,
FMIPA2,"Studi Nematoda pada Ayam Petelur (Gallus gallus) Strain Isa Brown di Peternakan Mandiri Kelurahan Tegal Sari, Kecamatan Gading Rejo, Kab. Pringsewu Lampung",,QL,Jurnal Biologi Eksperimen dan Keanekaragaman Hayati,2017-12-02,
FMIPA2,"Studi Nematoda Pada Ayam Petelur (Gallus gallus) Strain ISA BROWN di Peternakan Mandiri Kelurahan Tegal Sari, Kecamatan Gading Rejo, Kab. Pringsewu, Lampung.","Ayam petelur merupakan ayam yang khusus diperlihara untuk dimulai telurnya. Kandungan protein telur yang tinggi serta harganya yang terjangkau membuat ayam jenis petelur ini banyak dibudidayakan. Namun dalam pembudidayaannya masih sering terdapat kendala, salah satunya disebabkan oleh berbagai nematoda yang menyebabkan berbagai macam infeksi. Penelitian ini telah dilaksanakan pada bulan April 2017 sampai bulan Juni 2017. Pengambilan sampel dilakukan di Peternakan mandiri, di Kelurahan Tegal Sari, Kecamatan Gading Rejo, Kabupaten Pringsewu, Provinsi Lampung dan identifikasi dilakukan di Balai Veteriner Lampung. Tujuan penelitian ini adalah untuk mengetahui jenis telur nematode dan mengetahui nilai prevalensi parasit tersebut pada ayam petelur. Metode pengambilan sampel sampel  yang digunakan pada penelitian ini adalah purposive sampling, yaitu mengambil sampel feses dari setiap kandang yang diduga terinfeksi nematode sebanyak 100 sampel. Penghitungan jumlah telur parasit menggunakan uji Mc.Master. Hasil penelitian pada ayam strain ISA brown ditemukan nematode Ascaridia galli, Heterakis gallinarum dan Syngamus trachea. Nilai prevalensi serangan nematoda paling tinggi sebesar 43% oleh Ascaridia galli dan nilai prevalensi paling rendah sebesar 4% oleh Syngamus trachea.",QL,Jurnal Biologi Eksperimen dan Keanekaragaman Hayati,2017-12-02,
FMIPA2,PengaruhPaparanSinarLampuUltraviolet(UV)CterhadapBerat Organ danGambaran HistopatologiHeparMencitJantan(Mus musculus l.),"AbstrakIndonesia merupakan negara tropis, yang kaya akan sinar matahari. Sinar ultraviolet
merupakan suatu radiasi elektromagnetik. Tujuan penelitian ini untuk mengetahuipengaruhpaparan sinar ultraviolet C terhadap hepar mencit jantan (Mus musculusL).Penelitian inimerupakan penelitian eksperimental,menggunakan 25 ekor mencit jantan dari sumber cahayadengan lama paparan per hari 0 jam (K), 30 menit (P1),60 menit (P2),120 menit (P3), dan240 menit (P4) selama 14 hari.Pengamatan dilakukan denganmenimbang berat hepar danmelihat degenerasi bengkak keruh. Hasil penelitian menunjukkan pada gambaranmakroskopis kelompok K (Kontrol) didapatkan rata-rata berat hepar mencit sebesar1,66±0,145, P1 sebesar 1,80±0,352, P2 sebesar 2,08±0,160, P3 sebesar 2,18±0,234, P4sebesar 2,47±0,296. Hasil uji One Way Anovadidapatkan nilai p = 0,001.Pada gambaranmikroskopis kelompok K (Kontrol) didapatkan rata-rata kerusakan hepar mencit sebesar1,08±0,548, P1 sebesar 1,28±0,548, P2 sebesar 1,68±0,548, P3 sebesar 2,12±0,548, P4sebesar 2,52±0,894. Hasil ujiKruskal-Wallisdidapatkan nilai p = 0,000.Dapat disimpulkan bahwa terjadi peningkatan kerusakan hepar mencit jantan yangberbanding lurus dengan lama paparan cahaya lampu ultraviolet-c.",QL,Jurnal Majority,2014,
FMIPA5,CYTOTOXIC ACTIVITY OF METHANOL EXTRACTION OF AVICENNIA MARINA AND TAURIN IN THE HeLa CANCER CELLS,"The aim of study was to determine any anticancer potential from Avicennia marina leaf extract compare to taurine on cytotoxic and anti-proliferation activities against HeLa cervical cancer cell line by using the MTT method (3- (4, 5-dimethylthiazol-2-yl)) - 2, 5-diphenyltetrazolium bromide). The results indicated that methanol extraction of A. marina leaf as well as taurine did have cytotoxic and anti-proliferation effects on HeLa cell line with IC50 values of 321 ppm and 603 ppm 1000 ppm. While the doubling time value for anti-proliferation of A. marina leaf methanol extraction and taurine showed higher values than the control group (72.19 hours).
Keywords : Avicenia marina, taurine, cytotoxic, anti-proliferative,  HeLa cells",QL,IOP Conf. Series: Earth and Environmental Science,2020,
,Cytotoxic activity of methanol extraction of Avicennia marina and taurin in the HeLa cancer cells,"emantisrosa@gmail.com4, hendri_busman@yahoo.com5
*Corespondi Author: Email : elwidi@yahoo.com
Abstract: The aim of study was to determine any anticancer potential from Avicennia marina leaf
extract compare to taurine on cytotoxic and anti-proliferation activities against HeLa cervical
cancer cell line by using the MTT method (3- (4, 5-dimethylthiazol-2-yl)) - 2, 5-
diphenyltetrazolium bromide). The results indicated that methanol extraction of A. marina leaf as
well as taurine did have cytotoxic and anti-proliferation effects on HeLa cell line with IC50 values
of 321 ppm and 603 ppm 1000 ppm. While the doubling time value for anti-proliferation of A.
marina leaf methanol extraction and taurine showed higher values than the control group (72.19
hours).
Keywords : Avicenia marina, taurine, cytotoxic,cytotoxic and anti-proliferative, HeLa cells",QL,,,
