division,title,abstract,subjects,publication,date,keywords
,"Exploring environmental DNA for barcoding
analysis of Sumatran rhino in Way Kambas
National Park.","The Sumatran rhino (Dicerorhinus sumatrensis) is one of five species of rhino in the world. The existence of the
Sumatran rhino is also considered very vulnerable to habitat degradation, internal cross-breeding, disease, and hunting. The
Sumatran rhino population will experience extinction if there are no mature management measures for the long term. It is
assumed that the dynamics of the natural ecosystem in the Sumatran rhino's natural habitat will harm the existence of its
population. Sumatran rhino wallow water is one of the remaining sources of environmental genetic material. Extraction of
eDNA in the wallow water of individual Sumatran rhinos in Sumatra Rhino Sanctuary, Way Kambas National Park aims to determine the results of testing the quality of genetic material from Sumatran rhino wallow water in the Sumatran Rhino Reserve, Way Kambas National Park using simple and molecular methods. DNA extraction using a simple method detects 0/12 samples, whereas using molecular methods can detect 11/12 samples. These results should be followed by detection using specific primers to ensure that the eDNA extracted is Sumatran rhino eDNA.","Q1, QK, QL",AIP Conference Proceedings,2020-10-31,
FMIPA2,"Coral Reef Fish and Plankton Diversity toward Coral Reef Coverage
in Panjang Island of Anak Krakatoa Mountain","Coral reef is part of the marine ecosystem that important because its role as a source of life 
especially for marine variety creatures. This study aims to determine the relationship of the
diversity of reef fish and plankton to coral reef cover on the Panjang Island of Anak Krakatoa
Mount, Lampung. Line Intercept Transect used for retrieval of coral reef data and
Underwater Visual Cencus method for collecting coral reef fish data. Diversity and
dominanceindex are utilized to analyze correlations between them. A good coral reef
isobtained at point 2 (5 meters in depth) while at other points the condition of the coral reef is
classified as moderate. The highest number of fish is found at point 1 (5 meters in depth)
with 56 individuals. The highest plankton diversity is 3.04 Index whereas located at point 2 (0
meters in depth). They have a positive correlation (0.955-coral reef coverage with fishes,
0.916-diversity of reef fish and coral reefs, 0.833-diversity of reef fish with plankton) upon
their relationship.",QL,Jurnal Biologi dan Eksperimen Keragaman Hayati,2019-08,
FMIPA2,Pemberian Inositol Terhadap Peningkatan Pertumbuhan dan SintasanJuvenil Ikan Gurami (Osphronemusgouramy Lac.),"Pertumbuhan ikan gurami (Osphronemus gouramy Lac.) sangat lambat, tingkat mortalitasnya juga tinggi akibat serangan penyakit maupun perubahan lingkungan yang tidak menentu. Inositol adalah kelompok poliol karbosiklik yang banyak ditemukan dalam produk makanan yang dikonsumsi manusia yang diketahui dapat membantu dalam peningkatan imunitas tubuh terhadap bakteri patogen.  Penelitian ini bertujuan untuk mengetahui pengaruh penambahan inositol pada pakan komersil terhadap peningkatan pertumbuhan dan sintasan juvenil ikan gurami.  Penelitian ini  dilaksanakan di  Gedong Tataan, Kabupaten Pesawaran, Provinsi Lampung pada bulan Desember 2013 - Februari 2014.  Penelitian ini menggunakan Rancangan Acak Lengkap (RAL) yang terdiri dari kontrol tanpa penambahan inositol (konsentrasi inositol 0 mg/100 g pakan) dan 2 perlakuan penambahan inositol yaitu konsentrasi 10 mg/100 g pakan, dan 20 mg/100 g pakan.  Data diperoleh setiap minggu diantaranya dalam bentuk sintasan, berat tubuh, panjang tubuh, lebar tubuh, rasio otot (MR), indeks hepatosomatik (HSI), indeks visceralsomatik (VSI), dan  laju pertumbuhan spesifik.  Keseluruhan data dari parameter dianalisis menggunakan Anova dan uji Tukey’s (α=5%).  Hasil penunjukkan bahwa penambahan inositol 10g/100 g pakan menunjukkan tingkat kelulushidupan yang tertinggi, mencapai 99,5%, serta meningkatkan pertambahan berat tumbuh secara nyata (p<0.05) dibandingkan kontrol.  Peningkatan ini diikuti dengan peningkatan panjang tubuh.  Namun semua nilai indeks (HSI, VSI, MR) tidak menunjukkan perbedaan yang nyata.",QL,Jurnal Ilmiah Biologi Eksperimen dan Keanekaragaman Hayati,2014,
FMIPA2,INOSITOL SUPPLEMENT ON FISH DIET FOR GROWTH AND SURVIVAL RATE OF JUVENILE GOURAMI (Osphronemus gouramy Lac.),"Pertumbuhan ikan gurami (Osphronemus gouramy Lac.) sangat lambat, tingkat mortalitasnya juga
tinggi akibat serangan penyakit maupun perubahan lingkungan yang tidak menentu. Inositol adalah
kelompok poliol karbosiklik yang banyak ditemukan dalam produk makanan yang dikonsumsi manusia
yang diketahui dapat membantu dalam peningkatan imunitas tubuh terhadap bakteri patogen.
Penelitian ini bertujuan untuk mengetahui pengaruh penambahan inositol pada pakan komersil
terhadap peningkatan pertumbuhan dan sintasan juvenil ikan gurami. Penelitian ini dilaksanakan di
Gedong Tataan, Kabupaten Pesawaran, Provinsi Lampung pada bulan Desember 2013 - Februari
2014. Penelitian ini menggunakan Rancangan Acak Lengkap (RAL) yang terdiri dari kontrol tanpa
penambahan inositol (konsentrasi inositol 0 mg/100 g pakan) dan 2 perlakuan penambahan inositol
yaitu konsentrasi 10 mg/100 g pakan, dan 20 mg/100 g pakan. Data diperoleh setiap minggu
diantaranya dalam bentuk sintasan, berat tubuh, panjang tubuh, lebar tubuh, rasio otot (MR), indeks
hepatosomatik (HSI), indeks visceralsomatik (VSI), dan laju pertumbuhan spesifik. Keseluruhan data dari parameter dianalisis menggunakan Anova dan uji Tukey’s (α=5%). Hasil penunjukkan bahwa penambahan inositol 10g/100 g pakan menunjukkan tingkat kelulushidupan yang tertinggi, mencapai 99,5%, serta meningkatkan pertambahan berat tumbuh secara nyata (p<0.05) dibandingkan kontrol.
Peningkatan ini diikuti dengan peningkatan panjang tubuh. Namun semua nilai indeks (HSI, VSI, MR) tidak menunjukkan perbedaan yang nyata.",QL,Jurnal Ilmiah Biologi Eksperimen dan Keanekaragaman Hayati,2014-11,
FMIPA2,"GAMBARAN HISTOLOGIS TUBULUS PROKSIMAL GINJAL MENCIT
(Mus musculus L.) JANTAN YANG TERPAPAR KEBISINGAN","Noise is unwanted noise level of an activity in a certain time and cause human health problems . Noise causes physiological or pathological damage on renal function . The
purpose of this study is to determine the histological features of proximal renal tubules of males mice ( Mus musculus L. ) exposed to noise . Benefits of the research is to provide an overview for the males society welfare. The research was conducted from May to June 2013 in the Zoology Laboratory, Biology Department, Faculty of Mathematics and Natural Sciences, Lampung University. Renal histological
preparations were carried out at the Veterinary  investigation Center ( BPPV ) Regional III . This research used Completely Randomized Design ( CRD ) with 25 males mice
(Mus musculus L. ) divided into 5 groups , each group consisted of 5 mice treated with the noise exposure of 6, 8, 10 and 12 hours / day for 21 days . The parameters
measured were the degree of histological damage to the structure of the kidney proximal tubule . Results were analyzed descriptively .The results of the study showed at treatment of 6 hours / day found intertubular hemorrhage , whereas in the treatment of 8 hours / day found intertubular bleeding , piknosis , karioreksis . At 10 hours of
exposure / day found bleeding , piknosis , necrosis , and karioreksis . On exposure 12 hours / day found bleeding, piknosis, kariolisis, necrosis, and congestion.","QL, R1",,,
FMIPA2,"GAMBARAN HISTOLOGIS TUBULUS PROKSIMAL GINJAL MENCIT 
(Mus musculus L.) JANTAN YANG TERPAPAR KEBISINGAN","Noise is unwanted noise level of an activity in a certain time and cause human health
problems . Noise  causes physiological or pathological damage on renal function . The
purpose of this study is to determine the histological features of proximal renal tubules
of  males mice ( Mus musculus L. ) exposed to noise . Benefits of the research is to
provide an overview for the males society welfare. The research was conducted from
May to June 2013 in the Zoology Laboratory, Biology Department, Faculty of
Mathematics and Natural Sciences, Lampung University. Renal histological
preparations were carried out at the Veterinary Investigation Center ( BPPV ) Regional
III . This research used Completely Randomized Design  ( CRD ) with 25 males  mice
(Mus musculus L. ) divided into 5 groups , each group consisted of 5 mice treated with
the noise exposure of  6, 8, 10 and 12 hours / day for 21 days . The parameters
measured were the degree of histological damage to the structure of the kidney proximal
tubule . Results were analyzed descriptively .The results of the study showed at
treatment of 6 hours / day  found intertubular hemorrhage , whereas in the treatment of
8 hours / day found intertubular bleeding , piknosis , karioreksis . At 10 hours of
exposure / day found bleeding , piknosis , necrosis , and karioreksis . On exposure 12
hours / day found bleeding, piknosis, kariolisis, necrosis, and congestion .",QL,,2013-11,
FMIPA2,"STUDI TUMBUHAN SUMBER PAKAN MONYET EKOR PANJANG (Macaca fascicularis) 
DI KAWASAN YOUTH CAMP TAMAN HUTAN RAYA WAN ABDUL RACHMAN LAMPUNG","Jenis pakan monyet ekor panjang dapat berupa daun, buah, biji, bunga, serangga, dan telur burung.
Tujuan penelitian ini adalah untuk mengetahui jenis-jenis tumbuhan dan bagian tumbuhan yang
digunakan sebagai sumber pakan monyet ekor panjang serta lokasi tempat mencari makan.  Penelitian
ini dilaksanakan dari bulan Agustus sampai dengan September 2012 di kawasan Youth Camp Taman
Hutan Raya Wan Abdul Rachman Lampung.  Penelitian ini menggunakan metode observasi. Terdapat 10
jenis tumbuhan yang menjadi sumber pakan monyet ekor panjang, yaitu dahu (Dracontomelon dao Merr.
Et Rolfe.), hampelas (Ficus tinctoria), bayur (Pterospermun javanicum), waluhan (Cucurbitaceae), waru
(Hibicus tiliaceus), keranji (Dalium plattysepalum), bambu (Bambusa sp.), matoa (Pometia pinnata J. R. &
G.Forst.), nangka (Arthocarpus integra), dan melinjo (Gnetum gnemon). Bagian pohon yang dimakan
berupa buah, daun dan bunga.

Kata kunci : monyet ekor panjang, jenis pakan",QL,Jurnal Ilmiah : Biologi Eksperimen dan Keanekaragaman Hayati,2013-03,
,JENIS PHYTOTELMATA SEBAGAI TEMPAT PEERINDUKAN ALAMI NYAMUK Aedes sp. BERDASARKAN JUMLAH TELUR YANG MENDIAMINYA DI AREA KAMPUS UNIVERSITAS LAMPUNG,"Phytotelmata merupakan tumbuhan yang bagian tubuhnya mampu menampung genangan air dan dapat digunakan sebagai tempat perindukan bagi serangga termasuk nyamuk.  Penelitian dilakukan pada Bulan Agustus-Desember 2019 di Area Kampus Universitas Lampung dengan tujuan untuk mengetahui jenis phytotelmata yang berpotensi menjadi tempat perindukan alami Aedes sp. berdasarkan jumlah telur yang mendiaminya, sebagai salah satu upaya dalam membantu pengendalian vektor penyakit DBD.  Penelitian ini menggunakan metode eksperimental dengan Rancangan Acak Lengkap (RAL). Data dianalisis menggunakan ANOVA dan Uji lanjut BNT dengan taraf kepercayaan 95% (α=5%).  Hasil penelitian menunjukkan bahwa ditemukan 6 Jenis Phytotelmata di Area Kampus Universitas Lampung, yaitu Cocos nucifera, Artocarpus heterophyllus, Bambusa sp., Bauhinia purpurea, Colocasia esculenta, dan Musa paradisiaca.  Jenis phytotelmata yang paling berpotensi menjadi tempat perindukan alami nyamuk Aedes sp. adalah Cocos nucifera dengan rerata jumlah telur sebanyak 16,33 butir telur.",QL,Bioma : Berkala Ilmiah Biologi,,
,"THE NUMBER of (Aedes sp.) EGGS LAYING ON DIFFERENCES TIPE AND SPECIES OF PHYTOTELMATA IN AREA OF
LAMPUNG UNIVERSITY","ABSTRACT
Phytotelmata is the part of a plant that can collect water and can be used as a natural breeding site for insects including mosquitoes. This research was conducted in August-December 2019 in the University of Lampung to find out the number of egg in phytotelmata and find the type and species of phytotelmata which are natural breeding site for Aedes sp. This study used an observatory method with a descriptive approach in the field. Analysis data was done using ANOVA and continued with the BNT test with 95% (a=5%) confidence. This research show that it found 3 types of phytotelmata like fruit hole, tree hole, axillary with six species of Phytotelmata such as Cocos nucifera, Artocarpus heterophyllus, Bambusa sp., Bauhinia purpurea, Colocasia esculenta, and Musa paradisiaca. The most potential species of phytotelmata became the natural breeding site for Aedes sp. mosquito is a Cocos nucifera with an average of 16,33 eggs.
Keywords: Aedes sp., Phytotelmata, Cocos nucifera, Musa paradisiaca",QL,Jurnal Ilmiah Biologi Eksperiment dan Keanekaragaman Hayati,,"Aedes sp., Phytotelmata, Cocos nucifera, Musa paradisiaca"
FMIPA2,Histologi Testis Mencit (Mus musculus L.) Muda Dan Tua Yang Diberi Ekstrak Lada Hitam (Piper nigrum L.),"Lada hitam (Piper nigrum L.) dipercaya oleh masyarakat memiliki banyak khasiat. Selain membuat penggunanya tetap sehat, lada hitam juga diduga memiliki kandungan antioksidan yang mampu menangkap radikal bebas sebagai salah satu faktor pemacu penuaan.Telah dilakukan percobaan menggunakan hewan mencit dengan tujuan untuk mengetahui pengaruh lada hitam terhadap perubahan histologi testis dan jumlah spermatozoa mencit muda dan mencit tua.Penelitian ini menggunakan 20 ekor mencit berumur 4 bulan dan 20 ekor mencit berumur 6 bulan. Masing-masing kelompok usia mencit tersebut dibagi menjadi 4 kelompok perlakuan. Kelompok 1, tidak diberi ekstrak lada hitam, kelompok 2, diberi ekstrak air lada hitam 0,3 ppt, Kelompok 3 diberi ekstrak ethanol sebanyak 0,3 ppt, dan Kelompok 4, diberi campuran ekstrak air dan ethanol 0,3 ppt. Data yang didapat dianalisis dengan Analisis Ragam (ANARA) 2 jalur (dengan α = 5%). Hasil penelitian menunjukkan bahwa pemberian ekstrak lada hitam pada mencit usia tua mampu meningkatkan jumlah spermatogonia dengan nilai rata-rata perlakuan mencapai 81,6 sel dan jumlah spermatogonia mencit yang tidak diberi perlakuan berjumlah 47,0 sel dalam 1 sayatan tubulus seminiferus. Sementara itu, jumlah spermatozoa antar setiap perlakuan tidak menunjukkan perbedaan yang nyata.",QL,Jurnal Ilmiah Biologi Eksperimen dan Keanekaragaman Hayati,2013,
FMIPA2,RECENT BIODIVERSITY IN ANAK KRAKATAU ISLAND,"ABSTRACT
Anak Krakatau Island is a volcanic island in the Krakatau preservation complex. With its regular explosions,
ranging from2 80 times/day in the year 2013, it was expected that the biodiversity would experience many
changes. In orderto determine the recent condition of the biodiversity, especially animal inhabitants, a survey
was conducted within the island in June, 2013. The survey was made for mammal, bird, reptile, and
invertebrate(ground, aerial, and arboreal) diversity. For mammals, 10 live traps were used along 100 m of line
transect, birds and reptiles were adopted faced encountered method, while the invertebrate survey was
conducted with visual techniques with a sweep net, pit-fall traps, and light traps. The result from the inventory
(especially invertebrate) was followed by determining the diversity and dominance of species. Relative
abundancewas also determined for mammals only. The survey indicated that there was 1 species of mammal
with 20% of relativeabundance, 13 species of birds within 11 families, 2 species of reptiles, 58 species of
insect, and 10 species of non-insect invertebrates, which consisted of 6 species of Araneae, 2 species of
Scorpiones, 2 species of Chilopoda. The diversity indexfor insects was 4.011 with Bothriamyrmex sp. as
subdominantin which its index of 2.86, and index for non-insects was 2.079. The result also was compared
with the other 3 islands of the Krakatau complex and data collected in the last 10 years.
Key words: Anak Krakatau, volcanic, biodiversity",QL,KnE Life Sciences,2015,
FMIPA2,"Density and Dominance of Mosquitoes’ Larvae that Inhabit Phytotelmata in Residential and Plantation Areas in Pesawaran District, Lampung Province, Indonesia","Phytotelmata is one of the natural breeding places of mosquitoes found in nature. The density of mosquito larvae inhabiting phytotelmata is closely related to the volume of puddles present in the phytotelmata. The research was conducted in residential and plantation area at Pesawaran district, Lampung Province, which aims to find out the type of mosquito larvae, density, and dominance of mosquito larvae that inhabit phytotelmata. The results of this study indicate that in the area of Culex quinquefasciatus larvae larvae have the highest density of 62.76%, and the lowest larvae of Aedes albopictus and Toxorynchites sp. respectively 10,7%. In the highest density plantation area was found in Aedes albopictus larvae of 20.64%. The dominant index of mosquito larvae in the settlement area was 0.4 and the dominant index of mosquito larvae in the plantation was 0.611. 

Keywords: phytotelmata, density, larvae, dominant index",QL,"American Journal of Zoological Research,",,"phytotelmata, density, larvae, dominant index"
FMIPA2,"Density of Different Dipteran Larvae Inhabiting Phytotelmata from Some Locations of West Sumatera, Indonesia","Diptera is kinds of insect’s ordo which has so many members and live in different breeding place, such as Phytotelmata’s plants. Research about Phytotelmata is still rare. That is why this phenomenon is worth to be researched. The aim of this paper is to reveal the density of diptera of Dipteran in some locations of West Sumatera, Indonesia. The result shows that averages of density of dipteran larvae is based locations and kinds of Phytotelmata. The highest density is happened in Bukittinggi (0,60 individu/ml) which based on locations and the lowest is in Payakumbuh with (0,49 individu /ml) both for Ae. Albopictus larvae. Based on kinds of Phytotelmata, Ae. Albopictus larvae mostly lives in Pandanus (0,60 individu /ml) and the lowest is live in Bamboo (0,36 individu /ml).

Keywords: phytotelmata, diptera larvae, density",QL,American Journal of Zoological Research,2016,"phytotelmata, diptera larvae, density"
FMIPA2,"Detection of Transovarial Dengue Virus with RT-PCR in Aedes albopictus (Skuse) Larvae Inhabiting Phytotelmata in Endemic DHF Areas in West Sumatra, Indonesia","Transovarial dengue virus detection by RT-PCR in Ae.albopictus larvae that inhabit Phytotelmata has been conducted in several dengue endemic areas in West Sumatra. The purpose of this study was to determine whether larval Ae. albopictus inhabiting Phytotelmata is a potential transmitter of Dengue Hemorrhagic Fever (DHF). The results concluded that Ae.albopictus larvae which inhabited Phytotelmata positively contained two serotypes of dengue virus (DEN-1) and (DEN-4) which has the potential to transmit and spread DHF. 

Keywords: transovarial, phyotelmata, DHF, Aedes albopictus",QL,American Journal of Infectious Diseases and Microbiology,2015-02-02,"transovarial, phyotelmata, DHF, Aedes albopictus"
FMIPA2,Effects of Black Pepper (Piper nigrum Linn.) Extract on Sexual Drive in Male Mice,"Black pepper (Piper nigrum L.), known as the king of spices, proven to contain various types
of active substances that are allegedly beneficial to the human body functions including sexual
function. This study was conducted to determine whether black pepper extract can be used to
improve sexual function in male subjects. Thirty six healthy male mice, four months old, weighing
between 25-30 g, were used as experimental animals and grouped into four. The first one mice was
given pellets that do not contain black pepper extract as a control. The second and third groups,
respectively were treated with pellets containing aqueous and ethanol extracts. The last group was
given pellets containing aqueous extract and ethanolic extracts with a ratio of 1:1. Pellets were
given once every day for 90 days. Mating behavior test was conducted in an open round plastic tray
with a diameter of 40 cm and height 25 cm. Throughout the test, videotaping was performed for
the following parameters: courtship latency and mounting frequency. The results revealed that
compared with control group, male mice fed on aqueous as well as ethanol extract of black pepper
significantly showed a shorter courtship latency (p<0.05). On the other hand, there was no
difference in the mounting frequency between treated groups. Interestingly, the mounting
frequency showed a strong negative correlation with the courtship latency (r = -0.968). In
conclusion, the fruit extract of black pepper potentially affect sexual drive in male mice.

Key words: Piper nigrum, black pepper, sexual drive, mating behavior",QL,Research Journal of Medicinal Plant,2015,
FMIPA2,Fluctuation of Diptera Larvae in Phytotelmata and Relation with Climate Variation in West Sumatra Indonesia,"Research of fluctuations in Diptera’s larvae in Phytotelmata had been conducted at three locations in West Sumatra, Indonesia; Padang, Bukittinggi and Payakumbuh, which aimed to determine the number and fluctuations Diptera larvae in Phytotelmata. The results obtained; the highest number of individual larvae Diptera in Phytotelmata was 7109 Aedes albopictus larvae (49.56%), followed by larvae of Culex tritaeniorhynchus with 2409 individuals (16.80%). Larvae fluctuated every month and tent to increase in November and December. There was no difference in the number of Diptera larvae individuals inhabiting pandan, taro, and pineapple, but there were significant differences between the three types of Phytotelmata (pandanus, taro and pineapple) with bamboo (p<0.05). Number of individual larvae in Phytotelmata negatively correlated with temperature and rainfall, but positively correlated with humidity (r = 0.44: p<0.05).

Keywords: Phytotelmata, diptera, fluctuation, west sumatera",QL,Pakistan Journal of Biological Sciences,2014,"Phytotelmata, diptera, fluctuation, west sumatera"
FMIPA2,"SOME FACTORS IN WATER CHEMISTRY AND PHYSICS THAT
DETERMINES THE DENSITY OF DIPTERA LARVAE ON
PHYTOTELMATA IN ENDEMIC AREA’S OF DENGUE
HEMORRHAGIC FEVER","As one of the breeding places, various changes in environmental factors may occur in stagnant water contained in
phytotelmata, such as changes in water chemistry and physical factors that can affect the lives of insects that inhabit in that
place. This study aimed to know what the factors in water chemistry are and physics that determines the density of Diptera
larvae in phytotelmata in three endemic areas of Dengue Hemorrhagic Fever. The results showed that the factor of water
chemistry and physics distributed to all types of phytotelmata. In phytotelmata types of taro which determines the density
of larvae is the temperature, in bamboo determined by volume and pH, and in pineapple determined by Zn. However, in
general, water chemistry and physical factors that determine the densities of phytotelmatas are pH with CCA score (0, 933)
and temperature of the water with CCA score (0.621).

Keywords: phytotelmata, diptera, DHF.",QL,ARPN Journal of Agricultural and Biological Science,2016-02,"phytotelmata, diptera, DHF."
,Sub lethal and Lethal Effects of Crude Leaves Extract of Gamal (Gliricidia maculata) on Red Ants (Solenopsis sp.),"Our previous studies showed that crude water extract of gamal (Gliricidia maculata) leaves powder contains flavonoids that are toxic to mealybugs. Our investigation shows that one of the mutualistic symbionts of mealybugs is red ants (Solenopsis sp.). This study is intended to determine whether gamal extract is also toxic to the symbionic ants of the mealybugs. Gamal leaves extract used in this study is crude water extract at the concentration of 0.11%, the LC50 of the extract on mealybug.  For comparison, we use a synthetic insecticide, Regent 50 SC at a concentration of 0,1/200ml as positive control and distilled water as normal control. Two experiments were conducted, sub-lethal and lethal test. For sub-lethal test 30 individuals of red ants were grouped into three (10 ants each). The three groups of ants were exposed to rice that has mixed with distilled water, gamal extract, and synthetic insecticide respectively. The relative distance and position of ants to food was observed every 30 minutes for 12 hours. For mortality test, red ants (n=30) were also grouped into three (10 ants each). The three groups of ants were successively sprayed with distilled water, gamal extract, and synthetic insecticide respectively. Sub-lethal test results showed that gamal leaves extract showed anti-feedant effect on red ants.  Mortality test results showed that gamal leaves extract has a lethal effect similar to the synthetic insecticide.",QL,Specialty Journal Of Biological Sciences,2019,
