division,title,abstract,subjects,publication,date,keywords
FMIPA5,Testosterone Level and Male Genital Formation of Juvenile Redclaw Crayfish After Immersion in Sea Cucumber’s Steroid Extract(SCSE),"In the development of aquaculture, one way to increase the production rate is  is through the cultivation of monosexual sex by directing  genital reversal. In monosex culture, energy from reproduction is diverted to growth, resulting in larger size of spesies culture. One of the genital reversal technique is masculinization, in which the sex development is directed from female to be male. It’s only alters phenotype rather than its genotype. The redclaw crayfish, Cherax quadricarinatus is relatively new commercial commodity. Males of this species grow faster than females, so it is proposed to monosex culture of all-male population for increasing yields. 
The steroid hormone that commonly used in genital reversal was 17α-methyltestosterone. This synthetic hormone has a very high rate of success, but it leaves residues that are detrimental for human health, environment, and cultivated organisms. A study needs to be done to obtain a natural steroid source that is safe for humans and environment. One approach is to exploit a natural hormone extracted from the viscera of sea cucumbers (Holothuria scabra). Therefore, the purpose of the study is to determine testosterone levels in hemolymph and male formation of juvenile crayfish after immersion in the sea cucumber’s steroid extract (SCSE).  
	The study used a Completely Random Design Factorial (CRDF) with two variables consisting of dose variations of SCSE (control, 0, 2, 4 ppm), and immersion time of 18 and 30 hours.  There are 8 group treatments and each treatment with three replications.  The result indicated that SCSE give an effect on increasing testosterone level and male genital formation of juvenile crayfish. There was an interaction between dose and duration time of immersion in the SCSE on testosterone levels.  The highest testosterone level was found in the treatment of 4 ppm SCSE and 30 hours immersion at 0,248 ng/mL with male percentage of 77,45%. The interaction between dose and duration time of immersion SCSE had a significantly effect on the growth, biomass and testosterone levels.  

Keywords : testosterone, redclaw, crayfish, steroid, sea cucumber",QP,,2018-10-29,
FMIPA5,"THE EFFECTIVENESS OF USING STEROID EXTRACT OF SEACUCUMBER 
FOR SEX REVERSAL IN JUVENILE REDCLAW CRAYFISH (Cherax quadricarinatus)","The freshwater crayfish, red claw Cherax quadricarinatus is commercially cultured in many tropical countries. Males of this species have larger harvest size than females, so it is proposed to culture of all-male population for increasing yields. However this practice has hindrance, since it is difficult to provide monosex seed in high quantity.To overcome this problem, it is important to undergo a monosex (single gender) cultivation. Although sex of C. quadricarinatus is determined by genetics, sex reversal from females to males can be triggered by using steroid hormone at their early juvenile stage. The research was conducted to evaluate the effectiveness of sea cucumber's steroid extract for sex reversal from females to males in juvenile crayfish. The research was designed using factorial complete random design. Two different techniques  in giving the steroid hormone, which are by immersion and oral. Two groups of 1-2 weeks old juvenile of C. quadricarinatus were immersed in water containing various doses of  sea cucumber's steroid extract 2 and 4 mg/L respectively, and the other two groups were administered diet containing either extract of sea cucumber or 17α-methyltestoterone (MT) in dose of 50 mg/kg diets. Sex ratio, survival and growth rate were observed at the end of 50 days juveniles rearing in aquaria.  Sex differentiation was determined by visual observation. Data was analyzed by Anova and LSD tests. The results showed that  administration of steroid extract of seacucumber was significantly increased the male ratio of crayfish.  Treatment dose of  2 mg/L during 18 h immersion was effective to increase male sex percentage from 31.03% (control) to 79.86%. On the other hand, 50 mg/kg of steroid extract of sea cucumber in the diet was more effective to increase the male percentage up to 75,16% than MT. Growth rate of juvenile crayfish, included total length, daily weight gain and biomass, were also significantly improved, while survival rate was insignificant. Thus, the administration steroid extract of seacucumber by both immersion and oral are effective to increase male sex percentage of juvenile crayfish.",QP,,2017-09-15,
FMIPA5,"THE EFFECTIVENESS OF USING STEROID EXTRACT OF SEACUCUMBER 
FOR SEX REVERSAL IN JUVENILE REDCLAW CRAYFISH (Cherax quadricarinatus)","The freshwater crayfish, red claw Cherax quadricarinatus is commercially cultured in many tropical countries. Males of this species have larger harvest size than females, so it is proposed to culture of all-male population for increasing yields. However this practice has hindrance, since it is difficult to provide monosex seed in high quantity.To overcome this problem, it is important to undergo a monosex (single gender) cultivation. Although sex of C. quadricarinatus is determined by genetics, sex reversal from females to males can be triggered by using steroid hormone at their early juvenile stage. The research was conducted to evaluate the effectiveness of sea cucumber's steroid extract for sex reversal from females to males in juvenile crayfish. The research was designed using factorial complete random design. Two different techniques  in giving the steroid hormone, which are by immersion and oral. Two groups of 1-2 weeks old juvenile of C. quadricarinatus were immersed in water containing various doses of  sea cucumber's steroid extract 2 and 4 mg/L respectively, and the other two groups were administered diet containing either extract of sea cucumber or 17α-methyltestoterone (MT) in dose of 50 mg/kg diets. Sex ratio, survival and growth rate were observed at the end of 50 days juveniles rearing in aquaria.  Sex differentiation was determined by visual observation. Data was analyzed by Anova and LSD tests. The results showed that  administration of steroid extract of seacucumber was significantly increased the male ratio of crayfish.  Treatment dose of  2 mg/L during 18 h immersion was effective to increase male sex percentage from 31.03% (control) to 79.86%. On the other hand, 50 mg/kg of steroid extract of sea cucumber in the diet was more effective to increase the male percentage up to 75,16% than MT. Growth rate of juvenile crayfish, included total length, daily weight gain and biomass, were also significantly improved, while survival rate was insignificant. Thus, the administration steroid extract of seacucumber by both immersion and oral are effective to increase male sex percentage of juvenile crayfish.",QP,,2017-09-15,
FMIPA2,"Monosex male formation of juvenile redclaw crayfish using
natural steroid hormone from gamma sea cucumber and different doses of honey bee","In a new commercial commodity aquaculture, tropical freshwater crayfish Cherax quadricarinatus, it is known that female has a slower growth rate than male. One way to increase production rate is through monosex cultures comprising all-male population by using genital reversion technique. This biotechnology method can be applied by using hormones and natural products. The natural hormones extracted from gamma sea cucumber, Stichopus variegatus has bioactive substances including steroid compounds, while honey bee contains chrysin compounds that act as aromatase inhibitors. Therefore, the combination of both substances expected can increase in testosterone level and accelerate production in the male monosex population of juvenile crayfish. The purpose of the study is to determine the most
effective dose of honey bee in masculinization of juvenile freshwater crayfish combined with 2 mg.L-1 steroid extract of gamma sea cucumber. Furthermore, a Completely Randomized 
Design (CRD) was designed in the experiment with five different dose of honey bee treatment and dipping method in 2 mg.L-1  steroid extract of gamma sea cucumber for 18 h. Each treatment with four replications. The highest male formation was found in the dose of 20 ml.L-1 honey bee at 83.75% and the lowest was in control. The present of honey bee at different doses in 2 mg.L-1  of gamma steroid extract did not significantly give an effect on percentage of female, intersex formation, survival, and growth rate of juvenile redclaw crayfish.",QP,Journal of Physics: Conference Series,2021-01,
FMIPA2,Masculinization of redclawcrayfish and nile tilapia by immersion using combination of steroid extract of sea cucumber and honey bee,"In the cultivation of redclaw crayfish and nile tilapia it is known that the male has a faster growth rate than the female. Honey bee contains chrysin compounds that act as aromatase inhibitors, while the sea cucumber has bioactive compounds as natural hormone sources, so the combination of both substances expected can increase testosterone production in the masculinization of juvenile crayfish. The purpose of the study is to determine the most effective dose of honey bee in masculinization of juvenile freshwater crayfish and nile tilapia larvae combined with 2 mg/L steroid extract of sea cucumber. The experiment was designed using Completely Randomized Design (CRD) with five-dose treatment of 0, 5,10,15, and 20 ml/L honey bee with dipping method in 2 mg/L steroid extract of sea cucumber for 18 hours. Each treatment with four replications. The results indicated that the highest male formation was found in the dose of 20 ml/L honey beeat 83.75% and the lowest was in the control at 55.35% . The presentof honey bee at different doses with dipping in 2 mg/L of steroid extract have not significant effect on the percentage of the female, the individual intersex, the survival, and the growth of redclaw crayfish.",QP,,2019-10,
FMIPA2,PEMANFAATAN KOMBINASI EKSTRAK STEROID TERIPANG GAMA(Stichopus variegatus)DAN MADU HUTAN DALAM MASKULINISASI JUVENIL LOBSTER AIR TAWAR(Cherax quadricarinatus),"Permintaan pasar akan produksi lobster air tawar jenis capit merah (Cherax quadricarinatus) semakin meningkat, sehingga usaha budidayanya makin banyak dikembangkan. Namun terdapat kendala dimana pertumbuhan lobster jantan lebih cepat dibanding betina pada umur yang sama, sehingga sangat penting dikembangkan budidaya monoseks jantan. Jeroan teripang gama diketahui mengandung senyawa bioaktif yang dapat dimanfaatkan sebagai sumber hormon steroid alami, sedangkan madu mengandung senyawa chrysin yang dapat berperan sebagai aromataseinhibitor, sehingga kombinasi keduanya diharapkan dapat meningkatkan pembentukan monoseks jantan.  Penelitian ini bertujuan untuk mengetahui pemberian dosis madu yang paling efektif dalam pembentukan jantan (maskulinisasi) juvenil lobster air tawar yang dikombinasi dengan perendaman dalam ekstrak steroid teripang gama 2 ppm. Penelitian disusunmenggunakan metoderancangan acak lengkap dengan 5 (lima) perlakuan pemberianmadu dosis berbeda : 0 (kontrol), 5,10,15dan 20 ml/L air dengan cara perendaman (dipping) dalam ekstrak steroid teripang gama 2 ppm selama 18 jam. Tiap perlakuan diulang sebanyak 4 kali.Hasil penelitian menunjukkan persentase pembentukan individu jantan tertinggi terdapat pada pemberian madu dosis 20 ml/L air sebesar 83,75%  dan terendah pada kontrol 55,35%. Dari hasil analisis BNT menunjukkan bahwa pemberian madu dengan dosis yang berbeda dalam ekstrak steroid teripang gama 2 ppm, tidak berpengaruh secara signifikan terhadap pembentukanindividu betina, individu interseks, kelulushidupan, serta pertumbuhan pada juvenil lobster air tawar. 

Kata kunci : lobster air tawar, madu,maskulinisasi, steroid, teripang gama",QP,,2018-07-28,
FMIPA2,MASCULINIZATION OF FRESHWATER CRAYFISH (Cherax quadricarinatus) USING COMBINATION OF STEROID EXTRACT OF GAMMA SEA CUCUMBER  (Stichopus variegatus) AND HONEY BEE,"In the cultivation of freshwater crayfish of red claws (Cherax quadricarinatus) it is known that male has a faster growth rate than female. Honey bee contains chrysie compounds that act as aromatize inhibitors, while the gamma sea cucumberer it has bioactive compounds as natural hormone sources, so the combination of both expected can increase testosterone production in the masculinization of juvenile crayfish. This study aims to determine the most effective dose of honey bee in masculinization of freshwater juvenile crayfish combined with immersion in steroid extract of 2 ppm gamma sea cucumber. The experiment was conducted with Completely Randomized Design (CRD) that was 5 treatment of honey dose (0, 5,10,15, and 20 ml/L water) with dipping method in 2 ppm steroid extract of sea cucumber for 18 hours. Each treatment with four replications. The results showed that the highest percentage of males was found in 20 ml/L water dose of 83.75% and the lowest was found in control 55.35%. The presents of honey bee with different doses in 2 ppm steroid extract did not give significantly an effect on percentage of female, individual intersex, survival, and growth of juvenile crayfish.
	
Keywords :freshwater crayfish, honey bee, masculinization, steroid, gamma sea cucumber",QP,,2018-08-09,
FMIPA5,"Growth and Estimation of Potential Carbon Absorption by
Transplantation Branching Coral Reefs on Mahitam and Pahawang
Islands of Pesawaran Regency, Lampung Province","This study aims to determine the growth and survival and carbon uptake of transplanted coral reefs in Mahitam and Pahawang Islands. Mahitam Island transplants were carried out using iron media and Pahawang Island using concrete media. Growth and survival measurements for 24 months were carried out 3 times from the start of planting. In addition,
measurements of water quality were also carried out at that location. The amount of carbon in coral reefs was measured using spectrophotometry, where samples of coral reefs were dried first then mashed and dissolved using a solution of H2SO4 and K2Cr2O7 1N. The results showed that the branching coral transplanted for 24 months had an average growth of 17.21 cm on Mahitam Island and 19.97 cm on Pahawang Island. The coral survival was higher on Mahitam Island compared to Pahawang Island with a percentage of 92.14 % and 88.24 %. The organic carbon (C) content of the transplanted coral reefs on Mahitam Island was 1.11 % and on Pahawang
Island was 1.01 %. In conclusion, the transplanting of branched coral reefs at Mahitam and Pahawang Islands was said to be successful with high growth and viability. As well as the transplanted coral reefs at the research location can store carbon (C).",QP,Journal of Physics: Conference Series,2021-01,
FMIPA5,UJI ANTIOKSIDAN TAURINE DAN EKSTRAK JAMUR TIRAM TERHADAP EFEK OKSIDAN PARAQUAT PADA JARINGAN PARU MENCIT JANTAN (Mus musculus),"Herbisida cukup memegang peran di bidang pertanian, namun demikian penggunaannya memberikan dampak samping sehubungan dengan peningkatan kerusakan oksidatif melalui pembentukan molekul reaktif-oksidatif (reactive oxidative species atau ROS). ROS ini mampu diperkecil jumlahnya dengan pemberian oksidan.  Tujuan dari penelitian ini adalah untuk mengeksplorasi peran senyawa organic taurine serta ekstrak jamur tiram terhadap efek oksidan paraquat pada jaringan paru mencit jantan, Mus musculus galur DDY.  Metode penelitian menggunakan rancangan acak lengkap dengan 5 perlakuan, yaitu control (K), pemberian paraquat (P1), pemberian ekstrak jamur tiram (P2), pemberian paraquat dan taurine (P3), serta pemberian paraquat dan ekstrak jamur tiram (P4), dengan masing-masing ulangan adalah 6.  Parameter yang diukur adalah konsentrasi malonaldehyde (MDA), glutation, superoxidedismutase (SDO), serta histopatologis jaringan paru.  Analisis data dilakukan dengan ANOVA dan uji lanjut BNT, serta uji Man Whitley pada α 5%. Hasil penelitian ini didapat bahwa pemberian taurine serta pemberian jamur tiram mampu untuk menurunkan efek oksidasi dari paraquat.  Konsentrasi MDA menurun 16-74%, demikian juga konsentrasi SDO menurun 17-20%, sedangkan glutation meningkat >200%.  Untuk efek pemulihan oksidan baik pemberian jamur tiram serta taurine mampu memperbaiki kerusakan jaringan dari skor 5,33 menjadi 3,50.  Kesimpulan dari penelitian ini adalah baik senyawa taurine maupun ekstrak jamur tiram mampu menurunkan efek oksidan paraquat dengan menurunkan konsentrasi MDA dan SOD dan menaikkan konsentrasi glutation, serta mampu memperbaiki jaringan paru sebesar 34-37%.",QP,Prosiding Seminar Nasional Biologi XXIV PBI Manado,2018-03,
FMIPA2,"Taurine and Oyster Mushroom (Pleurotus Ostreatus) Prevents Oxidative Damage in Liver of Mice Induced
by Paraquat","Paraquat is a toxic substance that can cause oxidative damage through increased ROS production. Oxidative damage can be prevented by supplementing with antioxidants, such as taurine and oyster mushrooms. This study aims to determine the ability of taurine and oyster mushrooms in preventing oxidative damage of the liver of mice induced by paraquat. This study uses a completely randomized design. A total of 30 DDY mice were divided into five treatment groups for 3 weeks, namely: 1) control, 2) the oyster mushroom (6.25% in feed and 2.5 g/L in drinking water), 3) paraquat (20 mg/kg, IP), 4) paraquat and taurine (15.6 g/kg) and 5) paraquat and oyster mushrooms. Parameters measured were MDA, glutathione, SOD enzyme levels and histopathological changes in liver. The results showed paraquat increases in liver MDA levels significantly but decreases in liver glutathione levels significantly compared to controls, while taurine and oyster mushrooms reduce the levels of MDA (p<0.05) and increase glutahion levels (p<0.05). Paraquat also increases the levels of SOD (p<0.05), while taurine and oyster mushroom are able to inhibit the increased levels of SOD although they do not show significant (p> 0.05). Paraquat induces liver histopathology change which is characterized by congestion, hydropic degeneration and cloudy swelling. In conclusion, paraquat causes oxidative damage to the liver, while taurine and oyster mushrooms can prevent the damage",QP,Biomedical and Pharmacology Journal,2017-12,
FMIPA2,"Ameliorative Properties of Crude Diosgenin from
Costus speciosus and Taurine on Testicular Disorders
in Alloxan-Induced Diabetic Mice","Diosgenin and taurine are two bioactive chemicals that get high attention in recent decades because it is claimed as an antioxidant, antidiabetic, and pro fertility. The study aimed to investigate the effect of the two substances when used in combination against diabetes-related infertility in
male mice. By using completely randomized design, 35 Swiss albino male mice divided into 7 groups (n=5). Group 1 treated with distilled water as normal control. Group 2 receive only alloxan as diabetic control. Group 3 only fed diosgenin 20% as diosgenin control. Group 4 treated with
alloxan and diosgenin 20%. Group 5 receive alloxan and diosgenin 30%. Group 6 treated with alloxan and taurine. Group 7 treated with alloxan, diosgenin 20% and taurine. Treatments were given intraperitoneally once daily for 14 days. The parameters assessed including blood glucose
levels, body and testis weight, spermatogenic cells counts, sperm counts as well as  sperm motility and viablity. The results showed  crude diosgenin extract from C.speciosus in normal mice lowers the number of spermatogonia,spermatocytes and spermatids cells in addition to decrease sperm motility. In alloxan-induced mice, diosgenin ameliorates the blood glucose levels but noteffective in normalization of the testicular parameters of the animals. Taurine, on the contrary, waseffective both to cope with the blood parameters and testicular disorders in alloxan-induced mice.
Application of diosgenin combined with taurine in alloxan-induced mice, at the end of treatment,most effective in lowering blood glucose levels compared with other treatment but shows little contribution in normalization testicular parameters. Thus, it can be concluded that crude diosgenin
extract from C.speciosus even though combined with taurine has little effect on testicular disorders in alloxan-induced diabetic mice in comparison to the application of taurine alone.
Keywords: Diosgenin, Costus speciosus, Pacing, Diabetes, Taurine, Alloxan.",QP,Biomedical & Pharmacology Journal,2017-02,"Diosgenin, Costus speciosus, Pacing, Diabetes, Taurine, Alloxan."
FMIPA5,"Ameliorative Properties of Crude Diosgenin from
Costus speciosus and Taurine on Testicular Disorders
in Alloxan-Induced Diabetic Mice","Diosgenin and taurine are two bioactive chemicals that get high attention in recent decades because it is claimed as an antioxidant, antidiabetic, and pro fertility. The study aimed to investigate the effect of the two substances when used in combination against diabetes-related infertility in
male mice. By using completely randomized design, 35 Swiss albino male mice divided into 7 groups (n=5). Group 1 treated with distilled water as normal control. Group 2 receive only alloxan as diabetic control. Group 3 only fed diosgenin 20% as diosgenin control. Group 4 treated with
alloxan and diosgenin 20%. Group 5 receive alloxan and diosgenin 30%. Group 6 treated with alloxan and taurine. Group 7 treated with alloxan, diosgenin 20% and taurine. Treatments were given intraperitoneally once daily for 14 days. The parameters assessed including blood glucose levels, body and testis weight, spermatogenic cells counts, sperm counts as well as  sperm motility and viablity. The results showed  crude diosgenin extract from
C.speciosus in normal mice lowers the number of spermatogonia, spermatocytes and spermatids cells in addition to decrease sperm motility. In alloxan-induced mice, diosgenin ameliorates the blood glucose levels but not
effective in normalization of the testicular parameters of the animals. Taurine, on the contrary, was effective both to cope with the blood parameters and testicular disorders in alloxan-induced mice. Application of diosgenin combined with taurine in alloxan-induced mice, at the end of treatment,
most effective in lowering blood glucose levels compared with other treatment but shows little contribution in normalization testicular parameters. Thus, it can be concluded that crude diosgenin extract from C.speciosus even though combined with taurine has little effect on testicular disorders in alloxan-induced diabetic mice in comparison to the application of taurine alone.",QP,Biomedical & Pharmacology Journal,2017-01,
FP21,"The intracellular photopigment and glutathione (GSH)
dynamics in symbiodinium natural population during light
stress and recovery","It is already proven by scientists, that mass coral bleaching is an early signal for
increasing global temperature. Over the last decades, there was a lack of studies aimed at
photoinhibition in Symbiodinium during laboratory treatments. It was important to predict the
initial adaptation in relation to photo-inhibitory of photosynthesis accompanied by slight photoprotective
mechanisms and gradual recovery of Symbiodinium. This information is important to
understand the recovery mechanism of mass coral bleaching, which can help to develop
sustainable management of the ecosystem. In our manuscript, we applied medium light stress
[600 μmol (photon).m-2.s-1] to trigger changes in intracellular photo-pigments (chlorophyll a,
chlorophyll c, carotenoid) and glutathione (GSH) contents in Symbiodinium. The result
showed that light-induced generated various depletion in chlorophyll (chl) a and chlorophyll
(chl) c contents, and more production in intracellular carotenoid and GSH. The total
intracellular GSH increased during the first 10 min of culture at high light treatment and
followed by a decrease (at 60 min). The GSH recovery finished in Symbiodinium even after 6 h
indicated the high ability of photo-protective processes in the species as another photoinhibition
effect and its photosynthetic performance in the initial environment.","Q1, QH301, QP, SH",,2019-09,
