division,title,abstract,subjects,publication,date,keywords
FMIPA2,"Does Expired-Larvicides Impacted to Plankton Abundance
and Diversity?","The using of chemical insecticides for controlling Aedes aegypti can cause mosquitoes resistant to insecticides. One of the natural insecticides commonly used in controlling Ae.
aegypti is Bacillus thuringiensis israelensis (Bti). Bti has been proven effective as larvae of the Ae. aegypti, but its effect on non-target organisms such as plankton is not well known.The purpose of this study was to determine the effect of Bti on plankton abundance and diversity index as a non-target organism. The study was conducted at the Laboratory of Aquatic Molecular Biology, Department of Biology, Faculty of Mathematics and Natural Sciences, the University of Lampung during April 2019 to June 2019, a completely
randomized design (CRD) with Bti concentrations of 0 ppm, 20 ppm, 40 ppm, 60 ppm, 80 ppm 100 ppm and Bti expires 20 ppm with 4 replications. Parameters observed were plankton abundance and diversity index and water quality after larvicide treatments on the 5th day. Data was Analysis of Variance (ANOVA) at α = 0.05. The results showed that Bti
treatments did not have a significant effect (p> 0.05) on plankton abundance and diversity index at different   concentrations, so it’s safe to use in the shrimp pond area.

Keywords: Aedes aegypti, Bacillus thuringiensis israelensis, plankton",QP,Jurnal Ilmiah Biologi Eksperimen dan Keanekaragaman Hayati,2019-12,"Aedes aegypti, Bacillus thuringiensis israelensis, plankton"
FMIPA5,Pengaruh Pemberian Senyawa Taurin dan Ekstrak Daun Dewa Gynura segetum (Lour)Merr terhadap Eritrosit dan Leukosit Mencit(Mus musculus)yang Diinduksi Benzo[α]Piren,"Blood cancer (leukemia) 
Keywords: benzo [α]pyrene, erythrocyte, Gynura segetum is a cancer that occurs due to malignancy of blood cells. Treatment of leukemia generally causesdamage to normal cells. Therefore, it needs a drug that has the effect of repairing cell damage and the ability to boost immunity of normal such as taurine and Gynura leaves which are expected to have anticancer and antioxidant properties.
The purpose of this study was to investigate the effect of taurine and dewa leaf extract on blood tissues induced by benzo [α] pyrene in vivo, by looking at changes in body weight, the number of red blood cells (erythrocytes), the total number and differentiation of white blood cells (leucocyte)in mice (Mus musculus. Data were analyzed by One Way ANOVA test followed by LSD at 5% significance level. The treatment groups were the group I was given 0.2 mL of corn oil (negative control), group II given benzo [α] pyrene as a positive control, Group III given taurine 7.8 mg/BW/day starting from day 1 to 15 before the induction of benzo[α] pyrene until the end of the study), Group IV was given benzo [α] pyrene, then were given taurine 7.8 mg/BW/day were given 2 times a day, as well as the V group was given benzo [α] pyrene, then given a dose of Gynura leaf extract 277.8 mg /BW/day. The results showed taurine and Gynura leaf extract were able to obstruct leukemia by increasing body weight, erythrocyte, leukocyte, and the number of leukocyte differentiation which becomes normalagain. In conclusion taurine has better ability for therapoitic than Gynura leaf extact against blood cells induced by benzo[α]piren",QP,Jurnal Natur Indonesia,2016-10,"benzo [α]pyrene, erythrocyte, Gynura segetum is a cancer that occurs due to malignancy of blood cells. Treatment of leukemia generally causesdamage to normal cells. Therefore, it needs a drug that has the effect of repairing cell damage and the ability to boost immunity of normal such as taurine and Gynura leaves which are expected to have anticancer and antioxidant properties.
The purpose of this study was to investigate the effect of taurine and dewa leaf extract on blood tissues induced by benzo [α] pyrene in vivo, by looking at changes in body weight, the number of red blood cells (erythrocytes), the total number and differentiation of white blood cells (leucocyte)in mice (Mus musculus. Data were analyzed by One Way ANOVA test followed by LSD at 5% significance level. The treatment groups were the group I was given 0.2 mL of corn oil (negative control), group II given benzo [α] pyrene as a positive control, Group III given taurine 7.8 mg/BW/day starting from day 1 to 15 before the induction of benzo[α] pyrene until the end of the study), Group IV was given benzo [α] pyrene, then were given taurine 7.8 mg/BW/day were given 2 times a day, as well as the V group was given benzo [α] pyrene, then given a dose of Gynura leaf extract 277.8 mg /BW/day. The results showed taurine and Gynura leaf extract were able to obstruct leukemia by increasing body weight, erythrocyte, leukocyte, and the number of leukocyte differentiation which becomes normalagain. In conclusion taurine has better ability for therapoitic than Gynura leaf extact against blood cells induced by benzo[α]piren"
FKIP15,Alanine as natural biopesticide from Mirabilis jalapa and its interaction with glutamate as an inhibitor in insects immune system,"Alanine is a secondary metabolic secretion from Mirabilis jalapa. It is used as a modulation of natural pesticide compound. Alanine is predicted to act as an inhibitor compound in the defense mechanisms in the insect body. This study investigated the modeling structures and the protein receptor from alanine in the immune system mechanism and their optimization of the effectiveness as biopesticides to the insects. This research was conducted using an in silico modeling through the reverse docking stage, including the collection of 3D structures of natural compounds, prediction of target protein, receptor profiling, clarification of the potential of alanine compounds based on mode of action with PyRx 0.8 software, and interaction visualization between alanine compounds with the target protein using PyMOL and LigPlus+ software. The results showed that the alanine compounds from M. jalapa plants have targeted well the glutamate receptors in the insects. Both alanine and glutamate compounds have the same interactions with the glutamate proteins receptor shown by the Van der Waals interaction, e.g. the hydrogen bonding on certain amino acids has binding affinity of -15.889 kJ/mol. The interaction between alanine and glutamate affects the signal transduction cascade at the cellular level due to a neuromuscle and olfactory inhibitor. In addition, the continuous interruption of signal transduction affects the dysfunctional immune system of the insect body leading to their mortality.","QH301, QP",Journal of Biological Researches,2018,
FMIPA2,Lectin Protein Spodoptera litura Activity After Exposured by Biopesticide from Mirabilis jalapa,"Spodoptera litura is folifagus agricultural pest with a tendency of resistance towards chemistry compound. This becomes a reason in the efforts to overcome it. The use of botanical material becomes one of the alternatives in controlling its population. The plant of Mirabilis jalapa has the active biopesticide compound that becomes its alternative prevention. This plant has the potential chemistry compound as biopesticide which works toward weakening immunity that is ended by the death of S. litura.  This research aims to analyze the existence of lectin protein as an indicator of immunity reaction’s activation Spodoptera litura after exposing biopesticide M. jalapa. Lectin test was conducted by using spot-test hemagglutination assay (HA) then was seen its speed forming of titer. The result of research shows that lectin was on the part of hemolimf S. litura supernatant. The result test shows that on the concentration 0.2% binding of lectin, carbohydrate and erythrocyte cells of vertebrate formed faster. The speed of titer forming was influenced by the number of hemosit. This is caused by immulectin receptors were on the cell’s surface. Therefore, exposing M. jalapa can induce lectin activation which functioned as the recognizing receptor of strange object which directly bound with carbohydrate related to the reaction of body immunity.","QL, QP",International Journal of Applied Biology,2019,
FP21,"Glutathione (GSH) Production as Protective Adaptation
Against Light Regime Radiation of Symbiodinium Natural Population","Glutathione (GSH), as a wide range of low molecular weight, which found in marine microalgae and event bacteria, are essential to prevent photooxidation and productivity loss from these Radical Oxigen Species (ROS). Symbiodinium, endo-symbiont of corals, were exposed with different UV radiation combined with irradiance treatments to explore biomass specific initial response. Intracellular glutahione was observed as potential adaptive response of Symbiodinium population under environmental specific stress. The result showed that GSH production increased significantly with increasing irradiance and/or UV levels. GSH concentration was fluctuated among populations exposed by different irradiance treatments, but not effected by UV and irradiance exposure. GSH production as a response of UV exposure was higher than irradiance treatments. Both these high correlative fluctuation of intracellular GSH production and the presence of both treatments indicated protective specific adaptation of Symbiodinium under specific environmental stress, respectively","QH301, QP, SH",Ilmu Kelautan,2017-08-17,
FP21,"The effect of light and nitrogen on the lipid
and carotenoid production in Symbiodinium","The marine photoautotrophic and endosymbiotic organism, Symbiodinium, uses a combination
of solar radiation and nutrient as its principal sources to maintain its physiological processes which
include photosynthesis, growth, and intracellular chemical compound production such as lipid and
carotenoid. The present study examined the synergetic effect of light and nitrogen on the intracellular
lipid production and carotenoid accumulation in Symbiodinium. The pure and isolated Symbiodinium was
cultured and treated with a combination of light intensity and nitrogen depletion. Data such as biomass
growth, lipid content, and carotenoid in its initial culture condition were analysed to examine their
correlation. The results showed that the initial stresses reduced biomass, increased total lipid content
which was dominated by palmitic acid (C16:0), linoleic acid (C18:2n6), and linolenic acid (C18:3n3), and
increased the intracellular carotenoid of Symbiodinium. The research identified a highly positive linear
correlation between intracellular lipid production and carotenoid accumulation of Symbiodinium in initial
culture condition.","Q1, QH301, QP, SH",AES Bioflux,2018-07-29,
FMIPA2,"Genotipe Single Nucleotide Polimorphism (SNP) Gen PLA2G10 T512C dan T-123/IN1C pada Penderita Angina Pektoris di Pusat Jantung Nasional Harapan Kita Jakarta, Indonesia","Angina pektoris merupakan salah satu gejala awal yang menjadi penanda masalah kardiovaskuler berat seperti penyakit jantung koroner. Sementara gen PLA2G10 dipercaya memiliki peran, baik dalam progresi aterosklerotik yang menyebabkan deposit plak dan penyumbatan pada arteri koroner, atau justru sebaliknya yaitu antiaterogenik. Polimorfisme PLA2G10 pada titik SNP T512C (rs36072688) dan T-123/in1C (rs4003232) mampu mengubah level ekspresi gen PLA2G10 sebagai gen pengode enzim sPLA2-GX. Penelitian ini bertujuan untuk mengetahui genotip dari PLA2G10 pada titik SNP T512C (rs36072688) and T-123/in1C (rs4003232) para penderita angina pektoris dan mengkaji apakah penyakit disebabkan karena mutasi. Sampel penelitian berupa peripheral blood mononuclear cell koleksi Divisi Litbang Rumah Sakit Jantung dan Pembuluh Darah Harapan Kita. Sampel berjumlah 113, berasal dari penderita angina pektoris dengan dan tanpa plak pada arteri koroner. Hasil penelitian menunjukkan bahwa gen PLA2G10 pada titik SNP T512C (rs36072688) memiliki genotip homozigot wildtype (TT) dan T-123/In1C (rs4003232) memiliki genotip heterozigot (TC) melalui metode TaqMan® SNP Genotyping Assay, dan tidak ada polimorfisme yang ditemukan pada kedua grup sampel tersebut.","QL, QP",Biota Jurnal Ilmu Ilmu Hayati,2020-10,
FMIPA2,"Prevalensi Pneumonia Pada Gambaran Histopatologi Organ Paru
Sapi (Bos Sp.) Qurban Di Daerah Lampung Pada Tahun 2019","Pneumonia is a disease that attack the respiration system especially the lungs that cause inflamation and huld buildup. Pneumonia is caused by variety of organism such as bacteria, virus, fungus and parasite. This research used quasy experiment with quantiying free variables, which
are viral inections and dependent variables that are viewed trought histophatology image. Sample that used is the lungs o qurban’s cow in lampung areas. This disease can be known based on the symptoms such as fever, asphyxyation, cough, and greenish phlegm and a fashter pulse, but that symptoms there’s no such thing as pneumonia disease if there’s no transformation and tissues. The tranformation of tissues can be seen in respiration system esspecislly the lungs, anatomically, it was observed that several change in the cow’s polmonary organs indicated symptoms of pneumonia.
The result microscopically through a histopatho;ogy profile that’s 65% of the 20 samples of the cow’s lung organs were infected by pneumonia 

Keywords: pneumonia; histopatologi; sapi (Bos sp)","QL, QP",ISEJ: Indonesian Science Education Journal,2020-09-01,pneumonia; histopatologi; sapi (Bos sp)
FMIPA5,Pengaruh Pemberian Taurin terhadap Gambaran Histopatologi Paru Mencityang Diinduksi Karsinogen Benzo Piren secara In Vivo,"Lung cancer is a disease that causes high mortality. Drugs used to prevent and cure cancer mostly causes intoxicity to the normal tissues due to its less effectiveness. Therefore, it is necessary to find out any agent or substance which works much more effective and safe for cancer treatment. The aim of the study was to elucidate the role of taurine on the lung tissue of mice 
Keywords: benzo phyren, histhopatology, lung, taurine",QP,Jurnal Natur Indonesia,2016-10,"benzo phyren, histhopatology, lung, taurine"
FMIPA5,TESTOTERONE LEVELS IN HEMOLYMPH OF JUVENILE FRESHWATER CRAYFISH (Cherax quadricarinatus) AFTER IMMERSION IN SEA CUCUMBER’S STEROID EXTRACTS (Holothuria scabra J.)AT DIFFERENT DOSE AND DURATION TIME,"Red claw crayfish (Cherax quadricarinatus) is a freshwater aquaculture commodity that is currently highly demand by the community, because it has a high nutritional value. To increase the production, it can be cultivated by the method of sex reversal. This study aims 1) to determine the most effective dose and duration time of immersion in sea cucumber’s steroid extract on sex reversal of juvenile freshwater crayfish. 2) to measure testoterone levels in hemolymph of juvenile freshwater crayfish. This study used a Completely Random Design Factorial (CRDF) with two variables consisting of dose variations (0, 2, 4 ppm), and dipping time 18 and 30 hours.  Treatment of 8 groups and each treatment with three replications.  The result indicated that sea cucumber’s steroid extracts give an effect on the success of increasing percentage of male genital formation of juvenile freshwater crayfish and there was an interaction between dose and duration time of immersion in sea cucumber’ steroid extract on testosterone levels.  The highest percentage of males was obtained at 4 ppm with 30 hours immersion time of 77,45% and the lowest was in negative control of 42,37%.  The interaction between dose and duration time of immersion had a significantly effect on the growth, biomass and testosterone levels.  The highest testosterone levels was found in the treatment of 4 ppm sea cucumber’s steroid extract and 30 hours immersion at 0,248 ng/mL.

Keywords : freshwater crayfish, sea cucumber, extract, steroids, sex reversal",QP,,2018-08-09,
FMIPA2,Pengaruh Bacillus thuringiensis israelensis Sebagai Larvasida Vektor Demam Berdarah Dengue (DBD) Terhadap Benur Udang Vaname (Litopenaeus vannamei),"Penyakit endemis yang menyebabkan angka kematian tertinggi hampir di seluruh provinsi di Indonesia adalah demam berdarah dengue (DBD). Vektor utama dalam penyebaran penyakit DBD adalah nyamuk Aedes aegypti. Usaha pembibitan udang banyak dikembangkan di Lampung namun usahanya tidak diikuti dengan penyelamatan lingkungan, sehingga muncul wabah DBD dari usaha pembibitan tersebut. Salah satu pengendalian vektor penyakit DBD dengan menggunakan larvasida Bti. Selain harus efektif membunuh larva nyamuk, Bti juga harus aman bagi organisme non target seperti udang vaname (Litopenaeus vannamei).Tujuan dari penelitian ini untuk mengetahui pengaruh Bti sebagai larvasida vektor DBD terhadap mortalitas benur udang vaname (L. vannamei). Penelitian ini dilaksanakan pada bulan November sampai Desember 2018 di Laboratorium Zoologi II, Jurusan Biologi, Fakultas Matematika dan Ilmu Pengetahuan Alam, Universitas Lampung. Metode yang digunakan adalah Rancangan Acak Lengkap (RAL). Perlakuan yang diberikan yaitu kontrol (tidak diberi Bti), dan penambahan Bti 20 ppm, 40 ppm, 60 ppm, 80 ppm, serta 100 ppm. Parameter yang diamati adalah mortalitas benur udang vaname (L. vannamei), pertumbuhan berupa berat dan panjang, kelulushidupan serta kualitas air selama pemeliharaan. Data pertumbuhan yang diperoleh dianalisis dengan ANOVA, sedangkan data persentase mortalitas, kelulushidupan dan kualitas air yang diperoleh dianalisis secara deskriptif. Hasil penelitian menunjukkan bahwa Bti dengan berbagai konsentrasi tidak memberikan pengaruh secara nyata terhadap pertumbuhan (p>0,05), persentase mortalitas dan kelulushidupan benur udang vaname (L. vannamei) sehingga larvasida tersebut dapat digunakan untuk pemberantasan vektor DBD pada hatchery dan tambak udang vaname. 
Kata kunci : Bacillus thuringiensis israelensis, benur udang vaname (L. vannamei), pertumbuhan, mortalitas, kelulushidupan",QP,Journal of Biological Research Bio Wallacea,2019-05,
FMIPA5,Sex reversal of juvenile freshwater crayfish (Cherax quadricarinatus) influenced by steroid extract of sea cucumber and 17α methyltestosterone hormone at different temperatures,"Redclaw crayfish (Cherax quadricarinatus) is a freshwater crayfish with high economic value, which entices fish farmers to farm and increases its production. Males of this species have larger harvest size than females, so it is proposed to culture an all-male population for increasing yields. This research aims to find out the effect of
sea cucumber steroid extract and 17α-methyltestosterone at different temperatures on sex reversal of juvenile 
C. quadricarinatus. This research was designed using factorial complete random design method. The treatments
were observed in controlled temperatures at 27 °C and 31 °C, with a dose of sea cucumber steroid extracts (SCSE) of 
50 mg · kg −1  and 50 mg · kg −1  of 17α-methyltestosterone. The results indicated that both SCSE and  17α-methyltestosterone were most effective at 27 °C on increasing the male percentage of juvenile crayfish, which
were up to 75.16 % and 73.79 % respectively. These steroid hormones had a significant effect on decreasing the
number of female individuals and also on increasing total length, daily weight gain, and growth of juvenile crayfish.
However, they did not make a significant effect on survival rate, the percentage of intersex and feed conversion ratio
of juvenile freshwater crayfish. 

Keywords: 17α-methyltestosterone, freshwater crayfish, sea cucumber, steroid, temperature",QP,AIP Conference Proceedings,2018-08,"17α-methyltestosterone, freshwater crayfish, sea cucumber, steroid, temperature"
FMIPA5,Sex reversal of juvenile freshwater crayfish(Cherax quadricarinatus)influenced by steroid extract of sea cucumber and 17 α-methyltestosterone hormone at different temperatures,"Redclaw crayfish (Cherax quadricarinatus) is a freshwater crayfish with high economic value, which entices fish farmers to farm and increases its production. Males of this species have larger harvest size than females,so it is proposed to culture an all-male population for increasing yields. This research aims to find out the effect of sea cucumber steroid extract and 17α-methyltestosterone at different temperatures on sex reversal of juvenile C. quadricarinatus. This research was designed using factorial complete random design method. The treatmentswere observed in controlled temperatures at 27 °C and 31 °C, with a dose of sea cucumber steroid extracts (SCSE) of 50 mg·kg−1 and 50 mg·kg−1  of 17α-methyltestosterone. The results indicated that both SCSE and 17α-methyltestosterone were most effective at 27 °C on increasing the male percentage of juvenile crayfish, which were up to 75.16 % and 73.79 % respectively. These steroid hormones had a significant effect on decreasing the number of female individuals and also on increasing total length, daily weight gain, and growth of juvenile crayfish. However, they did not make a significant effect on survival rate, the percentage of intersex and feed conversion ratio of juvenile freshwater crayfish.
 
Keywords: 17α-methyltestosterone, freshwater crayfish, sea cucumber, steroid, temperature",QP,AIP Conference Proceedings,2018-08-15,"17α-methyltestosterone, freshwater crayfish, sea cucumber, steroid, temperature"
FMIPA2,Genital reversal of betta fish by immersion using steroid extract of sea urchins,"Sea urchin, Diadema setosum is a potential fishery commodity with high economic value. It contains a steroid compound as an aphrodisiac in male monosexes (masculinization). In aquaculture usually used 17α-methyl testosterone, but it was difficult to decompose or it contaminated with carcinogens and pollutants. Therefore, it needs to be replaced with safer natural hormones from sea urchin.  Betta sp. is an ornamental fish with high demand because of its colorful, diverse tail shapes, and price of male is higher than female, so that male cultivation is beneficial. This study aimed to utilize steroid compounds of sea urchin gonad extracts in masculinization of betta fish. In particular, it is to examine the steroid compounds by providing different doses and soaking times to the formation of male. The study was conducted using a completely randomized design method which was further classified into two stages. In first stage, the soaking dose was 0, 2, 4, 6 and 8 mg L-1 for 12 h, while in stage II, the immersion duration was 0, 12, 18, 24 and 30 h at a dose of 4 mg L-1 in larvae aged 2 weeks.  Each treatment was repeated 3 times, and data were analyzed using Anova as well as with the LSD test at the level of 5%. The results showed that on the immersion in dose of 4 mg L-1, the highest male individual of 84.10% was formed. Also, a dose of 4 mg L-1  was significantly different from the control and 6 mg L-1 . The difference in immersion time significantly affected the success of male monosex formation and the duration of 12 h in dose of 4 mg L-1, but it was not significantly different from that of 2 and 8 mg L-1 sea urchin extracts showed the highest percentage of 84.00%.",QP,IOP Conference Series: Earth and Environmental Science,2021-01,
FMIPA5,SEA CUCUMBER’S STEROID EXTRACT (SCSE) AS SOURCE OF TESTOSTERONE HORMONE IN GENITAL REVERSION OF JUVENILE REDCLAW CRAYFISH,"Sea cucumbers, belong to the class Holothuroidea, are abundant soft-bodied echinoderms found nearly in the benthic areas across sea floor environment in Lampung, Indonesia. One of the bioactive compounds contained in sea cucumber is steroid components that serves as aphrodisiac and sex reversal. In the aquaculture development, one way to increase the production is through the single gender (monosex) cultivation by directing  genital reversal. 
This biotechnology method can be applied using natural or synthetic hormones. The synthetic hormone commonly used is 17α-methyltestosterone. It has a very high rate of success in the male formation up to 100 %, but it leaves residues that are dangerous for human health, environment, and cultivated organisms. A research needs to be done to obtain steroid hormone from the nature which is safe for consumers and environments. One approach is to exploit hormones extracted from the visceral organs of sea cucumbers (Holothuria scabra). Therefore, the aims of the research is to identify the level of  testosterone in hemolymph and male formation of juvenile redclaw crayfish after exposure in the sea cucumber’s steroid extract (SCSE). The research was designed using factorial completely random design, with two variables consists  of SCSE dose variations and immersion time.  Treatment of SCSE in juvenile redclaw crayfish with dipping method, using four-dose treatment of 0, 2, 4 mg/L, one positive control, and dipping time of 18 and 30 h. Each treatment has three replications.  
The result indicated that SCSE give an effect on elevation of testosteron level and male genital formation of juvenile redclaw crayfish. There was an interaction between dose and immersion time in the SCSE on the testosterone levels.  The highest testosterone levels was found in the SCSE dose of 4 mg/L after 30 h exposure at 0,248 ng/mL and the male formation was 77,45%. The interaction between dose and dipping time had a significantly effect on the growth, biomass and testosterone concentration.  

Keywords : Sea Cucumber, Steroid, Testosterone, Genital Reversion, Redclaw Crayfish",QP,,2018-10-25,
