division,title,abstract,subjects,publication,date,keywords
FP25,The influence of magnetic field on the growth of tomato (Lycopersicum esculentum) infected with Fusarium oxysporum,"Abstract— This Previous research suggests that magnetic field (MF) can enhance seedling vigor, growth, and the production of tomato plants. This study examines the influence of MF on the growth of tomato infected by Fusarium oxysporum, fungal pathogen that causes Fusarium wilt in tomatoes. This factorial study arranged in a stripe split plot design. Factors tested consists of long exposure to the MF, M (control; 7'48 ""; II'42"" and 15'36 ""), how to infect fusarium, F (through soaking the seeds and by infecting fusarium through the stem at the age 28 days after sowing (das), and soaking the seeds, S (soaking and without soaking for 15 minutes before MF treatment). Each unit of experiment was repeated 3 times. Parameters measured were percentage of germination, growth rate based on plant height, and fresh weight. Observations were made on the plant until 42 das. Data were analyzed of variance followed by the least significant difference (LSD) test at α = 1 and 5%. The results showed that the interaction between MF and fusarium (MxF), fusarium and soaking (FxS), and MF, fusarium, and soaking (MxFxS) did not produce a different response on all parameters measured. Differences in response to the treatments derived from the treatment of MF (M), Fusarium (F), and the treatment interaction of the MF x soaking (MxS). The MF (M) and the interaction of MF and soaking (MxS) significantly effect on all parameters measured at each measurement. The treatment of Fusarium (F) significantly effect on germination percentage, and fresh weight at 7 das.
Keywords— magnetic field, fusarium, germination percentage, growth rate, fresh weight.",QP,INSIST,2016-10,
FMIPA2,"Histopathological Observation of The Qurban Goat’s (Capra Aegagrus Hircus) Lung Organs in Tulus Rejo Village, Pekalongan District, East Lampung 2019 Suspected Of Being Infected With Pneumonia","Placement of goats of various ages and the numb  of animals that exceed the maximum limit in one cage can cause the spread of diseases caused by viruses, bacteria, etc. One of them can cause pneumonia. Dirt and extreme temperatures in East Lampung are feared to increase the growth of bacteria that cause pneumonia. The purpose of this research was to determine the type of pneumonia that infects and the
differences between the histopathological organs of the healthy qurban goats and those infected with pneumonia. This research was conducted in October-November 2019 at the Pathology Laboratory of the Veterinary Institute of Lampung. About 13 samples of lung organ of goat qurban (Capra aegagrus hircus) were taken from the Baburahman mosque of Tulus Rejo Village, Pekalongan District, East Lampung. The
results of the study found 6 samples of positive qurban goat lungs infected with pneumonia, with the characteristics of inflammatory cells accompanied by thickening of the septa alveoli, edema, and the presence of hemorrhage. Based on observations, the most infecting types of pneumonia are pulmonary edema and peri-bronchial edema. 

Keyword: Pneumonia in Goats; Goats; Hypatological of Pneumonia.","QL, QP",IJIS Edu : Indonesian Journal of Integrated Science Education,2020-07-21,
FK1,PERBANDINGAN MEAN ARTERIAL PRESSURE (MAP) ANTARA OBESITAS GENERAL DENGAN OBESITAS SENTRAL PADA PEGAWAI LAKI – LAKI DEWASA DI LINGKUNGAN UNIVERSITAS LAMPUNG,"Obesitas merupakan kondisi ketidaknormalan akibat kelebihan akumulasi lemak dalam jaringan adiposa. Peningkatan prevalensi obesitas berdampak pada munculnya berbagai penyakit kardiovaskuler. Resiko yang sering ditemukan kardiovaskuler adalah peningkatan tekanan darah. Tujuan penelitian ini adalah mengetahui perbandingan mean arterial pressure antara obesitas general dengan obesitas sentral pada pegawai laki – laki dewasa dengan obesitas di lingkungan Universitas Lampung. Penelitian ini menggunakan metode analitik komparatif dengan pendekatan cross sectional. Penelitian dilakukan pada bulan September-Desember 2016. Populasi dalam penelitian adalah pegawai laki-laki dewasa di lingkungan Universitas Lampung sebanyak 60 responden. Sampel diambil dengan teknik consecutive sampling. Hasil penelitian menunjukan responden rata – rata berumur pada kelompok usia 40 – 49 tahun (51,7%). Rerata nilai mean arterial pressure pada penderita obesitas sentral sebesar 108,22 mmHg dan pada penderita obesitas general sebesar 95,56 mmHg dengan selisih MAP sebesar 12,67 mmHg. Hasil uji T perbandingan MAP pada obesitas general dengan obesitas sentral dengan nilai p = 0,001. Terdapat perbedaan mean arterial pressure antara obesitas general dengan obesitas sentral pada pegawai laki-laki dewasa di lingkungan Universitas Lampung.

Kata Kunci : mean arterial pressure, obesitas general, obesitas sentral.","QP, RZ",Jurnal Kelitbangan Provinsi,2017-04-01,
FMIPA2,Pengaruh Bacillus thuringiensis israelensis Sebagai Larvasida Vektor Demam Berdarah Dengue (DBD) Terhadap Ikan Guppy (Poecilia reticulata),"Penyakit tular vektor merupakan salah satu masalah kesehatan masyarakat yang utama di Indonesia, diantaranya penyakit Demam Berdarah Dengue (DBD) yang ditularkan oleh Aedes aegypti. Untuk mengurangi efek negatif insektisida, dewasa ini pemberantasan vektor diupayakan dengan penggunaan agen biologi yaitu menggunakan Bacillus thuringiensis israelensis (Bti) yang lebih ramah lingkungan dan tidak menyebabkan resisten vektor. Selain harus efektif membunuh larva nyamuk, Bti juga harus tidak membahayakan biota perairan lainnya yang sehabitat seperti ikan Guppy (Poecilia reticulata). Oleh karena itu, penelitian ini bertujuan untuk mengetahui pengaruh Bti terhadap mortalitas ikan Guppy sebagai organisme non target vektor DBD. Penelitian ini dilakukan di Laboratorium Zoologi, Jurusan Biologi, Fakultas Matematika dan Ilmu pengetahuan Alam, Universitas Lampung. Dilaksanakan pada Desember – Februari 2019. Metode penelitian yang digunakan adalah eksperimental skala laboratoris berupa Rancangan Acak Lengkap (RAL) yaitu konsentrasi Bti sebagai perlakuan dengan empat kali ulangan. Perlakuan yang diuji yaitu kontrol ( tidak diberi Bti), dan pemberian Bti dengan konsentrasi 20 ppm, 40 ppm, 60 ppm, 80 pmm, dan 100 ppm. Hasil penelitian menunjukkan pemberian Bti pada konsentrasi berbeda tidak berpengaruh terhadap kematian ikan Guppy dan tidak berpengaruh secara signifikan terhadap pertumbuhan berat total ikan Guppy. 
Kata kunci : Demam Berdarah Dengue (DBD), Bacillus thuringiensis israelensis, ikan Guppy.",QP,Journal of Biological Research Bio Wallacea,2019-05,
FMIPA2,"Taurine Content Of Three Different Macroalgae: Halopuntia L., Sargassum sp. And Eucheuma cottonii L.","As one of the marine resources, macroalgae presumably contains of free 
amino acid such as taurine.  Taurine is known to be one of the most important amino
acid related to hyperosmotic stress for most of living organisms.  The study was
conducted to explore the taurine contain from the most abundance macroalgae found in
Indonesia seawater, especially in Lampung Province, namely Halimeda opuntia L.,
Sargassum sp. and Eucheuma cottonii L. Maceration followed by ethanol extraction
was applied to those three different macroalgae and the filtrate was identified for its
taurine content by using UV-Vis spectrophotometry.  Standard of pure taurine of 0,1
and 1 M was used and the maximum wavelength of under the UV-Vis
spectrophotometry was 630 nm. Simple correlation from the standard taurine was y =
0.001x+0.033 and used to determine the taurine content of those three macroalgae.  The
result indicated that potential taurine content of Halimeda opuntia L was 7.85 mg/100g
dry mass, Sargassum sp was 1.21 mg/100g dry mass and Eucheuma cottonii L was 4.61
mg/100g dry mass.",QP,IOP Proceedings,,
FMIPA2,Antiestrogenic Effect of Tuber Extract of Cyperus rotundus L on The Endometrial Thickness of Mice,similarity,QP,World Journal of Pharmaceutical and Life Sciences,2016,
FMIPA2,Antispermatogenik Effect of Seeds Extract of Papaya (Carica Papaya L) in Mice,similarity,QP,The Pharmaceutical and Chemical Journal,2018,
FMIPA2,"CHEMICAL COMPOSITION OF THE ESSENTIAL OILS DISTILLED FROM TUBER OF RUMPUT TEKI (CYPERUS ROTUNDUS LINN.) GROWING IN TANGGAMUS, LAMPUNG, INDONESIA",Hasil penilaian sejawat sebidang atau peer review karya ilmiah: jurnal ilmiah internasional,QP,European Journal of Biomedical and Pharmaceutical Sciences,2018-04,
FMIPA2,"Chemical Composition of Essential Oils Distilled from Tuber of Rumput Teki (Cyperus rotundus Linn) Growing in Tanggamus Lampung, Indonesia",similarity,QP,European Journal of Biomedical and Pharmaceutical Sciences,2018,
FMIPA2,EFEK ANTIESTROGENIK EKSTRAK RIMPANG RUMPUT TEKI (Cyperus rotundus L.) TERHADAP KETEBALAN SEL GRANULOSA LUTEIN DAN TEKA LUTEIN KORPUS LUTEUM MENCIT (Mus musculus L.),similarity,QP,,2014,
FMIPA2,EFEK ANTIESTROGENIK EKSTRAK RIMPANG RUMPUT TEKI (Cyperus rotundus L.) TERHADAP KETEBALAN SEL GRANULOSA LUTEIN DAN TEKA LUTEIN KORPUS LUTEUM MENCIT (Mus musculus L.).,Hasil penilaian sejawat sebidang atau peer review karya ilmiah:prosiding dan makalah yang dipresentasikan,QP,,2014-05,
FMIPA2,EFEK PEMAPARAN KEBISINGAN TERHADAP JUMLAH SEL-SEL SPERMATOGENIK DAN DIAMETER TUBULUS SEMINIFERUS MENCIT (Mus musculus L.),Hasil penilaian sejawat sebidang atau peer review karya ilmiah: prosiding dan makalah yang dipresentasikan,QP,,2013-11,
FMIPA2,EFEK PEMAPARAN KEBISINGAN TERHADAP JUMLAH SEL-SEL SPERMATOGENIK DAN DIAMETER TUBULUS SEMINIFERUS MENCIT (Mus musculus L.),similarity,QP,,2013,
FMIPA2,"EFFECT OF CONSUMPTION KEMUNING’S LEAF (MURRAYA PANICULATA (L.) JACK) INFUSE TO REDUCE BODY MASS INDEX, WAIST CIRCUMFERENCE AND PELVIS CIRCUMFERENCE ON OBESE PATIENTS",Hasil penilaian sejawat sebidang atau peer review karya ilmiah: jurnal ilmiah internasional,QP,International Journal of Research in Ayurveda and Pharmacy,2017,
FMIPA2,"EFFECT OF CONSUMPTION KEMUNING’S LEAF (MURRAYA PANICULATA (L.) JACK) INFUSE TO REDUCE BODY MASS INDEX, WAIST CIRCUMFERENCE AND PELVIS CIRCUMFERENCE ON OBESE PATIENTS",Simirality,QP,International Journal of Research in Ayurveda and Pharmacy,2017,
FMIPA2,Efek Antiestrogenik Tamoxifen dan Ekstrak Umbi Teki (Cyperus rotundus L.) terhadap Diameter Uterus dan Lumen Uterus Mencit (Mus musculus L.),Hasil penilaian sejawat sebidang atau peer review karya ilmiah: jurnal ilmiah nasional,QP,JK Unila JURNAL KEDOKTERAN UNIVERSITAS LAMPUNG,2018-02,
FMIPA2,Efek Antiestrogenik Tamoxifen dan Ekstrak Umbi Teki (Cyperus rotundus L.) terhadap Diameter Uterus dan Lumen Uterus Mencit (Mus musculus L.),similarity,QP,JUKE,2018,
FMIPA2,"Efek Kuratif Pemberian Jus Buah Naga Putih (Hylocereus undatus) terhadap Motilitas, Jumlah, dan Morfologi Spermatozoa Tikus Putih (Rattus norvegicus) Jantan Galur Sprague dawley yang Diinduksi Siproteron Asetat",Hasil penilaian sejawat sebidang atau peer review karya ilmiah: jurnal ilmiah nasional,QP,Jurnal Majority,2015-11,
FMIPA2,"Efek Kuratif Pemberian Jus Buah Naga Putih (Hylocereus undatus) terhadap Motilitas, Jumlah, dan Morfologi Spermatozoa Tikus Putih (Rattus norvegicus) Jantan Galur Sprague dawley yang Diinduksi Siproteron Asetat",similarity,QP,Medical Journal of Lampung University,2015,
FMIPA2,"Efek Kuratif Pemberian Jus Buah Naga Putih (Hylocereus undatus) terhadap Motilitas, Jumlah, dan Morfologi Spermatozoa Tikus Putih (Rattus norvegicus) Jantan Galur Sprague dawley yang Diinduksi Siproteron Asetat",similarity,QP,Majority,2015,
FMIPA2,Efek Protektif Ekstrak Etanol Daun Binahong Terhadap Gamabaran Histopatologi Hati Tikus Putih Galur Sprague Dawley yang Diinduksi Et,similarity,QP,MAJORITY,2014,
FMIPA2,Extract Etanol Daun Sirsak Berpotensi Memiliki Efek Kemoterapi pada Kanker Payudara Tikus putuh,similarity,QP,Jurnal Kedokteran Brawijaya,2014,
FMIPA2,GAMBARAN HISTOLOGIS TUBULUS PROKSIMAL GINJAL MENCIT (Mus musculus L.) JANTAN YANG TERPAPAR KEBISINGAN,Hasil penilaian sejawat sebidang atau peer review karya ilmiah: prosiding dan makalah yang dipresentasikan,QP,,2013-11,
FMIPA2,GAMBARAN HISTOLOGIS TUBULUS PROKSIMAL GINJAL MENCIT (Mus musculus L.) JANTAN YANG TERPAPAR KEBISINGAN,similarity,QP,,2013,
FMIPA2,Histologi ginjal mencit akibat radiasi cahaya lampu merah,Hasil penilaian sejawat sebidang atau peer review karya ilmiah: jurnal ilmiah nasional,QP,Jurnal Ilmiah Biologi Eksperimen dan Keanekaragaman Hayati,2013-07,
FMIPA2,Histologi ginjal mencit akibat radiasi cahaya lampu merah,similarity,QP,JurnalIlmiah Biologi Eksperimen dan Keanekaragaman Hayati,2013,
FMIPA2,Histologi ulas vagina dan waktu siklus estrusmasa subur mencit setelah pemberian ekstrak rimpang rumput teki,Hasil penilaian sejawat sebidang atau peer review karya ilmiah: prosiding dan makalah yang dipresentasikan,QP,,2013,
FMIPA2,Histologi ulas vagina dan waktu siklus estrusmasa subur mencit setelah pemberian ekstrak rimpang rumput teki,similarity,QP,,,
FMIPA2,PEMERIKSAAN STRUKTUR HISTOLOGIS DAN FUNGSI HATI MENCIT YANG TERPAPAR MEDAN LISTRIK TEGANGAN TINGGI,Hasil penilaian sejawat sebidang atau peer review karya ilmiah: prosiding dan makalah yang dipresentasikan,QP,,2010,
FMIPA2,PEMERIKSAAN STRUKTUR HISTOLOGIS DAN FUNGSI HATI MENCIT YANG TERPAPAR MEDAN LISTRIK TEGANGAN TINGGI,similarity,QP,,2010,
FMIPA2,POLA RESISTENSI Pseudomonas sp. DARI SAMPEL PUS TERHADAP ANTIBIOTIK DI UPTD BALAI LABORATORIUM KESEHATAN PROVINSI LAMPUNG PERIODE AGUSTUS 2014-AGUSTUS 2015,Hasil penilaian sejawat sebidang atau peer review karya ilmiah: prosiding dan makalah yang dipresentasikan,QP,,2015-11,
FMIPA2,POLA RESISTENSI Pseudomonas sp. DARI SAMPEL PUS TERHADAP ANTIBIOTIK DI UPTD BALAI LABORATORIUM KESEHATAN PROVINSI LAMPUNG PERIODE AGUSTUS 2014-AGUSTUS 2015,similarity,QP,,2015,
FMIPA2,Pengaruh Kebisingan Terhadap Kualitas Spermatozoa Mencit,Hasil penilaian sejawat sebidang atau peer review karya ilmiah: prosiding dan makalah yang dipresentasikan,QP,,2013,
FMIPA2,Pengaruh Kebisingan Terhadap Kualitas Spermatozoa Mencit,similarity,QP,,2013,
FMIPA2,Pengaruh Protektif dan Kuratif Pemberian Suplemen Jus Buah Naga Putih (Hylocereus undatus) terhadap Histologi Tubulus Seminiferus Tikus Putih (Rattus norvegicus) Dewasa Galur Sprague dawley yang Diinduksi Siproteron Asetat.,Hasil penilaian sejawat sebidang atau peer review karya ilmiah: jurnal ilmiah nasional,QP,Jurnal Agromedicine,2016,
FMIPA2,Pengaruh radiasi lampu merkuri terhadap berat dan panjang fetus mencit,Hasil penilaian sejawat sebidang atau peer review karya ilmiah: jurnal ilmiah nasional,QP,Jurnal Biologi Eksperimen dan Keanekaragaman Hayati,2013,
FMIPA2,Pengaruh radiasi lampu merkuri terhadap berat dan panjang fetus mencit,similarity,QP,Jurnal Ilmiah Biologi Eksperimen dan Keanekaragaman Hayati,2013,
FMIPA2,Potensi Ekstrak Etanol Daun Pare Sebagai Alternatif Obat Penyembuh Luka pada Punggung Mencit Jantan,Hasil penilaian sejawat sebidang atau peer review karya ilmiah: jurnal ilmiah nasional,QP,Jurnal Penelitian Pertanian Terapan,2017-05,
FMIPA2,Potensi Ekstrak Etanol Daun Pare Sebagai Alternatif Obat Penyembuh Luka pada Punggung Mencit Jantan,similarity,QP,Jurnal Penelitian Pertanian Terapan,2017,
FMIPA2,Rhizome Extract of White Ginger Maintains Testicular Function of Aging Mice,Hasil penilaian sejawat sebidang atau peer review karya ilmiah: jurnal ilmiah internasional,QP,International Journal of Nutrition and Food Sciences,2016,
FMIPA2,Rhizome Extract of White Ginger Maintains Testicular Function of Aging Mice.,similarity,QP,International Journal of Nutrition and Food Sciences,2016,
FMIPA2,"Root Extract of Purwoceng Enhances Aggressiveness, but Not Libido, in Male Mice",Hasil penilaian sejawat sebidang atau peer review karya ilmiah: jurnal ilmiah internasional,QP,Annual Research & Review in Biology,2017,
FMIPA2,"Root Extract of Purwoceng Enhances Aggressiveness, but Not Libido, in Male Mice",similarity,QP,nnual Research & Review in Biology,2017,
FMIPA2,Sperm Quality of Mice Decreased by Seed Extract of Papaya (Carica Papaya L),Hasil penilaian sejawat sebidang atau peer review karya ilmiah: jurnal ilmiah internasional,QP,European Journal of Biomedical and Pharmaceutical Sciences,2018-08,
FMIPA2,Sperm Quality of Mice Decreased by Seed Extract of Papaya (Carica Papaya L),similarity,QP,European Journal of Biomedical and Pharmaceutical Sciences,2018,
FMIPA2,Struktur Histologi Kartilago Epifisialis Fetus Mencit Setelah Pemberian Ekstrak Metanol Rimpang Teki,Hasil penilaian sejawat sebidang atau peer review karya ilmiah: jurnal ilmiah nasional,QP,Jurnal Ilmiah Biologi Eksperimen dan Keanekaragaman Hayati,2014-11,
FMIPA2,Struktur Histologi Kartilago Epifisialis Fetus Mencit Setelah Pemberian Ekstrak Metanol Rimpang Teki,similarity,QP,Jurnal Ilmiah Biologi Eksperimen dan Keanekaragaman Hayati,2016,
FMIPA2,Struktur Histologis Hati Mencit Sebagai Respon Terhadap Kebisingan,Hasil penilaian sejawat sebidang atau peer review karya ilmiah: prosiding dan makalah yang dipresentasikan,QP,,2013-11,
FMIPA2,Struktur Histologis Hati Mencit Sebagai Respon Terhadap Kebisingan,similarity,QP,,2013,
FMIPA2,Struktur Tulang Belakang Fetus Mencit Setelah Pemberian Ekstrak Etanol Rimpang Teki,Hasil penilaian sejawat sebidang atau peer review karya ilmiah: jurnal ilmiah nasional,QP,Jurnal Biologi Eksperimen dan Keanekaragaman Hayati,2016-01,
FMIPA2,Struktur Tulang Belakang Fetus Mencit Setelah Pemberian Ekstrak Etanol Rimpang Teki,similarity,QP,Jurnal Ilmiah Biologi Eksperimen dan Keanekaragaman Hayati,2016,
FMIPA2,Testicular Function of Rats Treated with Water Extract  of Red Ginger Combined with Zinc,Hasil penilaian sejawat sebidang atau peer review karya ilmiah: jurnal ilmiah internasional,QP,Journal of Food and Nutrition Research,2016,
FMIPA2,Testicular Function of Rats Treated with Water Extract of Red Ginger Combined with Zinc.,similarity,QP,jurnal of food and NR,2016,
FMIPA2,Uji Senyawa Taurin Sebagai Antikanker Terhadap Jumlah Sel-sel Leukosit dan Sel-sel Eritrosit Mencit yang Diinduksi Benzo(A) Pyren Secara in Vivo,Hasil penilaian sejawat sebidang atau peer review karya ilmiah: jurnal ilmiah nasional,QP,Jurnal Penelitian Pertanian Terapan,2016-05,
FMIPA2,Uji Senyawa Taurin Sebagai Antikanker Terhadap Jumlah Sel-sel Leukosit dan Sel-sel Eritrosit Mencit yang Diinduksi Benzo(A) Pyren Secara in Vivo,similarity,QP,Jurnal Penelitian Pertanian Terapan,2016,
FMIPA2,efek protektif ekstrak daun binahong terhadap gambaran histopatologi hati tikus galur spragae dawley yang diinduksi et,Hasil penilaian sejawat sebidang atau peer review karya ilmiah: jurnal ilmiah nasional,QP,Jurnal Majority,2014-02,
FMIPA2,efek protektif ekstrak daun binahong terhadap gambaran histopatologi lambung tikus galur sprague dawley yang diinduksi etanol,Hasil penilaian sejawat sebidang atau peer review karya ilmiah: jurnal ilmiah nasional,QP,Jurnal Majority,2014-02,
FMIPA2,efek protektif ekstrak daun binahong terhadap gambaran histopatologi lambung tikus galur sprague dawley yang diinduksi etanol,similarity,QP,MAJORITY,2014,
FMIPA2,efek protektif ekstrak daun binahong terhadap gambaran histopatologi tubulus proksimal ginjal tikus galur sprague dawley yang diinduksi etanol,Hasil penilaian sejawat sebidang atau peer review karya ilmiah: jurnal ilmiah nasional,QP,Jurnal Majority,2014-02,
FMIPA2,efek protektif ekstrak daun binahong terhadap gambaran histopatologi tubulus proksimal ginjal tikus galur sprague dawley yang diinduksi etanol,similarity,QP,Majority,2014,
FMIPA2,"efek teratogenik ekstrak rimpang rumput teki terhadap jumlah fetus, panjang depan dan belakang serta malformasi fetus mencit",Hasil penilaian sejawat sebidang atau peer review karya ilmiah: jurnal ilmiah nasional,QP,Jurnal Ilmiah Biologi Eksperimen dan Keanekaragaman Hayati,2016-01,
FMIPA2,"efek teratogenik ekstrak rimpang rumput teki terhadap jumlah fetus, panjang depan dan belakang serta malformasi fetus mencit",similarity,QP,Jurnal Ilmiah Biologi Eksperimen dan Keanekaragaman Hayati,2016,
FMIPA2,effect of exposure to high voltage electrical field in abnormalitles mycardial bucieus mouse,Hasil penilaian sejawat sebidang atau peer review karya ilmiah: jurnal ilmiah internasional,QP,JUKE,2013-03,
FMIPA2,effect of exposure to high voltage electrical field in abnormalitles mycardial bucieus mouse,similarity,QP,Juke Unila,2013,
FMIPA2,ekstrak etanol daun sirsak berpotensi memiliki efek kemoterapi pada kanker payudara tikus,Hasil penilaian sejawat sebidang atau peer review karya ilmiah: jurnal ilmiah nasional,QP,jurnak kedokteran brawijaya,2014-08,
FMIPA2,pengaruh paparan sinar lampu ultraviolet terhadap berat organ dan gambaran histopatologi hepar mencit jantan,Hasil penilaian sejawat sebidang atau peer review karya ilmiah: jurnal ilmiah nasional,QP,Jurnal Majority,2014-02,
FMIPA2,pengaruh paparan sinar lampu ultraviolet terhadap berat organ dan gambaran histopatologi hepar mencit jantan,similarity,QP,Majority,2014,
FMIPA2,pengaruh pemberian ekstrak rimpang rumput teki pada endometrium mencit,Hasil penilaian sejawat sebidang atau peer review karya ilmiah: jurnal ilmiah nasional,QP,JUKE,2013-09,
FMIPA2,pengaruh pemberian ekstrak rimpang rumput teki pada endometrium mencit,similarity,QP,Juke Unila,2013,
FMIPA2,peningkatan ketebalan miokardium mencit akibat paparan medan listrik tegangan tinggi,Hasil penilaian sejawat sebidang atau peer review karya ilmiah: jurnal ilmiah nasional,QP,Majalah Kedokteran Bandung,2013-09,
FMIPA2,peningkatan ketebalan miokardium mencit akibat paparan medan listrik tegangan tinggi,similarity,QP,jurnal MKB,2013,
FMIPA2,perbandingan obat amaryl dengan ekstrak rimpang rumput teki terhadap gula pada mencit jantan yang diinduksi aloksan,Hasil penilaian sejawat sebidang atau peer review karya ilmiah: jurnal ilmiah nasional,QP,Jurnal Penelitian Pertanian Terapan,2016-01,
FMIPA2,perbandingan obat amaryl dengan ekstrak rimpang rumput teki terhadap gula pada mencit jantan yang diinduksi aloksan,similarity,QP,Jurnal Penelitian Pertanian Terapan,2016,
FMIPA2,"Lipid Contain of Three Microalgae on Culture 
with Different pH and Salinity","Three species of microalgae were used in this study, namely Nitzschia sp., Porphyridium sp., and
Tetraselmis sp., which collected from the Lampung Agency of Maricultures – Ministry of Coastal and Marine
Affairs.  They were cultured in room temperature with 12:12 day light and given different salinities and pH for
treatment groups with complete randomized design. Nitzschia sp. and Porphyridium sp. were treated within
factorial design 2x2, namely 20 and 40 ppt in salinities and 5 and 10 in pH, while the Tetraselmis sp. was given
with factorial 3x3, namely 10, 15, 20 ppt of salinities and 5, 8, 9.5 in pH.  All the cultures for 7 days were replicated
3 times.  Analysis of variance followed by LSD at 5% level of significant was applied to analyse the data on
specific growth rate and total lipid contains.  The results indicated that highest growth rate of Nitzschia sp. was in 20 ppt of salinity and at pH of 10, while Porphyridium sp. was in 40 ppt salinity and at pH of 5.  But the highest lipid content of Nitzschia sp. was in 40 ppt of salinity with 5 pH, and Porphyridium sp. was in 40 ppt of salinity and 5 in pH. Tetraselmis sp. had the highest growth rate in 20 ppt of salinity and at pH of 9.5, but the highest total lipid of it was in 10 ppt of salinity with 9.5 pH.",QP,IOP Proceedings,2019-08,
FMIPA2,Identification of bacteria causing Vibriosis (Vibrio sp) on white snapper (Lates calcarifer) reared in the marine cultivation ponds (Similarity Check),"Vibrio is a group of bacteria that causes Vibriosis in many aquatic biota cultivated in ponds. This research aims to
determine the type of the Vibrio sp. which causes vibriosis disease in white snapper reared in the marine cultivation
ponds at the Center for Marine Cultivation Fisheries (CMCF) Lampung, Indonesia. The research was conducted using
investigative method by isolating Vibrio bacteria from the organ in white snapper, mud, and water. The bacterial isolates
were indentified using biochemical test. The reseach parameters are TPC (Total Plate Count) Vibrio sp., water
temperature, pH, salinity, DO, BOD and ammonia. The results showed there were three types of isolates that are
suspected as the Vibriosis bacteria in white snapper fish namely Vibrio vulnificus, Vibrio alginolyticus and Vibrio
parahaemolyticus. The three isolates obtained were known to be α-hemolysis. The enviromental quality parameters are
as follows: water temperature of 29.8 °C, pH 7.8, salinity 33 psu, DO 4.4 mg / L, BOD 2.2 mg / L and ammonia 2.2 mg /
L. The TPC-values of the bacteria Vibrio sp. isolated from the inlet, the main chambers, and the outlet of the pond are: <25 CFU/ ml, 7.6x104 CFU/ml, and 2.1x103 CFU/ml respectively. The levels of ammonia and calculation of TPC-values of Vibrio bacteria are exceeds the water quality standards for the fish farming.","QL, QP",,2022-09,
