division,title,abstract,subjects,publication,date,keywords
FMIPA2,UJI EKSTRAK DAUN KEMANGI (Ocimum sanctum L.) DALAM BENTUK SALEP DAN SPRAY SEBAGAI SKABISIDA TUNGAU Sarcoptes scabiei,"The use of scabies drugs (scabicide) is generally made from synthetic chemical compounds. The effect of the administration of synthetic chemical compounds is the resistance of mites to drugs. Basil leaves can be an alternative to scabicide because they contain essential oils containing active ingredients eugenol, cineol, and flavonoids. The study was conducted in October-November 2019. The purpose of this study was to determine the potential of basil leaf extract as a scabicide and to find out the basil leaf extract preparations that were more effective between ointment and spray. This research was an experimental type with a Completely Randomized Design (CRD) consisting of four treatment groups (control +, control-, basil leaf extract ointment, basil leaf extract spray) and six replications. The research data were analyzed using One Way (ANOVA) and the results showed that there was a
significant difference in the width of the scab between treatments (p = 0.000). The results of the study were continued using Fisher LSD (Least Significant Different) at a 5% significance level, the smallest scab width obtained in the basil leaf extract ointment preparation. The conclusion from this research is that basil leaf extract can be used as a scabicide and ointment preparations are more effective than spray.

Keywords:body mass index (BMI), diabetes melitus tipe 2, total cholesterol","QL, QP",Jurnal Medika Malahayati,2020-01-01,
FMIPA5,The Effect of Immersion Time and Dose Variation of Steroid Extract of Sea Cucumber (Holothuria scabra) Towards Sex Reversal of Juvenile Freshwater Crayfish (Cherax quadricarinatus),"Freshwater crayfish (Cherax quadricarinatus) is one of fishery commodities which is highly market demand. In order to increase the number of male critters, it is important to know about sex reversal on crayfish. One method of manipulating sex reversal in crayfish is by dipping in steroid hormones. Sea cucumber is one type of marine commodities that has domestic and international valueas a potensial fishery commodities. The sea cucumber contains a bioactive substance called steroid compound. The aim of this research is to know the effect of dipping time and dose variation of steroid extract of sea cucumber on sex reversal to male on juvenile freshwater redclaw crayfish (C. quadricarinatus).  The research used Factorial Random Design (FRD) with 9 teartments and 3 replications. The data was analyzed by using analysis of variance (Anara) in accordance with the design used Completely Random Design (CRD) of two variables.  When there was any difference, the test must be continued with the Smallest Different Test (α =5%). The result showed that immersion in 2mg/L of steroid extract of seacucumber for 18 h was the best treatment as it resulted the highest number of male percentage at 79 ,86% and the lowest was in control at 31,03%. Also, the steroid influenced on several aspects of growth, such as total length, daily weight and biomass of juvenile crayfish, but it was not give significantly effect on their survival rate.Giving the steroid extract of seacucumber with different immersion time has resulted the formation of male monosex in juvenile crayfish with the best treatment in 18 h of soaking and dose of 2mg/L.",QP,,2017-07-13,
FMIPA5,The Effect of Immersion Time and Dose Variation of Steroid Extract of Sea Cucumber (Holothuria scabra) Towards Sex Reversal of Juvenile Freshwater Crayfish(Cherax quadricarinatus),"Freshwater crayfish (Cherax quadricarinatus) is one of fishery commodities which is highly market demand. In order to increase the number of male critters, it is important to know about sex reversal on crayfish. One method of manipulating sex reversal in crayfish is by dipping in steroid hormones. Sea cucumber is one type of marine commodities that has domestic and international valueas a potensial fishery commodities. The sea cucumber contains a bioactive substance called steroid compound. The aim of this research is to know the effect of dipping time and dose variation of steroid extract of sea cucumber on sex reversal to male on juvenile freshwater redclaw crayfish (C. quadricarinatus).  The research used Factorial Random Design (FRD) with 9 teartments and 3 replications. The data was analyzed by using analysis of variance (Anara) in accordance with the design used Completely Random Design (CRD) of two variables.  When there was any difference, the test must be continued with the Smallest Different Test (α =5%). The result showed that immersion in 2mg/L of steroid extract of seacucumber for 18 h was the best treatment as it resulted the highest number of male percentage at 79 ,86% and the lowest was in control at 31,03%. Also, the steroid influenced on several aspects of growth, such as total length, daily weight and biomass of juvenile crayfish, but it was not give significantly effect on their survival rate.Giving the steroid extract of seacucumber with different immersion time has resulted the formation of male monosex in juvenile crayfish with the best treatment in 18 h of soaking and dose of 2mg/L.",QP,,2017-07-13,
FMIPA5,"The Effect Of Methanolic Extract of  Brown  (Sargassum p.),  Red (Gracillaria sp.)Macroalga and Taurine Towards Hepar Histopathology of Male Mice (Mus musculus)Which Induced By  Benzo (α)Pyrene","Cancer is a disease marked by the existence of abnormal growth of cell continuously and uncontroll in an organism body. Benzo(α)pyrene is one of the substances that can cause a cancer. The methanolic extract of Sargassum sp. and Gracillaria sp. has anticancer and antioxidant activity. Other compounds with antioxidant activity is taurine. The aim of this research is to examine the effect from methanolic extract of Sargassum sp. and Gracillaria sp .and also taurine on  hepar histopatology of  male mice (Mus musculus) induced by benzo(a)pyrene. This research used  Completely Randomized Design. 30 male mice were divided into 6 groups of treatments, those were: K1 = (K-), K2= induced by benzo(α)pyrene for 10 days, K3= after induced by benzo(α)
pyrene, were given the Sargassum sp. orally with a dose 8mg/mice during 15 days, K4=after induced by benzo (a)pyrene, were given the combination of  Sargassum sp. (8mg/mice) and taurine(15,6mg/mice) orally during
15 days, K5= after induced by benzo (α)pyrene, were given the Gracillaria sp.orally with a dose 8mg/mice during 15 days, and K6=after  induced by benzo(a)pyrene, were given the combination of  Gracillaria sp.(8mg/mice) and taurine (15,6mg/mice) orally during 15 days. Data were analyzed using ANOVA (α = 5%).The result shows that the  combination  of Sargassum sp. and Gracillaria sp. and taurine can increase the number of erythrocyte , decrease the number of leucocyte and protect the damage of hepar histopatology of 
male mice (Mus musculus) induced by benzo (α)pyrene. Combination of extract  Gracillaria sp. and taurine is
the most effective to protect the damage hepar histopatology of  male mice(Mus musculus) induced by benzo (α )pyrene.

Keywords: male mice,Sargassum sp., Gracillaria sp., taurine, benzo(a)pyrene, hepar",QP,Jurnal Biologi Indonesia,2018-06,"male mice,Sargassum sp., Gracillaria sp., taurine, benzo(a)pyrene, hepar"
FMIPA5,"The Effect Of Methanolic Extract of Brown (Sargassum p.),Red (Gracillaria sp.) Macroalga and Taurine Towards Hepar Histopathology of Male Mice (Mus musculus) Which Induced By Benzo (α)Pyrene","Cancer is a disease marked by the existence of abnormal growth of cell continuously and uncontroll in an organism body. Benzo(α)pyrene is one of the substances that can cause a cancer. The methanolic extract of Sargassum sp. and Gracillaria sp. has anticancer and antioxidant activity. Other compounds with antioxidant activity is taurine. The aim of this research is to examine the effect from methanolic extract of Sargassum sp. and Gracillaria sp .and also taurine on hepar histopatology of male mice (Mus musculus) induced by benzo(a)pyrene. This research used Completely Randomized Design. 30 male mice were divided into 6 groups of treatments, those were: K1 = (K-), K2= induced by benzo(α)pyrene for 10 days, K3= after induced by benzo(α)pyrene, were given the Sargassum sp. orally with a dose 8mg/mice during 15 days, K4=after induced by benzo(a)pyrene, were given the combination of Sargassum sp. (8mg/mice) and taurine(15,6mg/mice) orally during 15 days, K5= after induced by benzo (α)pyrene, were given the Gracillaria sp.orally with a dose 8mg/mice during 15 days, and K6=after induced by benzo(a)pyrene, were given the combination of Gracillaria sp. (8mg/mice) and taurine (15,6mg/mice) orally during 15 days. Data were analyzed using ANOVA (α = 5%). The result shows that the combination of Sargassum sp. and Gracillaria sp. and taurine can increase the number of erythrocyte , decrease the number of leucocyte and protect the damage of hepar histopatology of male mice (Mus musculus) induced by benzo (α)pyrene. Combination of extract Gracillaria sp. and taurine is the most effective to protect the damage hepar histopatology of male mice(Mus musculus) induced by benzo(α )pyrene.
Keywords: male mice,Sargassum sp., Gracillaria sp., taurine, benzo(a)pyrene, hepar",QP,Jurnal Biologi Indonesia,2018-06,"male mice,Sargassum sp., Gracillaria sp., taurine, benzo(a)pyrene, hepar"
FMIPA5,THE EFFECT OF STEROID EXTRACTS OF SEA CUCUMBER (Holothuria scabra) AND 17α METHYLTESTOSTERONE AT  DIFFERENT TEMPERATURE ON SEX REVERSAL OF JUVENILE FRESHWATER CRAYFISH (Cherax quadricarinatus),"Red claw (Cherax quadricarinatus) is one kind of fresh water cray fish with high economic value which encourages farmers to increase their production. However, there are several obstacles where the growth of female individuals is faster than male. To overcome this problem, it is important to undergo a monosex (single gender) cultivation. The aim of this research is to find out the effect of sea cucumber's steroid extract and 17α methyltestosterone at different temperature to sex reversal to males on juvenile freshwater crayfish, Cherax quadricarinatus. This research was designed using Factorial Complete Random Design Method. The treatments were observed at temperatures of 27° C and 31ºC as follows: 50 mg/kg of sea cucumber's steroid extracts at temperatures of 27°C and 31ºC, and 50 mg/kg of 17α methyltestosterone at temperatures of 27 ° C and 31 ° C. The results showed that the most effective use of steroid extracts of sea cucumber and 17α methyltestosterone was at 27°C to increase the male percentage of 75.16% and 73.79% respectively and gave a significant effect on female genital decrease, total length, daily weight gain and biomass. While giving the steroid hormone did not make a significant effect on survival rate, intersex percentage and feed conversion of juvenile freshwater crayfish.",QP,,2017-07-13,
FMIPA5,THE EFFECT OF STEROID EXTRACTS OF SEA CUCUMBER (Holothuria scabra) AND 17α METHYLTESTOSTERONE AT  DIFFERENT TEMPERATURE ON SEX REVERSAL OF JUVENILE FRESHWATER CRAYFISH (Cherax quadricarinatus),"Red claw (Cherax quadricarinatus) is one kind of fresh water cray fish with high economic value which encourages farmers to increase their production. However, there are several obstacles where the growth of female individuals is faster than male. To overcome this problem, it is important to undergo a monosex (single gender) cultivation. The aim of this research is to find out the effect of sea cucumber's steroid extract and 17α methyltestosterone at different temperature to sex reversal to males on juvenile freshwater crayfish, Cherax quadricarinatus. This research was designed using Factorial Complete Random Design Method. The treatments were observed at temperatures of 27° C and 31ºC as follows: 50 mg/kg of sea cucumber's steroid extracts at temperatures of 27°C and 31ºC, and 50 mg/kg of 17α methyltestosterone at temperatures of 27 ° C and 31 ° C. The results showed that the most effective use of steroid extracts of sea cucumber and 17α methyltestosterone was at 27°C to increase the male percentage of 75.16% and 73.79% respectively and gave a significant effect on female genital decrease, total length, daily weight gain and biomass. While giving the steroid hormone did not make a significant effect on survival rate, intersex percentage and feed conversion of juvenile freshwater crayfish.",QP,,2017-07-13,
FMIPA2,ANTI-HYPERCHOLESTEROLEMIC EFFECT OF ETHANOL FRUIT EXTRACT OF VANILLA (Vanilla planifolia Andrews) ON MALE MICE,"Hypercholesterolemia is a condition characterized by high levels of cholesterol in the blood. Vanilla is one among plants that has cholesterol-lowering substances, but research on this subject is still lacking. This study aimed to determine whether ethanol fruit extract vanilla (Vanilla planifolia Andrews) can be used as anti-hypercholesterolemia in mice induced by quail egg suspension. Male mice (n=20) were divided into five groups. Group-1 (negative control) was given only high-fat quail egg yolks suspension. Group-2 (positive control) was treated with simvastatin at the dose of 10 mg/kg. Whereas group-3, 4 dan 5 were given vanilla extract of 50, 100, dan 200 mg/kg body weight respectively. The results showed that ethanol fruit extract of vanilla at the dose of 200 mg/kg significantly reduced level of blood cholesterol compared with that of negative control. It is worth concluding that vanilla fruit extract potential to be used as anti-hypercholesterolemia.",QP,European Journal of Biomedical and Pharmaceutical Sciences,2019,
FMIPA2,FRUIT EXTRACT OF VANILLA (Vanilla planifolia Andrews) LOWERS TOTAL BLOOD GLUCOSE IN ALLOXAN-INDUCED HYPERGLYCEMIC MICE,"Hyperglycemia, a high level of blood glucose, is a main indicator of diabetes mellitus. Diabetic patients that do not manage the sugar levels in their blood can suffer from many severe complications. One of plant origin bioactive suspected to have anti-hyperglicemic activity is vanillin. This study aimed to determine whether ethanol fruit extract vanilla (Vanilla planifolia Andrews), the main source of vanillin, can be used as anti-hyperglicemia in mice induced by alloxan (150mg/kg). Male mice (n=24) were divided into six groups. Group 1 (normal control) did not receive induction or treatment. Group-2 (negative control) was induced with alloxan but received no drug. Group-3 (possitve control) was treated with glibenclamide at the dose of 0.039 mg/kg. Whereas group-4, 5 dan 6 were given vanilla extract of 2.1, 4.2, dan 8.4 mg/g body weight respectively. The treatment were given once daily for 14 days. Blood glucose levels were examined on day-0 (base line), 6th, 13th and 20th. The results showed by day-13 all levels of vanilla extract have significantly reduce blood glucose levels compared with negative control group. On the 20th day the effect of reducing blood sugar by vanilla fruit extract has even surpassed the glibenclamide. It can be concluded that ethanol fruit extract of vanilla is potential to be used as antidiabetes.",QP,EUROPEAN JOURNAL OF PHARMACEUTICAL AND MEDICAL RESEARCH,2019,
FMIPA2,Sub Lethal And Lethal Effects Of Crude Leaves Extract Of Gamal (Gliricidia Maculata) On Red Ants (Solenopsis Sp.),"Our Previous Studies Showed That Crude Water Extract Of Gamal (Gliricidia Maculata) Leaves Powder Contains Flavonoids That Are Toxic To Mealybugs. Our Investigation Shows That One Of The Mutualistic Symbionts Of Mealybugs Is Red Ants (Solenopsis Sp.). This Study Is Intended To Determine Whether Gamal Extract Is Also Toxic To The Symbionic Ants Of The Mealybugs. Gamal Leaves Extract Used In This Study Is Crude Water Extract At The Concentration Of 0.11%, The LC50 Of The Extract On Mealybug.  For Comparison, We Use A Synthetic Insecticide, Regent 50 SC At A Concentration Of 0,1/200ml As Positive Control And Distilled Water As Normal Control. Two Experiments Were Conducted, Sub-Lethal And Lethal Test. For Sub-Lethal Test 30 Individuals Of Red Ants Were Grouped Into Three (10 Ants Each). The Three Groups Of Ants Were Exposed To Rice That Has Mixed With Distilled Water, Gamal Extract, And Synthetic Insecticide Respectively. The Relative Distance And Position Of Ants To Food Was Observed Every 30 Minutes For 12 Hours. For Mortality Test, Red Ants (N=30) Were Also Grouped Into Three (10 Ants Each). The Three Groups Of Ants Were Successively Sprayed With Distilled Water, Gamal Extract, And Synthetic Insecticide Respectively. Sub-Lethal Test Results Showed That Gamal Leaves Extract Showed Anti-Feedant Effect On Red Ants.  Mortality Test Results Showed That Gamal Leaves Extract Has A Lethal Effect Similar To The Synthetic Insecticide.",QP,Specialty Journal Of Biological Sciences,2019,
FMIPA2,Testicular Function of Rats Treated with Water Extract of Red Ginger (Zingiber officinale var.rubrum) Combined with Zinc,"Ginger is suggested as an antioxidant, has androgenic as well as hypoglycemic effect, whereas zinc claimed as fertility supplement. However, scientific study on the effects of ginger along with zinc in combination is still very limited. Current study aims to investigate any possible effect of ginger extract combined with zinc on testicular function of male albino rats. Twenty-four male Wistar rats weighing180-200g and aged 10-12 weeks were randomly grouped into four consisted of six rats. Group 1 treated with distilled water (control); group 2, 3 and 4 are the rats given 500 mg/kg of ginger extract plus consecutively of 0 mg/kg; 0.5 mg/kg and 1 mg kg zinc sulfate. The testicular function variables measured were testosterone levels, sperm concentration, sperm quality, and spermatogenic cell counts. The results showed that serum testosterone levels, sperm count, percentage of sperm viability and motility was higher in the mice given a combination of ginger extract and zinc compared with controls (P<0.01). Conversely the percentage of abnormal sperm morphology was decreased (P<0.01). Moreover, rats group receiving oral combination of ginger extract and zinc significantly showed an increased in the pre leptotene and pachytene spermatocytes, and spermatids (P<0.01), but showed no significant difference in the spermatogonia cell counts (P>0.05). In conclusion, water extract of red ginger combined with zinc, administered orally potentially enhance testicular function including steroidogenesis and spermatogenesis in male rats.",QP,Journal of Food and Nutrition Research,2016,
FMIPA2,Therapeutic potentials of sungkai (Peronema canescens Jack.) an Indonesian luxurious woody plant,"In Indonesia sungkai plant (Peronema canescens Jack.) categorized as a luxurious timber because the wood is used for various purposes such as: for houses construction, interior finishes, furniture and decorative veneer. Besides being used for its wood, the sungkai plant is also used as a medicinal plant to treat several diseases such as: fever, ringworm, and toothache.In this article, several pharmacological research results that verify the claims of traditional communities about the medicinal properties of this plant are presented. The results of the existing research indicate that the sungkai plant has therapeutic potential.",QP,World Journal of Biology Pharmacy and Health Sciences,2022-07-28,
FMIPA2,"Testicular Dysfunction in Male Rats Reversed by Ethanolic
Extract of Pitaya Fruit","Abstract: Sexual disorders have a great impact on men's life, so that is why efforts in searching materials and techniques for
the effective treatment of safe and cheap still continued. However, many of the natural material that is claimed efficacious
drugs for the high content of bioactive, particularly for sexual disorders, has not been scientifically tested. This study was
designed and conducted to ascertain whether the dragon fruit (Hylocereus sp) which is claimed to be efficacious as an
antioxidant as well as anti-aging, can be used as a remedy for sexual function disorders and fertility in male rats. Male
Sprague-Dawley rats (Rattus novergicus) aged 10 – 12 weeks, grouped in to four consisted of six rats each, treated once daily for
25 days. Group 1 (control) was given 1 ml CMC 1%; group 2 received extract of pitaya fruit at a dose of 500mg/kg; group 3
treated with cyproterone acetate (CPA) at a dose of 25mg/kg; whereas group 4 adminstered with 25mg/kg CPA and 500mg/kg of
pitaya fruit extract. CPA treatment effectively reduces serum testosterone while pitaya fruit extract effectively enhances the
androgen concentration; increases spermatozoa counts, sperm viability, sperm motility, and spermatid counts. However, pitaya
fruit fail to restore the decrease of primary spermatocyte due to CPA induction. So, the conclusion white pitaya fruit extract
effectively increase the synthesis of testosterone and play a role spermiogenesis, thus the pitaya fruit herbs can be used as an
enhancer of sexual activity and fertility in male.",QP,Journal of Diseases and Medicinal Plants,2016-08,
FK1,PERBANDINGAN MEAN ARTERIAL PRESSURE (MAP) ANTARA OBESITAS GENERAL DENGAN OBESITAS SENTRAL PADA PEGAWAI LAKI – LAKI DEWASA DI LINGKUNGAN UNIVERSITAS LAMPUNG,"Obesity is an abnormal condition due to excess accumulation of fat in adipose tissue. The increasing prevalence of obesity impact on various cardiovascular diseases. Common cardiovascular risk is blood pressure increase. This research purpose is to determine the comparison of mean arterial pressure between general obesity and central obesity in male employees at the University of Lampung. This study uses comparative analytic method with cross sectional approach. Research conducted in September-December 2016. The population was the male employees at the University of Lampung 60 respondents. Samples were taken with consecutive sampling technique. The results showed the average age in the age group 40-49 years (51.7%). The mean value for mean arterial pressure in respondents with central obesity amounted to 108.22 mmHg and respondent with general obesity amounted to 95.56 mmHg with a difference of 12.67 mmHg. T test results comparison of MAP between general obesity and central obesity with p value = 0.001. There are differences of mean arterial pressure between general obesity and central obesity in male employees at the University of Lampung.

Keywords: mean arterial pressure, general obesity, central obesity.","QP, R1",Jurnal Kelitbangan Provinsi,2017-04,"mean arterial pressure, general obesity, central obesity."
FK1,"Pemberian Latihan Intensitas Sedang untuk Manajemen Kesehatan
Kardiovaskuler pada Mencit Obesitas","Pemberian Latihan Intensitas Sedang untuk Manajemen Kesehatan
Kardiovaskuler pada Mencit Obesitas
Rama Agung Prakasa1
, Khairun Nisa2
, Tri Umiana Soleha3
, Agustyas Tjiptaningrum4
1Mahasiswa Pendidikan Dokter, Fakultas Kedokteran, Universitas Lampung
2
Bagian Fisiologi, Fakultas Kedokteran, Universitas Lampung
3
Bagian Mikrobiologi, Fakultas Kedokteran, Universitas Lampung
4
Bagian Patologi Klinik, Fakultas Kedokteran, Universitas Lampung
Abstrak
Obesitas merupakan suatu kondisi abnormal tubuh dimana terjadi penumpukan lemak berlebih pada jaringan adiposa
tubuh, sehingga menyebabkan terjadinya gangguan kesehatan berupa dislipidemia dan penyakit kardiovaskuler. Latihan
fisik merupakan suatu upaya dalam menangani obesitas. Latihan fisik memiliki pengaruh yang baik terhadap tubuh,
terutama dalam pencegahan penyakit kardiovaskuler. Penelitian ini meneliti tentang pemberian latihan intensitas sedang
terhadap penurunan kadar trigliserida dan peningkatan kadar high density lipoprotein (HDL) pada mencit obesitas.
Penelitian ini merupakan penelitian eksperimental laboratorium menggunakan posttest control group design. Penelitian
dilakukan selama 35 hari. Sampel berupa mencit jantan dengan jumlah 36 sampel dibagi dalam 3 kelompok penelitian yaitu
kelompok kontrol normal (K), kelompok kontrol obesitas (K2), kelompok perlakuan (P1) mencit obesitas + latihan intensitas
sedang. Hasil uji analisis menunjukkan adanya perbedaan bermakna pada kelompok pemeriksaan trigliserida (p=0,027) dan
kelompok pemeriksaan HDL (p=0,001). Terdapat perbedaan bermakna antara kelompok K1 dengan kelompok K2 pada
pemeriksaan trigliserida (p=0,042) dan perbedaan bermakna antara kelompok K2 dengan kelompok P1 pada pemeriksaan
HDL (p=0,001). Latihan intensitas sedang tidak dapat menurunkan kadar trigliserida, namun dapat meningkatkan kadar HDL
pada mencit obesitas. Berdasarkan hasil tersebut latihan dapat membantu dalam pencegahan penyakit kardiovaskuler.
Kata kunci : High density lipoprotein, kardiovaskuler, latihan intensitas sedang, obesitas, trigliserida.",QP,"MEDULA, medicalprofession journal of lampung university",2019-10,
