division,title,abstract,subjects,publication,date,keywords
,Parental Perception Of Early Children Education,"This study aims to determine the percentage level of parents perceptions of Early Childhood Education in District of East Bandar Jaya. The method of research used is descriptive method with quantitative approach.  The population in this study amounted to 315 parents (mothers) and sample in this study amounted to 63 parents (mothers) who send their children to kindergartens in the District of  East Bandar Jaya. Sample taken using by Cluster Random Sampling techniques, the data collection in this study was caried out using questionnaire. While the data were analyzed using descriptive statistics. The results of the research on parents perceptions of Early Childhood Education in District of East Bandar Jaya showed that perception of parents in the high category that 70 percen.","L1, LB1501, LB2361",Jurnal Golden Age,2021,
FKIP23,Permainan Finger Painting Untuk Pengembangan Kemampuan Motorik Halus Anak Usia Dini,"Artikel ini sebagai kajian pustaka yang bertujuan untuk dapat mengetahui seberapa penting penerapan yang dilakukan melalui permainan finger painting dalam pengembangan kemampuan  motorik halus anak yang menggunakan jari-jemari tangan dan gerakan pergelangan tangan yang sesuai dengan Standar Pencapaian Perkembangan Anak (STPPA) yang termuat di dalam Peraturan Menteri pendidikan dan Kebudayaan (PERMENDIKBUD) Nomor 137 Tahun 2014 Tentang Standar Nasional Pendidikan Anak usia Dini. Kemampuan motorik halus pada permainan ini akan melibatkan perkembangan otot-otot kecil khususnya pada bagian tangan anak. Maka dari itu penerapan permainan  finger painting ini diharapkan dapat sesuai dalam pencapaian perkembangan motorik halus anak dan permainan ini tidak menyimpang dari hakikat anak yaitu belajar melalui bermain yang secara tidak langsung akan mengembangan motorik halus anak yang tertuang dalam STPPA terkait gerakan tangan yaitu mengkoordinasikan tangan dan mata untuk melakukan gerakan rumit, melakukan gerakan manipulatif untuk menghasilkan suatu bentuk dengan berbagai media, dan mengekspresikan diri dengan berkarya seni menggunakan berbagai media. 
Kata kunci: finger painting, motorik halus, anak usia dini","L1, LB, LB1501, LB2361",Jurnal Warna: Jurnal Pendidikan dan Pembelajaran Anak Usia Dini,2020-04-01,
FKIP23,"EFEKTIVITAS DESAIN PEMBELAJARAN TERPADU
BERBASIS CORE CONTENT DI SD","Curriculum 2013 of primary school leads to an integrated thematic learning, but there are still many teachers who have difficulty to carry it out. This study aimed to determine the effectiveness of integrated learning design core content-based which was the development results of the curriculum 2013 design of primary school. The population of this research was schools that had already used the curriculum 2013 of primary school in Bandar Lampung. Samples of this research were the teachers and the students. The research design was using quasi experiment with the data collecting instruments were using tests, interviews, observation, and documentation. Data were analyzed by using t-test and it was proved that the integrated learning design of core content-based is effective to create learning activities that generated the integration of knowledge capabilities, social cohesion in the integration of experience and training.","LB1501, LB2361",Berkala Seklah Dasar,2017-08-23,
FKIP23,Belajar Melalui Bermain Anak Usia Dini Meretas Pendidikan Berkelanjutan untuk Pembangunan Berkelanjutan (SDGs),"ABSTRACT
Realizing the Sustainable Development Goals (SDGs) targets is the responsibility of all parties and all levels of education including Early Childhood Education. Early Childhood Education is the foundation for the development of education which is very vital for early childhood development as an educational capital in later ages. The solutions discussed in this article are from the literature that strengthens early childhood learning in responding to the demands of SDGs. The context of learning becomes unified in learning and play activities, because only when playing early childhood can learn to find out, to explore, prove, collect data joyfully and responsibly. If this condition is always created in early childhood learning, it is not impossible that humans will be able to go through a lifelong learning program (lifelong learning). Through play children can develop multiple intelligences through the development of aspects of (a) religious and moral values (b) social and emotional, (c) cognitive, (d) language, (e) physical and motoric, (f) art which empties into the ability to think critically and solve problems, collaborate, communicate skillfully, and be creative
Keywords : learning, playing, sustainable development, multiple intelligences

ABSTRAK
Mewujudkan target Pembangunan Berkelanjutan/Sustainable Development Goals (SDGs) menjadi tanggung jawab semua pihak dan semua jenjang pendidikan termasuk Pendidikan Anak Usia Dini (PAUD). PAUD menjadi peletak dasar pembinaan pendidikan yang sangat vital bagi tumbuh kembang anak usia dini (AUD) sebagai modal pendidikan di usia-usia selanjutnya. Solusi yang dikaji dalam artikel ini tentang literatur yang menguatkan cara belajar anak usia dini dalam menjawab tuntutan SDGs. Konteks pembelajaran menjadi bersatu padunya kegiatan belajar dan bermain. Karena hanya ketika bermain Anak Usia Dini bisa belajar mencari tahu, berekspolasi, membuktikan, mengumpulkan data dengan sukacita dan penuh tanggung jawab. Jika kondisi ini selalu diciptakan pada pembelajaran anak usia dini, maka tidak mustahil manusia akan bisa melalui program belajar sepanjang hayat (lifelong learning). Melalui bermain anak dapat mengembangkan kecerdasan majemuk melalui pengembangan aspek-aspek (a) Nilai Agama dan Moral (b) Sosial dan Emosi, (c) Kognisi, (d) Bahasa, (e) Fisik dan Motorik, (f) Seni yang bermuara pada kemampuan berpikir kritis dan memecahkan masalah, berkolaborasi, terampil berkomunikasi, dan kreatif
Kata Kunci : belajar, bermain, pembangunan berkelanjutan, kercerdasan majemuk","LB1501, LB2361",,2019-11-03,
FKIP12,Evaluasi Program Penugasan Dosen di Sekolah (PDS) FKIP Universitas Lampung Menggunakan Model CIPP,"Penugasan Dosen di Sekolah (PDS) merupakan salah satu program unggulan revitaliasi LPTK berbasis kemitraan dengan sekolah. Program PDS di FKIP Unila yang telah dilaksanakan perlu dievaluasi tingkat keberhasilannya. Tujuan evaluasi ini adalah mendeskripsikan tingkat keberhasilan pelaksanaan program PDS di FKIP Unila secara menyeluruh dalam hal konteks, masukan, proses, dan produk. Model evaluasi program menggunakan model CIPP (Context, Input, Process, Product). Teknik pengumpulan data yang digunakan berupa observasi,
penyebaran kuesioner, dan analisis dokumen. Data evaluasi dianalisis secara deskriptif kualitatif dengan tahapan, yaitu reduksi data, penyajian data, dan penarikan kesimpulan. Hasil evaluasi menunjukkan bahwa program PDS FKIP Unila berhasil dilihat dari segi konteks, masukan,
proses, dan produk. Keberhasilan dari segi konteks ditunjukkan dari dasar hukum pelaksanaan program yang jelas dan memiliki tujuan program yang sesuai dengan revitalisasi LPTK dengan peningkatan profesionalitas guru. Keberhasilan dari segi masukan ditunjukkan dari instruktur yang kompeten dibidangnya, tim penyelenggara yang profesional, materi program yang sesuai dengan kurikulum sekolah, sarana dan prasarana yang mendukung serta dan anggaran dana yang mencukupi. Keberhasilan dari segi proses meliputi keterlaksanaan rencana kegiatan telah sesuai dengan jadwal yang ditentukan, kinerja penyelenggara dan instruktur sudah optimal, peserta mampu mengikuti pendidikan dan pelatihan dengan aktif dan baik, dan evaluasi dilakukan secara menyeluruh baik evaluasi peserta, instruktur maupun penyelenggara. Keberhasilan dari segi produk yaitu diperolehnya luaran berupa best practices dalam bentuk
jurnal refleksi, video dan media pembelajaran serta artikel yang diterbitkan dalam prosiding internasional dan jurnal internasional bereputasi. Berdasarkan hasil evaluasi, maka pelaksanaan program PDS FKIP Unila efektif dalam memberikan solusi bagi peningkatan profesionalitas pendidik.","L1, LB2361",Ruang Pengabdian: Jurnal Pengabdian kepada Masyarakat,2022,
FKIP25,Blog Resmi Dosen,"Halaman ini berisi megenai segala materi perkuliahan, informasi akademik dan tugas mahasiswa untuk kebutuhan perkulihan","LB2300, LB2361, ML, MT",,,
FKIP25,PELATIHAN APLIKASI PLICKERS UNTUK PENILAIAN FORMATIF BERBASIS TIK DALAM PEMBELAJARAN SENI DI LAMPUNG,"Aplikasi merupakan basis pembelajaran yang saat ini banyak digunakan di luar negeri. Pentingnya media berbasis daring ini adalah sebagai bentuk penyesuaian terhadap zaman yang terus berkembang. Parasiswa sebagai generasi milenial sangat dekat dengan ""gadget"" dan berbagai konten berbasis daring. Hal ini yang menyebabkan pembelajaran berbasis aplikasi perlu diterapkan.","LB2361, LC",,,
,Hasil Laporan Penelitian: Persepsi Guru PAUD Terhadap Kecerdasan Kinestetik,"Penelitian ini diharapkan dapat menjadi salah satu sumbangan penelitian dalam hal menyiapkan kesadaran para guru tentang pentingnya menjaga kualitas profesionalisme guru salah satunya dalam memahami perkembangan fisik motorik anak usia dini yang terangkum di kecerdasan kinestetik. Dengan memahami kecerdasan kinestetik akan memudahkan para guru dalam memetakan gaya belajar dan potensi non akademis para peserta didik anak usia dini. Tujuan penelitian ini adalah menganalisis pemahaman guru PAUD terhadap kecerdasan kinestetik, sehingga dapat dilanjutkan pada penelitian berikutnya untuk mengembangkan keterampilan mengajar guru dalam pengembangan kecerdasan kinestetik anak usia dini. Penelitian ini menggunakan desain penelitian survei cross-sectional, dengan pengumpulan data kuantitatif. Lokasi penelitian di Kota Bandar Lampung. Teknik pemilihan lokasi menggunakan puporsive sampling, sedangkan teknik pemilihan sampel menggunakan simple random sampling. Jumlah sampel 100 orang guru dengan cara pengambilan data melalui kuesioner. Analisis data yang dilakukan secara deskriptif dan inferensial. Luaran penelitian ini submit artikel ilmiah jurnal nasional terakreditasi pada tahun 2021. 
 
Kata kunci: kecerdasan kinestetik, persepsi guru, anak usia dini","L1, LB, LB1501, LB2361",,2021,
FKIP1,Indonesian EFL Teachers Professional Knowledge Development during Their Participation in TSG: A Case Study,"The study examines three new EFL teachers professional knowledge development through discussion in a Teacher Study Group (TSG) in Indonesian (Asian) context. These three participants have less than five year-teaching experience and teach junior high schools in Bandarlampung in the time of the study. The data were collected through audio-visual recorded observation of TSG sessions teaching practice. They were converted into written trasncription. The analysis signifies that group discussion recalls participants’ case knowledge from distant experience while group reflection explores participants’ practical knowledge from their own immediate practice. Some of the knowledge is still fragmented and some has been integrated into pedagogical content knowledge (PCK). Both TSG group theme-based discussion and collaborative reflection manage to explore participants’ professional knowledge. 

Keywords: EFL teachers’ professional knowledge, case knowledge, theme-based discussion, collaborative reflection","LB2361, LC5201, LG, P1, PE",English Language Teaching,2016-08-01,"EFL teachers’ professional knowledge, case knowledge, theme-based discussion, collaborative reflection"
FKIP4,Efektivitas Iklim Kelas Berbasis Kooperatif untuk Meningkatkan Model Mental dan Penguasaan Konsep.,,"L1, LB2300, LB2361",,2020-12,
FKIP23,EVALUASI HASIL AKREDITASI LEMBAGA PAUD SE-KOTA DEPOK,"Tujuan penelitian ini adalah menganalisis (1) hasil deskriptif data akreditasi lembaga PAUD se-Kota Depok tahun 2018; (2) hasil sebaran akreditasi lembaga PAUD se-Kota Depok pada 11 kecamatan; (3) hasil akreditasi berdasarkan lama berdirinya sekolah, luas lahan, dan pengalaman akreditasi di setiap program TK. Penelitian ini menggunakan pendekatan mix method research dengan metode analisis kritis dan metode kepustakaan, dengan menyajikan data kuantitatif secara sederhana dan mendeskripsikannya ke dalam data kualititatif. Diperoleh hasil temuan yakni: (1) Jumlah lembaga yang terakreditasi masih didominasi oleh lembaga PAUD dengan program TK, yakni sebanyak 97 lembaga dari 186 lembaga yang mengikuti akreditasi atau sebanyak 52% dari total lembaga PAUD yang mengikuti akreditasi; (2) Terdapat ketidakmerataan jumlah lembaga yang terakreditasi di 11 kecamatan yang ada di Kota Depok; dan (3) Nilai akreditasi tinggi dan rendah tidak selalu berkaitan dengan lama berdiri, luas lahan dan pengalaman lembaga dalam melaksanakan akreditasi. Kata kunci: pendidikan anak usia dini, akreditasi, program taman kanak-kanak","L1, LB1501, LB2361",JECE (Journal of Early Childhood Education),2019-12,
FP1,Development Of E-Learning Lkpd Schoology Improving Critical Thinking Ability And Learning Outcome Of History,"The learning process has been less effective because the media used is still 
conventional Student Work Sheet. So the students don’t interest in learning, 
passively listening, writing and it’s impact on learning outcomes. This study aims 
to develop LKPD through History Schoology to improving the ability of critical 
thinking and learning outcomes to be effective. The methodology of this study 
follows the Borg and Gall development model. Data analysis shows that E-
learning through Schoology media enhances critical thinking skills and learning 
outcomes in history learning. One of the main stages is the development stage, 
namely media creation and review of media, material and language. The objective 
is to suggestion for LKPD perfection that is developed so that the result of
research found that E-learning through Schoology media can improve the ability 
of critical thinking and learning result in learning history.","L1, LB, LB1603, LB2361",,2018,
FKIP12,Peran Pembelajaran Pendidikan Pancasila dan Ilmu Kewarganegaraan Dalam Menguatkan Sikap Toleransi Peserta Didik,"Penelitian ini bertujuan untuk mengetahui Peran Pembelajaran Pendidikan Pancasila dan ilmu kewarganegaraan dalam menguatkan Sikap Toleransi Peserta Didik Di Sekolah Menengah Pertama Negeri 01 Way Tenong. Metode penelitian yang digunakan dalam penelitian ini adalah metode deskriptif dengan pendekatan kuantitatif. Subjek dalam penelitian ini adalah peserta didik kelas VIII di Sekolah Menengah Pertama Negeri 01 Way Tenong. Sampel dalam penelitian ini berjumlah 71 responden. Pembelajaran Pendidikan Pancasila dan ilmu Kewarganegaraan berperan sebesar 53,6% terhadap sikap toleransi peserta didik. Peran pembelajaran Pendidikan Pancasila dan ilmu Kewarganegaraan memberikan dampak positif dan juga dampak yang baik kepada peserta didik yaitu salah satunya agar menjadi peserta didik yang memahami arti penting toleransi dalam kehidupan sehari hari yang bermanfaat untuk kerukunan, kebersamaan, dan kenyamanan antar masyarakat. Peran pembelajaran Pendidikan Pancasila dan ilmu kewarganegaraan dalam menguatkan sikap toleransi merupakan sebagai tempat untuk membentuk atau menguatkan karakter dan sikap yang mampu menghargai perbedaan, menghargai pendapat, dan mengedepankan kedamaian.","L1, LB1603, LB2300, LB2361",Educare: Jurnal Penelitian Pendidikan dan Pembelajaran,2023-07-27,
FKIP17,Development of Authentic Assessment instruments for Critical Thinking skills in Global Warming with a Scientific Approach,"This study aims to develop an authentic assessment instrument to measure critical thinking skills in global warming learning and to describe the suitability, easiness, and usefulness of the use instruments which are developed base on the teacher’s opinion.   The development design is carried out by Borg & Gall (2003) development model, which is conducted with seven stages: information gathering stage, planning stage, product development stage, product test stage, product revision stage, field trial stage, and final product. The test subjects are students and teachers in SMA Lampung Tengah by using purposive sampling technique.  Global warming learning using authentic assessment consists of a series of learning activities, including observing, discussing, exploring, associating and communicating.  The results show the authentic assessment techniques global warming to measure and cultivate critical thinking skills consisting of written tests, performance, portfolios, projects, and attitudes.  The developed assessment model meets content and constructs validity, and effectively improves students' critical thinking skills and has a high level of suitability, easiness, and usefulness well-being. The assessment techniques are used in global warming learning are performance assessment techniques, portfolios, projects, products, and attitude that together contribute to the improvement of critical thinking skills on 97,4% of global warming learning.","L1, LB2361",International Journal of Science and Applied Science: Conference Series,2017,
FKIP23,Model Pembelajaran Sentra: Implementasi di Lembaga Pendidikan Anak Usia Dini,Buku Model Pembelajaran Sentra (Implementasi di Lembaga PAUD ini dimaksudkan untuk memberikan sumber bacaan alternatif bagi para guru dan atau calon guru dalam merancang pembelajaran yang inovatif dan model pembelajaran sentra dapat dijadikan sebagai pilihan yang tepat dalam memberikan stimulasi yang sesuai dengan minat dan bakat anak usia dini.,"L1, LB1501, LB2361, LT",,2022-07,
FKIP11,The readiness of certified elementary school theachers in Bandar Lampung for the implementation of the 2013 curriculum,"The purpose of the research is to know the level of theacher's readiness for the implementation the 2013 curriculum in terms of organizational justice, organizational commitment, organizational support, and psychologycal climate variables. The research method used ini this reserach was a qualitative survey. The population of the research was primary school teachers in the city of Bandar Lampung as much as 2300 people and the research sample which was used random sampling as much as 10%, was 230 people. Data was collected by using questionnaire and categorized into three level; high, medium and low, and were analyzed by quantitative descriptive. The research conclusion is the readiness of primary school teachers in Bandar Lampung city for the implementation of the 2013 curriculum, in terms of organizational justice, organizational support and psychological climate variables is not on the high category, while for organizational commitment variable, it is on the high category.","L1, LB2361",,,
,"Hasil Peer Review: Sekolah Efektif, Learning Organization, dan Kepemimpinan Kepala Sekolah","Pentingnya kepemimpinan kepala sekolah dalam peningkatan kinerja guru dan implementasi learning organization untuk mencapai sekolah efektif. Hasil penelitian ini akan menjadi dasar untuk menentukan rumusan kebijakan dalam pendidikan untuk meningkatkan manajemen sekolah, khususnya manajemen penyelenggaraan di lembaga PAUD. Penelitian ini menggunakan pendekatan kuantitatif dengan metode korelasional untuk mengetahui hubungan antara sekolah efektif, learning organization, dan kepemimpinan kepala sekolah. Penelitian ini melibatkan 50 guru PAUD yang ada di Kota Bandar Lampung dengan teknik pengambilan sampel purposive sampling dan pengumpulan data melalui kuesioner. Teknik analisis data melalui Uji Statistik Nonparametric Correlations menggunakan SPSS Version 25. Hasil penelitian: terdapat hubungan yang signifikan antara sekolah efektif, learning organization, dan kepemimpinan kepala sekolah. Pelaksanaan sekolah efektif dan implementasi learning organization semakin baik seiring dengan semakin baiknya kepemimpinan kepala sekolah.","L1, LB, LB1501, LB2361",,2021-11-07,
,"Sekolah Efektif, Learning Organization, dan Kepemimpinan Kepala Sekolah","Pentingnya kepemimpinan kepala sekolah dalam peningkatan kinerja guru dan implementasi learning organization untuk mencapai sekolah efektif. Hasil penelitian ini akan menjadi dasar untuk menentukan rumusan kebijakan dalam pendidikan untuk meningkatkan manajemen sekolah, khususnya manajemen penyelenggaraan di lembaga PAUD. Penelitian ini menggunakan pendekatan kuantitatif dengan metode korelasional untuk mengetahui hubungan antara sekolah efektif, learning organization, dan kepemimpinan kepala sekolah. Penelitian ini melibatkan 50 guru PAUD yang ada di Kota Bandar Lampung dengan teknik pengambilan sampel purposive sampling dan pengumpulan data melalui kuesioner. Teknik analisis data melalui Uji Statistik Nonparametric Correlations menggunakan SPSS Version 25. Hasil penelitian: terdapat hubungan yang signifikan antara sekolah efektif, learning organization, dan kepemimpinan kepala sekolah. Pelaksanaan sekolah efektif dan implementasi learning organization semakin baik seiring dengan semakin baiknya kepemimpinan kepala sekolah.","L1, LB, LB1501, LB2361",Jurnal Obsesi : Jurnal Pendidikan Anak Usia Dini,2021-11-07,
,"Sekolah Efektif, Learning Organization, dan Kepemimpinan Kepala Sekolah","Pentingnya kepemimpinan kepala sekolah dalam peningkatan kinerja guru dan implementasi learning organization untuk mencapai sekolah efektif. Hasil penelitian ini akan menjadi dasar untuk menentukan rumusan kebijakan dalam pendidikan untuk meningkatkan manajemen sekolah, khususnya manajemen penyelenggaraan di lembaga PAUD. Penelitian ini menggunakan pendekatan kuantitatif dengan metode korelasional untuk mengetahui hubungan antara sekolah efektif, learning organization, dan kepemimpinan kepala sekolah. Penelitian ini melibatkan 50 guru PAUD yang ada di Kota Bandar Lampung dengan teknik pengambilan sampel purposive sampling dan pengumpulan data melalui kuesioner. Teknik analisis data melalui Uji Statistik Nonparametric Correlations menggunakan SPSS Version 25. Hasil penelitian: terdapat hubungan yang signifikan antara sekolah efektif, learning organization, dan kepemimpinan kepala sekolah. Pelaksanaan sekolah efektif dan implementasi learning organization semakin baik seiring dengan semakin baiknya kepemimpinan kepala sekolah.","L1, LB, LB1501, LB2361",Jurnal Obsesi : Jurnal Pendidikan Anak Usia Dini,2021-11-07,
FP1,Perbandingan Hasil Belajar Ekonomi Menggunakan Model Gabungandengan Memperhatikan Kemampuan Berpikir Kritis,"The objective of this research was to find out the differences of students’ learning 
results, the learning result average of students who had high critical thinking 
abilities, the learning result average of students who had low critical thinking 
abilities, and interactions between cooperative learning model and students’ 
critical thinking abilities to the learning results. This research used comparative 
method with quasi experiment design. Population was 124 students and 63 
respondent samples were taken by using cluster random sampling. Data were 
collected through documentation and test. Hypothesis was tested by using two 
paths variance analysis and independent two samples t-test.","L1, LB, LB2361",,2017,
FKIP18,Analysis of Online Based IPS Learning on Covid-19 Pandemic Time,,"LB, LB1603, LB2361",International Journal of Multicultural and Multireligious Understanding,2021-08-03,
FKIP17,Evaluasi dan Asesmen Pembelajaran,,"L1, LB2361",,2017,
FKIP4,Measuring metacognitive ability based on science literacy in dynamic electricity topic.,,"L1, LB2361",,2018,
FKIP4,Measuring metacognitive ability based on science literacy in dynamic electricity topic.,,"L1, LB2361",,2018,
FKIP12,ACTUALIZATION OF PANCASILA VALUES THROUGH SCIENTIFIC APPROACH IN STRENGTHENING NATIONAL INSIGHTS,"This research was to analyze the actualization of Pancasila values as an effort to improve and strengthen the nation's insight through Pancasila education in the Civic Education Program in Lampung University. This research used classroom action research method by teaching, did the observation, then the last distributing the test to 60 respondents in civic education program. The data analyzed by qualitative analysis. Based on the results of this research showed that the actualization of Pancasila values was able to strengthen the nationality insight. This was shown from the activities and student learning outcomes show improvement. In the first cycle, the data was 54.81%, then increase in the second cycle, that was 71.93% and amounted to 81.17% in the third cycle. So, it can be concluded that the more Pancasila values were actualized in a complete and consistent manner, the nationality insight possessed by students will increase according to the set success targets of researchers. The finding of this study is useful for the teachers or the lecturers of Pancasila education to explore their way of teaching Pancasila education, so the students absolutely have the soul of Pancasila to implement in their daily life. It would be relevant to increasing diversity in unity in Indonesia.","L1, LB2361",NeuroQuantology,2022-07,
