division,title,abstract,subjects,publication,date,keywords
FP5,"IDF (intensity-duration-frequency) curve and unit
hydrograph as signature of characteristic changing of Way
Kuala Garuntang Watershed","Abstract. There is direct relation between global warming and precipitation. Air capacity of
water increase by 7% to increasing of 1oC of air temperature, causing more water vapor content
in the air. This research aims to investigate how IDF Curve and Unit Hydrograph can be used
as signature of characteristic changing of Way Kuala Garuntang Watershed. The study area is
Way Kuala Garuntang watershed and rainfall data source is from automatic rainfall recorder of
Stasiun BMKG Maritim Panjang, ARR Tipping bucket installed at Way Kuala Garuntang
watershed, and 4 manual raingauges. From the research can be concluded that IDF Curve can
be used as signature of characteristic changing of Way Kuala Garuntang watershed mainly the
changing of rainfall intensity in various of return period. Meanwhile, due to average of IUH of
5 flood events in 1 year data serie, and significant differences of Qp between IUH and SUH,
the Unit Hydrograph was not suitable as signature of characteristic changing of Way Kuala
Garuntang watershed.",QC,IOP Conference Series: Earth and Environmental Science,2020,
FMIPA1,An Automatic Data Acquisition System for Optical Characterization of  Polymer-Based Gas Sensor,"A measurement system that consists of a pair of laser diode and photodiode coupled with an automatic data acquisition system based on microcontroller of AVR ATMega16 (hereafter to be called DAQ MA-16) has been developed for measuring optical response of polymer-based gas sensor. In this case, the optical response was represented by the voltage output of the photodiode. The polymer-based gas sensor was a thin film of polymer of Poly(3,4-ethylenedioxythiophene): poly(styrenesulfonate) or PEDOT:PSS deposited on a glass substrate. For measurement, the sensor was placed in the chamber, and then the gas ammonia with a fix flow rate was flowed into the chamber. The opposite part of the chamber was installed a pump to throw the gas. The National Instrument Data Acquisition (NI DAQ) BNC-2110 has been used to calibrate the DAQ MA-16 system. From the calibration, it can be estimated that the accuracy of DAQ MA-16 is about 99.4%.",QC,,2015,
FMIPA6,Chloride ion addition for controlling shapes and properties of silver nanorods capped by polyvinyl alcohol synthesized by polyol method,"We report our investigation on the effect of chloride ions oncontrolling the shapes and properties of silver
nanorods(AgNRs) synthesized using a polyol method. In this study, we used polyvinyl alcohol (PVA) as a capping agent and sodium chloride (NaCl) as asalt precursor and performed at the oilbath temperature of 140oC. The chloride ions originating from the NaCl serve to control the growth of the silver nanorods. Furthermore, the synthesized silver nanorodswere characterized using UV-VIS, XRD, SEM and TEM. The results showed that besides being able to control the growth of AgCl atoms, the chloride ions were also able to control the growth of multi-twinned-particles into the single crystalline silver nanorods by micrometer-length. At an appropriate concentration of NaCl, the diameter of silver nanorods decreased significantly compared to that of without chloride ion addition. This technique may be useful since a particular diameter of silver nanorods affects a particular application in the future.",QC,,2016,
FMIPA1,Effect of Temperature on Silver Nanorods Synthesized by Polyol Method,"Effect of temperature on the formation of silver nanorods (AgNRs) synthesized using
polyol method has been investigated. In this experiment, materials were used silver nitrate (AgNO
)
as main raw material, ethylene glycol (EG) as a solvent, small amount of sodium chloride (NaCl) as
a mediated agent, while polyvinyl alcohol (PVA) as a capping agent to assist the growth of AgNRs.
To apply a constant temperature at each synthesis process, an Erlenmeyer flask containing the
sample was immersed in a controllable magnetic stirrer oil bath.  It is found that the presence of
heat as represented by the temperature of oil bath has been shown to have a strong impact on the
AgNRs formation. The scanning electron microscope (SEM) confirmed uniform and high density of AgNRs when the oil bath temperature during polyol process was 140°C. In the same condition, the UV-vis spectra also confirmed formation process of AgNRs with appearance of the transverse plasmon peak about 350 nm. Finally, the X-ray diffraction (XRD) pattern represented that the final product of AgNRs was highly crystallized.",QC,Advanced Materials Research,2015-03,
FMIPA1,Effect of Stirring Rate on The Synthesis Silver Nanowires using Polyvinyl Alcohol as A Capping Agent by Polyol Process,"Silver nanowires (AgNWs) have been successfully synthesized by using polyol process. In this study, the synthesis AgNWs using ethylene glycol (EG) as solvent and reductant, silver nitrate (AgNO3) as the metal precursors, and polyvinyl alcohol (PVA) as a capping agent and stabilizer without adding chloride ions. The synthesis AgNWs was done by varying the stirring rate about 125, 350, 500, 700, and 1100 rpm. The scanning electron microscopy (SEM) showed that the AgNWs optimally formed at a stirring rate of 350 rpm with a diameter of (190 ± 40) nm and a length about (70 ± 20) µm. The silver nanorods (AgNRs) formed with diameter and length about (500 ± 20) nm and (20 ± 10) µm for stirring rate of 500 rpm, and (700 ± 30) nm and (20 ± 5) µm for 700 rpm. For the stirring rate of 125 and 1100 rpm only produced silver particles (AgNPs) with a diameter of 2 to 3 µm. The X-ray diffraction (XRD) and transmission electron microscopy (TEM) showed AgNWs has a high crystalline with face-center-cubic (fcc) structures. The UV-vis spectra of AgNWs shows that the absorbance peaks at a wavelength of 358 and 380 nm. PVA can be used as a capping agent and stabilizer for the synthesis AgNWs and AgNRs with high aspect ratio.",QC,International Journal on Advanced Science Engineering and Information Technology,2016,
,Bukti cek simalarity: A Control System on the Syringe Pump Based on Arduino for Electrospinning Application,,QC,,,
,Bukti cek simalarity: Conductive Layers Based on Silver Nanowires by Spray Coating Process,,QC,,,
,Bukti cek simalarity: The Crystal Structure Analysis of Silver Nanowires Using Rietveld Method for Optoelectronic Application,,QC,,,
,Bukti cek simalarity: The Quenching and Sonication Effect on the Mechanical Strength of Silver Nanowires Synthesized Using the Polyol Method,,QC,,,
,"Bukti cek simalarity: Thin Films of Silver Nanowires for Flexible, Transparent, and Conductive (FTC) Electrodes",,"QC, QD",,,
,Bukti cek similarity: Flow Rate and Volume Control of Fluid Based on Arduino for Synthesis of Silver Nanowires,,QC,,,
,Bukti cek similarity: Improvement of Electrical Characteristics of Electrochemical Cells Made from Sea Water Using Electroplating Method of Cu (Ag)-Zn Electrode as Renewable Energy Source,,QC,,,
,Bukti cek similarity: Structural and Physical Properties of Refractory Cordierite Precursors Prepared From Rice Husk Silica with Different MgO Addition,,QC,,,
,"Bukti korespondensi Jurnal ""The Crystal Structures Analysis of Silver Nanowires Synthesized by Polyol Method""",,QC,,,
,"Bukti korespondensi jurnal ""A Control System on the Syringe Pump Based on Arduino for Electrospinning Application""",,QC,,,
,"Bukti korespondensi jurnal ""The Effect of Quenching on The Physical Properties of Silver Nanowires Synthesized Using The Polyol Method""",,QC,,,
FMIPA1,Concentration Effect on The Thin Films of Silver Nanowires Fabricated Using Meyer-rod Coating,"In this paper, we report our investigation effect of concentration of silver nanowires (AgNWs) solution on the AgNWs thin films coated onto a glass substrate by simple Meyer-rod coating. Diameter and length of AgNWs have used about 120 nm and 20 to 30 µm, respectively. Concentration of AgNWs were variated of 186 mg/ml, 210 mg/ml, and 223 mg/ml in ethanol solution. AgNWs thin films then were heated at temperature 90 oC for 20 min. The UV-vis spectrophotometry, scanning electron microscope (SEM), and four-point-probe were employed to characterize the AgNWs thin films. The result shows that concentration of AgNWs solution affects on the transmittance and a sheet resistance of the AgNWs thin films. The transmittance at the wavelength of 550 nm is obtained 94.5% by a sheet resistance about 1.2 Ω/sq. The higher concentration of AgNWs solution can decrease the sheet resistance and the transparency of the AgNWs thin films.",QC,Journal of Physics: Conference Series,2019,
,Conductive Layers Based on Silver Nanowires by Spray Coating Process,,QC,,,
,Feer Review: Measuring of Cassava Starch Content by Using Strain Gauge,,QC,,,
,Feer Review: The Crystal Structure Analysis of Silver Nanowires Using Rietveld Method for Optoelectronic Application,,QC,,,
,"Feer Review: The Quenching and Sonication Effect on the Mechanical Strength of Silver Nanowires Synthesized Using the
Polyol Method",,QC,,,
,Feer review: Concentration Effect on The Thin Films of Silver Nanowires Fabricated using Meyer-rod Coating,,QC,,,
,Feer review: Efek Variasi Konsentrasi NaOH pada Pembentukan Struktur Selulosa Cladophora sp.,,"QC, QD",,,
,Feer review: Improvement of Electrical Characteristics of Electrochemical Cells Made from Sea Water Using Electroplating Method of Cu (Ag)-Zn Electrode as Renewable Energy Source,,QC,,,
,Feer review: Improvement of Electrical Characteristics of Electrochemical Cells Made from Sea Water Using Electroplating Method of Cu (Ag)-Zn Electrode as Renewable Energy Source,,QC,,,
,"Feer review: Indirect Approach on Human-Wildlife Conflict Mitigation: Potential Local Landscape Based Ecotourism in Margahayu, Labuhan Ratu VII",,QC,,,
,Feer review: Karakteristik Struktur dan Termal Komposit Aspal Karbosil Silika Sekam Padi,,QC,,,
,Feer review: Kontrol Kecepatan dan Temperatur dengan Teknik Pulse Widht Modulation Untuk Aplikasi Hotplate Stirrer Berbasis Arduino,,QC,,,
,Feer review: Measuring of Cassava Starch Content by Using Strain Gauge,,QC,,,
,Feer review: Rancang Bangun Sitem Catu Daya dengan Metode Switching Mode Power Supply (SMPS) Berbasis Arduino untuk Aplikasi Electrospinner,,QC,,,
,Feer review: Studi Awal Analisator Perubahan Sifat Elektrik materi Cair yang Berinteraksi dengan Cahaya untuk Aplikasi Spektrometri,,QC,,,
,Feer review: Studi Pendahuluan Pembentukan Struktur Komposit Perak Silika (Ag/SiO2) Berbasis Sekam Padi,,"QC, QD",,,
,Feer review: Studi Pendahuluan Penentuan Nilai Energi Band Gap Komposit Perak Silika (Ag/SiO2) Berbasis Sekam Padi,,QC,,,
FMIPA1,Komputerisasi Alat Ukur V-R Meter untuk Karakterisasi Sensor Gas Terkalibrasi NI DAQ BNC-2110,"Telah dikembangkan sebuah alat ukur dengan biaya rendah berbasis mikrokontroler untuk mengukur parameter secara optik dari sensor gas amonia berbasis polimer. Dalam penelitian ini, parameter secara optik ditampilkan dalam bentuk tegangan keluaran dari sebuah fotodioda dan hambatan sensor gas. Tujuan dalam penelitian ini adalah membuat alat ukur secara otomatis dan real time untuk mengkarakteristik sensor gas yang terkalibrasi dengan National Instrument Data Acquisition (NI DAQ) tipe BNC-2110. Hasil validasi menunjukkan bahwa tingkat akurasi dari alat ukur V-R meter sangat tinggi dengan ralat pengukuran sebesar -0,6%. Alat ukur V-R meter memiliki range pengukuran 0-4,96 volt untuk tegangan dan 0 – 20 Mohm untuk resistansi dengan toleransi/tingkat ketelitian ±0,005 volt. Alat ukur V-R meter yang dibuat dapat mengukur tegangan dan hambatan listrik dengan sangat baik seperti NI DAQ tipe BNC-2110.

Kata kunci: alat ukur, mikrokontroler, sensor gas, NI DAQ",QC,Jurnal Teori dan Aplikasi Fisika,2013-01,
FMIPA1,The Roles of Polyvinyl Alcohol (PVA) as the Capping Agent on the Polyol Method for Synthesizing Silver Nanowires,"We report our investigation of roles of polyvinyl alcohol (PVA) as a high-performance capping agent in synthesizing silver nanowires (AgNWs) using polyol method. For this purpose, we varied the concentration of silver nitrate (AgNO ), from 0.3 M to 1.0 M, and molar ratios of [PVA:AgNO 3 3 ] from 2 to 6. The UV-vis spectra show the AgNWs growth optimally at a molar ratio of 4.5 with the absorbance peaks of 378 nm and 380 nm. Meanwhile, from XRD patterns, it was found that the crystal structure of the AgNWs can be identified as a face-centered cubic (fcc) with a lattice constant according to the spacing distance between the {111} planes of 4.087 Å. Finally, scanning electron microscopy (SEM) and transmission electron microscopy TEM images show the diameter and length of the AgNRs are 150 to 230 nm and 50 to 120 µm, respectively. These results show that the AgNWs synthesized using PVA having a long size.",QC,Journal of Nano Research,2017,
FMIPA1,"Spektrofotometer UV-Vis untuk Estimasi Ukuran
Nanopartikel Perak","We present a simple technique to estimate the size of silver nanoparticles (AgNPs) based on uv-vis spectra computationally. To have the nanoparticles, the AgNPs colloid was prepared by chemical reduction technique using 40 mM of tri-sodium citrate dihydrate (Na-O)
and silver nitrate (AgNO3) at different concentrations of 2.5 and 5.0 mM. The colloid was then analyzed by using UV-Vis spectrophotometer. For comparison of the size estimation, a small amount of AgNPs was also analyzed using transmission electron microscopy (TEM). By ﬁtting the model and the UV-Vis spectra of these colloids, the set ﬁtting parameters can be obtained including the absorption coefﬁcient, the full width at half maximum (FWHM), the wavelength and absorbance of peaks. It is assumed that the shape of nanoparticle is spherical, so that its diameter can be estimated using the values of scattered absorbance and FWHM. Based on the model it is found that the size of AgNPs are (28 ±8) nm and (15 ±7) nm for samples prepared with concentration of 2.5 and 5.0 mM, respectively. On the other hand, from statistically estimation using images from TEM, it is found that the size of AgNPs are (17 ±4)nm and (8 ±3) nm for samples prepared with concentration of 2.5 and 5.0 mM, respectively. This discrepancy occurs may be due to non-homogenous of the particles. It indicates, however, this
computationally simple method can be used as a ﬁrst step to estimate size of the AgNPs colloid prior to measurement and calculation using advanced equipments and techniques.",QC,Jurnal Teori dan Aplikasi Fisika,2017,
,feer review: A Control System on the Syringe Pump Based on Arduino for Electrospinning Application,,QC,,,
,feer review: Desain dan Realisasi Akumulator Elektrolit Air Laut dengan Penambahan Sodium Bicarbonate (NaHCO3) sebagai Sumber Energi Alternatif,,QC,,,
,feer reviewer: Analisis Transisi Fasa dan Sifat Dielektrik pada Li2CoSiO4 yang Diapresiasi dari Silika Sekam Padi dan Produk Daur Ulang Katoda Baterai Ion Litium Bekas,,QC,,,
,feer reviewer: Conductive Layers Based on Silver Nanowires by Spray Coating Process,,QC,,,
,feer reviewer: PEMBERDAYAAN MASYARAKAT DALAM PEMANFAATAN LIMBAH LAMPU HEMAT ENERGI (LHE) SEBAGAI ALTERNATIF LAMPU EMERGENCY DENGAN TEKNIK JOULE THIEF,,QC,,,
,feer reviewer: Rancang Bangun Mesin Penggulung Lilitan Kawat Transformator Otomatis Berbasis Arduino Uno,,QC,,,
,"feer reviewer: SINERGITAS PENGGIATAN EKONOMI KERAJINAN BATIK LAMPUNG, EKSPLORASI BUDAYA DAN
EDUKASI KONSERVASI: ANDANAN BATIK TULIS, NEGERI SAKTI, PESAWARAN, LAMPUNG",,QC,,,
,feer reviewer: Silver Nanorods Layer Based on Polyvinyl Alcohol on Glass Substracts by Dip-Coating Method,,QC,,,
,feer reviewer: Simulasi Dinamika Molekul Berbasis Kode LAMMPS untuk Mengkaji Titik Leleh Bahan Besi (Fe). Timbal (Pb) dan Aluminium (Al),,QC,,,
,feer reviewer: Sistem Identifikasi Tingkat Kematangan Buah Nanas Secara Non-Destruktif Berbasis Computer Vision,,QC,,,
,feer reviewer: Structural and Physical Properties of Refractory Cordierite Precursors Prepared From Rice Husk Silica with Different MgO Addition,,QC,,,
,"feer reviewer: Thin Films of Silver Nanowires for Flexible, Transparent, and Conductive (FTC) Electrodes",,QC,,,
,feer reviewer:Pengaruh Variasi Polivinylpirolidon (PVP) Terhadap Pembentukan Serat Nano Titanium Dioksida (TiO2) Menggunakan Metode Electrospinning,,QC,,,
,"feer reviwer: Monitoring Data Perubahan Suhu, Co, dan Co2 Secara Real Time Menggunakan MySQL",,QC,,,
FMIPA1,Pemanfaatan Limbah Aki dan Komponen Elektronik sebagai Sumber Energi Listrik Ramah Lingkungan,"UTILIZATION   OF   ACCU   WASTE   AND   ELECTRONIC   COMPONENTS   AS   AN ENVIRONMENTALLY  FRIENDLY  ELECTRICAL  ENERGY  SOURCE. This  community service is a form of community development activity in the utilization of Accu waste and electronic components as an alternative energy source for mini-inverters. The mini-invertermodule is made using the Joule Thief method. This method is able to increase low electric power  from  a 1.5-voltbattery  source  into  AC  alternating  current  that  can  turn  on  LED lights.  The  service  activity  will  be  carried  out  in  Hajimena  Village,  Natar  District,  South Lampung  Regency  in  August  2020.  This  community  service  activity  was  attended  by  32 participants.  Each  service  participant  has  been  fostered and  guided  about the  process of making mini-invertermodules  from  waste  batteries  and  components  that  are  no  longer used  so  that  they  are  ready  to  use  and  suitable  for  use  and  of  economic  value.  The components used in the manufacture of mini-invertersare all obtained from components from AKI and used electronic components as alternative energy sources. With this activity, it is hoped that the partner community will understand how to utilize waste that is difficult to decompose into ready-to-sell goods",QC,JURNAL PENGABDIAN PADA MASYARAKAT,2021,
FMIPA1,Studi Awal Analisator Perubahan Sifat Elektrik Materi Cair yang Berinteraksi dengan Cahaya untuk Aplikasi Spektrometri,"An initial study research has been carried out on the realization of electrical properties analyzer of liquids that interact with light to be applied to spectrometry. This study aims to develop a spectrometry method based on changes in electrical resistance in liquids when interacting with laser. Methylene blue solution was used as a sample that illuminated by a laser with 650 nm wavelength.The laser beam causes a change in electrical resistance in the methylene blue solution detected by Arduino Nano and converted to a concentration quantity. The conversion equation for changes in electrical resistance to concentration was obtained from the measurement of the change in electrical resistance of methylene blue solutions at concentration of 100 ppm, 200 ppm, 400 ppm, 600 ppm, 800 ppm, 1000 ppm. The equation was obtained based on the exponential regression approach with error value of 15,70 %. The analyzer test was carried out by measuring the concentration of methylene blur solution at a concentration of 500 ppm, 600 ppm, and 700 ppm. The test results show an error value of 9,83 %.",QC,Jurnal Teori dan Aplikasi Fisika,2019-01,
FMIPA1,Rancang Bangun Mesin Penggulung Lilitan Kawat Transformator Otomatis Berbasis Arduino Uno,"Research on application of the design an Arduino Uno-based automatic transformer wire winding machine has been carried out. The research aim was to make an automatic winding machine using wire coils that can be adjusted for rotation speed and high accuracy of the number of turns. In testing system, the enamel wire was wrapped around with a different number of turns, that is 200;400;600;800;1000 turns. The calibration method in this study was carried out manually, that is recounting the turns on the koker that had been wrapped using an automatic winding machine. The speed of the winding machine is calibrated using a tachometer. The results of the calculation of the average rolling accuracy of 99,73%.",QC,"Journal of Energy, Material, and Instrumentation Technology",2021,
FMIPA6,Measuring of Cassava Starch Content by Using Strain Gauge,"It has been realized an instrument for measuring cassava starch content digitally based on specific gravity method. The instrument is designed using strain gauge, which packing in load cell as a mass sensor, HX711 (Analog to Digital Converter), Arduino Uno as a data processor, LCD, and personal computer. The principles of this instrument are using specific gravity method, which is based on differences of cassava mass in the air and the water. Cassava starch content calculated by Arduino using Sungzikaw equation and displayed in LCD screen. The result showed that the instrument capable measure cassava starch content with the maximum capacity of 2,0 kg and average percentage error of less than 1,5 %.",QC,Journal of Physics: Conference Series,2019,
FMIPA1,Flow Rate and Volume Control of Fluid Based on Arduino for Synthesis of Silver Nanowires,"In this study, we have successfully developed a flow rate and volume control system based on Arduino. This system consists of a container containing liquid, dc motor, keypad, and Arduino UNO that serves as a controller. The principle of this system is to control pulse width modulation (PWM) and delay time of dc motor using Arduino. This fluid flow and volume rate control system aims to control how much the fluid volume enters a chamber for mixing the solution. This system has an accuracy rate of 0.5 ml and has a measurement range of up to 100 ml for one process. For forward, the system will be applied to the medical as a substitute for syringe pump and research laboratory for controlling the manufacture of solutions on the synthesis of nanomaterials, especially silver nanowires.",QC,Journal of Physics: Conference Series,2019,
FMIPA6,Synthesis and Characterization of Ag/SiO2 Nanocomposite Based on Rice Husk Silica Using Sol-Gel Method,"In this study, silver-silica (Ag/SiO2) was synthesized using the sol-gel method by silica from rice husks. Silica derived from rice husk waste was previously synthesized using the sol-gel method. In addition, the Ag material used in this study was also performed into silver nanoparticles (AgNPs). This method was chosen to obtain an Ag/SiO2 composite with nano size and high purity. AgNPs were synthesized using silver nitrate (AgNO3) by reduction method at 90 oC. The reducing agent and stabilizer used is trisodium citrate. UV-Vis, FTIR, XRD, and SEM-EDX were used to analyze Ag/SiO2 composites. Uv-Vis analysis results Ag/SiO2 has an absorption peak at a wavelength of 412 nm with a bandgap energy of 2.25 eV. These peaks indicate that AgNPs have formed in the SiO2 membrane. The FTIR results revealed the Si-O-Si bonds which indicated the presence of silica
and the Ag-O functional group, and the presence of AgNPs. The results of XRD analysis showed that the silica structure formed was cristobalite and silver crystals in the face center cubic (fcc) shape. The results of the SEM-EDX morphological analysis showed that the Ag/SiO2 nanocomposite was shaped like sharp stone chips and the presence of small granules (granules) with different particle sizes and shapes, slightly porous and the composition of the compounds in the Ag/SiO2 nanocomposite indicated the presence of various chemical elements in the sample, including carbon, oxygen, sodium, silica, and silver.",QC,Journal of Nano Research,2023-04-19,
FMIPA1,The Crystal Structure Analysis of Silver Nanowires Using Rietveld Method for Optoelectronic Application,"Abstract:
In this study, the synthesis and analysis of the crystal structure of silver nanowires (AgNWs) have been performed using the polyol method. In this research, materials used as the main raw material were silver nitrate (AgNO3). Polyvinyl pyrrolidone (PVP) was used as a capping agent and stabilizer, and Iron (III) Chloride (FeCl3) for controlling the shape and size of AgNWs. AgNWs were synthesized using two different solvents i.e., ethylene glycol (EG) and propylene glycol (PG). The crystal structure of AgNWs was analyzed using X-ray diffraction (XRD) with a scanning 2θ in the range of 20° to 90°. Furthermore, the structure and electron diffraction patterns were analyzed using transmission electron microscopy (TEM). The XRD pattern of the AgNW sample also has five diffraction peaks, these five diffraction peaks were identified at 38.24°, 44.42°, 64.54°, 77.52°, and 81.68° representing lattice constants (111), (200), (220), (311), and (222), respectively. Based on the results of the calculation of lattice constant values of AgNWs-EG and AgNWs-PG were 4.084 Å. The TEM images of AgNWs-EG have a diameter of 84 to 133 nm, corresponding to the SEM calculation data having a diameter of 109 ± 22 nm. AgNWs-PG has a diameter of 84 to 264 nm. The study results revealed that the results of the characterization performed are interconnected. The XRD characterization results revealed that both samples were crystal-indexed. AgNWs-PG has a larger crystal size than AgNWs-EG.",QC,Journal of Nano Research,2021,
