division,title,abstract,subjects,publication,date,keywords
FT1,"Pemisahan Menggunakan Polynomial Fitting dan Analisis Second Vertical Derivative (SVD) untuk Mengidentifikasi Patahan pada Lapangan Panasbumi Pulau Pantar, Kabupaten Alor","Pulau Pantar, Kabupaten Alor, Nusa Tenggara Timur berada di lingkungan vulkanik Kuarter yang memiliki potensi panasbumi yang diindikasikan adanya manifestasi panas bumi diantaranya fumarola, solfatara, tanah panas, dan air panas. manisfestasi tersebut dapat muncul ke permukaan karena keberadaan struktur geologi berupa patahan. Selain manisfestasi, patahan pada sistem panas bumi berperan penting dalam proses resapan pada daerah pengisian. Salah satu metode yang dapat digunakan untuk mengidentifikasi struktur geologi adalah metode gayaberat. Identifikasi struktur patahan pada survei ini dilakukan dengan mengkorelasikan pemodelan gaya berat 2D dan 3D. Pemisahan anomali Bouger dilakukan dengan polynomial fitting. Pada
lintasan pertama diidentifikasi terdapat 4 litologi antara
lain ada Vulkanik Tua Kongmauwas (VTKG), Aliran
Piroklastik Sirung Tua (StAl), Batugamping (Bgp), dan
Vulkanik Tua Kalondama (VTKl). Pada lintasan kedua
terdapat 4 litologi diantaranya terdapat Vulkanik Tua
Kongmauwas (VTKG), Aliran Piroklastik Sirung Tua (StAl), Jatuhan Piroklastik (SAj), dan Vulkanik Tua Kalondama (VTKl). Berdasarkan hasil pemodelan dan analisis data gayaberat diidentifikasi terdapat 4 struktur patahan pada lintasan AB yang telah dikorelasikan dengan peta geologi, dan terdapat 2 patahan pada anomali rendah dan 2 patahan pada anomali tinggi yang salah satu patahannya terdapat pada manifestasi air panas dan untuk lintasan CD diidentifikasi terdapat 3 struktur patahan untuk 2 patahan terdapat pada anomali tinggi dan 1 patahan terdapat pada anomali rendah.","Q1, QC, QE","Jurnal Geologi Dan Sumberdaya Mineral,",2022-05,
FT1,Radon and Thoron Analysis of Soil Gas Survey Case Study of Rajabasa Geothermal Field,"Radon and Thoron concentration of soil gas was measured by Scintrex Radon detector RDA 200 in the
Rajabasa geothermal field, South Lampung regency, Indonesia. This study is aimed todeterminethe buried fault
zoneunder theoverburdenlayer. The survey areacovers three geothermal manifestations in the southern part of
Rajabasageothermalfield. The result indicates fault system trending SW-NE (N 60o E) and SSW-NNE (N 8o E). The
contour map of Radon concentration performed high value in the three manifestations which was included survey area;
those are 123 cpm in Gunung Botak hot spring, 145 cpm in Kunjir fumarole and 382 cpm about 300 m from Bulakan
(Way Belerang) fumarole. Three manifestations were connected by two fault. The first fault passed begin from Gunung
Botak directed to Kunjir and the other across the first fault from SSW to Bulakan. The contour map of Radon and
Thoron ratio indicated that the second fault system is not only indicate the presence of the fault /fracture zones but also
show the extension of the faults/fractures from the depth to the surface.","QC, QE, TA, TN",AIP Conf. Proc.,2013-09-20,
FT1,"Application of Radon Isotopes to Determine Permeable Zones in Rajabasa Geothermal Field, Indonesia","This study aims to determine permeable zones (i.e. fault or fracture zones) in the
Rajabasa geothermal field using radon isotopes. Radon concentration of soil gas was measured by
Scintrex Radon detector RDA 200 consisting of 123 measurement station. The measurement site
spacing was between 200 m and 350 m. The radon concentration was classified based on a
statistical approach, i.e. low, high and very high. Very high value of radon concentration, called
radon anomaly, associated with permeable zones. From the radon anomaly contour map, a 2D
Radon migration from the source to the surface was modelled by means of numerical simulation.
Finally, the radon contour map was overlaid with the surface geological map and the resistivity
contour map in the area of study. It suggests that the radon anomaly correlates with the location of
permeable zone in the centre part of the study area i.e. mud pool manifestation at the Kunjir and the
Cugung (Bulakan) fumarole. Based on numerical simulation, the width of the fault is 2,800 m;
velocity of fluid is 0.08 m/s and the Radon concentration is 860,000 Beq/m3. The resistivity contour
map results in low resistivity of 0 to 100 Ωm indicating the conductive zone coincide with
permeable zones based on radon measurements. Furthermore, the peak of the profile curve of
Radon concentration could be an indication of fault systems in this area.","QC, QE, TA",Applied Mechanics and Materials,2015,
FT1,A Combination of Monte-Carlo and Damped Least Square Inversion Method for Determining Radon Source in Geothermal Case,"Radon measurement on the surface can represent the subsurface condition. The measured Radon in geothermal field is caused by the source, which is usually a geothermal reservoir. This study did the inversion process for determining the depth and value of Radon Source. Another fact, non�uniqueness of the solution can produce a result with different model parameter combinations. Hence, it can confuse the interpreter to determine the correct model. Based on this case, we 
proposed an inversion scheme that can minimize the non-uniqueness effect in the Radon data inversion. The scheme is started by Monte-Carlo inversion and finished by damped least-square. Monte-Carlo inversion, as one of the global optimizations, produce an appropriate starting model for the damped least squares. The damped least square method will finish the scheme fast. In order 
to be sure with the result, the whole scheme is repeated 19 times. The relative RMS error for the synthetic data is 0.07% to 0.32% to a depth difference of 7% from the synthetic model. With this synthetic data inversion test, the inversion scheme was applied to the real data from the Rajabasa Geothermal field. With this scheme, the section AA’ gives an error of 0.51% to 0.88% with a 
depth of 712 m and section BB’ gives an error of 5.79% to 5.27% with a depth of 728 m. This result is coherent with the magnetotelluric data in this area.","QA76, QC, QE",Journal of The Earth and Space Physics,2021-02,
,"SIMILARITY_Mapping and analysis of the physical properties of rocks for building materials in the
Sunda Strait region","Based on gravity mapping, high gravity anomalies in southern Lampung relate to igneous rocks, especially granite and granodiorite plutons, meanwhile andesite rock in medium gravity anomalies. Further geological observation and test of andesite rock physical properties become very important, in order to support the fulfilment of quantities with good quality for the acceleration of development of the Sunda Strait area.
The andesite potentials in the Tarahan and Bakauheni areas are predominantly located on the medium Bouguer anomaly. The results of petrographic analysis showed three types of rocks, namely hornblende andesite, basalt amphibolite and tuff. The magma series based on the Atomic Absorption Spectrometry (AAS) test results on the three samples shows the calc-alkaline magma series.
While from the testing of the physical properties of rock shows properties that meet the standard SII.0378-80 by the ultimate of the strength, force value range between 1125 to 1558 kg/cm2, in which the material can be used for medium to heavy buildings raw materials.","Q1, QC, QE",,2020-02,
FT1,PEMODELAN 3D STRUKTUR BAWAH PERMUKAAN GUNUNGAPI AGUNG PROVINSI BALI MENGGUNAKAN METODE GAYA BERAT,"Telah dilakukan penelitian dengan tema “Pemodelan 3D Struktur Bawah Permukaan Gunungapi Agung Provinsi Bali Menggunakan Metode Gaya Berat”. Penelitian ini bertujuan untuk mengidentifikasi kantong magma dan membuat model bawah permukaan Gunungapi Agung Provinsi Bali menggunakan data anomali gaya berat. Metode pengolahan data yang dilakukan dalam penelitian ini ialah (i) membuat peta kontur Anomali Bouguer, (ii) melakukan analisis spektrum (iii) melakukan pemisahan anomali regional dan residual (iv) melakukan analisis Second Vertical Derivative, (v) membuat penampang geologi bawah permukaan secara 3D (inverse modelling) (vi) melakukan interpretasi kualitatif dan kuantitatif. Hasil pada peta Anomali Bouguer menunjukkan nilai anomali Bouguer daerah penelitian berkisar antara 84 mGal yang tersebar pada bagian barat daya daerah penelitian sampai 279 mGal yang berada pada tubuh Gunungapi Agung. Batas antara batuan dasar dan batuan sedimen daerah penelitian terdapat pada kedalaman 0,89 km. Kantong magma Gunungapi Agung berada pada kedalaman 500 hingga 8000 meter dengan bentuk menjulang ke atas dan cembung dibagian tengahnya. Kantong magma ini memiliki densitas sebesar 2,73 – 2,86 gr/cc. Jika dilihat dari model yang didapat aliran magma di dalam Gunungapi Agung terlihat pada kedalaman 0 meter.","Q1, QC, QE",Jurnal Geofisika Eksplorasi,2019-07-02,
FKIP9,The Effect of Applying Argument Driven Inquiry Models to the Critical Thinking Skills of Students Based on Gender Differences,"This study aims to determine the effect of the application of the Argument-Driven Inquiry (ADI) learning model on students' critical thinking abilities and to determine the differences in critical thinking skills between female and male students in the class using the learning model Argument-Driven Inquiry (ADI). The subjects of this study were students of class VIII.1 and VIII.5 JHS 13 Bandarlampung, consisting of 30 students of class VIII.1 and 30 students of class VIII.5. The sample was taken using a purposive technique by looking at the class with the same number of female and male students. The research design used was quasi-experimental design with Pretest-posttest Control Group Design and data collection techniques of critical thinking skills using pretest-posttest, which refers to the five criteria of critical thinking according to Ennis. The results showed that (1) there is an effect of applying the Argument-Driven Inquiry learning model on female students' critical thinking skills as indicated by the sig value. equal to 0,0001 (2) there is an effect of the application of the Argument-Driven Inquiry learning model on male students' critical thinking skills as indicated by the sig value. for 0,000 (3) there is no difference in critical thinking skills between female and male students using the ADI model indicated by the sig value and amounting to 0.725. That is, the application of the Argument-Driven Inquiry model affects the critical thinking skills of both female and male students, but there is no difference in critical thinking skills between female and male students. This means, the implementation of Argument-Driven Inquiry model effective on students’ critical thinking skill, but there is no difference in critical thinking skills between female and male students.","L1, QC",Scientiae Educatia: Jurnal Pendidikan Sains,2019,
FMIPA4,Tropical Marine Diatom Cyclotella striata growth in Low Silica Concentration,"Cyclotella striata  is one of tropical marine diatom that has a great potential in biomass production. High biomass production by C. striata is related to optimum growth conditions, including the adequacy of nutrients, especially the silica concentration. In this study, the optimization of silica in growth media had been done to enhance the biomass production of C. striata. There were four different media with the range of silica concentration between 10 and 150 mg/L were applied to the growth of the microalga under light intensity of 2500 lux (photoperiod 12:12 h) at room temperature. C. striata cells were grew well at medium with low concentration of silica.",QC,,2018-10,
FMIPA1,Inhibisi Korosi Ekstrak Buah Pinang (ARECA CATECHU L.) Sebagai Penghambat Laju Korosi Pada Baja Karbon Rendah C-Mn Steel dengan Medium Korosif HCL dan NaCl,"Corrosion inhibition of areca nut extract (Areca catechu) as the resistor of corrosion rate in low carbon steel with HCl and NaCl corrosive medium concentrated at 3% had been reasearched. The C-Mn steel corrosion rate was examined during a 96 hours of submersion with and without the addition of areca nut extract with the concentration rate at 10%, 15%, and 20% respectively. The examination was done with the weight loss method. The result of the research shows that the use of higher the concentration of areca nut extract resulted in the decrease of corrosion rate and the increase of corrosion inhibition capability. The highest rate of corrosion effectiveness was found in the 20% concentration in both HCl and NaCl with the rate of 86,06% and 85,62% respectively. The result of X-Ray diffraction (XRD) characterization showed that the phase formed was pure Fe. Scanning Electron Microscopy (SEM) characterization showed uneven clusters with smaller size. Holes and cracks were not formed that the corrosion rate was lower compared to the sample without inhibitor addition. The characterization Energy Dispersive Spectroscopy (EDS) in the sample without inhibitor showed the presence of Cl substance.",QC,Jurnal Teori dan Aplikasi Fisika,2019-01-31,
FT1,"ANALISIS SIFAT FISIS PADA RESERVOAR BATUPASIR MENGGUNAKAN
METODE SEISMIK INVERSI IMPEDANSI AKUSTIK (AI) DAN MULTIATRIBUT
PADA LAPANGAN “MNF” CEKUNGAN BONAPARTE","Analisis sifat fisis pada reservoar batupasir dalam penelitian ini dilakukan dengan menggunakan metode inversi
impedansi akustik dan multiatribut seismik yang dilakukan pada Lapangan ―MNF‖ Cekungan Bonaparte. Pada
penelitian ini dihasilkan sebaran impedansi akustik, serta dari impedansi akustik tersebut diturunkan hingga
mendapatkan peta sebaran saturasi air serta dilakukan prediksi volume properti log untuk memprediksi pseudo
gamma ray, densitas dan porositas dengan analisis multiatribut menggunakan metode regresi linear dengan teknik
step wise regression. Dari hasil analisis crossplot data sumur untuk analisis sensitiv sand-shale dan analisis inversi
pada batupasir yang terisi oleh fluida hidrokarbon diperoleh nilai impedansi akustik antara 12.000 ft/s*g/cc –
27.000 ft/s*g/cc. Pada bagian Tengah sekitar Sumur NN-1, NN-3, dan NN4 serta bagian Tenggara daerah penelitian
merupakan daerah prospek yang memiliki nilai gamma ray dengan range 5-70 API, densitas dengan range 2,1-2,3
gr/cc dan porositas dengan range 18-23% serta SW sebesar 10-13% yang mengindikasikan pada lapangan
penelitian terakumulasi hidrokarbon gas. Dari hasil multiatribut serta impedansi akustik menunjukan bahwa
batupasir pada lapangan ini merupakan batupasir thight.","QC, QE",Jurnal Geofisika Eksplorasi,2018-11,
FT1,"ANALISIS SIFAT FISIS PADA RESERVOAR BATUPASIR MENGGUNAKAN
METODE SEISMIK INVERSI IMPEDANSI AKUSTIK (AI) DAN MULTIATRIBUT
PADA LAPANGAN “MNF” CEKUNGAN BONAPARTE","Analisis sifat fisis pada reservoar batupasir dalam penelitian ini dilakukan dengan menggunakan metode inversi
impedansi akustik dan multiatribut seismik yang dilakukan pada Lapangan ―MNF‖ Cekungan Bonaparte. Pada
penelitian ini dihasilkan sebaran impedansi akustik, serta dari impedansi akustik tersebut diturunkan hingga
mendapatkan peta sebaran saturasi air serta dilakukan prediksi volume properti log untuk memprediksi pseudo
gamma ray, densitas dan porositas dengan analisis multiatribut menggunakan metode regresi linear dengan teknik
step wise regression. Dari hasil analisis crossplot data sumur untuk analisis sensitiv sand-shale dan analisis inversi
pada batupasir yang terisi oleh fluida hidrokarbon diperoleh nilai impedansi akustik antara 12.000 ft/s*g/cc –
27.000 ft/s*g/cc. Pada bagian Tengah sekitar Sumur NN-1, NN-3, dan NN4 serta bagian Tenggara daerah penelitian
merupakan daerah prospek yang memiliki nilai gamma ray dengan range 5-70 API, densitas dengan range 2,1-2,3
gr/cc dan porositas dengan range 18-23% serta SW sebesar 10-13% yang mengindikasikan pada lapangan
penelitian terakumulasi hidrokarbon gas. Dari hasil multiatribut serta impedansi akustik menunjukan bahwa
batupasir pada lapangan ini merupakan batupasir thight.","QC, QE",Jurnal Geofisika Eksplorasi,2018-11,
FMIPA1,"Rancang Bangun Alat Ukur Kekeruhan Air
Menggunakan Fototransistor dan LED 
Inframerah Berbasis Arduino Uno","Pada  penelitian  ini,  telah  dirancang  dan  dibuat    alat  ukur  kekeruhan  air berbasis    Arduino    Uno dengan    menggunakan    Fototransistor    dan    LED inframerah.  Alat  ukur ini    terdiri  dari  rangkaian  sensor  inframerah,  Arduino sebagai  proses,  LCD  I2C  sebagai  penampil  nilai,  Micro  SD  sebagai  penyimpan data  dan  RTC  sebagai  pengatur  waktu.  Penelitian  ini  menggunakan  dua sampel air dengan variasi konsentrasi. Sampel yang digunakan, yaitu aquades ditambah   zat   pengotor   berupa   tanah   danabu.   Jumlah   aquades   yang digunakan  tetap  yaitu  100  ml  dengan  variasi  konsentrasi  zat  pengotor  mulai dari  0,1-0,9  gr.  Hasil  pengujian  sensor  menunjukkan  bahwa  semakin  besar tingkat   kekeruhan,   maka   semakin   besar   pula   tegangan   yang   diperoleh. Pembacaan uji sensor pada alat buatan mulai dari 2,02 V hingga 4,00 V untuk air  tanah  dan  2,02  V  hingga  4,31 V  untuk  air  abu.  Pembacaan  menggunakan alat  ukur  standar  untuk  air  tanah  mulai  dari  0  NTU  hingga  331,4  NTU, sedangkan  untuk  air  abu  mulai  dari  0  NTU  hingga  284,4  NTU.  Data  hasil pengujian  sensor  menghasilkan  persamaan  yang  digunakan  untuk  mengubah nilai tegangan alat ukur buatan menjadi nilai kekeruhan. Kemudian, dilakukan pengambilan  data  menggunakan  sampel  yang  sama  sehingga  diperoleh  nilai kekeruhan  untuk  air  tanah  mulai  dari  0  NTU  hingga  318,94NTU  sedangkan untuk  air  abu  mulai  dari  0  NTU  hingga 285,13NTU.Berdasarkan  hasil yangdiperoleh rata-rata akurasi untuk air tanah sebesar 94,66%, sedangkan untuk air abu sebesar 96,63%",QC,"Journal of Energy,Material,and Instrumentation Technology",2021-05-31,
FMIPA1,"Rancang Bangun Alat Ukur Kekeruhan Air
Menggunakan Fototransistor dan LED 
Inframerah Berbasis Arduino Uno","Pada  penelitian  ini,  telah  dirancang  dan  dibuat    alat  ukur  kekeruhan  air berbasis    Arduino    Uno dengan    menggunakan    Fototransistor    dan    LED inframerah.  Alat  ukur ini    terdiri  dari  rangkaian  sensor  inframerah,  Arduino sebagai  proses,  LCD  I2C  sebagai  penampil  nilai,  Micro  SD  sebagai  penyimpan data  dan  RTC  sebagai  pengatur  waktu.  Penelitian  ini  menggunakan  dua sampel air dengan variasi konsentrasi. Sampel yang digunakan, yaitu aquades ditambah   zat   pengotor   berupa   tanah   danabu.   Jumlah   aquades   yang digunakan  tetap  yaitu  100  ml  dengan  variasi  konsentrasi  zat  pengotor  mulai dari  0,1-0,9  gr.  Hasil  pengujian  sensor  menunjukkan  bahwa  semakin  besar tingkat   kekeruhan,   maka   semakin   besar   pula   tegangan   yang   diperoleh. Pembacaan uji sensor pada alat buatan mulai dari 2,02 V hingga 4,00 V untuk air  tanah  dan  2,02  V  hingga  4,31 V  untuk  air  abu.  Pembacaan  menggunakan alat  ukur  standar  untuk  air  tanah  mulai  dari  0  NTU  hingga  331,4  NTU, sedangkan  untuk  air  abu  mulai  dari  0  NTU  hingga  284,4  NTU.  Data  hasil pengujian  sensor  menghasilkan  persamaan  yang  digunakan  untuk  mengubah nilai tegangan alat ukur buatan menjadi nilai kekeruhan. Kemudian, dilakukan pengambilan  data  menggunakan  sampel  yang  sama  sehingga  diperoleh  nilai kekeruhan  untuk  air  tanah  mulai  dari  0  NTU  hingga  318,94NTU  sedangkan untuk  air  abu  mulai  dari  0  NTU  hingga 285,13NTU.Berdasarkan  hasil yangdiperoleh rata-rata akurasi untuk air tanah sebesar 94,66%, sedangkan untuk air abu sebesar 96,63%",QC,"Journal of Energy,Material,and Instrumentation Technology",2021-05-31,
FMIPA1,Realiasasi Sensor Temperatur LM35DZ Sebagai Sensor Kecepatan Aliran Fluida Berbasis Mikrokontroler ATMega32 dengan Media Penyimpan Data Micro Secure Digital (Micro SD),"This research has been used eight temperature sensors of LM35DZ type and the heater has been controlled to be at a constant temperature of 52.3oC. The output of this research was the temperature, the temperature difference, the Analog Digital to Converter (ADC), response the difference of ADC, response voltage, and voltage difference. More high of the faucet angle, the difference temperature obtained will the more small and the speed fluid will the more hight. The heat propagation is fluid flow is more hight than the fluid flow its self, so it will give the more hight temperature difference. The response of temperature difference to the faucet angle is inversely. This research control was Atmega32 and data storage media was Micro Secure Digital (Micro SD).",QC,Jurnal Teori dan Aplikasi Fisika,2016-07-15,
FT1,"Well Log Analysis and Geochemical Data to Identify Source Rock and Hydrocarbon
Reservoir: Northeast Java Basin Study Case","Comprehensive characterizarion methods are carried out to determine accurate
source rock and reservoir identification. Geochemical data has become a critical part of
recent unconventional exploration and development. However, due to high cost of geological
core extraction and analysis, geophysical wireline logging tools have become the primary
source of downhole measurement of geomechanical properties. This study covers an
integrated approach at defining geochemical report derived from geological core extraction
and analysis and its relationship with geophysical wireline logs of 5 (five) wells at Northeast
Java Basin. Geophysical wireline logs can be utilized to identify reservoir and source rock
intervals in the early stage of well drilling. However, the well logs that directly measure the
hidrogen content of the kerogen do no exist. Consequently, it is utilized for source rock
evaluations and calculation of Total Organic Carbon (TOC) which are most commonly
include sonic, density, gamma ray, neutron, and resistivity. The Van Krevelen diagram has
been applied to all 5 (five) wells that indicates 2 (two) of them have potential gas – kerogen
type III/IV with marginally mature to mature source rock. The integration of well logs and
geochemical data greatly improves the accuracy and understanding of the controls of
reservoir quality and source rock. It can be used for further step of knowing basin potential
and its prospect level.","QC, QD, QE",IOP Conf. Series: Earth and Environmental Science,,
,Exploring teacher perception about STEM learning material to foster students understanding of dispersion concept,". In the 21st century, the required human resources must be of high quality and
possess high-level thinking skills, including critical, creative, innovative. Thus, the teacher's
role is needed to develop these skills in preparing appropriate learning. The design of a
learning plan must be able to accommodate the needs associated with the learning process in
class. Activities undertaken as well as the results to be achieved through indicators of
achievement must be fully reflected in the learning plans. This research was conducted to
analyze teacher perceptions of STEM learning to improve understanding of diffraction
concepts. The research method used qualitative methods. Data obtained from document
analysis and in-depth interviews. This study involved 75 respondents/educators in physics who
were scattered throughout the region in Lampung Province. The results showed the tendency of teachers to still use conventional learning methods. This was identified from the learning implementation plan and student worksheets compiled by the teacher had not developed learning innovations that can train students improving the understanding of concepts. So in future research, it is necessary to develop teaching materials that are integrated with STEM, so that they can improve students' conceptualization and skills..","H1, L1, QC",Journal of Physics: Conference Series,,
FT6,PERENGKAHAN KATALITIK MINYAK JELANTAH MENGGUNAKAN KATALIS Co-CARBON YAND DIHASILKAN DENGAN METODE ION EXCHANGE,"Penggunaan bahan bakar yang terus meningkat mengakibatkan cadangan minyak bumi mengalami penurunan. Bahan bakar minyak (BBM) yang berasal dari fosil tidak dapat diperbaharui. Biofuel adalah salah satu sumber energi alternatif. Pembuatan Biofuel dapat dilakukan dengan perengkahan termal dan perengkahan katalitik minyak goreng bekas. Minyak goreng bekas dapat menjadi biofuel dengan proses perengkahan katalitik menggunakan katalis Co-Arang. Penelitian ini meliputi preparasi katalis kobalt-arang aktif dengan metode ion exchange, Karakterisasi katalis, dan perengkahan katalitik minyak jelantah. Konsentrasi larutan logam yaitu 1%, 2%, dan 3%, dengan variasi temperatur perengkahan yaitu 450°C, 500°C, 550°C. Karakterisasi dengan XRD menunjukkan struktur atom karbon berbentuk struktur amorf. Hasil karakterisasi dengan SEM-EDX didapatkan hasil logam kobalt yang teremban yaitu sebesar 0,86%, 1,99% dan 0,11%.  Konversi rata-rata (%) CHP perengkahan minyak jelantah pada Konsentrasi katalis 1%, 2% dan 3% adalah  31,83%, 8,51% dan 11,43%. Produk perengkahan maksimum di dapatkan pada temperatur 450oC dengan konsentrasi Co-Arang 1% yaitu 47,55%. Energi aktivasi perengkahan yaitu -40,64 kJ, 71,03 kJ dan 29,98 kJ.","QC, QD, TP",Journal of Bio-Geo Material and Energy,2021-03,
