division,title,abstract,subjects,publication,date,keywords
FMIPA1,"Preliminary Study on Functional Groups
Characteristics of Asphalt Containing Rice Husk Silica","Abstract. In this research, asphalt composite was produced by combining asphalt and rice 
husk silica. The ratio of asphalt and silica were 1:1.5; 1:1.7; and 1:1.9 respectively and
calcined at temperature of 150°C.  Functional group characteristics of asphalt composites
were examined by FTIR and XRD. The FTIR and XRD studies revealed that the main
Functional groups are Si-O-Si, C-H, and structure amorph of silica. 
Keyword: Rice Husk, Silica, Asphalt, Functional Group, FTIR",QC,Journal of Technomaterials Physics,2019,
FMIPA1,"STRUCTURE AND MICROSTRUCTURE PROPERTIES
OF А REFRACTORY CORDIERITE PREPARED FROM AMORPHOUS RICE HUSK
SILICA RESULTING FROM PERICLACE INTRODUCTION","ABSTRACT
А refractory cordierite ceramic prepared from amorphous rice husk silica is modified by the addition of 5 wt. %
to 20 wt. % of periclase followed by a sintering treatment at a temperature of 1230 oC. The phases, the structural
changes and the microstructure characteristics of the samples are investigated by x-ray diffraction (XRD) and scanning
electron microscopy (SEM). The results obtained indicate the significant effect of the periclace addition on
the phase decomposition of cordierite into spinel and forsterite. The addition of periclace is found to increase the
presence of forsterite and decrease that of spinel. The formation of spinel and forsterite is connected with electrical
resistivity and porosity decrease but density increase.
Keywords: cordierite, periclace, silica, rice husk, structure.",QC,"Journal of Chemical Technology and Metallurgy, 54, 4, 2019, 721-726",,"cordierite, periclace, silica, rice husk, structure."
FMIPA1,"STRUCTURE AND MICROSTRUCTURE PROPERTIES
OF А REFRACTORY CORDIERITE PREPARED FROM AMORPHOUS RICE HUSK SILICA RESULTING FROM PERICLACE INTRODUCTION","А refractory cordierite ceramic prepared from amorphous rice husk silica is modified by the addition of 5 wt. %
to 20 wt. % of periclase followed by a sintering treatment at a temperature of 1230 
C. The phases, the structural
changes and the microstructure characteristics of the samples are investigated by x-ray diffraction (XRD) and scanning

electron microscopy (SEM). The results obtained indicate the significant effect of the periclace addition on
the phase decomposition of cordierite into spinel and forsterite. The addition of periclace is found to increase the
presence of forsterite and decrease that of spinel. The formation of spinel and forsterite is connected with electrical
resistivity and porosity decrease  but density increase.
Keywords: cordierite, periclace, silica, rice husk, structure",QC,"Simon Sembiring, Wasinton Simanjuntak, Rudy Situmeang Journal of Chemical Technology and Metallurgy",2019,"cordierite, periclace, silica, rice husk, structure"
"FMIPA1, FMIPA4","STRUCTURAL AND PHYSICAL PROPERTIES OF REFRACTORY
CORDIERITE PRECURSORS PREPARED FROM RICE HUSK
SILICA WITH DIFFERENT MgO ADDITION","This study describes the structural and physical properties of refractory cordierite prepared from rice husk silica, which is sintered at a temperature of 1230°C and followed by the addition of periclace (MgO) from 5 to 30 % by weight. The phases formed and structure changes as a result of periclace addition were investigated using different characterization technique of X-ray diffraction (XRD) coupled with Rietveld analysis, and scanning electron microscopy (SEM). Density, porosity, hardness, bending strength and coefficient of thermal expansion are also measured.
The results obtained revealed that the addition of periclace of 10 to 30 % promoted the transformation of the cordierite to the forsterite and spinel, and the cordierite is practically undetectable. Addition of periclace was found to increase forsterite and decrease spinel. The presence of forsterite and spinel resulted in increased of density, hardness, bending strength, and thermal expansion coefficient, as well as decreased porosity. The coefficient of thermal expansion of the samples with the addition of 10-30 % periclace reach the relatively constant value of 8.2 × 10-6 °C, with the main crystalline phase is forsterite, followed by spinel in smaller quantities.","QC, QD",Ceramics-Silikáty,2018-02-21,
"FMIPA1, FMIPA4","STRUCTURAL AND PHYSICAL PROPERTIES OF REFRACTORY
CORDIERITE PRECURSORS PREPARED FROM RICE HUSK
SILICA WITH DIFFERENT MgO ADDITION","This study describes the structural and physical properties of refractory cordierite prepared from rice husk silica, which is
sintered at a temperature of 1230°C and followed by the addition of periclace (MgO) from 5 to 30 % by weight. The phases
formed and structure changes as a result of periclace addition were investigated using different characterization technique
of X-ray diffraction (XRD) coupled with Rietveld analysis, and scanning electron microscopy (SEM). Density, porosity,
hardness, bending strength and coefficient of thermal expansion are also measured.
The results obtained revealed that the addition of periclace of 10 to 30 % promoted the transformation of the cordierite to the forsterite and spinel, and the cordierite is practically undetectable. Addition of periclace was found to increase forsterite and decrease spinel. The presence of forsterite and spinel resulted in increased of density, hardness, bending strength,and thermal expansion coefficient, as well as decreased porosity. The coefficient of thermal expansion of the samples with the addition of 10-30 % periclace reach the relatively constant value of 8.2 × 10-6 °C, with the main crystalline phase is forsterite, followed by spinel in smaller quantities.","QC, QD",Ceramics-Silikáty,2018-02-21,
FMIPA1,STRUCTURAL AND PHYSICAL PROPERTIES OF REFRACTORY CORDIERITE PRECURSORS PREPARED FROM RICE HUSK SILICA WITH DIFFERENT MgO ADDITION,"This study describes the structural and physical properties of refractory cordierite prepared from rice husk silica, which is sintered at a temperature of 1230°C and followed by the addition of periclace (MgO) from 5 to 30 % by weight. The phases formed and structur e changes as a result of periclace addition were investigated using different characterization technique  of X-ray diffraction (XRD) coupled with Rietveld analysis, and scanning electron microscopy (SEM). Density, porosity,  hardness, bending str ength and coefficient of thermal expansion ar e also measur ed.  The results obtained revealed that the addition of periclace of 10 to 30 % promoted the transformation of the cordierite to the forsterite and spinel, and the cordierite is practically undetectable. Addition of periclace was found to increase forsterite and decrease spinel. The presence of forsterite and spinel resulted in increased of density, hardness, bending strength, and thermal expansion coefficient, as well as decreased porosity. The coefficient of thermal expansion of the samples with  the addition of 10-30 % periclace reach the relatively constant value of 8.2 × 10
 °C, with the main crystalline phase is forsterite, followed by spinel in smaller quantities.",QC,Ceramics-Silikáty,2018-02-21,
FMIPA1,Effect of alumina addition on the phase transformation and crystallisation properties of refractory cordierite prepared from amorphous rice husk silica,"The effect of alumina addition of 5–30% by weight on phase transformation and crystallisation properties of refractory cordierite ceramics prepared from amorphous rice husk silica followed by sintering treatment at temperature of 1230 ◦C was studied. The crystallinity and microstructure of the samples were characterised using X-ray diffraction (XRD) coupled with Rietveld analysis, scanning electron microscopy
(SEM), respectively. Some physical properties include density, porosity, hardness, bending strength, and
thermal expansion coefficient of the samples with different alumina additions were measured. The results show that addition of alumina promoted crystallisation of cordierite into crystalline spinel, corundum, cristobalite, in which with addition of 10–30% alumina, the cordierite phase was practically undetected. Addition of alumina was also found to increase the amount of spinel, while corundum and cristobalite decreased following alumina addition of 10–30%. The presence of spinel, corundum, and cristobalite
resulted in increased of density, hardness, bending strength and thermal expansion coefficient, while for porosity, the opposite was observed. Thermal expansion coefficient of the samples with alumina addition of 15–30% reach the relatively constant value of 9.5×10−6/◦C, with the main crystalline phase was spinel,accompanied by corundum and cristobalite in smaller quantities.","QC, QD",Journal of Asian Ceramic Societies,2017-06,
"FMIPA1, FMIPA4",Preparation of refractory cordierite using amorphous rice husk silica for thermal insulation purposes,"This study aims to investigate the effect of sintering temperatures on the phase formation and physical characteristics of refractory cordierite prepared from rice husk silica, Al2O3, and MgO powders. The samples were subjected to sintering temperatures of 1050–1350 °C, and development of structures was characterized using Fourier Transform Infrared (FTIR) spectroscopy, X-ray diffraction (XRD) coupled with Rietveld analysis, scanning electron microscopy (SEM) and dilatometry. The results obtained indicated the significant role of sintering temperatures on phase transformation of spinel and cristobalite into cordierite, in which at sintering temperatures of 1230–1350 °C the cordierite emerges as a dominant phase, while spinel and cristobalite are practically undetected. Formation of cordierite was followed by decrease in density, porosity, and thermal expansion coefficient, while for hardness and bending strength the opposite was true. Thermal expansion coefficient of the sintered sample at 1350 °C is 3.3×10−6/°C and the XRD analysis demonstrated that the main crystalline phase is cordierite. Based on these characteristics, the samples are considered as insulator, suggesting their potential use in refractory devices.","QC, QD",Ceramic International,2016-05-15,
"FMIPA1, FMIPA4",Preparation of refractory cordierite using amorphous rice husk silica for thermal insulation purposes,"This study aims to investigate the effect of sintering temperatures on the phase formation and physical characteristics of refractory cordierite prepared from rice husk silica, Al2O3, and MgO powders. The samples were subjected to sintering temperatures of 1050–1350 °C, and development of structures was characterized using Fourier Transform Infrared (FTIR) spectroscopy, X-ray diffraction (XRD) coupled with Rietveld analysis, scanning electron microscopy (SEM) and dilatometry. The results obtained indicated the significant role of sintering temperatures on phase transformation of spinel and cristobalite into cordierite, in which at sintering temperatures of 1230–1350 °C the cordierite emerges as a dominant phase, while spinel and cristobalite are practically undetected. Formation of cordierite was followed by decrease in density, porosity, and thermal expansion coefficient, while for hardness and bending strength the opposite was true. Thermal expansion coefficient of the sintered sample at 1350 °C is 3.3×10−6/°C and the XRD analysis demonstrated that the main crystalline phase is cordierite. Based on these characteristics, the samples are considered as insulator, suggesting their potential use in refractory devices.","QC, QD",Ceramic Internasional,2016-05-15,
FMIPA1,Structure and Microstructure Properties of Refractory Cordierite Prepared from Amorphous Rice Husk Silica by Periclace Addition,"Refractory cordierite ceramic using amorphous rice husk silica was modified by addition of periclase from 5 to 20% by weight, followed by sintering treatment at temperature of 1230 oC. The phases, structural changes and microstructure characteristics of samples were investigated by x-ray diffraction (XRD), scanning electron microscopy (SEM). The results obtained indicated the significant role of periclace addition on the phase decomposition of cordierite into spinel and forsterite. Addition of periclace was found to increase forsterite and decrease spinel. Formation of spinel and forsterite was followed by decrease in electrical resistivity, porosity and by increase density.","Q1, QC",,,
FMIPA1,"Pengaruh Penambahan Silika (Sio2) Sekam Padi Terhadap Karakteristik Mikrostruktur dan Struktur Aspal dengan Perbandingan Massa 1:0 ; 1:1,5 ; 1:1,6 dan 1:1,7","Abstarct. Synthesis and characterization of silica rice husk blend asphalt was carried out with a mass ratio of 1;0; 1:1,5; 1:1,6 and 1:1,7 respectively. Rice husk was prepared by sol-gel method as a raw material of silica. Asphalt and silica is mixed by using the solid-sate method, which is heated with a temperature of 110 oC for 4 hours. This study was revealed to investigate the effect of the addition of silica from rice husk on microstructure and asphalt structure. SEM results show the morphology of the asphalt surface without addition of silica which transforms elongated folds and after addition of silica shows uncertain granules more likely seems clusters with grain size (1:1,5 = 4,298 m, 1:1,6 = 3,103 m and 1:1,7 = 5,328 m) respectively. The XRD results show asphaltene amorphous phase in the asphalt sample with two peaks at 2= 18,90 and 2= 42. Furthermore, the addition of silica with asphalt able to modify two asphaltene peaks into carbon and silica amorphous peaks.
Keywords: Asphalt, silica, rice husk, asphaltene, sol gel.",QC,Jurnal Teori dan Aplikasi Fisika,2019-01,"Asphalt, silica, rice husk, asphaltene, sol gel."
FMIPA1,"Synthesis and characterization of asphalt composite
precursors using amorphous rice husk silica","In this research, asphalt composites were produced by mixing asphalt with silica extracted from rice husk, with a ratio of asphalt
to silica of 1:0, 1:1.7 and 1:2, and calcined at 150 °C. Development of structures was characterized using Fourier transform
infrared (FTIR) spectroscopy, X-ray diffraction (XRD), scanning electron microscopy (SEM), followed by differential thermal
analysis (DTA/TGA). The FTIR results showed the presence of Si-OH, C=O, and C-H functional groups, which were associated
with asphaltene, carbon, and silica, according to the XRD analysis. The results obtained also indicated the significant effect of
rice husk silica addition on phase transformation of asphaltene into silica and carbon, while asphaltene molecules were practically
undetected. The presence of silica and carbon resulted in increased decomposition temperature of the sample. Based on these
characteristics, the samples were considered as a roof material, suggesting their potential use as a substitute for lightweight steel
roof devices.
Keywords: rice husk, silica, asphalt, structure, thermal behavior.",QC,Cerâmica,2019,"rice husk, silica, asphalt, structure, thermal behavior."
FMIPA1,"Effect of MgO-SiO2 Ratio on the Forsterite (Mg2SiO4) Precursors Characteristics Derived from
Amorphous Rice Husk Silica","This study acquires the potential of rice husk silica for production forsterite precursors using sol-gel method. The samples preparation were conducted by mixing magnesium oxide sol from Mg(NO3)2.6.12H2O with silica sol extracted from rice husk, with three different composition ratios of MgO to SiO2 are 1:1, 2:3 and 3:2 by weight and sintered at 900oC. The samples were characterized using Fourier transform infrared (FTIR) spectroscopy, x-ray diffraction (XRD),differential thermal analysis (DTA), followed by scanning electron microscopy (SEM). The FTIR results showed the presence of Si-O-Si, Mg-O and Mg-O-Si functional groups, which were associated with forsterite, enstatite, cristobalite and periclase, according to the XRD analysis. The formation of forsterite (Mg2SiO4) is composition-dependent as revealed the increase of forsterite intensity after sintered at 900oC in ratio 3:2. The surface morphology of non-sintered samples shows that particle and grain size were larger than particle and grain size of sintered samples. Also, SEM analysis of sintered samples clearly shows the presence of regular particle size with smaller grain size was found in ratio of MgO to SiO2 is 3:2. DTA analysis revealed that the formation of forsterite increased with increasing temperature. In addition, the electrical resistivities of the samples were found in the range of 0.75 x 1013 to 3.30 x 1013Ω-cm, demonstrating that the samples exhibit good potential as isolator.","QC, QD",ORIENTAL JOURNAL OF CHEMISTRY,2017-08,
FT1,"IDENTIFICATION OF GEOLOGICAL STRUCTURE AND ITS IMPACT TO LAND SURFACE TEMPERATURE BASED ON ASTER AND DEM DATA ON ""TG14"" GEOTHERMAL FIELD, SUMATERA","In a study of geothermal prospects, the first thing to do is identify the geological condition in the area. This study aims to determine the geological conditions in area of ""TG14"" geothermal field using remote sensing method on ASTER and DEM imagery and the impact to land surface temperature. The land surface temperature (LST) from thermal infra red (TIR) band using a retrieval method. Surface emissivity was determined based on Normalized Difference Vegetation Index (NDVI) of study area. Remote sensing analysis is good approach to identification of geological structure from surface that control thermal manifestation in ""TG14"" geothermal field. The hottest temperature in the area along the deep-seated Great Sumatera Fault and the western graben transform fault. Heated by magma assosiated with the volcanic deposits. Its show the Great Sumatera Fault is the main structure in geothermal field which assosiated with high LST and thermal manifestation.","QC, QE",,2017-08-04,
,A Systematic Literature Review: Internet of Things on Smart Greenhouse,,QC,International Journal of Advanced Computer Science and Applications,,
FKIP17,In-House Training of 3D Molecular Modeling using Avogradro for High School Chemistry Teachers,"The purpose of this activity is to improve the knowledge and skills of chemistry 
teachers in visualizing 3D molecules. This activity was attended by 20 high school chemistry
teachers in Bandar Lampung. Methods in the activities include presentations, discussions,
questions and answers and guided practice, and independent exercises. The results of the activity
evaluation were revealed through questionnaire responses by the trainees as well as participant
performance assessments which were revealed through the product of a 3D molecular structure
visualized through the use of software. Avogadro. Based on the analysis of participants'
responses, all participants agreed and strongly agreed that the Avogadro software opened an
application that helped visualize 3D molecules; easy to operate; assist in teaching topics related
to molecular shapes and carbon compounds, molecular properties with an attractive and dynamic
appearance; provides a new experience that helps better understand the arrangement of atoms in
3D space. Based on a performance assessment in the form of a 3D molecular structure
visualization product, all participants are skilled at visualizing a 3D molecular structure. Based 
on the results of the activity, it can be concluded that this activity can improve the knowledge and 
skills of high school chemistry teachers in Bandar Lampung in visualizing molecules in 3D with
Avogadro software.","L1, QC, QD",Journal of Social Research and Community Service,2022-06-05,
FMIPA1,"Analisis Karakteristik Elektrik Air Laut Tersaring Sebagai
Sumber Energi Alternatif Berkelanjutan  
(Sustainable Energy)","The electrical characteristics of filtered seawater can be determined by using Cu-Zn electrode
pairs. Seawater is filtered by using a 1 micron sediment filter. Measurement of electrical characteristics of
water is carried out using a 3 watt DC LED load and when the load is removed. The electrolyte cell consists
of 40 cells, which are arranged in series and parallel with 300 ml per cell. Tool testing is carried out for 144
hours with 6 times electrolyte filling every 24 hours. The test results show that the longer the tool is used, the
more electrical characteristics produced will be decreasing. The produce of maximum voltage (Vbl) by
seawater is not filtered with a series of 31.5 V. The produce of maximum power (P) by seawater is not
filtered with a series of 101.1 mW. The produce of maximum illumination by seawater is not filtered with a
series of 426.4 Lux, the duration of the light is 8 hours. Despite the produce of maximum illumination by
filtered seawater with a series of 319.7 Lux series, the duration of the light is 11 hours.",QC,Jurnal Teori dan Aplikasi Fisika,2018-07-01,
FMIPA1,"Pengaruh Penambahan Inhibitor Ekstrak Kopi Dan Waktu
Perendaman Terhadap Laju Korosi Pada Baja Karbon AISI
1020 Dalam Larutan NaCl 3%","Ekstrak kopi yang digunakan sebagai inhibitor pada sampel baja karbon AISI 1020, direndam
dalam medium korosif NaCl 3%. Dengan memvariasikan waktu perendaman 4 hari dan 8 hari, dan juga
konsentrasi inhibitor 0%, 3%, 5% dan 7%. Setelah perlakuan pada sampel diperoleh hasil perhitungan laju
korosi yang paling lambat pada sampel AISI 1020 8.7 dan yang paling cepat pada sampel AISI 1020 4.0.
Inhibitor yang digunakan mempunyai nilai efisiensi paling tinggi pada sampel AISI 1020 4.7. Hasil
karakterisasi XRD menunjukkan bahwa struktur kristal yang terbentuk merupakan fasa Fe murni.
Karakterisasi SEM menunjukkan morfologi permukaan sampel, terlihat gumpalan pada sampel. Karakterisasi
EDS pada sampel terlihat unsur Oksigen (O) yang mengindikasikan bahwa sampel telah terkorosi.",QC,Jurnal Teori dan Aplikasi Fisika,2019,
FMIPA1,Studi Pendahuluan Penentuan Nilai Energi Band Gap Komposit Perak Silika (Ag/SiO2) Berbasis Sekam Padi,"Penelitian mengenai sintesis perak silika (Ag/SiO2) telah dilakukan melalui metode sol-gel dengan menggunakan variasi konsentrasi koloid perak nitrat (AgNO3) yaitu 0,5; 0,6 dan 0,7 M ke dalam sol silika sekam padi dengan perlakuan termal pada suhu 850°C. Tujuan dari penelitian ini yaitu sebagai studi pendahuluan penentuan nilai energi band gap komposit Ag/SiO2 melalui karakterisasi Spektrofotometer Uv-vis. Analis Uv-vis menunjukkan bahwa jumlah konsentrasi AgNO3 mempengaruhi nilai energi band gap. Semakin besar nilai konsentrasi AgNO3 pada sampel maka nilai energi band gap yang dihasilkan akan semakin meningkat. Sehingga, semakin banyak kadungan Ag yang terbentuk dan semakin bagus digunakan sebagai agen antibakteri.",QC,Jurnal Teori dan Aplikasi Fisika,2022,
FMIPA1,Effect of Calcination Temperature on Silica-Asphalt Composite Properties using Amorphous Rice Husk Silica,"This study aims to investigate the effect of thermal treatment on the phase formation and physical characteristics of silica asphalt composite prepared from rice husk silica and asphalt powders. The mass ratio of asphalt to silica is 1:2, and subjected to calcining temperatures of 200-450 °C. Development of structures was characterized using X-ray diffraction (XRD), Fourier Transform Infrared (FTIR) spectroscopy and scanning electron microscopy (SEM). Further evaluation was made by comparing the characteristics of the silica-asphalt composite include the density, porosity, and compressive strength. The XRD study revealed that the major phases were carbon and silica amorphous, The XRD study revealed that the major phases were silica and carbon amorphous, which were associated with are Si-OH, Si-O-Si and C-H functional groups according to FTIR analysis. In addition, an increased calcination temperatures was followed by an increase in the density and compressive strength. Based on these characteristics, the samples are considered for the roof material, suggesting their potential use in substitute lightweight steel roof devices.",QC,,,
FMIPA1,"Desain Inti Reaktor Supercritical Water Reactor (SCWR) Model
Teras Silinder (r, z) dengan Bahan Bakar Thorium
Hasil Daur Ulang","Abstract. The research of the supercritical water reactor (SCWR) core design of the cylindrical core model
(r, z) using the SRAC program has been done. The SRAC basic code was PIJ and CITATION. PIJ was used
to calculate the fuel level and CITATION was used to calculate the reactor core level. The calculation of the
reactor core has been done on the 1/4 cylinder core (r, z) and the geometry of the fuel cell was the cylindrical
cell. Reactor fuel material was thorium burned 40 GWd/t and 30 GWd/t. The neutron parameters in this
research were fuel enrichment, burn up, reactor core size, reactor core configurations, multiplication factor,
and power density distribution. Multiplication factor (k-effective) in this research was 1.000004, which is
reactor was in a critical condition. The reactor core in critical condition had the size of radius (r) was 130
cm, height (z) was 270 cm and fuel enrichment of 2.8262%. The maximum power density was 130.0808 Watts
/cm3 which was located at a radius of 25 cm and 135 cm high. The peak power factor in the radial direction
was 1.6063 and the peak power factor in the axial direction was 1.3189.",QC,Jurnal Teori dan Aplikasi Fisika,,
