division,title,abstract,subjects,publication,date,keywords
,PEMETAAN ESTIMASI DAERAH RAWAN TSUNAMI DAN WILAYAH LAYANAN EVAKUASI BERDASARKAN SKENARIO WAKTU KEPUTUSAN EVAKUASI DI WILAYAH PESISIR KOTA BANDAR LAMPUNG,"Geological activity in the Sunda Strait shows us again its existence through the tsunami that occurred at the end of 2018 and the tectonic earthquake in the Sunda Strait subduction zone with Magnitude 6.9 on August 2, 2019. This activity raises concerns in the surrounding area. Bandar Lampung City which is located in a radius that is quite close to the Sunda Strait has a tsunami-prone lowland which is quite extensive with a high population density. Considering this risk threat, this study aims to map areas estimated to be affected by tsunami inundation and evacuation service areas during a tsunami emergency for 3 evacuation time scenarios namely 10 minutes, 20 minutes and 30 minutes from the Temporary Evacuation Site (TES). This challenge requires spatial analysis of tsunami inundation areas which is processed from SRTM topographic data of 15m altitude. Evacuation services area is obtained through evacuation network analysis according to the Bandar City road network. Both of these steps are simulated using spatial analysis and network analysis tools in the Geographic Information System (GIS). The results show the tsunami submerged estimation area in the coastal area of the city that forms a half circle from the west, north to east. Generally the community can evacuate within 20 minutes on foot. But in some areas, TES can only be reached in more than 20 minutes. Even the people on the island of Pasaran have to spend more than 30 minutes to reach TES","GB, GC, HD61, QE",,2020,
FT11,Analisa Luasan Terumbu Karang Di Perairan Pulau Tegal Lampung Dengan Teknologi Penginderaan Jauh,"Kerusakan terumbu karang di Pulau Tegal berdampak terhadap berkurangnya habitat terumbu karang, sehingga perlu dilakukan monitoring. Monitoring dilakukan dengan analisis luasan dan perubahannya dengan memanfaatkan teknologi penginderaan jauh untuk pemetaan kondisi eksistingnya. Data yang digunakan yaitu citra landsat pada tahun 1998, 2008, 2015 dan 2018. Pengolahan citra digital dilakukan mulai dari koreksi citra, perhitungan algoritma lyzenga, interpretasi citra dan validasi lapangan, serta dilakukan uji akurasi habitat terumbu karang menggunakan matriks konfusi. Hasil penelitian menunjukan bahwa terjadi perubahan luasan terumbu karang dari tahun 1998 – 2018. Kelas terumbu karang mengalami pengurangan seluas 11,22 ha. Kelas terumbu karang yang berubah menjadi kelas pasir seluas 9,13 ha (29,49%) dan lamun seluas 4,38 ha (14,15%). Kelas pasir yang berubah menjadi terumbu karang seluas 2,08 ha (13,52%) dan kelas lamun yang berubah menjadi terumbu karang seluas 0,21ha (0,25%). Perubahan yang paling besar yaitu perubahan terumbu karang menjadi pasir seluas 9,13 ha (29,49%), sedangkan perubahan paling kecil yaitu perubahan lamun menjadi terumbu karang seluas 0,21 ha (0,25%). Pada kelas lainnya perubahan luasan paling besar yaitu perubahan lamun menjadi pasir seluas 5,76 ha (6,96%), sedangkan perubahan paling kecil yaitu perubahan pasir menjadi lamun seluas 2,67 ha (17,35%).","GC, T1, TR",Jurnal Geofisika Eksplorasi,2019-07-15,
FP21,LAJU FILTRASI KERANG HIJAU (Perna viridisLinn. 1758) YANG BERBEDA UKURAN PADA BERBAGAI TINGKAT SALINITAS TERHADAP MIKROALGA Chaetoceros calcitrans (Paulsen. 1968),"Green shells is a nonselective filter feeder organism that is a consumer of microalgae in the water. Microalgae can be duplicated uncontoallably due to the large number of nutriensts in the water, this can lead to blooming of microalgae. This research aims to assess the rate of green
shell filtration of different sizes at different levels of salinity against Caetoceros calcitrasns (Paulsen. 1968). This research used experimental method with completely randomized factorial design with nine treatments and three levels of repetition. Each treatment has a combination of
salinity at 25‰, 30‰, 35‰ and size at 3, 6 and 8 cm. The density of microalgae given at each treatment was 5 x 106 sel/l. The result showed that is no effect of green shell size and levels of salinity on rate of green shell filtration against Chaetoceros calcitrans.","GC, SH",Biospecies,2021-07-29,
FP21,PERFORMANCE OF GREEN MUSSEL (PERNA VIRIDIS) IN MONOCULTURE AND POLYCULTURE SYSTEM WITHIN SEA BASS (LATES CALCARIFER ),"Green mussel (Perna viridis) is oyster has high potential to be developed. A huge market demand is an important factor to optimized green mussel cultivation, there are to system that could be applied for cultivation green mussel is polyculture and monoculture. The purposed of this study is to determined growth performance of green mussel which culture in monoculture and polyculture system. Green mussel is culture in floating cage bath of monoculture and polyculture system. In polyculture system green mussel placed within seabass (Lates calcarifer). Growth performance of green mussel determined by comparizing growth in wide and body lenght using T-test to analyzed factor that assigned to growth performance used principle component analysis (PCA) to environment factor such as Total Amonia Nitrogen (TAN), Total Organic Matters (TOM), Total Suspended Solid (TSS) and phytoplankton both in polycultured and monocultured system. The result of this research was shown that growth in this significant shown from third place where sample collected at 0-100 in depth The results showed that this significant growth was shown from the third place where the samples were collected at 0-100 in depth and the second place where the samples were collected at 100-150 in depth. This is caused by availability of feed source such as TOM and phytoplankton thy driven by sea current. The significant value shown by growth in wide of mussel shell at 100-150 cm in depth.","GC, SH",Jurnal ilmu perikanan dan sumberdaya budidaya perairan,2016-03,
FP21,REDUKSI AMONIA PADA SISTEM RESIRKULASI DENGAN PENGUNAAN FILTER YANG BERBEDA,"Amonia merupakan parameter kualitas air yang berperan penting pada budidaya ikan. Ikan mengeluarkan limbah dari sisa pakan dan metabolisme yang banyak mengandung amonia. Permasalahan yang biasa dihadapi adalah cepatnya akumulasi limbah dari residu pakan dan hasil metabolisme ikan. Amonia akan terakumulasi dalam sistem resirkulasi dan dapat mencapai konsentrasi yang merugikan ikan jika terlalu berlebihan. Untuk mengurangi amonia pada sistem resirkulasi dapat di lakukan dengan penambahan filter. Penelitian ini bertujuan untuk mengetahui laju pengurangan amonia dan menguji jenis filter yang efektif dalam penurunan amonia pada sistem resirkulasi. Penelitian ini menggunakan rancangan acak lengkap dengan empat perlakuan dan tiga ulangan (kontrol, zeolit, arang, dan pecahan karang). Penelitian dilakukan menggunakan benih lele (Clarias sp.) 4-5 cm dalam kolam terpal berukuran 1 x 1 x 2 mdengan kepadatan 200 ekor/m2. Parameter utama dalam penelitian ini adalah amonia, dengan parameter pendukung yakni suhu, pH, dan oksigen terlarut. Hasil penelitian ini menunjukan bahwa penambahan filter berupa pecahan karang  memberikan pengaruh nyata terhadap penurunan amonia pada sistem resirkulasi.","GC, SH",Jurnal Rekayasa Teknologi dan Budidaya Perairan,2015-10,
FT9,Analysis of Urban Fabric: An Integrated Coastal Zone Management (ICZM) Approach for Sustainable Tourism Development in The Coastal Area of Bandarlampung,"The coastal zone of Bandarlampung which grew as one of the economic development area in southern, is currently experiencing environmental degradation caused by trading activities, warehousing on a large scale. The natural resources in coastal area is holds high economic activity to create the tourism development based on local community in the future. The concept of Integrated Coastal Zone Management (ICZM) can ensure the sustainable use of natural resources, the environment and landscapes into account in harmony with economic, social and cultural development. This paper aims to identify the urban fabric as physical form of coastal land resources for the data based information, then provides the potential analysis for tourism development strategies with understanding to the built environment especially the urban fabric. A qualitative research method is used to observing the solid-void forms and linkage elements on the coastal area landscape. Based on this study, the character of solid-voids and linkage element is also influenced by the cultural, political, social and economic of the community. The characteristic of urban fabric can be the basic concept to develop the thematic tourism zones of the coastal area. There are three thematic tourism concept: Negeri Mina Teluk Betung Selatan Zone, Negeri Mina Kangkung Zone and Negeri Mina Kunyit Zone. The result of this study can be the reference for local goverment and stakeholders to increase community empowerment, environmental conservation and community resillience. Furthermore, the characteristic of urban fabric in the coastal area can be considered to create the sustainable tourism development planning based on ICZM concept.","GC, NA",International Conference on Marine and Coastal Engineering and Sciences 2019,2019-08-23,
FP21,EFEKTIFITAS KIJING AIR TAWAR ( PILSBRYOCONCHA EXILIS ) SEBAGAI BIOFILTER DALAM SISTEM RESIRKULASI TERHADAP LAJU PENYERAPAN AMONIAK DAN PERTUMBUHAN IKAN LELE SANGKURIANG (CLARIAS GARIEPINUS),"Tujuan dari penelitian ini adalah untuk mempelajari pengaruh penggunaan kijing air tawar (Pilsbryoconcha exilis) terhadap perbaikan kualitas air dan laju pertumbuhan lele sangkuriang. Penelitian ini menggunakan Rancangan Acak Lengkap dengan empat perlakuan dan tiga ulangan. Penelitian menggunakan perbedaan jumlah hewan kijing air tawar yaitu 100, 150,  200 ekor/ keranjang berukuran 0,6 m3 dan perlakuan kontrol yaitu tanpa menggunakan perlakuan sistem resirkulasi dan tanpa penambahan kijing air tawar. Parameter utama dalam penelitian ini adalah pertumbuhan ikan dan konsentrasi amoniak, dengan parameter pendukung antara lain yakni suhu, pH, dan oksigen terlarut. Hasil penelitian menunjukkan bahwa penambahan kijing air tawar berpengaruh terhadap pertumbuhan dan kelangsungan hidup ikan lele sangkuriang. Pertumbuhan mutlak tertinggi terdapat pada perlakuan 200 individu dengan berat 19.71 gr dan tingkat kelangsung hidup tertinggi terdapat perlakuan 200 individu (80.14 %). Hasil penelitian juga menunjukan bahwa penambahan kijing air tawar dengan jumlah yang berbeda memberikan pengaruh nyata terhadap penurunan amoniak. Berdasarkan hasil uji Beda Nyata Terkecil (BNT) perlakuan dengan penambahan kijing air tawar sebanyak 200 ekor/ keranjang berukuran 0,6 m3merupakan perlakuan terbaik dalam penurunan amoniak pada sistem resirkulasi.","GC, SH",Jurnal Rekayasa Teknologi dan Budidaya Perairan,2016-02,
FP21,pemodelan pola sebaran tumpahan minyak yang berbeda di pelabuhan tanjung priok,,GC,Indonesian Journal of Marine Science,2010-02,
FP21,KAJIAN BIOLOGI IKAN TEMBAKANG (HELOSTOMA TEMMINCKII) DI RAWA BAWANG JUYEUW KABUPATEN TULANG BAWANG BARAT,Kajian perikanan pada tembakang (Helostoma temminckii) di Rawa Bawang Juyeuw Kabupaten Tulang Bawang Barat dilakukan untuk mempelajari potensi biologinya. Kajian ini diperlukan sebagai data dasar domestikasi tembakang sebagai ikan budidaya dan konservasi. Hasil penelitian menunjukkan bahwa waktu terbaik untuk penangkapan tembakang ukuran benih sampai dewasa adalah pada Maret sampai April dengan menggunakan jaring tancap yang tidak mematikan tembakang. Morfologi tembakang pada ukuran yang berbeda menunjukkan stok yang belum tereksploitasi dan layak dijadikan plasma nutfah perikanan tangkap dan budidaya yang berkelanjutan. Pada ukuran benih sampai dewasa isi pencernaan tembakang didominasi oleh plankton sebagai makanan utamanya. Masyarakat lokal disarankan untuk menjadikan tembakang sebagai alternatif sumber protein hewani selain ikan eksotis yang mulai banyak berkembang di Rawa Juyeuw.,"GC, SH",Jurnal Rekayasa Teknologi dan Budidaya Perairan,2015-02,
FP5,PERSEPSI MASYARAKAT PESISIR KOTA BANDAR LAMPUNG TERHADAP HUTAN MANGROVE,"Persepsi masyarakat di wilayah pesisir perkotaan terhadap ekosistem mangrove menjadi faktor penting dalam perencanaan strategi keberlanjutannya. Penelitian ini bertujuan untuk menjelaskan persepsi masyarakat terhadap hutan mangrove di Kelurahan Kota Karang, Kota Bandar Lampung. Pengumpulan data dilakukan dengan wawancara menggunakan kuisioner dan observasi. Data yang terkumpul dianalisis menggunakan Skala Likert dan selanjutnya dideskripsikan secara kuantitatif. Hasil penelitian menunjukkan bahwa 50 % persepsi masyarakat terhadap mangrove masuk ke dalam kategori sedang (netral). Kondisi ini terjadi akibat masyarakat cenderung ragu dalam menentukan sikap terhadap hutan mangrove. Faktor yang mempengaruhi persepsi masyarakat tersebut yaitu rendahnya pengetahuan, jenjang pendidikan, kesadaran dan ketersediaan waktu masyarakat, serta minimnya informasi mengenai hutan mangrove akibat belum optimalnya peran pemerintah dalam memberikan edukasi (penyuluhan). Pemerintah diharapkan dapat memberikan edukasi dan membuat kebijakan untuk meningkatkan kesadaran masyarakat akan pentingnya kelestarian hutan mangrove.","GC, GE, GF, GN, SD",Journal of Tropical Marine Science,2021-04,
