division,title,abstract,subjects,publication,date,keywords
FP21,KONSENTRASI EFEKTIF (EC50-1JAM) EKSTRAK AKAR TUBA (DERRIS ELLIPTICA) SEBAGAI BAHAN ANESTESI BENIH IKAN MAS (CYPRINUS CARPIO),"Tuba (Derris elliptica) root was used traditionally as a poison to fish catching. This research looks for beneficial of tuba root extract as an anesthetic for the transport of fish seed. This research aims was to explore the value of effective concentration (EC50 - 1 hr) of tuba root extracts by ethanol and hexane, as well as determine the effect of the effective concentration value and the period of transportation time on the survival and growth of common carp seed. Probit analysis used to determine the effective concentration , whereas to determine the effect of differences of periods of transportation (2 , 4 and 6 hours) and the value of the effective concentration of each solvent on the survival and growth of the research design uses factorial analisis. The results of probit analysis for ethanol and hexane solvent are 6.166 and 3.72 ppm. Transportation showed the highest survival rate at treatment of transportation period 2 hour with values ​​reaching an average of 100%, while the highest growth occurres in hexane treatment on the period of transportation of 6 hours. This results also found that the period of transportation differences significantly affect the survival of common carp seeds but has no significant effect on the growth of common carp other results showed that the difference in the solvent not significantly affect the survival and growth of common carp seed.","GC, SH",Jurnal ilmu perikanan dan sumberdaya budidaya perairan,,
FP5,7% Similarity,"Paper entitel ""Measuring the Sustainability of Ecotourism...""","G1, GC, SD",,2023-05,
FP21,EFEKTIFITAS SISTEM AKUAPONIK DALAM MEREDUKSI KONSENTRASI AMONIA PADA SISTEM BUDIDAYA IKAN,"Kualitas air memegang peranan penting dalam bidang perikanan terutama untuk kegiatan budidaya serta produktifitas hewan akuatik. Limbah yang dihasilkan dari proses budidaya memiliki dampak negatif bagi hewan akuatik. Amonia merupakan salah satu limbah yang berasal dari sisa metabolisme ikan yang terlarut dalam air berupa feses dan sisa makanan ikan yang tidak termakan dan mengendap di dasar kolam budidaya. Penelitian ini bertujuan untuk mengetahui efektifitas sistem akuaponik dalam mereduksi kadar amonia serta mengetahui jumlah kepadatan optimal tanaman pada sistem akuaponik dalam menyerap kadar amonia. Penelitian dilaksanakan selama 60 hari pada Juli-September 2013 bertempat di Laboratorium Budidaya Perikanan Universitas Lampung. Perlakuan penelitian menggunakan kangkung (Ipomoea aquatica) 10 batang, 20 batang, 30 batang per rumpun dan tidak menggunakan tanaman. Pengurangan amonia oleh tanaman air digunakan untuk pertumbuhan yang diserap melalui jaringan akar. Semakin banyak tanaman air makin efektif dalam mereduksi amonia. Penggunaan 30 batang per rumpun kangkung dapat mengurangi amonia hingga 58,57mg/l","GC, SH",Jurnal Rekayasa Teknologi dan Budidaya Perairan,2014,
FT13,Analisis Pembuatan Peta Zona Rawan Bencana Tsunami Pada Daerah Pesisir (studi kasus pesisir kota Bandar Lampung),"Berdasarkan  Undang-undang  No.  24  tahun  2007  tentang  penanggulangan  bencana dikatakan  bahwa  Bencana  alam  adalah  bencana  yang  diakibatkan  oleh  peristiwa  atau serangkaian  peristiwa  yang  disebabkan  oleh  alam  antara  lain  berupa  gempa  bumi, tsunami,  gunung  meletus,  banjir,  kekeringan,  angin  topan,  dan  tanah  longsor.  Pada penelitian ini akan dilakukan analisis pembuatan peta zona rawan tsunami pada daerah pesisir  yang  bertujuan  untuk  memberikan  arahan  penanggulangan  terjadinya  bencan tsunami. Penelitian ini menggunakan data dasar peta citra yang kemudian menghasilkan lokasi mana saja yang termasuk dalam zona rawan tsunami serta jalur evakuasi sehingga dapat  digunakan  sebagai  bentuk  peringatan  dini  untuk  menghindari  besarnya  korban jiwa. Dari peta zonasi rawan bencana tsunami di pesisir kota Bandar Lampung terlihat pada  tinggi  gelombang  tsunami  mencapai  5m  daerah  yang  terkena  dampaknya  adalah daerah yang terletak sekitaran  154m  dari garis  pantai,  pada  tinggi  gelombang  tsunami mencapai  15m  daerah  yang  terkena  dampaknya  adalah  daerah  yang  terletak  sekitaran 488m  dari  garis  pantai,  pada  tinggi  gelombang  tsunami  mencapai  25m  daerah  yang terkena dampaknya adalah daerah yang terletak sekitaran 843m dari garis pantai, pada tinggi gelombang tsunami mencapai 40m daerah yang terkena dampaknya adalah daerah yang terletak sekitaran 955m dari garis pantai.","GA, GC, T1",,2014-11-17,
FKIP18,Geografi Pesisir dan Kelautan,"Buku ini Membahas tentang pengantar geografi pesisir dan kelautan, batasan dan pengelolaan wilayah pesisir dan kelautan, kebijakan pengelolaan wilayah pesisir dan keluatan, kekayaan sumber daya pesisir dan keluatan, serta membahas tentang isu dan masalah pengelolaan wilayah pesisir dan keluatan",GC,,,
FP21,2_Simulasi numerik model hidrodinamika 3 dimensi di perairan teluk lampung,"Hydrodynamic model is very important for simulate global oceanic circulation. Hydrodynamic model can be used to predict the distribution pattern of waste, sedimentation, etc. The aim of this research is to study the pattern circulation of current in the Lampung Bay, using a numerical model. A hydrodynamic model (Estuarine Lake Coastal Model (ELCOM) is applied to simulate the pattern of circulation. The results show that the pattern of currents in the bay head area tend swirling around the head of the bay, while for the area at the mouth of the bay flow patterns are influenced by tides.",GC,Jurnal Ilmiah Matematika dan Terapan,2011-11,
FP21,"AKUMULASI LOGAM CU, CD DAN PB PADA MEIOFAUNA INTERTITIAL DAN EPIFIT DI EKOSISTEM LAMUN MONOTIPIC (ENHALUS ACOROIDES)","Enhalus acoroides is water plant intertidal that might be interaction between ecosystem eachother so it have ability to adsorb heavy metal that came from sea water and sediment that can accumulated in roots, leaf and bar ponder. Variation methods used to know distribution of meiofauna as intertitial fauna or epiphytic fauna on seagrass. The concentration of heavy metal of water, sediment and meiofana will be analyzed. The purpose of this research to determined correlation between concentration in seagrass, sediment, water and organism which associated whitin. The result of this research shown that  concentration of heavy metal Cu, Cd and Pb have a significant correlation between water, sediment, part of seagrass and meiofauna. The value of R2 shown that correlation between water and sediment have bigest value, otherwise the  R2 value of heavy metal shown that Pb is the biggest than Cd and Cu. Concentration heavy metal in seagrass shown that Cu>Cd>Pb and the same condition is also due in meiofauna. Its mean that the heavy metal is bioavailble for accumulation by meiofauna. Meifauna and segrass can be a good bioindicator for environmenta change especially heavy metal.","GC, SH",Jurnal ilmu perikanan dan sumberdaya budidaya perairan,2015-02,
FP21,"PEMODELAN PERAN ZOOPLANKTON DALAM SIKLUS NITROGEN 
DI TELUK LAMPUNG","The aim of this research is to quantify the role of zooplankton in nitrogen cycle in the Lampung Bay, using field data and a numerical model.A coupled hydrodynamic and ecological model (Estuarine Lake Coastal Model (ELCOM)– Computational Aquatic Ecosystem Dynamics Model (CAEDYM)) is applied to simulate the seasonal nutrient dynamic using an extensive field data set as initial 
condition. Two phytoplankton groups consist of dinoflagellate group and diatome  group, and one zooplankton group (copepode group) is used to representative collectivelly another group of plankton. Parameterization of the model was conducted based onliterature studies. The results predict that excretion of dissolved organic nutrients by zooplankton that assumed as regenerate nutrient accounts for 7.1 - 30.53% of phytoplankton uptake of nitrogen.",GC,,2011-11,
FP21,"KORELASI ASIAN MONSOON, EL NINO SOUTH OSCILATION DAN INDIAN OCEAN DIPOLE TERHADAP VARIABILITAS CURAH HUJAN DI PROPINSI LAMPUNG","Perairan Asia Tenggara dan sekitarnya memiliki variabilitas laut-atmosfer yang besar akibat dari fluktuasi parameter oseanografi yang berasal dari perairan Samudera Pasifik dan Samudera Hindia pada arah zonal dan pada arah meridional berasal dari Laut Cina Selatan, perairan utara dan selatan Jawa dan perairan barat Australia. Fenomena yang dominan mempengaruhi variabilitas laut-atmosfer di wilayah Asia Tenggara dan sekitarnya adalah Muson, Dipole Mode (DM) dan El Nino Southern Oscillation (ENSO) dengan siklus waktu dari musiman sampai antar tahunan. Penelitian sebelumnya yang dilakukan lebih banyak mengkaji Muson, DM dan ENSO secara individu dari fenomenanya itu sendiri, tidak secara komprehensif mengarah kepada kemungkinan adanya interaksi satu sama lain. Tujuan dari penelitian ini adalah mengkaji variabilitas lautatmosfer dan proses dinamika interaksi antara Muson, DM dan ENSO secara simultan terhadap curah hujan di Propinsi Lampung. Analisis data yang digunakan pada penelitian ini dengan pendekatan metode yang dapat mendekomposisi sinyal tersebut baik pada skala ruang maupun waktu dari hasil interaksi antara Muson, DM dan ENSO. Analisis yang digunakan meliputi transformasi wavelet kontinyu dan korelasi silang transformasi wavelet. Dari analisis transformasi wavelet kontinu, koherensi maupun transformasi silang diperoleh kesimpulan bahwa pola curah hujan di wilayah lampung sangat dipengaruhi oleh pengaruh musiman atau adanya pengaruh WNPMI dibandingkan dengan pengaruh DMI dan SOI, akan tetapi arah fase yang berlawanan menunjukkan adanya pola pergantian pengaruh yang terjadi. DMI berpengaruh pada periode 6 bulanan, sedangakan SOI berpengaruh pada fase 12 bulanan",GC,Jurnal ilmu perikanan dan sumberdaya budidaya perairan,2013-02,
FT11,Kajian Daerah Rendaman Tsunami di Pesisir Teluk Lampung Akibat Perubahan Topografi Gunung Anak Krakatau di Tahun 2018,"Akibat erupsi Gunung Anak Krakatau (GAK) pada bulan Desember 2018 menyebabkan sebagian tubuh GAK longsor ke dalam laut dan mengakibatkan tsunami. Longsoran ini juga menyebabkan perubahan topografi  GAK.  Jika  terjadi  pengulangan  bencana  dengan  kondisi  topografi  GAK  saat  ini,  tentunya  akan menyebabkan  perubahan  tinggi  gelombang  tsunami  di  bibir  pantai  yang  akan  mempengaruhi  perubahan daerah  rendaman  tsunami.  Karena  letak  wilayah  pesisir  Teluk  Lampung  yang  cukup  dekat  dengan  GAK menyebabkan wilayah pesisir Teluk Lampung rentan terkena bencana tsunami. Sehingga perlu dikaji daerah rendaman tsunami akibat perubahan topografi GAK saat ini di wilayah pesisir Teluk Lampung. Kajian ini dilakukan dengan menggunakan metode non numerik untuk mendapatkan tinggi gelombang di bibir pantai dan  metode  Berryman  untuk  mendapatkan  daerah  rendaman  tsunami  di  wilayah  pesisir  Teluk  Lampung dengan membuat tiga skenario. Berdasarkan hasil kajian, diketahui tinggi gelombang tsunami, yaitu 13 meter, 26 meter, dan 39 meter dengan rata-rata waktu tiba gelombang tsunami di bibir pantai mencapai 57 menit. Di mana  terdapat  tujuh  kecamatan  yang  terendam  tsunami  dengan  jarak  rendaman  berkisar  160  meter-1,6 kilometer","GC, GE, T1",Jurnal Geofisika Eksplorasi,2020-03-20,
FT11,Analisa Luasan Terumbu Karang Di Perairan Pulau Tegal Lampung Dengan Teknologi Penginderaan Jauh,"Kerusakan terumbu karang di Pulau Tegal berdampak terhadap berkurangnya habitat terumbu karang, sehingga perlu dilakukan monitoring. Monitoring dilakukan dengan analisis luasan dan perubahannya dengan memanfaatkan teknologi penginderaan jauh untuk pemetaan kondisi eksistingnya. Data yang digunakan yaitu citra landsat pada tahun 1998, 2008, 2015 dan 2018. Pengolahan citra digital dilakukan mulai dari koreksi citra, perhitungan algoritma lyzenga, interpretasi citra dan validasi lapangan, serta dilakukan uji akurasi habitat terumbu karang menggunakan matriks konfusi. Hasil penelitian menunjukan bahwa terjadi perubahan luasan terumbu karang dari tahun 1998 – 2018. Kelas terumbu karang mengalami pengurangan seluas 11,22 ha. Kelas terumbu karang yang berubah menjadi kelas pasir seluas 9,13 ha (29,49%) dan lamun seluas 4,38 ha (14,15%). Kelas pasir yang berubah menjadi terumbu karang seluas 2,08 ha (13,52%) dan kelas lamun yang berubah menjadi terumbu karang seluas 0,21ha (0,25%). Perubahan yang paling besar yaitu perubahan terumbu karang menjadi pasir seluas 9,13 ha (29,49%), sedangkan perubahan paling kecil yaitu perubahan lamun menjadi terumbu karang seluas 0,21 ha (0,25%). Pada kelas lainnya perubahan luasan paling besar yaitu perubahan lamun menjadi pasir seluas 5,76 ha (6,96%), sedangkan perubahan paling kecil yaitu perubahan pasir menjadi lamun seluas 2,67 ha (17,35%).","GC, T1, TC",Jurnal Geofisika Eksplorasi,2019-07-02,
FT11,Review Jurnal:  Analisa Luasan Terumbu Karang Di Perairan Pulau Tegal Lampung Dengan Teknologi Penginderaan Jauh,"Kerusakan terumbu karang di Pulau Tegal berdampak terhadap berkurangnya habitat terumbu karang, sehingga perlu dilakukan monitoring. Monitoring dilakukan dengan analisis luasan dan perubahannya dengan memanfaatkan teknologi penginderaan jauh untuk pemetaan kondisi eksistingnya. Data yang digunakan yaitu citra landsat pada tahun 1998, 2008, 2015 dan 2018. Pengolahan citra digital dilakukan mulai dari koreksi citra, perhitungan algoritma lyzenga, interpretasi citra dan validasi lapangan, serta dilakukan uji akurasi habitat terumbu karang menggunakan matriks konfusi. Hasil penelitian menunjukan bahwa terjadi perubahan luasan terumbu karang dari tahun 1998 – 2018. Kelas terumbu karang mengalami pengurangan seluas 11,22 ha. Kelas terumbu karang yang berubah menjadi kelas pasir seluas 9,13 ha (29,49%) dan lamun seluas 4,38 ha (14,15%). Kelas pasir yang berubah menjadi terumbu karang seluas 2,08 ha (13,52%) dan kelas lamun yang berubah menjadi terumbu karang seluas 0,21ha (0,25%). Perubahan yang paling besar yaitu perubahan terumbu karang menjadi pasir seluas 9,13 ha (29,49%), sedangkan perubahan paling kecil yaitu perubahan lamun menjadi terumbu karang seluas 0,21 ha (0,25%). Pada kelas lainnya perubahan luasan paling besar yaitu perubahan lamun menjadi pasir seluas 5,76 ha (6,96%), sedangkan perubahan paling kecil yaitu perubahan pasir menjadi lamun seluas 2,67 ha (17,35%).","GC, T1, TC",,2019-07-02,
FT11,Review Jurnal: ANALISIS PEMBUATAN PETA ZONA RAWAN BENCANA TSUNAMI PADA DAERAH PESISIR (Studi lokasi : Pesisir Kota Bandar Lampung),"Berdasarkan Undang-undang No. 24 tahun 2007 tentang penanggulangan bencana dikatakan bahwa Bencana alam adalah bencana yang diakibatkan oleh peristiwa atau serangkaian peristiwa yang disebabkan oleh alam antara lain berupa gempa bumi, tsunami, gunung meletus, banjir, kekeringan, angin topan, dan tanah longsor. Pada penelitian ini akan dilakukan analisis pembuatan peta zona rawan tsunami pada daerah pesisir yang bertujuan untuk memberikan arahan penanggulangan terjadinya bencan tsunami. Penelitian ini menggunakan data dasar peta citra yang kemudian menghasilkan lokasi mana saja yang termasuk dalam zona rawan tsunami serta jalur evakuasi sehingga dapat digunakan sebagai bentuk peringatan dini untuk menghindari besarnya korban jiwa. Dari peta zonasi rawan bencana tsunami di pesisir kota Bandar Lampung terlihat pada tinggi gelombang tsunami mencapai 5m daerah yang terkena dampaknya adalah daerah yang terletak sekitaran 154m dari garis pantai, pada tinggi gelombang tsunami mencapai 15m daerah yang terkena dampaknya adalah daerah yang terletak sekitaran 488m dari garis pantai, pada tinggi gelombang tsunami mencapai 25m daerah yang terkena dampaknya adalah daerah yang terletak sekitaran 843m dari garis pantai, pada tinggi gelombang tsunami mencapai 40m daerah yang terkena dampaknya adalah daerah yang terletak sekitaran 955m dari garis pantai. Kata kunci: tsunami, pesisir, peta","GC, Q1, T1, TC",,2015-04-21,
FT11,Pengembangan Sensor Ultrasoic Guna Pengukuran Pasang Surut Laut Secara Otomatis dan Real Time (Korespondensi),"Kegiatan pemetaan batimetri dilaut memerlukan data pasang surut air laut guna keperluan koreksi kedalaman hasil pengukuran. Pengamatan pasang surut secara manual ini dilakukan siang dan malam tanpa henti selama kurun waktu tertentu, sehingga diperlukan minimal 4 orang personil un- tuk pengamatan satu stasiun pengamatan. Pengamatan secara manual ini rentan terjadi kesalahan pembacaan terutama dimalam hari. Pada dasarnya saat ini sudah ada alat ukur pasang surut semi otomatis dan otomatis yang dijual, akan tetapi harganya cukup mahal. Pada penelitian ini telah dikembangkan alat ukur pasang surut air laut secara otomatis dan realtime baik pengamatannya maupun pengiriman datanya dengan memanfaatkan teknologi sensor ultrasonik dan mikro kon - troller. Metode yang digunakan adalah rancang bangun dengan cara memanfaatkan sensor ultra sonik dan mikro kontroller arduino uno, serta modul GSM (Global System for Mobile Communica- tions). Setiap perangkat dihubungkan ke mikro kontroler kemudian dilakukan pemrograman untuk proses pengambilan data, perhitungan level air, dan mengirim data ke handphone melalui fasilitas SMS (Short Message Service). Pengujian hasil pengukuran pasang surut dari alat yang dibuat di- lakukan di laboratorium hidrografi dan selanjutnya diuji langsung ke lapangan sekitar pesisir teluk Lampung. Penelitian ini menghasilkan peralatan untuk pengukuran pasang surut air laut secara otomatis dan realtime dengan sensor ultrasonik. Hasil dari pengukuran pasang surut akan disimpan dalam micro SD dan ditampilkan pada layar LCD, serta dikirim ke nomor yang dituju melalui SMS dengan modul SIM 800L v.2. Besar eror yang dihasilkan dari uji lapangan yaitu 1.833% < 10 %, dapat disimpulkan alat ini memiliki tingkat akurasi yang tinggi yaitu sebesar 98.167 %. Kata kunci: Pasang surut, Mikro kontroller, Sensor ultrasonik, GSM, SMS","GC, T1, TC",,2019-04,
FP21,EFEK PELARUT YANG BERBEDA TERHADAP TOKSISITAS EKSTRAK AKAR TUBA (DERRIS ELLIPTICA),"Akar tuba (Derris elliptica) digunakan sebagai racun pada penangkapan ikan air tawar. Rotenon sebagai bahan aktif dari akar tuba sangat efektif untuk membunuh ikan tetapi penelitian tentang toksisitasnya masih sangat terbatas. Tujuan penelitian ini untuk mengetahui tingkat toksisitas ekstrak akar tuba menggunakan pelarut etanol, heksan dan akuades dengan menggunakan dua hewan uji yaitu artemia (Artemia sp.) dan ikan mas (Cyprinus carpio). Penelitian ini menggunakan rancangan acak lengkap (RAL) dengan 5 tingkat konsentrasi yang berbeda. Jumlah rendemen hasil ekstraksi pada pelarut etanol, heksan dan akuades berturut-turut 5; 3,6; 2,5%. Hasil penelitian pada artemia menunjukkan bahwa tingkat mortalitas 100% pelarut heksan terjadi pada konsentrasi 63 dan 100 mg/l; etanol 100 mg/l dan akuades 1000 mg/l.  Hasil analisis probit pada artemia menunjukkan nilai LC50(Lethal Concentration) 24 jam pada heksan, etanol dan akuades berturut-turut 37,03; 46,77; 307,47 mg/l. Hasil penelitian pada ikan mas menunjukkan bahwa tingkat mortalitas 100% pelarut heksan terjadi pada konsentrasi 3,979; 6,30 dan 9,96 mg/l dan pelarut etanol 9,96 mg/l. Hasil analisis probit pada hewan uji ikan mas menunjukkan nilai LC50-96 jam heksan dan etanol berturut-turut 3,83 dan 6,85 mg/l. Penelitian ini diharapkan mampu menjadi data awal untuk penggunaan akar tuba baik untuk meracuni ikan maupun untuk membius ikan.","GC, SH",Jurnal Rekayasa Teknologi dan Budidaya Perairan,2014-02,
FP21,"PENGARUH DEBIT AIR TERHADAP PERBAIKAN KUALITAS AIR 
PADA SISTEM RESIRKULASI DAN HUBUNGANNYA DENGAN
SINTASAN DAN PERTUMBUHAN BENIH IKAN GURAME 
(Oshpronemus gouramy)","Kendala dalam kegiatan budidaya ikan gurame adalah ketersediaan benih yang kurang. Tingkat Kematian yang tinggi pada tahap pembenihan ikan gurame
menjadi kendala yang sering dihadapi dalam industrialisasi komoditi ini. Sistem
resirkulasi dengan perlakuan debit air dapat menjadi salah satu pemecahan masalah. Tujuan penelitian ini untuk mengetahui debit yang paling optimal dalam
memperbaiki kualitas air dan hubungannya dengan pertumbuhan dan sintasan benih ikan gurame pada sistem resirkulasi. Penelitian ini menggunakan Rancangan Acak
Lengkap dengan 3 perlakuan yaitu debit 0,03 L/detik, debit 0,025 L/detik dan 0,02 L/detik dengan 3 kali ulangan. Hasil penelitian menunjukkan bahwa debit air yang berbeda memberikan pengaruh yang signifikan terhadap peningkatan tingkat kualitas air, pertumbuhan dan kelangsungan hidup. Perlakuan terbaik ditunjukkan
oleh perlakuan ketiga (debit 0,03 L/detik), yaitu nilai pertumbuhan panjang 1,28±0,15 cm, nilai pertumbuhan berat 0,58±0,07 dan nilai kelangsungan hidup mencapai 85%.","GC, SH",Jurnal Rekayasa Teknologi dan Budidaya Perairan,2017-02,
FP21,"Estimasi Serapan Karbon Pada Vegetasi Mangrove Register 15, Kecamatan Pasir Sakti, Kabupaten Lampung Timur, Provinsi Lampung","Perubahan iklim di sebabkan oleh kenaikan gas karbon dioksida (CO2) semenjak era revolusi industri dimana hal ini dicirikan dengan adanya peningkatan suhu, paras muka laut, perubahan pola curah hujan serta meningkatnya kejadian ekstrim seperti banjir, kekeringan, gelombang panas dan badai. Fenomena ini akan berdampak serius apabila berlangsung secara terus-menerus. Blue carbon (karbon biru) merupakan karbon yang diperangkap dan disimpan melalui proses fotosintesis oleh organisme autotrof dalam bentuk biomassa dan sedimen oleh ekosistem pesisir dan laut. Mangrove merupakan salah satu dari eksosistem sebagai blue carbon tersebut. Mangrove Register 15 merupakan suatu kawasan mangrove yang berada Kecamatan Pasir Sakti, Kabupaten Lampung Timur, Provinsi Lampung. Penelitian ini bertujuan menganalisis karbon tersimpan pada tegakan, nek romassa, serasah, dan substrat mangrove. Penelitian dilakukan dari bulan Maret–Mei 2021. Hasil penelitian menunjukkan karbon tersimpan pada sedimen lebih besar dibandingkan dengan karbon tersimpan pada tegakan, nekromassa, dan serasah. Karbon tersimpan pada sedimen yang tertinggi berada pada sedimen yang memili ki ukuran liat kasar karena liat kasar dapat menyimpan unsur hara yang tinggi.","GC, SH",Journal of Marine Reserach,,
FP21,"IDENTIFIKASI SAMPAH ANORGANIK DI DESA GEBANG, KECAMATAN TELUK PANDAN, KABUPATEN PESAWARAN, PROVINSI LAMPUNG",,GC,Jurnal Perikanan UNRAM,2022-12,
FP21,PENURUNAN FOSFAT PADA SISTEM RESIRKULASI DENGAN PENAMBAHAN FILTER YANG BERBEDA,"Peningkatan sisa pakan dan buangan metabolit yang terakumulasi dapat menyebabkan peningkatan fosfat sehingga kualitas air menjadi rendah yaitu menurunnya kadar oksigen terlarut pada perairan. Salah satu cara untuk mengatasi masalah tersebut yaitu mengaplikasikan sistem resirkulasi dengan penambahan filter. Penelitian ini bertujuan untuk mengetahui penurunan fosfat pada sistem resirkulasi dengan penambahan filter yang berbeda. Penelitian ini dilaksanakan pada bulan Juli sampai dengan bulan September 2013 di Jurusan Budidaya Perairan Fakultas Pertanian Universitas Lampung. Hewan uji yang digunakan sebagai penghasil fosfat yaitu lele sangkuriang (Clarias gariepnus) berukuran 3-5 cm/ekor dengan padat tebar 200 ekor/m2 dan dipelihara selama 60 hari. Desain penelitian menggunakan rancangan acak lengkap dengan empat perlakuan yaitu kolam tanpa filter (kontrol), kolam dengan filter zeolit, kolam dengan filter arang dan kolam dengan filter pecahan karang dimana setiap perlakuan diberikan tiga kali ulangan. Hasil penelitian menunjukkan bahwa penggunaan filter yang berbeda menyebabkan terjadinya penurunan fosfat yang berbeda nyata (P>0,05). Penurunan fosfat tertinggi terjadi pada jenis media filter arang yaitu sebanyak 0,02675 mg/l, sedangkan penurunan fosfat terendah terjadi pada jenis media filter zeolit yaitu sebanyak 0,021 mg/l","GC, SH",Jurnal Rekayasa Teknologi dan Budidaya Perairan,2015-02,
FP21,RATE OF PHOSPHATE ABSORPTION IN AQUAPONIC SYSTEM,"The waste resulted by fish farming in form of feed waste and feces will accumulate and increase the phosphorus content in a pond. Excessive amount of phosphorus content
will cause nutrient enrichment and decrease oxygen. As the result, it may impact the farmed fish. Aquaponic system can be a solution to the problem, because the plants in the aquaponic system can absorb and utilize the phosphate for the plant growth. This study aims to determine the rate of phosphate absorption through aquaponic system and determine the maximum number of kale plants that works best in absorbing phosphate.
This study was conducted from July to September, 2013. It was held at the laboratory in Aquaculture Department of Agriculture Faculty, University of Lampung. This study
used Complete Randomized Design with four treatments (control, 10 stems/clump, 20 stems/clump, and 30 stems/clump) and three repetitions. The result showed significant effect on the level of α = 0.05. This means that the treatment has an effect on the absorption of orthophosphate. Rate of highest phospate absorption is 0,000387 mg/L on in 24 hour. The treatment that shows the most significant influence in decreasing the concentration of orthophosphate is the one with 30 stems/clump. 
Key words : Aquaponic, phosphate, fish, kale","GC, SH",,2013-11,
