division,title,abstract,subjects,publication,date,keywords
FH3,Ekonomi dan Lembaga Keuangan Islam,"Islam adalah agama yang telah disempurnakan dengan
Sumber utamanya Al Qur'an dan Sunnah Rasulullah. Sebagai agama
yang paling sempurna Islam tidak hanya mengatur masalah-
masalah yang berkaitan dengan ibadah tetapi juga mengatur
tentang muamalah. Kedua sumber utama yang dimiliki membuat
Islam sebagai agama yang memiliki daya jangkau dan daya atur yang
universal sifatnya sehingga selalu tepat untuk diimplikasikan ke
dalam kehidupan umatnya sehari-hari. Dalam bidang ekonomi,
Islam memberikan pedoman yang berisi ketentuan-ketentuan
hukum yang umumnya dalam bentuk garis besar-garis besarnya.
Hal ini dimaksudkan tidak lain adalah untuk memberikan peluang
seluas-luasnya terhadap perkembangan zaman khususnya dalam
persoalan perekonomian di masa yang akan datang, karena seluruh
syariat Islam tidak dibatasi oleh waktu dan tempat.","K1, KF, KZ",,2022-08,
FH3,Does the Juvenile Justice System protect Youth Supply chain? Progressive Juvenile Court Judges: Reform of the Juvenile Criminal Justice System in Indonesia through a Socio-Legal Approach supported by PLS-Structural Equation Modeling,"The current Indonesian legal culture is based on written text contained in legislation that is positivistic and ignores progressive legal principles. This research takes a socio-legal approach (socio-legal research), from within the non-doctrinal legal research tradition, and uses the constructivism paradigm to explore this issue. Additionally, this study examines how the juvenile justice system protects youth supply chain. The findings of this study reveal that judges in the juvenile justice court do not follow a progressive legal approach where the law is judged by the social goals to be achieved and consequences of the operation of the law. It can be concluded that progressive law can be used as a basis and reference for juvenile court judges to make decisions on cases that prioritize social and religious morality, alongside substantive justice. Moreover, results of the Partial Least Square (PLS)-Structural Equation Modeling (SEM) reveal that the juvenile justice system protects youth supply chain. Childq punishment based on criminal activities causes issues related to mental health disorders which effect negatively on youth supply chain. Therefore, it is necessary to reform this legal culture by changing the positivist paradigm to a non-positivist one, by not only using a juridical approach, but also by engaging in social sciences and new legal values that support a progressive legal approach. For these reforms to take place, a judge must have the moral courage to take breakthrough steps outside of the law.
Key words: reformation; legal culture; juvenile court judge; progressive; youth supply chain.","K1, KF","International Journal of Innovation, Creativity and Change",2019-10-07,
