division,title,abstract,subjects,publication,date,keywords
FKIP25,https://penerbit.brin.go.id/press/catalog/book/554,"Mengajarkan musik tentunya juga membutuhkan suatu teori dan referensi. Khususnya kepada anak-anak, ada beberapa pendekatan yang dapat digunakan untuk mengajarkan musik. Buku ini menujukkan beberapa pendekatan pembelajaran tersebut, mulai dari hal-hal yang penting dilakukan untuk mengajarkan musik kepada anak, strategi mengajarkan teori musik, hingga metode-metode populer yang diajarkan di sekolah-sekolah di dunia. Buku ini juga memaparkan praktik belajar musik yang menyenangkan untuk anak-anak, termasuk yang berbasis teknologi. Tidak hanya itu, pembahasan diawali dengan dasar-dasar tentang apa itu musik dan manfaatnya serta diakhiri dengan jawaban-jawaban atas pertanyaan-pertanyaan penting terkait musik dan pengenalan tentang tokoh-tokoh penting dalam sejarah teori musik.","M1, ML, MT",,2022-12-23,
FKIP25,The identity construction through music notation of the indigenous style of gitar tunggal Lampung Pesisir,"This study aims to reveal the meaning of music notation writing of gitar tunggal Lampung Pesisir written by Imam Rozali. Imam is a gitar tunggal player who wrote his technique and playing style in notation symbols. This article uses a case study research design with pattern matching techniques (Yin, 2018). Data were collected through observation, interviews, document analysis, and audio recordings. A series of tests were carried out on the notation and other supporting information to improve the validity of the data. Laboratory analysis was carried out to describe signs, interpret symbols, and compare Western musical notation. As a result, (1) the music notation written by Imam Rozali is a musical expression used as a medium for remembering; (2) the writing of Imam Rozali’s musical notation constructs his musical identity as a Gitar tunggal Lampung Pesisir player; (3) Imam Rozali’s music notation symbolizes an indigenous style which has its concept of gitar tunggal music; (4) Imam Rozali tries to add value to his musical identity among gitar tunggal players because the notation is a symbol of intellectuality","M1, ML, MT",Harmonia: Journal of Arts Research and Education,2021-12-31,
FKIP25,The next big thing in art integrated learning: Asynchronous learning video by using YouTube,"Performing arts are supported by numerous aspects of art, such as music, dance, and theater. Integrated learning was implemented in a traditional Lampung music class held by the Dance Education Study Porgrame, University of Lampung. Although the course has been done on the subject of music, the materials and learning models are applied to merge music and dance. In performance art, especially Lampung, dance and music are always combined into full performance music, and vice versa. It emphasizes dance accompaniment music in this course because music accompanying skills are often needed for dance and music students. This learning model was developed in traditional music classes organized by the department of dance education. Before conducting field research, questionnaires are given to students and alumni (N=45) to determine their needs on this course. Student activity, music knowledge, and complimentary dance and music course materials were identified in this study. Learning is recorded and uploaded to YouTube so that the material can be re-accessed (asynchronous) by students whenever they need it. As a result, dance and music competencies are completely mastered in this course. Through students’ and alumni’s answers, accompanying dance music skills are needed to teach and produce performances. Alumni and last students are spread throughout Lampung, and this course has been taught for several years. Especially in the Lampung region, music and dance competencies are needed for art scholars. This instructional model is needed to teach art, manage art groups, the art community, and the dampness of non-formal art education healed by “sanggar.”
Keywords: Integrated learning, YouTube, music, traditional, Lampung, asynchronous","L1, ML, MT, T1",,2020-11-30,"Integrated learning, YouTube, music, traditional, Lampung, asynchronous"
FKIP25,Notasi pembelajaran musik tradisional gamolan pekhing Sekala Brak Lampung,"Alat musik gamolan pekhing dalam perkembangannya telah mengalami peningkatan secara signifikan dalam proses penyebarannya, walaupun masyrakat yang tinggal di provinsi lampung sebagian besar berasal dari luar lampung dan berlatarbelakang budaya yang berbeda-beda tetapi senantiasa tetap menjaga dan melestarikan gamolan pekhing. Sunguh amat beruntung masyarakat Lampung pada khususnya serta Indonesia pada umumnya yang memiliki sosok Syapril Yamin (Rajo Gamolan) sehingga eksistensi gamolan pekhing dapat terjaga dengan baik hingga sekarang. Melalui buku ini sang rajo gamolan tidak hanya mewariskan produk fisik gamolan pekhing melainkan juga notasi-notasinya sehingga generasi penerus dapat memahami dan mempelajarinya dengan baik dan benar.","M1, ML, MT",,2018-11-07,
FKIP25,Dasar-Dasar Musik,,"M1, ML, MT",,2016,
FKIP25,Educators' perceptions of Tiktok as a music instructional materials,"TikTok's popularity has grown over the last two years, eliciting both excellent and adverse reactions. While it may appear intimidating to enter such a crowded field of lip-syncers, dancers, gymnasts, comedians, and others, there is absolutely room for everyone in this content-rich atmosphere (Brach, 2020). This research explores the perspectives of Indonesian music educators on TikTok, from informal knowledge to active use in music education. Participants are involved in this qualitative research and secondary material from the internet, such as news articles, documents, and the YouTube platform. The questionnaire was completed by 28 educators, including music teachers, instructors, and lecturers. Searches for digital data were also conducted through 13 Indonesian creator accounts with thousands of followers, particularly those involving conceptions and consistency. The study's findings indicate that the usage of TikTok for music learning media has not been determined and that during remote learning due to the COVID-19 crisis, educators continue to rely on the Zoom Meeting and Whatsapp applications. Because it is limited in time, educators have not observed the effectiveness and efficiency of this program. Educators that use TikTok do this solely for entertainment and to learn from their influencers. The explicit objective of using TikTok for music instruction has not yet progressed to the next level, and discussions concerning TPACK are continuing.","M1, ML, MT",,2021-09-11,
FKIP25,Kelas gitar akustik berbasis pembelajaran kooperatif,"This article examines learning acoustic guitar in formal schools employing cooperative learning design. The problem is focused on students’ perceptions of the difficulty of interpreting theory, teacher mastery of music theory, and the learning methods used. This study aims to describe the cooperative learning method implemented in acoustic guitar classes at schools (N = 30). Data were collected through observation, interviews, and documentation to be analyzed qualitatively using an interactive model (Miles et al., 2014). The guitar learning process is carried out in groups by breaking the home group and the expert group. Music material in group interaction is in the form of theory and practice. Based on observations of students’ musical abilities, there is an increase in knowledge of music theory and practice in guitar classes. Students receive the highest score on the aspects of sound accuracy, chord progression to the song, and the time expended learning the song. This study concludes that learning acoustic guitar applying cooperative learning methods is effective in enhancing students’ musical understanding through appreciation and creation. Appreciative attitude turns out as a manifestation of a positive response affective.","L1, ML, MT",Kelas gitar akustik berbasis pembelajaran kooperatif,2020-12-05,
