division,title,abstract,subjects,publication,date,keywords
FKIP7,"Attitude and Motivation in Learning a Local
Language","Abstract—Some studies have been conducted to relate motivation with second /foreign language learning.
Belmechri and Hummel (1988) introduced intensity and desire in exploring motivation in the acquisition of a
second language. In some studies motivation was classified into integrative and instrumental (Gardner and
Lambert, 1972; Ely, 1986; Oxford and Shearin, 1994; and Sung and Padila, 1998), while some other studies
motivation was classified into extrinsic and intrinsic (Dornyei (1994; Ramage, 1990; and Noels et al. 1999).
Unlike the concept of motivation introduced by Oller et al.(1977 and Spolsky ( 1969), who did not separate
attitude from motivation in language learning motivation in language learning in the study is separated from
attitude. This study attempted to investigate how individual differences with regard to attitude and motivation
are correlated in language learning. The participants in this study consisted of 75 students of a university in
Indonesia who have been learning Lampungese language, a local language, since Elementary School. The data
of attitude and motivation, which were collected through questionnaires, were analyzed by undertaking
correlation analyses. The findings show that attitude and motivation was significantly correlated. The
pedagogical implications were also provided in this study.
Index Terms—attitude to language, attitude to language teaching, attitude to native speakers, intrinsic
motivation, extrinsic motivation term","L1, PR",Theory and Practice in Language Studies,2018-01-01,
FKIP1,Integrating Mind Mapping (MM) and Three-Step-Interview (TSI) in Enhancing Students’ Writing Process in Foreign Language Setting,"There had been many studies conducted to investigate the benefits of Mind Mapping (MM) in the writing process and Three-Step-Interview (TSI ) in the speaking process, this study set out to investigate the effectiveness of an integrated technique which was the combination of MM and TSI in teaching writing. This technique was intended to facilitate the students with individual and group brainstorming practice and to help create another teaching procedure which could effectively solve the students’ writing problem, especially in generating and organizing ideas in the pre-writing process. The subject of this study was 29 students who took Intermediate Writing subject at English Department Faculty of Education, Lampung University-Indonesia . The pretest and posttest were administered before and after the treatment. The data was analyzed by means of the paired sample t-test. The result shows that the students' writing ability significantly improved subsequent to the treatment. It also reveals that the most significant improvements were those of the writing content and organization aspects. The results are discussed in relation to relevant previous research findings.","LB, PR",International Journal of Language and Linguistics,2019-12,
FKIP7,"Pelatihan Pengucapan Bahasa Prancis Baku (Prononciation Du Francais Standard) Bagi Guru- Guru Bahasa Prancis SMA/ SMK - Lampung
Tahun Ajaran 2018/ 2019","Abstrak—Banyak guru bahasa Prancis yang belum bisa mengucapkan bahasa prancis dengan benar sesuai dengan aksen dan peraturanya. Tujuan yang ingin dicapai dalam kegiatan ini adalah memberikan pengetahuan atau wawasan kepada para guru tentang pengucapan baku / pelafalan standar alphabet Prancis ( vokal sengau, nasal ,semi vocal , konsonan, semi konsonan), fonetik internasional, kata- kata, kalimat dalam bahasa Prancis yang benar sesuai dengan aksen dan penekanannya(stress). Metode yang digunakan dalam pelatihan ini adalah metode ceramah, Tanya jawab, dan praktek, yaitu para guru menyimak penjelasan yang diberikan oleh nara sumber dengan seksama dan antusias dengan dibantu media power point yang ditampilkan melalui LCD beserta video pembelajaran pengucapan bahasa Prancis. Untuk skor rata- rata Post- Test dari hasil para guru adalah 81.8 dengan interpretasi nilai Baik. Perolehan skor rata – rata tersebut menunjukkan peningkatan 40.7 point dari skor sebelumnya 41.1 (kurang). Dari hasil tersebut menunjukkan bahwa ada peningkatan pengetahuan dan pemahaman para guru selama pelatihan berlangsung. Perolehan skor pada interpretasi nilai Baik Sekali sebesar 50% ( 5 orang), interpretasi nilai Baik sebesar 10% ( 1 orang), dan nilai Cukup  sebanyak  40% ( 4 orang). Hasil tersebut tentu saja belum maksimal dapat 100% bagus semua dan belum sesuai dengan yang diharapkan oleh nara sumber.

Kata Kunci—Pengucapan Baku, Bahasa Prancis, Guru SMA/SMK",PR,"SEMINAR NASIONAL HASIL- HASIL PENGABDIAN KEPADA MASYARAKAT 2008"" BERKARYA DAN BERINOVASI UTUK BANGSA BERBASIS PEMBANGUNAN YANG BERKELANJUTAN",2019-12-20,
