division,title,abstract,subjects,publication,date,keywords
,Instalasi Penerangan di TPA TROPONG BULAN BANDAR LAMPUNG  secara Matik menggunakan Rancangan Sensor –Klip “Siang hari padam dan Malam hari Nyala Otomatis” serta Secara Hibrid sistem PLN dengan Sistem Gen-set.,"Penerangan lampu sekitar TPA TROPONG BULAN BANDAR LAMPUNG dipertimbangkan agar efisien dan untuk menjaga agar tidak ada kendala penerangan lampu di malam hari elektrifikasinya di hibrid  yaitu sistem PLN dengan sistem gen-set, walaupun sementra ini masih dilakukan secara manual. Sensor-Klip berfungsi sebagai sensor cahaya swit On-Off, ketika sunset/maghrib pk.18: 00 sensor-klip akan Swit-On dan pada pagi hari pk.06:00 Sensor-Klip akan Swit-Off otomatis. Dengan penggunaan alat sensor tersebut sangat efektif untuk tercapai efisiensi penggunaan energi listrik yang tidak seharusnya dikeluarkan. 
Terus Terang TPA TROPONG BULAN BANDAR LAMPUNG TERANG TERUS untuk Lawan Covid-19","QA, QA75, QC",,,
,"PEMODELAN MATEMATIKA SISTEM HIBRID ENERGI LISTRIK BERBASIS ANGIN, MATAHARI DAN MIKRO HIDRO DENGAN PENGENDALIAN EFISIENSI MENGGUNAKAN PHOTOCELL DAN WIFI SWITCH:","Dewasa ini pengadaan sumber listrik system hybrid untuk elektrifikasi tidak hanya diterapkan di kawasan terpencil jauh dari sumber listrik Perusahaan Listrik Negara (PLN) yang telah dikenal secara luas. Akan tetapi sudah merambah menjadi trend yang menarik bahwa system hybrid energi listrik dikelola secara perumahan dengan pertimbangan ekonomi, sosial untuk penerangan jalan atau gang, penerangan kawasan pondok pesantren dan juga untuk pengembangan riset lainnya. Pengadaan sumber listrik konvensional unit genset sudah lama dikenal, namun untuk mempertahankan kekonsistenan suplai energi dengan cara tersebut ternyata banyak energi yang dihasilkan terbuang ketika beban listrik yang harus dipenuhi menurun. Sayangnya sistem unit genset tidak mampu menyimpan energi listrik yang tersisa sehingga banyak energi listrik yang terbuang, terutama ketika output dari genset melebihi beban permintaan. Padahal beban listrik yang harus disuplai pada kenyataannya fluktuatif dari waktu ke waktu, misalnya pada siang hari korbanan energi listrik yang tidak termanfaatkan tidak sebanding dengan kapasitas yang seharusnya. Sementara itu metode sistem hibrid energi listrik dengan strategi pengendalian efisiensi menggunakan photocell dan wifi switch digunakan untuk pengadaan sumber listrik yang memiliki kemampuan menyimpan energi listrik yang tersisa dan kemampuan switching ketika beban yang harus dipenuhi mengalami fluktuasi naik atau turun. Oleh karena itu untuk mengakomodasi pengadaan sumber listrik yang efisien dan terbarukan atau ramah lingkungan secara bersama-sama, dari sisi terapannya sangat menarik dan menantang untuk mengkaji pengembanagan model matematika sistem hibrid energi listrik berbasis angin, matahari dan mikro hidro sebagai energi alternatif untuk elektrifikasi penerangan jalan, gang, dan kawasan sekitar pondok. 

Berdasarkan latar belakang tersebut di atas, penelitian ini akan mengkaji model matematika sistem hibrid energi listrik berbasis energi terbarukan dan kehandalan strategi pengendalian efisiensi secara dinamis dalam menanggapi fluktuatif beban permintaan. Dengan cara mengkombinasikan model dan strategi tersebut diharapkan dapat mengakomodasi fenomena sistem pengadaan sumber listrik dan fluktuasi beban permintaan yang harus dipenuhi secara bersama-sama sehingga kondisi optimal sesungguhnya dalam operasional sistem dapat tercapai. Dengan demikian informasi perancangan sistem yang diperoleh dari kajian ini dapat lebih akurat dan tepat sehingga dalam pengambilan keputusan pengadaan unit sistem hybrid peralatan sumber listrik yang diperlukan dapat lebih berkualitas dan lebih akurat, khususnya diera pandemik ini dengan  pengendalian efisiensi menggunakan wifi os android untuk switching.

Secara khusus tujuan penelitian ini adalah: (1) Membuat pemodelan matematika sistem hibrid untuk kontrol sumber listrik yang aktif; (2) Perancangan strategi pengendalian efisiensi yang berperan sebagai otomatis switching supaya tidak terjadi over load; (3) Publikasi jurnal ilmiah pada jurnal terindeks iop publisher seminar series icasmi dan deseminasi di lppm Unila; (4) Bahan ajar mata kuliah Pemodelan Matematika, Persamaan Differensial Parsial dan Pemrograman Komputer.

 
 
Kata Kunci: Modeling, Hibrid, Otomatis, Switching","Q1, QA, QA75, QC",,,
FMIPA10,Implementation of Fuzzy-based Model for Prediction of Prostate Cancer,"Cancer is one of the leading causes of death worldwide. One type of cancer that causes death in
the male population is prostate cancer. This disease occurs only in men because in women they do not have
a prostate appearance. The aim of this study was to compare the accuracy of the model with the predict ions
of prostate cancer specialists. Prediction is made based on prostate specific antigen data, age, and patient
prostate volume. The independent variables in this study were prostate specific antigen, age, and prostate
volume. The dependent variable is the risk of prostate cancer using a fuzzy model. The novelty of this study
is that the model has a low, moderate, high, and very high prostate cancer risk level output. In the previous article only PCR values were produced. The results show that the proposed fuzzy model provides a PCR value that is within the PCR interval predicted by a specialist doctor can be used properly to help diagnose and analyze the possibility of prostate cancer and is one of the considerations for doctors to decide whether or not a biopsy is needed for these patients.",QA75,Journal of Physics: Conference Series 1751,2021,
,Similarity Check : Implementation of Fuzzy-based Model for Prediction of Prostate Cancer,,QA75,,2021,
FMIPA9,Analysis of The Aggregation Claim Number Distributed Poisson with Amount of Claims Distributed Gamma and Rayleigh,"A claim is a transfer of risk from the insured to the guarantor. Claims that occur individually are called individual claims, whereas collections of individual claims are called aggregation claims in a single period of vehicle insurance. Aggregation claims consist of a pattern of the number and amount (nominal value) of individual claims, so that the model of aggregation claims is formed from each distribution of the number and amount of claims. The distribution of claims is based on the probability density function and the cumulative density function. One method that can be used to obtain a claim aggregation model is to use convolution, which is by combining the distribution of the number of claims and the distribution of the amount of claims so that the expected value can be obtained to predict the value of pure premiums. In this paper, aggregation claim modeling will be carried out with the number of claims distributed Poisson and the amount of claims distributed Gamma. As comparison, we compare it with claim amount distributed Rayleigh. By using VaR (value at risk) and MSE (Mean Square Error) indicators, the results of the analysis show that the Rayleigh distribution is better used for distributing data that has extreme values. Data analysis in this study was conducted using the R program package.",QA75,,2019-10-09,
FMIPA9,Simulasi Jumlah Klaim Agregasi Berdistribusi Poisson dengan Besar Klaim Berdistribusi Gamma dan Rayleigh,"Klaim adalah pengalihan risiko dari tertanggung kepada penanggung. Bila klaim terjadi secara individual maka dinamakan klaim individu. Adapun koleksi beberapa klaim individu disebut klaim agregasi dalam satu periode asuransi kendaraan. Klaim agregasi terdiri dari pola jumlah (banyaknya) dan besar (nilai nominal) klaim individu. Dengan demikian model klaim agregasi dibentuk dari setiap distribusi jumlah klaim dan besar klaim. Distribusi klaim didasarkan pada fungsi kepadatan peluang dan fungsi kepadatan kumulatif. Metode konvolusi dapat digunakan untuk mendapatkan model klaim agregasi, yaitu dengan menggabungkan distribusi jumlah klaim dan besar klaim diamana nilai yang harapan yang diperoleh sebagai prediktor nilai premi murni. Dalam makalah ini, pemodelan klaim agregasi dilakukan dengan asumsi jumlah klaim dan besar klaim secara berurutan berdistribusi Poisson dan berdistribusi Gamma. Sebagai perbandingan, dibandingkan dengan besar klaim yang berdistribusi Rayleigh. Dengan menggunakan indikator VaR (value at risk) dan MSE (Mean Square Error), hasil analisis menunjukkan bahwa distribusi Rayleigh lebih baik digunakan untuk distribusi data yang memiliki nilai ekstrim.",QA75,Limits: Journal of Mathematics and Its Applications,2020-12,
FP5,"PELATIHAN PENGGUNAAN MEDIA SOSIAL DALAM MEMPROMOSIKAN EKOWISATA HUTAN MANGROVE SEKAR BAHARI DESA MARGASARI, KABUPATEN LAMPUNG TIMUR","Potensi ekowisata di desa Margasari perlu ditingkatkan, salah satunya dipromosikan melalui media sosial. Pelatihan pemanfaatan media sosial dalam mempromosikan ekowisata hutan mangrove ini memiliki tujuan untuk meningkatkan pemahaman masyarakat desa terhadap dunia digital khususnya media sosial agar minat masyarakat luas semakin meningkat serta dapat memungkinkan pengembangan potensi ekowisata. Sasaran kegiatan ini adalah anggota Kelompok Sadar Wisata (POKDARWIS) yang berada di Desa Margasari, Kecamatan Labuhan Maringgai, Kabupaten Lampung Timur. Analisis tingkat pemahaman peserta dilakukan untuk mengetahui peningkatan pemahaman dengan membandingkan tahap penilaian awal (pre-test) dan tahap penilaian akhir (post-test) dan menggunakan observasi untuk mengamati situasi. objek sasaran. Hasilnya adalah peningkatan pemahaman peserta, dengan 51,39% nilai rata-rata pre-test dan 81,94% dari nilai rata-rata post-test, meningkat 30,55%. Oleh karena itu, edukasi dalam penggunaan media sosial akan memudahkan anggota masyarakat untuk mempromosikan potensi ekowisata hutan mangrove di Desa Margasari","QA75, S1",BUGUH : Jurnal Pengabdian Kepada Masyarakat,2022-09,
FMIPA3,PENGEMBANGAN SISTEM PENCARIAN PADA TUJUH KITAB HADIS MENGGUNAKAN ALGORITMA KNUTH-MORRIS-PRATT,"Hadith search information system requires the main function that is the word search method to make it easier for users to find the word they are looking for. Word search can be conducted by using string matching algorithm to obtain the search term, one of them is Knuth-Morris-Pratt algorithm. This algorithm has two stages in the search process, namely the pre-KMP process which is the stage of giving a shift value in the keyword (pattern) and KMP-Search stage which is a matching phase between text and keyword (pattern). The process of matching text and patterns is conducted from the left to the right based on the value of the shift that has been obtained in the pre-KMP process. The search time is influenced by the length of the text on the database and the pattern the user is looking for, the longer the text and pattern, the search time will increase",QA75,Jurnal Komputasi,2019-04,
FMIPA3,Sistem Informasi Simpan Pinjam Multikoperasi Menggunakan Framework Laravel,"The initial purpose of saving and loan cooperative is giving a financial solution for the members only. As time goes by, nowadays cooperative can provide finance support for small enterprise and public society. Transactions which always increasing can cause trouble in data management. The price of the application that is relatively expensive can be a problem for cooperative which don’t have any information system yet. Furthermore, user needs IT expert for maintaining and updating system. Saving and loan information system using SaaS model (Software as a Service) can be a solution to the problem. With the SaaS model users do not need to buy the app, just by subscribing with the application directly to use the application. Saving and loan multi cooperative information system developed for ease the saving and loan data management. Saving and loan multi cooperative information system developed with Extreme Programming method by using PHP languages, and Laravel Framework. The conclusion of this research is saving and loan multi cooperative information system is successfully built according to user needs, by displaying data transparently.",QA75,Jurnal Komputasi,2019-10,
FMIPA3,Sistem Informasi Penilaian Kinerja Karyawan Berbasis Metode Simple Additive Weighting (SAW) Dan 360 Derajat Pada PLTD/G Tarahan,"PT. PLN (Persero) or PT. Electricity Company of State is one of company in BUMN (State-owned enterprise) which is in charge in electricity sector in Indonesia state. Assesment employees performance in every company very impotant where can achive goals in organization by every employees example
working targets. Nowadays PLTD/G Tarahan need information system of assessment employees that can help in the assessment process with suitable methods but not changed assessment criteria or assessment process have been implied. Assesment employees criteria in this research use 360 degrees and calculating assessment value use Simple Additive Weighting (SAW) method with 3 criteria such as absenteeism, work realization and character (assessment of coworkers). In this system built using Programming Hypertext Prepocesor (PHP) language based web. The research result system used Black Box doing by 2 staff in PTLD/G Tarahan resolved what user needed. Calculation testing has been done using system and manual can get the same result. Based on questionnaire testing by admin, leader and each member get incoming results at intervals 80% - 100 %
with very good category.",QA75,Jurnal Komputasi,2017-10,
FMIPA3,PENGEMBANGAN SISTEM INFORMASI KULIAH KERJA NYATA (KKN) DENGAN ALGORTIMA GREEDY UNTUK MENENTUKAN PENGELOMPOKAN PESERTA KKN (STUDI KASUS: UNIVERSITAS LAMPUNG),"Activity of Community Service Program/Kuliah Kerja Nyata (KKN) at Lampung University is an intra-curricular activity that combines the implementation of Tri Dharma
Perguruan Tinggi with a method of providing learn and work experience to students in community development activities. In its practice, a student who has been eligible to join KKN activity will be grouped according to predetermined criteria. In this study, it has
been developed an Information System of Community Service Program/Kuliah Kerja Nyata (KKN) Lampung University with Greedy Algorithm to determine the grouping of KKN participants. The main concept of Greedy Algorithm is to take the best choice which can be acquired at the time without regard to the consequences in future. Implementation of Greedy Algorithm performed with composition of the division of participants in the group equally by faculty, gender, and department.

Keywords: Greedy Algorithm, Community Service Program.",QA75,,,"Greedy Algorithm, Community Service Program."
FMIPA3,"Hasil Peer Review Jurnal Ilmiah Nasional Terakreditasi Dikti dengan judul ""Hotspot Predictive Modeling Using Regression Tree Algorithm""",,QA75,,,
FMIPA3,"Hasil Peer Review Jurnal Ilmiah Nasional Terakreditasi Dikti dengan judul ""Penerapan Algoritma C45 Untuk Prediksi Churn Rate Pengguna Jasa Telekomunikasi""",,QA75,,,
,Similarity TURNITIN_Jurnal Teknoinfo_Hotspot Predictive Modeling Using Regression Decision Tree Algorithm,,QA75,,,
FMIPA3,Confidence Analysis of Hotspot as Peat Forest Fire Indicator,"Indonesia has recorded 14.9 million hectares of peat forest that continue to be deforested due to fire across Sumatra and Kalimantan. To operate a successful firefight, fast detection is a key element. Hotspot that appeared consecutively in more than two days is a strong indicator of fire existence. As the interest in data mining arose, an advanced technique can be implemented toward hotspot dataset into finding solutions. Many previous works have been carried out to mine sequence patterns and succeeded in determining as well as predicting areas with high occurrence of fire. However, none of the studies analyses the outliers, such as several hotspots which confidence decrease significantly in an adjacent interval of time. Confidence determines the quality of hotspot, with a value above 70 strongly indicates that fire spot exist. This study generated sequence patterns using the SPADE algorithm and analyses 21 hotspots considered as outliers using the Landsat-8 image. The result shows that 85.71 of hotspots have decreased confidence due to haze cover.","QA75, SD",Journal of Physics: Conference Series,2021-01,
FMIPA3,HOTSPOT PREDICTIVE MODELING USING REGRESSION DECISION TREE ALGORITHM,"Forest fires had always become an international issue influencing many life sectors, including environmental, social, and economic. The forest fire in 2013 was regarded as one of the worst forest fire tragedies in history, not only in Indonesia but also in the world. Detection of hotspots on the earth's surface by the satellite can be an indication of land and forest fire occurrence. This research aims to build a predictive model of monthly hotspots in Rokan Hilir Regency using the regression tree algorithm. Several variables related to weather information are included, such as rainfall, sea surface temperature, and southern oscillation index. This research used 245 training data and 43 testing data, resulting a predictive model with a correlation of 0.875 and an error rate of 0.166. Based on the values, we can conclude that the performance of the model is considerably good.","QA75, SD",Jurnal TEKNOINFO,2022-07,
FMIPA3,AUDIT TEKNOLOGI INFORMASI PADA DEALER MOBIL XYZ DI BANDAR LAMPUNG DENGAN MENGGUNAKAN PENDEKATAN COBIT 4.1,"Information technology is growing rapidly and greatly influences to improving the effieciency and effectiveness of business activities in developing the company. In this case, an information technology audit is needed to ensure the existing information technology, that has been already satisfy the common control standards and has the ability to compete in the business world. The purpose of this research is to evaluate the assessment and to make recommendations based on the analysis maturity level of IT in Car Dealer XYZ in Bandar Lampung according to the framework COBIT 4.1. Standard of COBIT 4.1 has parameters that can aid the assessment of an enterprise using a maturity model. This research finds that the result of maturity level of Car Dealer XYZ in Bandar Lampung is 4.02. This shows that Information Technology has been updated well where the procedures and policies have been done effectively, monitored and there are corrective actions are taken.",QA75,Jurnal Komputasi,2017-04,
FMIPA3,Hotspot Sequence Patterns with an Improvement in Spatial Feature,"Forest fires in Sumatra and Kalimantan resulted in degradation of peatlands significantly. The strong indicator
of forest and land fires including in peatland can be identified using hotspots which occurred consecutively in 2
to 5 days. The previous studies have been conducted in mining sequence patterns on hotspot datasets in
Sumatra and Kalimantan. However, those studies applied the sequential pattern algorithms on the datasets
containing temporal and rough spatial features. This study aims to generate sequence pattern of hotspot datasets
using the SPADE algorithm with the improvement of the spatial feature. The study results in 892 1-frequent
sequences and 28 2-frequent sequence patterns at the minimum support of 0.02%. A total of 484 hotspots were
found from the 28 2-frequents sequence patterns, most of which were occurred in September to November
2014 and 2015. Central Kalimantan, Riau, and South Sumatra are the area where hotspots mostly occurred in
2014 and 2015. The visualization module for hotspot sequences was successfully developed in two iterations
using the JavaScript.","QA75, SD",International Journal of Engineering and Manufacturing,2018-11,
FMIPA3,Expert System for Pregnant Mothers Treatment and Early DiseaseDetection for Infants and Toddlers Based on Android (Kasih Ibu),,QA75,Journal of Physics: Conference Series,2019-10-23,
FMIPA9,Investigasi Numerik Profil Kecepetan Aliran Fluida Pada Saluran Mikro Persegipanjang,,QA75,,,
FMIPA9,Ortogonalitas Solusi Analitik Masalah Nilai Batas Model Aliran Fluida pada Saluran Mikro Segi-empat,,QA75,,,
FMIPA9,A Study Slip Flow through elliptic Microchannels,"There are many publications explored steady slip flow through micro channel such as micro annuals,
rectangular, elliptical.  This study solves analytically unsteady slip flow through elliptic micro channels in case of constant
pressure gradient. The exact solutions for the velocity field were found by variable separable method.",QA75,,2018,
,Regularisasi Metode Simplek Study Kasus pada Masalah Kepler,,QA75,,,
FMIPA9,Mathematical Analysis of Fluid Flow Through Rectangular Microchannel with Slip Boundary under Constant Pressure Gradient,,QA75,,,
FMIPA9,Mathematical Analysis of Fluid Flow through Channels with Slip Boundary,,QA75,,,
FMIPA9,"Mathematical Analysis of Fluid Flows through rectangular microchannels under Constant Pressure gradient. Suharsono Suharsiono, Y H Wu, Benchawan Wiwatanapataphe",,QA75,,2011,
FMIPA9,"Mathematical Analysis of fluid flow through Channels with Slip Boundary.  Suharsono Suharsono, Wu YH, Benchawan Wiwatanapataphe",,QA75,,2011,
FMIPA9,SOLUTION OF THE REVERSE FLOW REACTOR MODEL USING HOMOTOPY ANALYSIS METHOD,"Methane (CH4) is one of the most dangerous greenhouse gases in the atmosphere. A reverse flow reactor is utilized to convert CH4 to carbon dioxide (CO2) as a means of reducing the effect of global warming. The dynamics of its dependent variables can be stated by a set of convective-diffusion equations. In this article, we examined analytical solutions of temperature dynamics and methane conversion for a 1-D pseudo homogeneous model without refrigeration by using the homotopy analysis method. The results show that temperature and conversion of methane will go to constant when time goes to infinity.",QA75,IIUM Engineering Journal,2021-01,
FMIPA3,Pengembangan Sistem Rekruitmen Karyawan Perusahaan Mitra UPT Kewirausahaan Dan Pengembangan Karir Universitas Lampung,"Recruitment is the process of finding and the best qualified candidate work in a company or agency. There are various recruitment methods such as via employee recommendations, university collaboration, job vacancy, and jobsfair. In this paper an online company employee recruitment will be made using the black box testing method with the Equivalence Partitioning technique and the Likert scale. The data is taken from company users and job seekers. System displays job vacancies in accordance with the minimum level of education, gender and applicant's GPA. Job seekers fill out the Curriculum Vitae (CV) on the system as a company assessment for acceptance of applicants.The system can also provide announcements for applicants who have successfully passed a company. The system has been tested with black box testing with technique Equivalence Partitioning and get valid results for each test case, and for testing using a Likert scale gets very good results with a value of 87.05%.",QA75,Jurnal Komputasi,2020,
FMIPA3,PENGEMBANGAN SISTEM INFORMASI MONITORING TUGAS AKHIR (MONITA) JURUSAN ILMU KOMPUTER FAKULTAS MATEMATIKA DAN ILMU PENGETAHUAN ALAM UNIVERSITAS LAMPUNG,"The 2016 Academic Regulations of University of Lampung article 48 stated that; students are obligated to finish their thesis to be avowed as a graduate of a certain bachelor degree. In the Computer Science Department, theses are managed by the thesis coordinator. Thesis coordinator has several tasks, including monitoring the thesis progress of each student. However, in practice, the monitoring process can not be performed easily. Therefore, a thesis monitoring information system is expected to support the thesis coordinator and thesis supervisors in the Computer Science Department on conducting thesis monitoring, as well as accommodating students in terms of administration ease. This research has successfully generated a Thesis Monitoring Information System developed according to the user requirements, by implementing PHP, MySQL, and Nexmo API.","QA75, QA76",Jurnal Pepadun,2020,
FMIPA10,PENERAPAN METODE CERTAINTY FACTOR DALAM MENDETEKSI PENYAKIT TANAMAN KARET,"Karet (Hevea brasiliensis) termasuk dalam genus Hevea dari familia Euphorbiaceae, merupakan pohon kayu tropis yang berasal dari hutan Amazon. Banyak artikel dan penelitian yang menyebutkan bahwa hingga saat ini Indonesia telah memiliki luas areal perkebunan karet terluas namun tidak didukung dengan produktivitas yang tinggi. Hal tersebut tentu saja akan menimbulkan kerugian ekonomi. Kerugian ekonomi dari budidaya karet disebabkan adanya serangan penyakit. Pengetahuan para petani tentang penanganan penyakit pada tanaman karet juga masih rendah. Namun, seiring dengan kemajuan teknologi dalam berbagai aspek kehidupan saat ini menjadikan para pengembang teknologi untuk membuat aplikasi baru yang lebih memudahkan masyarakat dalam memperoleh informasi. Metode certainty factor sering digunakan dalam sistem pakar agar terlihat lebih natural. Penelitian ini menekankan pada dua aspek utama yaitu gejala-gejala dan jenis penyakit pada pohon karet. Hasil penelitian menunjukkan bahwa penerapan metode certainty factor pada penelitian ini, memiliki akurasi sebesar 100% dari hasil diagnosa sistem pakar.",QA75,Jurnal Pendidikan Teknologi dan Kejuruan,,
