division,title,abstract,subjects,publication,date,keywords
FT5,Similarity_Identifikasi Calon Mahasiswa Baru dalam Pemilihan Program Studi sebagai Model Pengembangan Kerjasama dengan MKKS se Provinsi Lampung,"There are still many prospective students from the University of Lampung from various high school graduates and their equivalent who do not know which study program at the University of Lampung is good and suitable for them, so that when they are accepted and start lectures, it is not uncommon for students to feel that they have chosen the wrong major which results in curiosity. changing study programs late or even unable to complete college. This study aims to build a decision support system that displays recommendations for Study Programs at the University of Lampung that are in accordance with the interests and academic abilities or intelligence of prospective students. This system is expected to assist prospective students in choosing a study program that suits them, so as to reduce the risk of changing study programs, as well as being late for graduation or even not being able to graduate. The system development method that will be carried out in this research is Extreme Programming (XP) in order to build a system quickly and according to user needs which has four main stages, namely planning, designing, coding, and testing before releasing the system. Meanwhile, to determine recommendations based on the interests and intelligence of prospective students, they will use Holland's theoretical basis for interest, and the Intelligence Structure Test (IST) theory for intelligence.",QA75,,,
FMIPA3,Feature Analysis and Classification of Particle Data from Two-DimensionalVideo Disdrometer,"We developed a ground observation system for solid precipitation using two-dimensional video disdrometer (2DVD). Among 16,010 particles observed by the system, around 10% of them were randomly sampled and manually classified into five classes which are snowflake, snowflake-like, intermediate, graupel-like, and graupel. At first, each particle was represented as a vector of 72
features containing fractal dimension and box-count to represent the complexity of particle shape. Feature analysis on the dataset clarified the importance of fractal dimension and box-count features for characterizing particles varying from snowflakes to graupels. On the other hand, performance evaluation of two-class classification by Support Vector Machine (SVM) was conducted. The experimental results revealed that, by selecting only 10 features out of 72, the average accuracy of classifying particles into snowflakes and graupels could reach around 95.4%, which had not been achieved by previous studies.",QA75,Advances in Remote Sensing,2015,
FMIPA3,"Implementation of Multilevel Feedback Queue Algorithm
in Restaurant Order Food Application Development for
Android and iOS Platforms","Rapid business development encourages every entrepreneur to
create a different service to attract customers. Fast service is
its own attraction for customers. Implementation of queuing
or scheduling system on chefs can be used to avoid a high
stack of ordering food in the chefs, so that serving times can
be done quickly. Multilevel Feedback Queue scheduling
algorithm is one of the CPU scheduling in the computer
operating system. Multilevel feedback queue algorithms allow
the process to move the queue. If a process is too time
consuming, then the process will be moved to a lower queue.
Therefore the interaction process becomes fewer and it
reduces CPU time. On this research, we developed a food
ordering web application on Android and iOS by applying
multilevel feedback queue to create a queue ordering food at the chefs. The time obtained from multilevel feedback queue methods faster 30 minutes 48 seconds from the first come first serve method.

Keywords
Android, iOS, Restaurant, Queue, Web App.",QA75,International Journal of Computer Applications,,
FT12,The Role of Internet of Things to Support Cultural Heritage Inventory in Urban Resiliency Approach : Traditional House in BANDAR LAMPUNG Case,"Abstract—This paper views Internet of Things (IoT) as a tool to support architectural and urban heritage protection and preservation. It bases its understanding on the premise that urban resiliency act as an agent of cultural heritage inventory which are completed by building category, facade, typology, structure, social cultural and human behavior. This research proposes the first step of an innovative methodological approach to develop an information system, and to stimulate identification of “flag” all traditional houses in database’s management. Moreover, we deliver opportunity and challenge to implement IoT in cultural heritage inventory. Collectively view these possibility to adapt, protect, and preserve local community knowledge, traditional technique and traditional houses that as part cultural identity in the future. As a case study, we present three layer inventory which integrates IoT for sustainable cultural heritage, especially traditional houses in Bandar Lampung, Indonesia.
Keywords—Internet of Things, Architecture, Urban Resiliency, Traditional Houses, Bandar Lampung.","NA, QA75",International Conference on Information Technology System and Innovation 2018,,
FMIPA3,Goldfish (Carassius auratus) Image Segmentation Using Expectation Maximization (EM) Algorithm,"Carassius Auratus, also known as goldfish, is the most commonly kept ornamental fish  in  an  aquarium  that  has  a  variety  of  species,  shapes,  and  colors.  Goldfish anatomy is almost similar between species so it is difficult to distinguish. Goldfish identification has several processes to determine the level of success. One process that is very important for identification is segmentation. Segmentation is the stage to separate   objects   and   backgrounds.   Good   segmentation   results   will   provide maximum feature extraction results and it should impact on optimal identification results. This research aims to create a system that can be used to segment goldfish fish  objects  in  the  background   using  the  Expectation-Maximization  method. Expectation-Maximization is an algorithm for estimating a parameter in a function by using Maximum Likelihood Estimation (MLE). Goldfish fish species total of 72 images  each  totaling  216.  Goldfish  segmentation  evaluation  results  using  the Expectation-Maximization method can work well with an accuracy rate of 89.14%. Analysis of the results of the imperfect fish image segmentation is influenced by white light and the background color is almost similar to that of the goldfish. The results of  the  best  goldfish  image  segmentation  are  influenced  by  a  good  goldfish  image when the image capture process at the time of the screenshot has a stable focus and is not blurry so that the edges of the goldfish object appear clearly and sharply.",QA75,Journal of Applied Informatics and Computing (JAIC),2020-12,
FMIPA3,Audit Manajemen Teknologi Informasi pada PT XYZ Menggunakan Framework COBIT 5,"PT XYZ is an agri-food company that has used the information technology for its company's operations. Information technology management at PT XYZ requires an audit to determine the level of information technology capability on PT XYZ and it provides a recommendations for business process improvements to achieve the business objectives of the company. Since this audit is intended to assess the managerial and technical aspect of information technology, audit of PT XYZ is conducted by applying COBIT 5 framework. Procedure of COBIT 5 consists of audit plans, audit preparation phase, the implementation phase of the audit, and audit reporting stage. This audit measures the capability level of information technology management at the sub-domain Manage Strategy (APO02), Manage Enterprise Architecture (APO03), Manage Relationships (APO08),
Manage Suppliers (APO10), Manage Requirements Definition (BAI02), Identification Solutions Manage and Build (BAI03), and Manage Knowledge (BAI08). Based on evaluation using COBIT 5, PT XYZ is in the level 2.6 out of 5. Due to the rounding index value, the measurement results are at level 3 (Established Process) while the company's expectation level is at level 5. The level difference occurs because PT XYZ has not conducted a review, evaluation, and report of the settlement. Therefore, companies need to improve information technology management in achieving the company's business goals.",QA75,Jurnal Komputasi,2019-04,
FMIPA3,"IMPLEMENTASI FRAMEWORK COBIT 5.0 FOKUS DOMAIN DELIVERY, SUPPORT, DAN SERVICE PADA PT.XYZ","XYZ company has implemented information technology in the company's operations. Information technology management audits are needed to find out whether the application of information technology is in accordance with the company's control standards. The framework used in this research was COBIT 5.0 domain that is DSS (Delivery, support, dan service) because the DSS domain includes has IT management scope, data management scope, and facility operational scope. This research aimed to evaluate information technology management at the company. Audit results shows that the company's capability level in 4th level (Predictable Process). Predictable Process means that DSS domain process has been standarized, do the IT process, and achieved process. Capability level that the company wants to be achieve is 5th level (Optimizing Process). To achieve this level, companies must innovate and make sustainability improvements.",QA75,KLIK - KUMPULAN JURNAL ILMU KOMPUTER,2020-06,
FMIPA3,"Syarmee.id, Sistem Perencanaan Sumber Daya Perusahaan Untuk Usaha Jahit Rumahan Berbasis Web",,QA75,,2019-09-25,
FMIPA3,Priority Determination of Application Candidate UsingWard and Peppard’s Composite Matrix Portfolio and Business Process Analysis for Customer Relationship Management (CRM),"By using CRM, the organization will be able to identify of what customerrequires and needs, thus will improve the service. The designing of CRMthe ComputerScience Department using Zachman  Framework  is  one  of  the  approach  methods to  serve  customers  in  better  ways. Zachman  Framework  has  not  provided  a  method  for  determining the  priority  of  the application candidates that will be designed.In this research the authors use the Ward and Peppard’scomposite matrix portfolio and business process analysis for priority to determine the priority of application candidates. The phase of candidate’sdetermination by using Ward and Peppard’s composite matrix and business processconsist of six steps.The results arein the form of mappingfor each application candidate/application system into four quadrants which are providedin compositematrix for the decision-makingprocess. The matrixconsistsof keyoperational,  strategic,  high  potential  and  support.  The  mapping  on  Ward  and Peppard’s  composite  matrix  is  then  used  to  separate  the  application  candidates  into  two groups, the main priority of application group/information system and non-main priority of application  group/information  system.  There  are  five  information  systems  which  are classified into mainpriority application group/information systemand recommended to be developedin further research",QA75,SYSTEMIC : Information System and Informatics Journal,2018-08,
FMIPA3,Implementasi Business Intelligence Dashboard (BID) dengan Metode ADDIE pada Usaha Mikro Bidang Retail Studi Kasus CV Duta Square Bandar Lampung,"A company needs a strategy that can help in making a decision. The strategy used in decision making will  facilitate  the  process  of  analysis,  implementation, and  business  development  so  that  the  business  becomes more effective. The concept of utilizing technology as a means of decision making by integrating and analyzing data to be transformed into knowledge and understanding is commonly called the business intelligence dashboard. In  this  study  the  method  used  is  the  ADDIE  method,  where  the  stages  of  the  ADDIE  method  include  analysis, design,  development,  implementation,  and  evaluation.  This  research  will  discuss  the  business  intelligence dashboard on the micro business in the retail field CV. Duta Square, located in Bandar Lampung.The steps taken begin with analysis of business processes in the CV. Duata Square, defining problems and solutions, dashboard design,system development, implementation and evaluation.The results of this study are the system that have been tested by business owners that can display dashboard information including supplier quality bar charts, sales data line charts, items of interest or lack of customer interest, customers transactions, both members and non-members.","QA75, QA76",Matrix : Jurnal Manajemen Teknologi dan Informatika,2020-03,
FMIPA3,Web GIS based assessment  using SAW methods to identify high risk areas of tuberculosis transmission and incidence in Bandar Lampung City,"Tuberculosis (TB) is still a major problem in the public health sector, even in 2016 Indonesia was included in the five countries with the highest TB case burden in the world. In 2017, the number of TB cases in Lampung Province was 7,040 cases and one of the obstacles faced was the tendency for TB sufferers to be difficult to open so that many cases were not detected. Based on these facts, a Geographical Information System (GIS) is proposed which can process data into maps to see high risk areas where TB disease was found in Bandar Lampung. It will make it easier for health agencies to make policies in handling or preventing TB disease in Bandar Lampung. In this study, a decision-making system with Simple Additive Weighting (SAW) method was also proposed to produce a map of the area with the level of TB risk factors. The criteria used to summarize the weights are TB cases, population density, mortality, healthy and clean behavior, and health facilities. The result of data processing is presented in a color polygon map that has 4 levels of risk factors, namely very high, high, medium, and low.",QA75,,2020-09-03,
FMIPA3,Aplikasi Mobile untuk Pencatatan Keuangan Pengeluaran Biaya dan Penerimaan Dana pada Usaha Tani Padi (AKUPADI),"The level of income of farmers is influenced by several components, namely the amount of production, production costs, and product selling prices. In knowing the level of farmers' income, records management is needed in the form of financial statements that can be used as a reference in managing all production inputs. AKUPADI mobile application was developed using the waterfall method by providing several features that can be used to assist farmers in carrying out rice farming activities. This application was built using language that is easily understood by farmers. Features provided by the AKUPADI application are recording expenses, recording receipt of funds, displaying transaction history, displaying reports, and managing production input data.",QA75,,2019-10-24,
FMIPA3,"Pengembangan Modul Penerimaan Karyawan dan
Modul Penggajian pada Sistem Informasi Kepegawaian
Pt. Traktor Nusantara Bandar Lampung","This study developed a Decision Support System (DSS) by utilizing Analytical Hierarchy Process (AHP)
Method as a process in selection of employees acquisition. This selection process used several criteria
(multicriteria) to choose which applicants will be accepted. This Decision Support System (DSS) helps
managers of Human Resources (HR) in deciding which applicants will be selected. In this application, there are
criteria used and the weight of those criteria. This application of module business process will be able to
generate the rank of each applicant based on the final amount. The applicant who has the greatest value will be
given a better rank and it means that the applicant has criteria in accordance with company’s requirement. In
addition, Web Service as a business process of payroll modules. In this process, a set of functions or methods
which contained on a server can exchange data and information using an operating system and application that
different from each other through the internet that uses XML as the format of message delivery. This system
constructed by using PHP and MySQL as language. The result of functional testing data based on test case
testing shows that the system can work ""in accordance"" with its analysis.",QA75,Jurnal Komputasi,2016-04,
FMIPA3,SISTEM REKOMENDASI SEKOLAH MENENGAH PERTAMA DI KOTA BANDAR LAMPUNG MENGGUNAKAN METODE SAW  (SIMPLE ADDITIVE WEIGHTING) BERBASIS  SISTEM INFORMASI GEOGRAFIS,"Along with the development of information technology in the rapidly advancing era of globalization, the school education office in the city of Lampung conducted a zoning system in the acceptance of prospective elementary school students and above. With the advancement of technology, registration of prospective new students can access online registration which makes it easy to register. And now there needs to be a decision support system for prospective students in choosing schools according to the zoning mapping of the region. Then a decision support system is applied using the SAW (Simple Additive Weighting) method based on geographic information systems because the method is more appropriate in selecting criteria that are suitable for prospective students. In this case there are 3 (three) criteria contained in the system in the form of distance criteria, criteria for the difference in the number of UN scores of students with passing grade, and school quota criteria","QA75, QA76",,2020-02-24,
FMIPA3,Sistem Informasi Pengajuan Pengambilan Sampah Berbasis Website Dan Android,,QA75,,2021,
FMIPA3,Sustainable Development Goals (SDGs) Dashboard Universitas Lampung Berbasis Web,,QA75,,2020-08-01,
FMIPA3,Implementasi Customer Relationship Management (CRM) Pada Usaha Mikro Bidang Retail Studi Kasus CV Duta Square Bandar Lampung,"To compete and develop business better, businesses must continue to innovate in the implementation of business processes. One innovation that can be done by business actors is implementing technopreneurship in the business they do. Application of technology and utilization of data that occurs in the business conducted will have many advantages for business people. This paper will discuss the implementation of Customer Relationship Management (CRM) in the retail micro business of CV. Duta Square, located in Bandar Lampung, Lampung, Republic of Indonesia. The company is focused on handling retail sales of Muslim clothing and daily necessities. The ADDIE model will be used in the development stage and will implement CRM that focuses on point-of-sales, data collection, and member transaction storage. Implementation of the company's needs will be discussed with business owners to determine the effectiveness of the system that has been created",QA75,,2019-10-24,
FMIPA3,"IMPLEMENTASI METODE REGRESI LINIER SEDERHANA PADA
PENYAJIAN HASIL PREDIKSI PEMAKAIAN AIR BERSIH PDAM
WAY RILAU KOTA BANDAR LAMPUNG DENGAN SISTEM
INFORMASI GEOFRAFIS","Banyaknya pelanggan dan pemakaian air bersih di suatu daerah yang masuk dalam zona pelayanan
PDAM Way Rilau Kota Bandar Lampung diamati sebagai informasi yang dapat digunakan dalam perencanaan
produksi air bersih di masa mendatang. Hasil prediksi jumlah pelanggan dan jumlah pemakaian air bersih akan
bermanfaat dalam perencanaan produksi air bersih dan peningkatan layanan kepada pelanggan. Prediksi dapat
dilakukan dengan berbagai metode, salah satunya metode regresi linier sederhana. Penelitian ini dilakukan
dengan tujuan untuk membangun sistem informasi geografis yang dapat menyajikan hasil prediksi pemakaian air
bersih kota Bandar Lampung dalam wilayah pelayanan PDAM Way Rilau Kota Bandar Lampung. Data pada
penelitian ini diperoleh dari PDAM Way Rilau Kota Bandar Lampung. Hasil keseluruhan pengujian
menunjukkan bahwa sistem informasi geografis penyebaran dan prediksi jumlah penduduk telah sesuai baik dari
segi fungsionalitasnya, maupun dari segi interaksi sistem dengan pengguna.",QA75,Jurnal Informatika Mulawarman,2017-09,
FMIPA3,Marketplace Pakan Ternak Dan Produk Hasil Ternak Berbasis Android (ePakan),,QA75,,2019-10-25,
FMIPA3,INTEGRASI INFORMASI GEOGRAFIS PADA SISTEM IZIN MENDIRIKAN BANGUNAN KAWASAN PERDAGANGAN DAN JASA KOTA BANDAR LAMPUNG,"The Department of Housing and Settlements of Bandar Lampung City was formed based on the Regulation of the Lampung Province Number 8 of 2016 concerning the Formation and Arrangement of the Lampung Province Regional Apparatus. One of the activities carried out by the service is to make a Building Permit (IMB). Problems that are often experienced in spatial planning include irregular use of space and not in accordance with Building Permit and utilizing the use of space without regard to negative impacts on the surrounding environment. Especially in the trade and service area, most of Bandar Lampung City residents are engaged in industry, trade and services. In supporting the infrastructure of the development of activities in the field of Trade and Services, naturally effective and efficient development as a factor of economic growth for the region is needed. Therefore, as an element of service improvement in making permits to construct buildings, it needs tools in the form of technology. The technology in question is a website-based online licensing. With the advancement in technology, permit makers can access and submit licenses without being limited by distance, time and place. Then the integration of Geographic Information is applied to the Building Permit System for the Bandar Lampung City Trade and Services Area. In this system using the PHP programming language and Mariadb as the database. Testing using Black Box testing. In addition to the licensing process, this system also uses Google Maps Api as a geographic information feature in mapping building locations that have been submitted by permit makers. So that in addition to facilitating the applicant in the process of making permits, this system can also facilitate the Housing Settlement Office in monitoring and structuring the location of buildings in the Trade and Services area.","QA75, QA76",Pepadun,2020-12-01,
FMIPA3,"Measuring spatial accessibility of healthcare services using ARIA method, case study at Bandar Lampung City","Accessibility of health services in Indonesia is still a problem. Health equity focuses on easy access and equitable distribution of health services and obtaining services with a standard quality set. Three dimensions of in-depth equity health can be divided into equity in health status, equity in health service use, and equity in health financing. The entire population is a health insurance participant. Health services that benefit packages include comprehensive services (preventive, promotive, curative, and rehabilitative). Government-owned health facilities must be provided, such as community health centers, clinics, doctors, hospitals, and financing paid by the government; the people who can afford it pay a premium. In this study, the accessibility of health services at hospitals and health centers in the city of Bandar Lampung was analyzed in geographic references by determining the distance and ranking health facilities ranging from very high to less accessibility value categories using the ARIA accessibility index calculation method. For hospital accessibility, Panjang district had the lowest index. Meanwhile, this district had a very high index for community health center accessibility compared to others. In health clinic accessibility, Teluk Betung Barat District had the lowest index, and Tanjung Karang Barat District had the highest index.","QA75, QA76",,2020-11-18,
FMIPA3,"Icoffee.id, Platform Jual Beli, Lelang Dan Investasi Panen Kopi Berbasis
Web",,QA75,,2020-11-16,
FMIPA3,Pengembangan Sistem Informasi Manajemen Supplier dan Barang dengan Extreme Programming,"The case study was taken from one of the trading companies in  Lampung. The company sells  Muslim fashion products from a large number of suppliers. Suppliers data is recorded in detail manually, as well as products recorded. Manual data collection can result in recording errors,  data easily tucked, or not recorded. This research develops an information system to help the company in data collection of suppliers and products automatically based on the web using Laravel as a framework. This system is built using extreme programming methods and has features that   focus on collecting suppliers,  products,  and product  shipments. The results of  system testing using the black box testing method shows that the system has fulfilled functional requirements and user needs.","QA75, QA76",Jutisi,2020-04,
FMIPA3,Parsing Data Text dengan N-Gram Similarity dan Algoritma Brute Force pada Studi Kasus Verifikasi Transkrip Mata Kuliah,"In this research, the development of verification systems courses is used as a study case. It  aims to accelerate the process of checking the existing curriculum in computer science majors. Course verification systems was developed with the search string matching method which has two parts programming methods: exact matching and heuristic matching. Exact matching programming method using a brute force algorithm has shortcomings because it does not have the preprocessing phase. Meanwhile, heuristic matching algorithm using n-gram similarity as it can check the detail . The results shows brute-force  algorithm more quickly in running time results. But n-gram similarity algorithm is more efficient in checking if there some difference in one or more character in course code and course name",QA75,Journal Science East Borneo,2014-12-04,
