division,title,abstract,subjects,publication,date,keywords
FMIPA2,"Peningkatan Kualitas Pemahaman Konten dan Teknik Pengajaran Mata Pelajaran Fisika, Kimia, Matematika, Biologi, dan Teknologi Informasi Komputer (TIK)","Pembelajaran Fisika, Kimia, Matematika, Biologi dan Teknologi
Informasi-Komputer (TIK) atau disingkat MIPA-TIK di level Sekolah Menengah Atas
(SMA) merupakan salah satu bagian dari komponen pendidikan tersebut. Pemahaman
yang baik dan benar dari siswa SMA tentang MIPA-TIK diperlukan agar siswa SMA
tidak lagi memandang mata pelajaran tersebut sebagai ilmu pengetahuan yang sukar.
Oleh karena itu tingkat kualitas pemahaman guru-guru mata pelajaran tersebut di
Provinsi Lampung umumnya dan Kabupaten Lampung Selatan khususnya, memegang
peranan yang sangat penting. Metode: Evaluasi dilakukan pada awal kegiatan (pretest) dan akhir kegiatan (post-test) untuk melihat keberhasilan dari kegiatan ini. Hasil:
Hasil post-test dibanding pre-test sebesar 45,8%. Kesimpulan: terjadi peningkatan
kemampuan atau kompetensi guru-guru dalam menyampaikan materi mata pelajaran
tersebut secara baik dan benar.","QA, QA75, QC, QD, QK",Jurnal SOLMA,2023-04-30,
,"Peningkatan Kualitas Pemahaman Konten dan Teknik Pengajaran Mata Pelajaran Fisika, Kimia, Matematika, Biologi, dan Teknologi Informasi Komputer (TIK)",,"QA, QA75, QC, QD, QH301",Jurnal SOLMA,,
FP1,Analisis Perubahan Penggunaan Lahan Pertanian Akibat Pembangunan Jalan Tol Berbasis Citra Satelit Di Kabupaten Lampung Selatan,"There are concerns that toll road construction will change livelihoods and reduce agricultural production. This study aims to map the potential agricultural land affected by toll road construction and to analyze the changes. The research was conducted from July to August 2020. The research site was in South Lampung Regency with the consideration that this area is one of the districts affected by toll road construction and is a center for food crops in Lampung Province. To see land changes carried out with a remote sensing system and then calculate the rate of land change. The rate of land conversion analyzed is in the period 2014 to 2020 in South Lampung Regency, with the assumption that in 2015, toll roads will be built and in 2020 the construction will be completed. The data source used is the 2014 and 2020 land use map of South Lampung Regency, the result of interpretation of Landsat imagery. The results showed that the toll road construction almost entirely took up agricultural potential land, both land used for plantations and food crops. From the total land area, 72.13 percent is plantation land and 25.12 percent is land planted with food crop commodities.","QA75, QA76, S1",JoFSA,2021-04-30,
FT5,WEB SERVICE PENCARIAN KOLEKSI REPOSITORY PERPUSTAKAAN PADA APLIKASI EPRINTS,"Institutional Repository (IR) adalah sarana penting bagi universitas untuk menyimpan bahan-bahan digital, dan termasuk upaya untuk pengorganisasian, akses dan pendistribusian yang baik untuk karya-karya akademik yang dimilikinya. Tantangan dari penggunaan IR adalah bagaimana menjamin koleksi yang dimiliki oleh universitas, khususnya perpustakaan, dapat didistribusikan dengan baik terhadap civitas akademika yang berhak mengaksesnya. API (Application Programming Interface) Web Service adalah salah satu cara yang dapat digunakan sebagai cara akses data oleh perangkat lunak tanpa terikat dengan perangkat lunak itu sendiri. Sehingga, penggunaan API Web Service dapat mengurangi waktu yang diperlukan untuk pengembangan perangkat lunak karena cara akses data seragam. Tujuan penelitian ini adalah untuk mengembangkan API web service IR yang berfungsi untuk mengoptimalkan layanan koleksi IR, khususnya untuk pencarian dokumen pada aplikasi Eprints yang tidak mendukung API Web Service. API Web Service IR dikembangkan menggunakan metode Rapid Application Development (RAD) yang memungkinkan dilakukannya iterasi revisi dengan cepat. Pembuatan API Web Service menggunakan bahasa PHP dengan dua skenario yaitu generasi data secara real-time dan generasi data periodik. Berdasarkan hasil uji skenario, diketahui bahwa skenario generasi data secara real-time membutuhkan waktu yang lebih lama dalam memperoleh data. Sedangkan, generasi data periodik memiliki performansi yang cepat walau pun jika ada data baru yang masuk, sebelum periode generasi data, menjadi tidak tersedia. Karena penggunaan di setiap universitas berbeda, kedua skenario ini harus dipertimbangkan dalam memilih model generasi data yang diperlukan. Dengan penerapan API Web Service untuk pencarian koleksi repository pada aplikasi EPrints, layanan perpustakaan Unila telah dihadirkan dalam bentuk KiosK untuk layanan bersifat mandiri.","QA75, QA76, Z665",Prosiding Seminar Nasional Inovasi Perpustakaan 2017,2018-01-23,
FMIPA3,IMPLEMENTASI FRAMEWORK MODEL-VIEW-CONTROLLER PADA SISTEM INFORMASI AKADEMIK UNIVERSITAS LAMPUNG,"Information System characteristics should be able to handle mass transaction, could present real time data and provide interactive experince to its user. This paper would discuss Model-View-Controller framework implementation on Academic Information System of The University of Lampung. Result showed Model-View-Controller architecture could seperate data core processing and it functionality, consistency among views,  fleksible interface in relation to the views and could present the information in many forms. 
 
Keywords: Academic Information System, Model-View-Controller, Web Framework",QA75,Prosiding Seminar Nasional Sains & Teknologi VI UNILA 3 November 2015,,"Academic Information System, Model-View-Controller, Web Framework"
,Peer Review paper IMPLEMENTASI FRAMEWORK MODEL-VIEW-CONTROLLER PADA SISTEM INFORMASI AKADEMIK UNIVERSITAS LAMPUNG,,QA75,,,
,Peer Review paper Multi-Inductive Learning approach for Information Extraction,,QA75,,,
,Peer review paper METODE KLASIFIKASI OPTIMUM UNTUK DESCRIPTION LOGIC BASED-HIERARCHICAL STUCTURED-KNOWLEDGE BASE,,QA75,,,
,Plagiarism check paper : Multi-Inductive Learning Approach for Information Extraction,,QA75,,2011,
FMIPA10,Chord Identification Using Pitch Class Profile Method with Fast Fourier Transform Feature Extraction,"Recognizing a chord of a music is not an easy task to do, but it can be done easier using digital signal processing in computer system. This research implements pitch class profile (PCP) method in recognizing chord from audio signal. The audio signals are converted from time domain into frequency domain using Fast Fourier Transform (FFT). In this research, signals are processed using various frame blocking width in order to find out the most optimal width in frame blocking using Hamming window. This research implements chord recognition method in Python programming to process guitar chord recording. The purpose of this research is to find out the accuracy of chord recognition using PCP method. 

Keywords: Chord; Guitar; Pitch Class Profile; Fast Fourier Transform.",QA75,International Journal of Computer Science Issues,2014,Chord; Guitar; Pitch Class Profile; Fast Fourier Transform.
FMIPA10,RANCANG BANGUN APLIKASI KARTU MENUJU SEHAT (e-KMS) PADA PLATFORM ANDROID,"Toddler Growth Chart held by parents is a book that consists of a toddler's growth history which holds by Maternal and Child Health Services (Posyandu) officer. Growth Chart-book still uses traditional ways, written by hands to records all of the toddler's growth. Po-syandu reports that sent to the Public Health Center (Puskesmas) every month still proceeds with a spreadsheet, and it makes Posyandu officers felt the difficulty of processing the data, like record, search, and store the data. e-KMS Apps can help Posyandu officers for easy re-cording and searching , and tracing data history. It also helps Posyandu officers to make Po-syandu reports easily. This app helps toddler’s parents to control their toddler’s growth and make the parents feel easy about how to take care of the toddlers.
This application is equipped with features of calculating nutrition status and pre-senting toddler nutrition status data in the graph based on WHO (World Health Organiza-tion) standards in 2006, Posyandu activities, calculation of nutritional status for parents of children under five to be able for knowing the nutritional status of toddlers anywhere and at any time without waiting for the Posyandu schedule. It also provides tips and tricks for car-ing for toddlers to inform parents how to care for toddlers, and manages Posyandu reports every month to control the condition of toddlers",QA75,Kumpulan Jurnal Ilmu Komputer (KLIK),2020-02,
FMIPA3,METODE KLASIFIKASI OPTIMUM UNTUK DESCRIPTION LOGIC BASED-HIERARCHICAL STUCTURED-KNOWLEDGE BASE,"Since W3C has recommended OWL-DL, many legacy ontologies are now being translated into Description Logic (DL) based ontology languages in order to take advantage of DL based tools and reasoning services. However the resulting Knowledge Bases (KBs) are typically of large size, but have consist mainly of shallow taxonomies. In this paper we propose an optimisation which speeds-up classification for such KBs.

Keyword: Description Logic, Classification, Information Retrieval, Hierarchical.Data, Ontology.",QA75,,2007-11,
FMIPA3,Sentiment Analysis Protokol Kesehatan Virus Corona Dari Tweet Menggunakan Word2Vec Model dan Recurrent Neural Network Learning,"Sentiment analysis is a computational study of opinion from various opinions, which is part of the work that conducts a review related to the computational treatment of opinions, sentiments, and perceptions of the text. To solve various problems in sentiment analysis, needed a good text representation method. In this study, a deep learning analysis was carried out using the Recurrent Neural Network (RNN) method and the Word2Vec Model as word embedding in sentiment classification. The sentiment dataset used comes from user reviews on Twitter (tweets) on the health protocols implemented by the public from the government's appeal. The results showed that the RNN model using sigmoid activation resulted in the greatest accuracy of 66%. The training process in this test uses 10 epochs and 32 batch sizes so that the precision value for negative sentiment is 54% and for positive sentiment is 67%.",QA75,Jurnal Pepadun,2021-12,
FMIPA3,"Penerapan Sistem Administrasi Kependudukan Desa
Untuk Aparatur Negara Di Desa Tanjung Tirto
Kecamatan Way Bungur Kabupaten Lampung Timur",Pelaksanaan administrasi kependudukan desa telah diatur pemerintah dalam bentuk Buku Administrasi Penduduk. Kegiatan pengadian kepada masyarakat ini bertujuan untuk membantu meningkatkan pelayanan administrasi kependudukan di DesaTanjung Tirto. Salah satu upaya untuk meningkatkan pelayanan dengan menggunakan sistem administrasi kependudukan desa yang telah dikembangkandi Jurusan Ilmu Komputer. Sistem ini dapat memudahkan aparatur pemerintah desa dalam mengelola data kependudukan desa. Kegiatan pengabdian ini juga diisi dengan pelatihan penggunaan sistem oleh tim pengabdian kepada aparatur pemerintah desa yang akan menggunakan sistem ini. Dengan adanya kegiatan pengabdian kepada masyarakat ini dapat menambah pengetahuan aparatur pemerintah desa dalam pemanfaatan teknologi informasi dan komunikasi untuk pengelolaan data kependudukan,QA75,,2009-12,
FMIPA3,"Aplikasi Pendugaan Erosi Bentang Lahan Dengan Menggunakan
Metode Universal Soil Loss Equation (USLE) Berbasis Android",SURAT PENCATATAN CIPTAAN,QA75,,2020-01-14,
FMIPA3,"Aplikasi Pendugaan Erosi Di Daerah Aliran Sungai (DAS)
Menggunakan Metode Sediment Delivery Ratio (SDR) Berbasis
Android",SURAT PENCATATAN CIPTAAN,QA75,,2020-02-14,
FT5,Pemrosessan Sinyal Waktu Diskrit Menggunakan Compressive Sensing Berdasarkan Algoritma Pemulihan L1.,,QA75,ELECTRICIAN – Jurnal Rekayasa dan Teknologi Elektro,2019-10-25,
FMIPA9,OPERATOR-SM PADA RUANG BARISAN SELISIH,"OPERATOR-SM PADA RUANG BARISAN SELISIH
Muslim Ansori dan Suharsono,S
Universitas Lampung,Jurusan Matematika FMIPA
Jln Soemantri Brodjonegoro No. 1 Bandar Lampung
Email: ansomath@yahoo.com/muslim.ansori@fmipa.unila.ac.id
Abstrak
Diberikan ruang barisan selisih terbatas, selanjutnya dikonstruksikan pemetaan pada ruang
barisan selisih tersebut menggunakan operator matriks takhingga dengan norma khusus. Akan
diselidiki sifat-sifat dasar operator dan beberapa aplikasinya
Kata kunci: barisan selisih,operator, matriks takhingga
SM-OPERATOR ON DIFFERENCE SEQUENCE SPACE
Muslim Ansori dan Suharsono,S
Universitas Lampung,Jurusan Matematika FMIPA
Jln Soemantri Brodjonegoro No. 1 Bandar Lampung
Email: ansomath@yahoo.com/muslim.ansori@fmipa.unila.ac.id
Abstract
Let be given some bounded difference sequence spaces. Further, it is constructed some mapping
on the sequence spaces via infinite matrix operator with special norm. Then we investigate
principal characteristic of the operator and some examples will be given
Keywords: difference sequence,operator, infinite matrix",QA75,,2019-07-06,"difference sequence,operator, infinite matrix"
FMIPA3,An Enterprise Architecture Planning for Higher Education Using The Open Group Architecture Framework (TOGAF): Case Study University of Lampung,"University is an organization that obliged to provide higher education, research, and community service (Tri Dharma), it has autonomy to manage their institutions. In order to realize Tri Dharma, University should made a planning of information technology (IT) infrastructure to support alignment process between organization business strategy and IT strategy. University of Lampung (Unila) as a government university in Lampung Province, already had IT infrastructure and managed by special unit. IT management on Unila nowadays more complicated, disintegrated of IT management has an effect that IT infrastructure was not adaptive to response the quick change of business needs. This research aimed to design an adaptive IT infrastructure based on enterprise architecture framework The Open Group Architecture Framework (TOGAF) Architecture Development Method (ADM) on Unila. The results of this research found that there are 3 core business activities, and 6 supporting activities identified on this campus. We also proposed 12 application to developed, all applications should be modular and integrated with other.",QA75,,2017-11,
FMIPA3,Application of Word Embedding to Drug Repositioning,"As a key technology of rapid and low-cost drug development, drug repositioning is getting popular.
In this study, a text mining approach to the discovery of unknown drug-disease relation was tested. Using a word embedding algorithm, senses of over 1.7 million words were well represented in sufficiently short feature vectors. Through various analysis including clustering and classification, feasibility of our approach was tested. Finally, our trained classification model achieved 87.6% accuracy in the prediction of drug-disease relation in cancer treatment and succeeded in discovering novel drug-disease relations that were actually reported in recent studies.",QA75,Journal Biomedical Science and Engineering,,
FMIPA3,Applying Deep Learning Models to Mouse Behavior Recognition,"n many animal-related studies, a high-performance animal behavior recognition system can help researchers reduce or get rid of the limitation of human assessments and make the experiments easier to reproduce. Recently, although deep learning models are holding state-of-the-art performances in human action recognition tasks, these models are not well-studied in applying to animal behavior recognition tasks. One reason is the lack of extensive datasets which are required to train these deep models for good performances. In this research, we investigated two current state-of-the-art deep learning models in human action recognition tasks, the I3D model and the R(2 + 1)D model, in solving a mouse behavior recognition task. We compared their performances with other models from previous researches and the results showed that the deep learning models that pre-trained using human action datasets then fine-tuned using the mouse behavior dataset can outperform other models from previous researches. It also shows promises of applying these deep learning models to other animal behavior recognition tasks without any significant modification in the models’ architecture, all we need to do is collecting proper datasets for the tasks and fine-tuning the pre-trained models using the collected data.",QA75,Journal of Biomedical Science and Engineering,2019-02-28,
FMIPA3,DNA Sequence Classification by Convolutional Neural Network,"In recent years, a deep learning model called convolutional neural network with an ability of extracting features of high-level abstraction from minimum preprocessing data has been widely
used. In this research, we proposed a new approach in classifying DNA sequences using the convolutional neural network while considering these sequences as text data. We used one-hot vectors to represent sequences as input to the model; therefore, it conserves the essential position information of each nucleotide in sequences. Using 12 DNA sequence datasets, we evaluated our proposed model and achieved significant improvements in all of these datasets. This result has shown a potential of using convolutional neural network for DNA sequence to solve other sequence problems in bioinformatics.",QA75,Journal Biomedical Science and Engineering,2016,
FMIPA9,Synonym-based Text Generation in Restructuring Imbalanced Dataset for Deep Learning Models,"One of which machine learning data processing problems is imbalanced classes. Imbalanced classes could potentially cause bias towards the majority classes due to the nature of machine learning algorithms that presume that the object cardinality in classes is around similar number. Oversampling or generating new objects in minority class are common approaches for balancing the dataset. In text oversampling method, semantic meaning loses often occur when deep learning algorithms are used. We propose synonym-based text generation for restructuring the imbalanced COVID-19 online-news dataset. Three deep learning models (MLP, CNN, and LSTM) using TF/IDF and word embedding (WE) feature are tested with the original and balanced dataset. The results indicate that the balance condition of the dataset and the use of text representative features affect the performance of the deep learning model. Using balanced data and deep learning models with WE greatly affect the classification significantly higher performances as high as 4%, 5%, and 6% in accuracy, precision, recall, and f1-score, respectively.",QA75,"Proceedings of the 5th International Conference on Networking, Information Systems & Security: Envisage Intelligent Systems in 5G/6G-based Interconnected Digital Worlds NISS 2022",2023-04-03,
FMIPA3,PENGEMBANGAN APPLICATION SERVICE DATA MAHASISWA PADA WEBSITE JURUSAN ILMU KOMPUTER,,QA75,Pepadun,,
FMIPA3,PERENCANAAN ARSITEKTUR APLIKASI UNIVERSITAS LAMPUNG MENGGUNAKAN ZACHMAN FRAMEWORK,"In the present era, to support business processes in a university requires the support of ICT in improving the quality of education and services. Analysis of the existing condition of ICT implementation in Unila using Zachman framework shows that the change in the need of application becomes the most dominant thing to be immediately corrected in various fields of work in dispersed work units. Application requirements analysis is obtained by interviewing, obervating, and giving questionnaires to internal and external customers, and conducting document study of strategic plan of Unila. The result of this research is planning of Unila application architecture in accordance with organizational purpose which can give input for management to prepare integrated application in the future.",QA75,Jurnal Komputasi,2017-04,
FMIPA9,AN ANALYTICAL SOLUTION OF 1-D PSEUDO HOMOGENEOUS MODEL FOR OXIDATION REACTION USING HOMOTOPY PERTURBATION METHOD,"In this paper, we propose an analytical solution of convective-diffusion equation that derived from an oxidation reaction in a chemical reactor. Here, concentration of feed gas as dependent variable. In this study, the reaction are assumed to be a one-dimensional pseudo homogeneous model and it is evaluated at a certain reaction rate. By rescaling process, the nonlinear term of the reaction rate can be approximated by a linear term, resulting a linear convective-diffusion equation with an initial condition and a set of boundary conditions. Here, we present an analytic solution of the initial condition and the boundary conditions using the homotopy perturbation method. The results show that at the end of the reactor, the solution is in agreement with numerical solution of the initial and boundary conditions.",QA75,Journal of Research in Mathematics Trends and Technology,2019-02,
FMIPA9,Bukti Email Korespondensi Artikel IIUM Jurnal,Berikut adalah rincian email korespondensi artikel dengan judul SOLUTION OF THE REVERSE FLOW REACTOR MODEL USING HOMOTOPY ANALYSIS METHOD pada IIUM Engineering Journal,QA75,,2022-11,
FMIPA9,Bukti Email Korespondensi artikel di Jurnal Desimal,Berikut adalah bukti email korespondensi artikel dengan judul  Variational homotopy perturbation method for solving systems of homogeneous linear and nonlinear partial differential equations pada Jurnal Desimal,QA75,,2022-11,
FMIPA9,Bukti Email Korespondensi di jurnal Limits,Berikut adalah bukti email korespondensi artiekl dengan judul Simulasi Jumlah Klaim Agregasi Berdistribusi Poisson Dengan Besar Klaim Berdistribusi Gamma dan Rayleigh pada Jurnal Limits,QA75,,2022-11,
FMIPA9,Bukti email Korespondensi artikel di JETS,Berikut adalah bukti email krespondensi artikel dengan judul Design Optimization of Propellant Grain and Nozzle Contour to Improve Performance of Solid Rocket Propulsion pada JETS,QA75,,2022-11,
FMIPA9,Bukti email korespondensi artikel di IJMEMS,"Berikut adalah bukti email korespondensi artikel dengan judul  Image Cryptography Based On A Second-Order QRT Difference Equation, Serial: 2455-7749 di IJMEMS",QA75,,2022-11,
FMIPA9,Bukti email korespondensi artikel di JPJHMT,Berikut adalah bukti email korespondesi artikel dengan judul PARAMETER SENSITIVITY ANALYSIS ON MATHEMATICAL MODEL OF METHANE OXIDATION USING REVERSE FLOW REACTOR WITH PERIODICALLY PERTURBED FEED GAS pada JP Journal of heat and mass transfer,QA75,,2022-11,
FMIPA9,"SIMULASI NUMERIK DINAMIKA OKSIDASI MENGGUNAKAN
REAKTOR ALIRAN BOLAK-BALIK DENGAN GAS UMPAN FUNGSI TANGGA","Reaktor aliran bolak-balik merupakan reaktor yang arah aliran gas umpannya dibalik setelah waktu tertentu. Dinamika reaksi oksidasi dengan menggunakan reaktor aliran bolak-balik dapat dimodelkan dalam bentuk sistem persamaan difusi-konveksi yang di dalamnya mengandung suku tak linier yang terkait dengan laju reaksi serta  dilengkapi dengan syarat awal dan syarat batas tertentu. Pada artikel ini akan dikaji dinamika peubah tak bebas temperatur dan konsentrasi pada proses oksidasi  dengan konsentrasi gas umpan berupa fungsi tangga melalui pendekatan numerik. Profil konsentrasi gas umpan di sepanjang reaktor akan disimulasikan untuk beberapa perioda berbeda dan  dibandingkan dengan kasus gas umpan konstan.

Kata Kunci: reaksi oksidasi, persamaan difusi-konveksi, fungsi periodik",QA75,,2017-11-24,
FMIPA9,"SOLUSI ANALITIK MODEL HOMOGEN SEMU 1-D UNTUK REAKSI OKSIDASI
MENGGUNAKAN HOMOTOPY PERTURBATION METHOD","Dalam artikel ini, kami mengkaji sebuah solusi dari persamaan konveksi-difusi yang diturunkan dari reaksi oksidasi di dalam sebuah reaktor kimia. Di sini komponen konversi dari gas umpan sebagai peubah tak bebasnya. Di dalam kajian ini, proses reaksi diasumsikan berupa model homogen semu satu-dimensi dan berada pada nilai laju reaksi tertentu. Dengan proses penskalaan ulang, bentuk nonlinear  dari laju reaksi dapat dihampiri dengan bentuk linier  sehingga menghasilkan sebuah  persamaan  konveksi-difusi linier  yang dilengkapi dengan syarat awal dan sekumpulan syarat batas.  Pada artikel ini dikaji  solusi analitik dari masalah syarat  awal dan syarat batas ini menggunakan metode perturbasi homotopi.",QA75,,2018-05,
FMIPA9,"Similarity Check Result Artikel ""Kinetic Properties of Nickel Leaching by ANOVA Method"" PROGRESS IN PHYSICS OF METALS, Volume 23, Issue 3 (2022)",Hasil Uji Similarity menggunakan Turnitin untuk artikel ini adalah 13%.,QA75,,2022-10,
FMIPA9,"Similarity check result artikel ""SOLUTION OF THE REVERSE FLOW REACTOR MODEL USING HOMOTOPY ANALYSIS METHOD"" IIUM Journal, Vol 22 No 1",Hasil similarity check menggunakan turnitin sebesar 18%,QA75,,2022-10,
FMIPA9,Simulasi Numerik Model Matematika Dinamika Reaksi Oksidasi dengan Konsentrasi Gas Umpan Periodik,Dinamika reaksi oksidasi metana digambarkan dalam bentuk sistem persamaan difusi-konveksi yang di dalamnya mengandung suku tak linier yang terkait dengan laju reaksi dan dilengkapi dengan syarat awal dan syarat batas tertentu. Pada artikel ini akan dikaji dinamika peubah tak bebas temperatur dan konsentrasi pada proses oksidasi gas metana dengan konsentrasi gas umpan berupa fungsi periodik melalui pendekatan numerik. Profil konsentrasi gas umpan di sepanjang reactor akan disimulasikan untuk beberapa perioda berbeda dan  dibandingkan dengan kasus gas umpan konstan. Hasil simulasi menunjukkan adanya pengaruh faktor besarnya laju alir gas umpan terhadap profil periodisitas gas metana di sepanjang reaktor,QA75,Prosiding Seminar Nasional Sains Matematika Informatika dan Aplikasinya IV,2016-10,
