division,title,abstract,subjects,publication,date,keywords
FMIPA3,SISTEM INFORMASI PEMBERKASAN PERKULIAHAN BERBASIS WEB MENGGUNAKAN FRAMEWORK LARAVEL,"Every institute, office or college must have filing activities in its business process. One of the lecture filing activities at the college is the preparation of lecture devices. The lecture device is very important and becomes a reference in every learning of a course. Nowadays, the preparation of lecture devices is still done manually and lecture filing activities will be a problem if there is no system that handles these activities, one of which is data search and storage space. The lecture filing information system has been developed to assist in the preparation and search for lecture devices. This information system was developed with Waterfall methods and Laravel framework. The conclusion of this research is the lecture filing information system is successfully built and can be used to help the preparation and search activities of lecture devices.",QA75,Jurnal Komputasi,2019-04,
FMIPA9,"PARAMETER  SENSITIVITY  ANALYSIS  ON  MATHEMATICAL  MODEL OF METHANE  OXIDATION  USING  REVERSE  FLOW  REACTOR  WITH PERIODICALLY  PERTURBED  FEED GASANuryaman*, L Zakaria  and S Suharsono","Abstract. In this paper, we investigate the effect of operation parameters to dynamic of dependent variables for catalytic oxidation reaction using reverse flow reactor (RFR). Here, we consider a 1-D pseudo-homogeneous model for RFR with cooling through the wall and periodically perturbed feed gas. By using finite difference method to the model, we construct numerical schemes.The simulations are conducted for various value of period of gas feeding, switching time, cooling capacity and superficial velocity.","QA, QA75",,2019-09-23,
FMIPA3,Cross Entropy Based Sparse Logistic Regression to Identify Phenotype-Related Mutations in Methicillin-Resistant Staphylococcus aureus,"Emergence of drug resistant bacteria is one of the serious problems in today’s public health.
However, the relationship between genomic mutation of bacteria and the phenotypic difference of them is still unclear. In this paper, based on the mutation information in whole genome sequences of 96 MRSA strains, two kinds of phenotypes (pathogenicity and drug resistance) were learnt and predicted by machine learning algorithms. As a result of effective feature selection by cross entropy based sparse logistic regression, these phenotypes
could be predicted in sufficiently high accuracy (100% and 97.87%, respectively) with less than 10 features. It means that we could develop a novel rapid test method in the future for checking MRSA phenotypes.",QA75,Journal of Biomedical Science and Engineering,2020,
FMIPA10,Parameter estimation for high dimensional classification model on colon cancer microarray dataset,"In classification problems, logistic regression is among powerful techniques for discrimination. It provides directive probabilities of sample classification and interpretable coefficients. When it comes to model high dimensional dataset, however, logistic regression with its Newton-Raphson method of parameter estimation is no longer applicable, especially on low sample size and extremely high dimension. By applying cross-entropy algorithm on regularized logistic regression, it was able to well performing parameter estimation and highly
accurate classification result.",QA75,,2021,
FMIPA9,"Similarity check result Artikel ""Design Optimization of Propellant Grain and Nozzle Contour to Improve Performance of Solid Rocket Propulsion"" Journal of Engineering and Technological Sciences, Vol 54, No 5",Hasil Uji Similarity menggunakan Turnitin untuk jurnal ini adalah 4%.,QA75,,2022-10,
FMIPA9,"Desain dan Analisis Geometri Propellant Grain Configuration
pada Roket Padat","Pada artikel ini dikaji mengenai model matematika propellant grain configuration untuk mendapatkan luasan pembakaran yang sesuai pada roket sonda. Roket sonda adalah roket percobaan yang dibuat oleh Pustekroket LAPAN untuk menunjang penelitian di bidang antariksa dengan jarak ketinggian sebagai sasaran penilaian. Luasan pembakaran untuk grain propellant model hollow grain, wagon wheel grain, dan star grain dikaji secara analitik melalui pemodelan matematika menggunakan konsep geometri agar didapatkan formula yang sesuai untuk tiap model grain propellant. Hasil yang diperoleh selanjutnya dibandingkan dengan menggunakan perhitungan manual menggunakan bantuan software SolidWork. Yang dimaksud manual adalah menambahkan fillet pada grain kemudian dihitung satu per satu panjang dari tiap fillet tersebut sehingga ini membutuhkan waktu yang lama. Hasil menunjukkan bahwa luasan pembakaran ketiga model grain tersebut tidak menunjukkan perbedaan yang signifikan pada kedua metode yang artinya formula yang didapatkan dari perhitungan analitik sudah valid.",QA75,Jurnal Siger Matematika,2020-09,
FMIPA9,Design Optimization of Propellant Grain and Nozzle Contour to Improve Performance of Solid Rocket Propulsion,"A rocket is a spacecraft, guided missile, or flying vehicle that boosted by a chemical reaction resulting from the combustion of propellant in the rocket motor. One of the essential parameters in the development of rocket motors is design optimization to improve the propulsion performance of the rocket. Increasing the propulsion performance of the rocket will increase the flight performance of the rocket, in terms of its maximum range or the altitude of the rocket trajectory. This study examined the determination of the design parameter values of a rocket motor by looking at it as an optimization problem with constraints. The problem studied was limited to the case of the second-stage rocket motor. A genetic algorithm was used to solve the resulting optimization problem of propellant grain configuration cases and a characteristic method for designing the bell nozzle. The results obtained indicated an increase in total impulse by 10% compared to the results before optimization.",QA75,Journal of Engineering and Technological Sciences,2022-09-15,
FMIPA3,Aplikasi Hybrid Genetic Algorithm Dengan Fuzzy Logic Controller: Pada Traveling Salesman Problem (Studi Kasus: Rute Truk Sampah Di Kota Bandar Lampung),"Adalah hal yang lazim, ketika kita ingin mengunjungi beberapa kota, kita berupaya mencari rute yang harus dilalui dengan total jarak tempuh terpendek. Persoalan ini dikenal dengan Traveling Salesman Problem (TSP). Untuk persoalan yang relatif kecil, TSP sepertinya mudah diselesaikan. Namun demikian untuk persoalan dengan jumlah kota yang besar, TSP sangat sulit untuk diselesaikan. Sepengetahuan kami, hingga kini belum ada peneliti yang dapat melaporkan metode yang menjamin menghasilkan nilai optimal untuk sembarang masalah dalam waktu secara polynomial. TSP dikenal sebagai salah satu persoalan NP-complete. Pada penelitian ini h-GA akan juga dikombinasikan dengan Fuzzy Logic Controller untuk melakukan auto-tuning parameter. Selanjutnya akan dilakukan penerapan metode ini pada aplikasi dunia nyata yaitu penentuan rute pengangkut sampah yang ada di kota Bandar Lampung.",QA75,,2008-11-18,
FMIPA3,Genetic Algorithm Dan Optimasi,"Research on optimization problems have taken great interest of researchers because of its great impact on engineering and economics. For real world applications, the optimization problems are usually associated with various constraints. Thus it becomes difficult to solve it exactly. Genetic Algorithm (GA) is known as one of powerful heuristic methods for solving various optimization problems. In this several years, we have applied GA on many variants of optimization problems such as Transportation Problem (TP), Traveling Salesman Problem (TSP), Vehicle Routing Problems (VRP), Production Distribution and Inventory Problem (PDI), Supply Chain Management (SCM), Scheduling and so on. We have shown that GA, in general, would give good solution for those problems. Keywords: Genetic Algorithm, Network and Engineering design, Heuristic, Optimization","Q1, QA, QA75",,2010-08-07,"Genetic Algorithm, Network and Engineering design, Heuristic, Optimization"
FMIPA3,Pemeriksaan Jurnal Komputasi 2020,,"Q1, QA75",,,
FMIPA3,Pemeriksaan Plagiasi Jurnal Sains MIPA,,"Q1, QA75",,,
FMIPA3,Pemeriksaan Plagiasi Prosiding SN Matematika 2010,,QA75,,,
FMIPA3,Pengecekan Plagiarisme JIBIS,,"Q1, QA75",,,
FMIPA3,Pengecekan Plagiarisme KLIK 2020,,QA75,,,
FMIPA3,Pengecekan Plagiasi Jurnal Tekno Kompak 2020,,QA75,,,
FMIPA3,PERFORMANCE EVALUATION OF VARIOUS GENETIC ALGORITHM APPROACHES FOR KNAPSACK PROBLEM,"Knapsack Problem (KP) is known as one of optimization problems that has taken great interest of researchers. It
has been applied for many practical applications. Since it belongs to the class of NP-hard problems, most of researchers reported heuristic methods to solve it. Those include Branch and Bound, Greedy Algorithm, Genetic Algorithm and Dynamic Programming.  

In this paper, we focus on the performance evaluation of various Genetic Algorithm (GA) approaches to solve
Knapsack Problem. We developed four different GA approaches with different strategies. The first, random penalty GA
(rpGA) uses random strategy to generate chromosome and penalty strategy to handle infeasible chromosome. The second, directed penalty GA (dpGA) uses directed strategy to generate chromosome and penalty to handle infeasible chromosome. The third, random repairing GA (rrGA) uses random strategy to generate chromosome and repairing strategy to handle
infeasible chromosome. The fourth, directed repairing GA (drGA) uses directed strategy to generate chromosome and
repairing strategy to handle infeasible chromosome. 

In order to investigate the performance of those Algorithms, we have done several numerical experiments by using different size Benchmark test problems given in literature. The effectiveness and the efficiency of the methods are also evaluated by varying GA parameters. Based on our experiments, it is shown that drGA was the best performance to give optimal solution within reasonable computational time. 
 
Keywords:
knapsack problem, combinatorial optimization, evaluation strategy, genetic algorithm.",QA75,ARPN Journal of Engineering and Applied Sciences,2016-04-10,
FMIPA9,KESTABILAN MODEL PREDATOR PREY DENGAN WAKTU TUNDAAN,"Melalui model matematika dapat diketahui pola pertumbuhan populasi dari predator dan prey secara kompleks. Perilaku sistem dapat diasumsikan dengan mengubah nilai parameter sehingga mampu mengestimasi jumlah populasi pada waktu tertentu. Model matematika dengan waktu tunda (τ), menentukan titik kesetimbangan dari sistem persamaan serta menganalisis kestabilan titik kesetimbangan sistem persamaan.",QA75,KESTABILAN MODEL PREDATOR PREY DENGAN WAKTU TUNDAAN,,
FMIPA9,PELATIHAN PEMBUATAN DATABASE ADMINISTRASI PEKON SEKECAMATAN WAY KRUI KABUPATEN PESISIR BARAT,"Selama ini proses pengadministrasian masih berjalan secara manual (melalui alat tulis). Kondisi tersebut,  mengakibatkan pencarian arsip sulit dan tak jarang memakan waktu yang lama bahkan bisa berjam-jam. Dengan jumlah penduduk yang relatif banyak, pemerintah Pekon dituntut untuk melaksanakan tugas kearsipan dengan cepat dan rapi, pekerjaan itu dapat dibantu dengan teknologi saat ini (laptop) melalui software Microsoft office excel. Undang-Undang Nomor 32 Tahun 2004 tentang Pemerintahan Daerah, telah membawa perubahan yang mendasar dalam sistem dan struktur Pemerintahan Daerah serta membawa dampak yang sangat luas bagi penyelenggaraan pemerintahan, perencanaan pembangunan, pengelolaan keuangan dan sistem penganggaran dalam menunjang penyelenggaraan pemerintahan di Daerah, khususnya pada tingkat Pemerintahan Pekon. Untuk meningkatkan manajemen Pemerintahan Pekon perlu dilakukan penataan administrasi agar lebih effektif dan effisien, penataan administrasi merupakan pencatatan data dan informasi dalam mendukung penyelenggaraan Pemerintahan Pekon, maka perlu dilakukan langkah penyempurnaan terhadap  pelaksanaan  administrasi.  Metode  yang  digunakan  adalah  metode  ceramah,  praktek langsung dengan file yang sudah diprogram tinggal diisi, tanya jawab, diskusi dan latihan untuk mengisi form yang sudah diprogram tinggal pengisian. Sehingga setelah adanya kegiatan pelatihan ini diharapkan operator/sekertaris Pekon dapat melakukan penataan administrasi lebih baik lagi.",QA75,PELATIHAN PEMBUATAN DATABASE ADMINISTRASI PEKON SEKECAMATAN WAY KRUI KABUPATEN PESISIR BARAT,,
,Pengembangan Modul Edukasi Kesehatan Reproduksi Remaja Berbasis Aplikasi Android di Indonesia,"Indonesia hingga saat ini masih menghadapi problem kesehatan reproduksi remaja krusial berupa tingkat pengetahuan yang rendah dan praktik kesehatan reproduksi beresiko. Kedua problem ini saling terkait dan berdampak luas. Berbagai upaya telah dilakukan untuk meningkatkan pengetahuan, sikap, dan perilaku positif kesehatan reproduksi remaja. Meskipun
demikian, masih terdapat banyak problem dan kendala, diantaranya adalah bahwa intervensiintervensi kesehatan reproduksi yang ada masih bersifat sporadis dan terbatas serta belum tersedianya kurikulum kesehatan reproduksi di sekolah. Tujuan umum penelitian ini adalah untuk meningkatkan aksesibilitas dan afordabilitas remaja terhadap pendidikan Kesehatan reproduksi. Sedangkan tujuan khusus penelitian ini adalah: 1) mengidentifikasi berbagai
karakteristik dinamika kelompok sebaya (peer group), keterpaparan media (media exposure), dan kebiasaan penggunaan gadget (gadget habitus) di kalangan remaja, 2) mengidentifikasi faktor-faktor yang menghambat aksesibilitas informasi dan layanan kesehatan reproduksi remaja, 3) mengetahui faktor-faktor yang mempengaruhi tingkat pengetahuan, sikap dan perilaku kesehatan reproduksi remaja, 4) mengetahui efektifitas, efisiensi, dan feasibilitas modul edukasi kesehatan reproduksi remaja berbasis aplikasi android sebagai modul yang diimplementasikan secara
nasional.","HM, QA75",,,
FMIPA9,Pemanfaatan Open Course Ware dalam Penggunaan Uji Profisiensi Sertifikasi Bidang Informatika,"Artikel ini merupakan lanjutan dari publikasi tahun ke-1, hal yang telah dihasilkan dalam tahun pertama adalah telah membuat suatu platform dalam hal Perancangan Open Course Ware (OCW) dalam Penerapan Content Management Application (CMA) berbasis Private Cloud Computing untuk Membantu Persiapan Uji Sertifikasi pada Lembaga Sertifikasi Profesi bagi Mahasiswa Program Studi Informatika Se-Indonesia. Pada Penelitian lanjutan ini berfokus pada penambahan dan pengembangan konten materi uji sertifikasi pada asosiasi dan penerapan hasil platform kepada seluruh mahasiswa program studi Informatika di Indonesia berdasarkan skema kompetensi yang ada.
Sesuai dengan peraturan Kemenristek nomor 44 tahun 2015 tentang Standar Nasional Pendidikan Tinggi, bahwa proses belajar mengajar mengacu kepada bentuk Student Learning Centered (SCL), dimana siswa harus aktif dalam proses belajar mengajar. Mahasiswa dinyatakan lulus berhak memperoleh ijazah,sertifikat profesi, dan sertifikat kompetensi. Sertifikat kompetensi diterbitkan oleh perguruan tinggi bekerjasama dengan organisasi profesi, lembaga pelatihan, lembaga sertifikasi profesi yang terakreditasi. 
Dari berbagai permasalahan terhadap Kelemahan-kelemahan yang ada, harus ada upaya untuk menyelesaikannya, munculnya konsep Open Course Ware (OCW) sebagai platform baru dibidang teknologi pendidikan memiliki beberapa karakteristik umum yang membedakan dengan manajemen sistem pembelajaran lainnya, diantaranya adalah (1) Offered Free, (2) No Register, (3) Openly Lisenced, (4) Accessible to anyone, (5) Extraordinary, penelitian ini diharapkan dapat membantu memberikan sumbangan sebagai solusi dalam meningkatkan kompetensi tenaga kerja indonesia, melalui Perancangan Open Course Ware (OCW) dalam penerapan content management application (CMA) untuk membantu persiapan uji kompetensi bagi mahasiswa yang berasal dari prodi informatika di Indonesia, metode perancangan system yang digunakan adalah metode prototype Hasil yang didapat berupa penerapan sebuah sistem yang terintegrasi dalam sebuah sisterm OCW yang menerapkan dan mengembangkan konten yang ada.","QA, QA75",Indonesian Journal on Networking  and Security,2018-10,
FMIPA9,"OCW IN IMPLEMENTATION OF CMA WITH PRIVATE CLOUD
COMPUTING-BASED TO HELP INFORMATICS STUDENTS TO OBTAIN
PROFESSIONAL CERTIFICATION IN INDONESIA","This paper focuses on the use of technology in
education field. It is one of the alternative strategy to
increase students’ ability in certified informatics field in
Indonesia. This paper explains how to create the
infrastructure of e-learning (virtual classroom) by using
Open Course Ware (OCW) with Cloud Computing-based to
help informatics students to take the certification test.
Furthermore, according to the regulation of National",QA75,"Proceeding International Conference on Computing, Engineering, and Design (ICCED 2017)",2017-11,
,Butterfly identification using gray level co-occurrence matrix (glcm) extraction feature and k-nearest neighbor (knn) classification,,QA75,Register: Jurnal Ilmiah Teknologi Sistem Informasi,,
FMIPA9,OPERATOR LINEAR PADA RUANG BARISAN TERBATAS L2,"ABSTRACT
It is defined a linear operator in matrix transformation from L2 sequence space into L2 by using basis of the sequence. The collection of all the linear operators forms a Banach Space.",QA75,"Prosiding Semirata 2017 Bidang MIPA BKS PTN Wilayah Barat Jambi, Ratu Convention Center 12 - 14 Mei 2017",2017-10-02,
FMIPA9,"OPERATOR-SM PADA RUANG BARISAN SELISIH
Muslim Ansori dan Suharsono,S","OPERATOR-SM PADA RUANG BARISAN SELISIH
Muslim Ansori dan Suharsono,S
Universitas Lampung,Jurusan Matematika FMIPA
Jln Soemantri Brodjonegoro No. 1 Bandar Lampung
Email: ansomath@yahoo.com/muslim.ansori@fmipa.unila.ac.id
Abstrak
Diberikan ruang barisan selisih terbatas, selanjutnya dikonstruksikan pemetaan pada ruang
barisan selisih tersebut menggunakan operator matriks takhingga dengan norma khusus. Akan
diselidiki sifat-sifat dasar operator dan beberapa aplikasinya
Kata kunci: barisan selisih,operator, matriks takhingga
SM-OPERATOR ON DIFFERENCE SEQUENCE SPACE
Muslim Ansori dan Suharsono,S
Universitas Lampung,Jurusan Matematika FMIPA
Jln Soemantri Brodjonegoro No. 1 Bandar Lampung
Email: ansomath@yahoo.com/muslim.ansori@fmipa.unila.ac.id
Abstract
Let be given some bounded difference sequence spaces. Further, it is constructed some mapping
on the sequence spaces via infinite matrix operator with special norm. Then we investigate
principal characteristic of the operator and some examples will be given
Keywords: difference sequence,operator, infinite matrix",QA75,,2019-07-06,"difference sequence,operator, infinite matrix"
FMIPA3,Hasil peer review Jurnal Ilmiah Nasional (Sinta 4) dengan judul “Web Service Sistem Informasi Terpadu (SIMIPA) Menggunakan REST API”,,"QA75, QA76",,,
FMIPA3,Hasil peer review Jurnal Ilmiah Nasional dengan judul “Cawa Lampung: Kamus Bahasa Indonesia-Lampung Dialek A Berbasis Android”,,"QA75, QA76",,,
FMIPA3,"Hasil peer review Jurnal Ilmiah Nasional dengan judul “Klasifikasi Abstrak Jurnal Komputasi Menggunakan Metode Text Mining dan Algoritma Support Vector Machine,”",,QA75,,,
FMIPA3,"Hasil peer review Prosiding Internasional (Scopus) dengan judul ""Abstract Classification Using Support Vector Machine Algorithm (Case Study: Abstract in a Computer Science Journal)""",,QA75,,,
FMIPA3,Hasil peer review Prosiding Internasional (Scopus) dengan judul “A prototype of IoT-based smart system to support motorcyclists safety”,,QA75,,,
FMIPA3,Hasil peer review Prosiding Internasional (Scopus) dengan judul “Perceptions of Online Taxi Utilization In Bandar Lampung Using UTAUT Model (Unified Theory Of Acceptance And Use Of Technology)”,,QA75,,,
FMIPA3,Hasil peer review Prosiding Internasional (Scopus) dengan judul “eDonation Android Application for Used Goods Donation using Location-based Service”,,"QA75, QA76",,,
FMIPA3,Hasil peer review Prosiding Nasional dengan judul “Pemanfaatan Aplikasi Quiver-3D Coloring Berbasis Augmented Reality dalam Pengembangan Kognitif Anak Usia Dini”,,QA75,,,
FMIPA3,Similarity check result of paper: A prototype of IoT-based smart system to support motorcyclists safety,,QA75,,,
FMIPA3,Similarity check result of paper: Abstract Classification Using Support Vector Machine Algorithm (Case Study: Abstract in a Computer Science Journal),,"QA75, QA76",,,
FMIPA3,Similarity check result of paper: Perceptions of Online Taxi Utilization In Bandar Lampung Using UTAUT Model (Unified Theory Of Acceptance And Use Of Technology),,QA75,,,
FMIPA3,Similarity check result of paper: eDonation Android Application for Used Goods Donation using Location-based Service,,"QA75, QA76",,,
FMIPA3,WEB SERVICE SISTEM INFORMASI TERPADU (SIMIPA) MENGGUNAKAN REST API,"SIMIPA web service is a service that is used to provide services in the form of information to the Android mobile apps, is the Student module, the Lecturer module, and the Parent module. The service provided uses the REST API as a bridge between the server and the client. The goal is that the REST API can be accessed on the Android mobile apps. The development of web services in this study uses the Scrum development method which has 26 product backlogs with 9 iterations of sprints. Each sprint has several stages, namely sprint planning, daily sprint, sprint review, and sprint retrospective. Web services developed using the PHP programming language and MySQL database. The result of this research is the SIMIPA REST API which can be accessed on the Android front-end. Android accesses the REST API via the GET and POST request methods using a URL that generates a JSON response. Based on several tests, the SIMIPA REST API URL is said to have been successfully developed and can be accessed on Android mobile apps according to the expected response. Data security using the REST API is focused on the POST method using JSON Web Token (JWT).",QA75,JURNAL KOMPUTASI,2021,
FMIPA3,An Expert System To Diagnose Chicken Diseases With Certainty Factor Based On Android,"There search was conducted to create an expert system that is able to diagnose chicken diseases based on the experts / specialists knowledge. This study uses a calculation method called Certainty Factor (CF) to calculate the level of expertise. The expert system created on Android mobile device platform.The research data consist of symptoms data, chicken diseases data, and data rules. Chicken disease data is limited to diseases caused by bacteria (bacterial), totaling 19 types of diseases with 78 kinds  of  symptoms and  184  types  of  rules.Inference method  that  used  is  forward  chaining  by searching for rules based on user answers in the form of check mark (√). Users answers are processed according to the rules and calculated using certainty factor method. The test results showed that : (1) Functional testing using Black Box Equivalence Partitioning (EP) get results as expected as the test scenarios in each test class.(2) Diagnosis testing by comparing the results of manual calculations and systems calculations showed 99 percent was appropriate and well-run.(3) Questionnaire testing with 31 respondents were divided into three groups of respondents indicated; first respondents group consisting of specialists of chicken diseases gets 63.33 percent of an average value (categorized good), the second respondents group consisting of breeder and students of majoring in animal. husbandry gets 77.71 percent of an average value (categorized good), and the third respondents group consisting of students of majoring computer science gets 82 percent of an average value (categorized very good).",QA75,,2016-10-20,
FMIPA3,"AN EXPERT SYSTEM TO DIAGNOSE CHICKEN DISEASES WITH
CERTAINTY FACTOR BASED ON ANDROID","Theresearch was conducted to create an expert system that is able to diagnosechicken diseases based
on the experts / specialists knowledge. This study uses a calculation method called Certainty Factor
(CF) to calculate the level of expertise. The expert system created on Android mobile device 
platform.The research data consist of symptoms data, chicken diseases data, and data rules. Chicken
disease data is limited to diseases caused by bacteria (bacterial), totaling 19 types of diseases with 78
kinds  of  symptoms and  184  types  of  rules.Inference method  that  used  is  forward  chaining  by
searching for rules based on user answers in the form of check mark (√).Users answers are processed
according to the rules and calculated using certainty factor method. The test results showed that : (1)
Functional testing using Black Box Equivalence Partitioning (EP) get results as expected as the test 
scenarios in each test class.(2) Diagnosis testing by comparing the results of manual calculations and
systems calculations showed 99 percent was appropriate and well-run.(3) Questionnaire testing with
31 respondents were divided into three groups of respondents indicated; first respondents group consisting of specialists of chicken diseases gets 63.33 percent of an average value (categorized good),the second respondents group consisting of breeder and students of majoring in animal husbandrygets77.71 percent of an average value (categorized good), and the third respondents group consisting of students of majoring computer science gets82 percent of an average value (categorized very good). 
Keywords: Android, Certainty Factor, CF method, Chicken Disease, Expert System.",QA75,,2016-10-20,"Android, Certainty Factor, CF method, Chicken Disease, Expert System."
