division,title,abstract,subjects,publication,date,keywords
FEB5,Sosialisasi Dan Edukasi Redenominasi Uang Rupiah Di Kampung Sendangretno Kecamatan Sendangagung  Kabupaten Lampung Tengah,"RUU tentang Perubahan Harga Rupiah (Redenominasi Rupiah) telah diusulkan oleh pemerintah kepada DPR sebagai prioritas Prolegnas 2013. Redenominasi diartikan menyederhanakan denominasi (pecahan) mata uang suatu negara menjadi pecahan lebih kecil dengan cara menghilangkan nol tanpa mengurangi nilai mata uang tersebut, misal Rp1.000 menjadi Rp1. Kegiatan sosialisasi dan edukasi kepada masyarakat dilakukan secara intensif, bertahap, dan terencana oleh bank sentral dan pemerintah untuk memberikan informasi yang cukup kepada publik terkait dengan redenominasi. Dengan dilaksanakannya sosialisasi dan edukasi redenominasi uang rupiah di Kampung Sendangretno ini, diharapkan nantinya para peserta pada khususnya dan masyarakat Kampung Sendangretno pada umumnya mengetahui dan mempersiapkan diri jika redenominasi diterapkan di Indonesia.",HT,,2018-11-15,
,Implementasi aplikasi sapa desa untuk meningkatkan kemandirian dan daya saing melalui digitalisasi sistem administrasi pemerintahan kampung,"Teknologi memainkan peran penting dalam berbagai sektor kehidupan, termasuk dalam hal administrasi pemerintahan di tingkat kampung/kelurahan sebagai upaya untuk mewujudkan good governance. Dengan demikian, upaya ini akan memberikan pelayanan publik yang berkualitas bagi warga masyarakat. Kegiatan pengabdian kepada masyarakat bertujuan implementasi teknologi berupa aplikasi SAPA DESA untuk meningkatkan kemandirian dan daya saing melalui digitalisasi sistem administrasi pemerintahan kampung ini akan dilaksanakan di Kampung Rukti Endah yang terletak di Kecamatan Seputih Raman, Kabupaten Lampung Tengah. Kampung ini memiliki lebih dari 1000 kepala keluarga (KK) dan mayoritas berprofesi sebagai petani dan peternak. Hasil Pengabdian kepada masyarakat didapatkan: 1) Apartur desa melakukan digitalisasi pelayanan publik pemerintahan kampung, khususnya terkait surat menyurat menggunakan aplikasi SAPA DESA; (2) melatih dan membantu sumber daya manusia di kampung tersebut agar literasi digital mereka meningkat. Dengan demikian, mereka akan sangat mudah mendukung program pemerintah di era desa digital dan mandiri (smart village) ini. Kegiatan ini diharapkan dapat memberi manfaat kepada mitra yang meliputi: (1) warga masyarakat akan mendapatkan kemudahan pelayanan publik melalui aplikasi SAPA DESA; (2) literasi digital aparatur kampung akan meningkat. Secara umum, setelah kegiatan pengabdian kepada masyarakat ini selesai, maka desa akan mampu meningkatkan kualitas layanan dimana tidak lagi membingungkan dan menyita waktu sehingga aparatur kampung tidak akan sibuk dengan masalah administrasi.",HT,Jurnal Sumbangsih,2022-09-16,
FKIP12,"Peran Tokoh Masyarakat dalam Penanaman Karakter Religius pada Remaja di Lingkungan Masyarakat Kelurahan Rajabasa, Kecamatan Rajabasa Kota Bandarlampung","Teenagers as the next generation of a nation are believed to be able to embody the idea of homeland by mastering the power religious spiritual, self control, smartness, noble attitude, along with skill which are necessary for themselves, community and nation. Multidimensional in term of moral decadency is now found among teenagers, the succesors of nation’s hope. Moral decadency of teenagers is marked by some indicators related to some phenomena such as, smoking, alcohol addicted and sex pre marriage which are now escalating and easily found in community environment. Religion is a solid shield to prevent moral decadency. Religion norm is imparative to guide and to lead teenagers behavior in accordance with moral standard applied in community is supposed to be done by those who own important influence such as local community public figures.The research was aimed to describe and analyze the role of local public figures in cultivating religious character to local teenagers. Research method applied was quantitative descriptive. Research subject were teenegers in community environment in Rajabasa Urban Village.. Sample of the research were 45 respondens. Data was analyzed by using product moment formula to calculate the correlation between the two variables, then followed by a regression analysis in order to determine its significance. The value  rxy= 0,78, which meant sufficient category. The result of regression analysis between variable X and variable Y obtained Fcount> Ftable or 67,8> 4,20. Ho was rejected and Ha was accepted. This justifies meaning that the increasing role of community leaders will increase the inculcation of religious character in teenegers, so that this becomes an impetus for local community public figures to increase their exemplary attitude, habituation, advice / attention and sanctions by providing good role models.","H1, HT, L1",Journal of Social Science Education,2020,
FEB6,"CEK PLAGIARISME: Development of Tanggamus Robusta Coffee
(Socio-ecological Approach)",,"H1, HT",,2023-05-02,
FEB6,Development of Tanggamus Robusta Coffee (Socio-ecological Approach),"Coffee is very popular with Indonesian people. Indonesia itself is the
fourth largest coffee18 producing country in the world. Lampung is also the largest
coffee producer in Indonesia with robusta coffee. Coffee also has a relatively high
economic value, so it plays an essential role in the Indonesian economy as a source
of foreign exchange and income for coffee farmers in Indonesia. Tanggamus con-
tributes 40% of the total coffee production in Lampung. Robusta coffee is the main
coffee grown on the mountain. Tanggamus Robusta has characteristics compared
to coffee in other regions. The reason is this is very dependent on the fertility of the
soil in Tanggamus and its management using natural fertilizers. 9 Social ecology
models emphasize different levels of influence (such as intrapersonal, interper-
sonal, organizational, community, and public policy) and the idea that behaviour
shapes and are both shaped by the social environment. The application of the
social ecology model to coffee focuses on several goals: to explain the interaction
of individuals with the environment, to maintain human growth and development
in a given environment, and to enhance the background so that they can support
the individual. There are five levels in the social ecology model. They start from
the individual or interpersonal group, The interpersonal. The organizational level.
The level of society or community is the culture. And the level of public policy.","H1, HT",,2023-05-02,
FT9,PANTI REHABILITASI GELANDANGAN DAN PENGEMIS DENGAN PENDEKATAN POLA SELF SUFFICIENCY SEBAGAI BENTUK ADAPTASI TERHADAP PANDEMI COVID-19,"Pandemi virus korona (covid-19) berdampak pada semakin banyak warga yang tidak berpenghasilan tetap kemudian turun ke jalan menjadi Penyandang Masalah Kesejahteraan Sosial (PMKS). Ketersediaan panti sosial sebagai upaya mewadahi para PMKS, kurang memadai dan belum siap beradaptasi atau menyesuaikan konsep ruang yang dapat meminimalisir penularan covid-19 serta menunjang potensi mereka melalui pembinaan kemandirian, yang dalam hal ini diutamakan untuk gelandangan, pengemis, dan manusia gerobak. Penelitian ini bertujuan untuk: 1) menemukenali apa saja kriteria desain bangunan panti rehabilitasi berdasarkan self sufficiency dan 2) bagaimana implikasinya terhadap desain bangunan panti rehabilitasi PMKS yang produktif & dapat meminimalisir penularan covid-19. Metode penelitian yang digunakan adalah metode deskriptif kualitatif. Penelitian dititikberatkan pada pengamatan perilaku PMKS, self sufficiency, dan tinjauan dari unsur-unsur protokol kesehatan selama pandemi Covid-19. Dalam penggunaannya, bangunan panti rehabilitasi PMKS harus bisa menuntut penggunanya agar menjadi lebih produktif. Untuk itu dibutuhkan fasilitas yang mengedepankan sistem “do it yourself” yang tentunya tidak mengurangi nilai fungsi pakai dari sebuah fasilitas. Sistem ini akan memicu penggunanya agar lebih aktif dan nantinya menjadi bekal untuk kehidupannya setelah keluar dari masa rehabilitasi.","H1, HT, NA",,2020-12,
FT7,Assistance for waste management of the Jasmine Jaya Cooperative in supporting sustainable city,"Purpose: This study aimed to increase the knowledge and ability of Koperasi  MelatiJaya's waste management.  Waste management capabilities can reduce the volume of waste to the landfill. 
Method: The program began the dissemination of commitment to waste management to contribute to SDGs achievement, assistance in manufacturing verticulture,   hydroponics,   eco-bricks,   garden architects,  and utilizing waste.  The evaluation was carried out to improve the waste management program.
Results: Through this program, more than 70% of the cooperative's members manage waste using the   7R   principle.   Knowledge, attitudes,   and abilities in recycling waste into hydroponics, verticulture, and eco-bricks have increased. The conversion of waste into valuable products indirectly contributes to reducing the volume of waste from TPA Bakung.The income of cooperative members and the fact that fresh vegetables in the city of  Bandar  Lampung have increased. 
Conclusions: The consistency program can bring  Sukamenanti Baru close to zero waste so that it becomes a  livable village. Indirectly, it supports the achievement of SDGs in Bandar Lampung City.","HT, T1",Yumary : Jurnal Pengebdian Kepada Masyarakat,2021-03-31,
FISIP4,Pemikiran Kelompok Dalam Komunitas Untuk Pengembangan Skill Anggota,"This article describe the role of groupthink in Komunitas Instameet Lampung in aim improving the skill of it members. The research worked in qualitative inquiry and use Groupthink Theory. The result shows that the community uses small group communication to built groupthink which creates cohesivity and strong solidarity between members. This make an individual sacrifice to group objectives. Increases ability of community members seen on the intensity of the participation of members. However, the research also found domination of majority when taking a group decision meanwhile there’s some different ideas from minority. 
Keywords : Community, Groupthink Theory, Group Communication","H1, HT",MetaKom Online,2017-09-30,
FISIP4,Menulis Artikel_ Potensi Pengembangan Energi Baru dan Terbarukan Berbasis Masyarakat Adat,,HT,Media Indonesia,,
FISIP4,Review Jurnal : Strategi dan Bentuk-Bentuk Informasi Transmigrasi pada Masa Orde Baru dalam Rangka Mensukseskan Program Pembangunan Nasional,,"HN, HT, HV",,2019-07,
FH3,POSITIVE PROTECTION: PROTECTING GENETIC RESOURCES RELATED TO TRADITIONAL KNOWLEDGE IN INDONESIA,"Genetic Resources is foundation of human life, as a source of food, industrial raw materials, pharmaceuticals, and medicines. From its utilization may provide financial benefit to the provider and the user of it. Unfortunately, most of it obtained from developing countries through bio-piracy, including Indonesia. Furthermore, in the early 1980s, access and benefit sharing (ABS) to genetic resources became an international issue. It leads to the adoption of the Convention on Biological Diversity (CBD) in 1992. However, since it was approved, the whole ideas of excellence of it could not be implemented, problem on it still arises. Intellectual property right laws, in certain aspects are possible for using to protect traditional knowledge from their utilization. However, in the same time, intellectual property regime also becomes “a tool” to legitimate of bio piracy practices.

Due to international massive pressure, mostly developing countries, it proposes two kind of protections, are positive protection and defensive protection. This paper will examine one of it, which is positive protection. By using the normative method and qualitative approach, this paper identified at least two kind of positive protections that we can develop in order to protect genetic resources related to traditional knowledge, are optimize the patent law and develop the sui generis law. Furthermore, it can do by some revision by adding new substances, improvement on the Articles, or even by doing the deletion on certain articles. Moreover, in order to develop the sui generis law, it identified several minimum elements that shall be contained on it, inter alia: the purposes of protection; scope of protection; criteria of protection; the beneficiaries of protection: the holder of traditional knowledge; the kind of rights to be granted; how does the rights acquired; how to enforce it; how does the rights lost or expired; and dispute resolution.","H1, HT, K1",Fiat Justicia Jurnal Ilmu Hukum Fakultas Hukum Universitas Lampung,,
FISIP1,"Green Products Image in the Perspective of Young
Consumers","Green products are becoming a trend for the business world to be involved in environmental conservation. However,
few studies have examined its effect on corporate image, especially among young people in developing countries.
This study provides an overview of the relationship between green products and advertising on green brand image in
young consumers' perspectives. A quantitative approach uses in this study to 100 samples of young consumers.
Theoretical and practical support can contribute to this research in expanding the use and campaign of green products.","HD28, HT","Advances in Social Science, Education and Humanities Research (ASSEHR)",2021,
FISIP1,"Development of Corporate Social Initiative (CSI) Model for Micro, Small and Medium Enterprises in Indonesia","This study aims to explore the social involvement impact of Micro, Small dan Medium Enterprises (MSMEs), consumers and a social community through the Corporate Social Initiative (CSI) program carried out by involving the social behaviour of consumers and community for their business sustainability in the future. This research uses a case study method with a qualitative approach, so the data collection technique is carried out by deep interviews and observations to MSME actors who implement CSI program indirectly. These informants consist of one owner, four managers, four employees and five consumers from one of the MSMEs engaged in the coffee industry. The results of this study show the important of CSI, which is a model and a solution for creating good relationships between MSMEs, consumers and social communities, it has a positive impact on the MSMEs image. The CSI program which done by MSMEs is inviting consumers to be actively involved in every social activity organized by MSMEs which collaborate with a social community. It has an impact on consumers who feel they are part of the MSMEs. MSMEs will have a very good competitive advantage for sustainability of their business.","HF, HT",,2021-09,
FISIP2,"Peningkatan Kapasitas Advokasi Sosial dan Pendampingan Hukum pada Anggota Satuan Tugas Perlindungan Anak Terpadu Berbasis Masyarakat (Satgas PATBM) Garuda Hitam Pekon Mataram, Kabupaten Pringsewu","Satuan Tugas Perlindungan Anak Terpadu Berbasis Masyarakat (Satgas PABTM) Garuda Hitam Pekon Mataram, Kabupaten Pringsewu baru terbentuk pada bulan Februari 2020, sehingga kemampuan untuk mencegah dan menanggapi kekerasan yang diterima oleh anak korban kekerasan belum maksimal. Untuk itu, kegiatan pengabdian ini dilakukan dengan tujuan meningkatkan kapasitas advokasi sosial dan pendampingan hukum pada anggota Satgas PATBM Garuda Hitam Pekon Mataram dengan metode pelatihan (ceramah, role-play, dan praktek). Pelatihan advokasi sosial dan pendampingan hukum ini memberikan pengaruh cukup siginifikan (sedang) terhadap peningkatan kapasitas (pengetahuan dan kemampuan) pendampingan hukum dengan tingkat keefektivan didominasi kriteria sedang sebesar 70 persen dengan nilai rerata N-Gain adalah 0,48.",HT,,2020-11,
FKIP8,UNSUR BUDAYA DAN NILAI MORAL DALAM CERITA RAKYAT KOMERING SEHARUK: SEBUAH TINJAUAN SOSIOLOGI SASTRA,"Penelitian ini bertujuan menggali dan mendeskripsikan unsur budaya dan nilai moral yang terkandung dalam cerita rakyat Komering Seharuk. Penelitian ini menggunakan metode deskriptif kualitatif dengan pendekatan sosiologi sastra. Sumber data penelitian berupa cerita rakyat Komering Seharuk yang ditulis oleh Usman Nurdin. Melalui sumber data tersebut diperoleh data penelitian berwujud kutipan kalimat yang dikumpulkan melalui teknik baca-catat. Adapun analisis terhadap data penelitian dilakukan menggunakan teknik analisis isi. Hasil penelitian menunjukkan bahwa cerita rakyat Komering Seharuk mengandung unsur budaya Komering dan nilai moral yang cukup beragam. Unsur budaya Komering yang dimaksud meliputi; (1) penggunaan bahasa Komering, (2) pengangkatan lagu daerah Komering Umbai Akas, (3) latar Sungai Komering sebagai salah satu sumber kebudayaan masyarakat Komering, dan (4) Tala Balak yang digunakan sebagai sarana penghancur kelaliman penguasa. Adapun nilai nilai moral yang dimaksud meliputi; (1) kepatuhan, (2) kebijaksanaan, (3) kesediaan bertanggung jawab, (4) bekerja keras, (5) religiusitas, (6) optimisme, (7) peduli sosial, dan (8) cinta damai. Unsur budaya dan nilai moral yang terkandung di dalam cerita rakyat Komering Seharuk dapat dijadikan salah satu pedoman dan motivasi dalam kehidupan bermasyarakat.","HT, PN",Widyaparwa (Jurnal Ilmiah Kebahasaan dan Kesastraan),2021,
FT2,Prediction Model of Tuberculosis Transmission Based on Its Risk Factors and Socioeconomic Position in Indonesia,"Context:
 The current evidence shows that people in low socioeconomic positions tend to be at high risk for TB transmission.
 Aims:
 To identify the significance of socioeconomic position and TB risk factors to TB transmission, particularly in Bandar Lampung, Indonesia.
 Settings and Design:
 This cross-sectional study, conducting in January – November 2017, included 166 samples of smear-positive TB patients collected from 30 primary health centres across the city that had implemented DOTS strategy.
 Methods and Material:
 The latent variables consisted of: socioeconomic position, housing, nutritional, healthcare access, and TB transmission, which was measured through corresponding indicators. The data was collected through in-depth interviews. 
 Statistical analysis used:
 Data analyzed using Partial least square method.
 Results:
 Determinants of socioeconomic position through housing determinants significantly influence TB transmission with R2 of 42.3%. They also show that education, housing density index, and internal house transmission are the strongest indicators in explaining their associated latent variables.
 Conclusions:
 Tuberculosis control program should be integrated with education improvement, a reduction of housing density index, and strengthened examinations of internal house contacts. These programs should be supported by health institutions and other related institutions. The findings will improve TB control programs, especially in low and middle income countries with high socioeconomic disparity.","GE, GF, HT, RA",Indian Journal of Community Medicine,2018-07,
FT1,"Penerapan Digital Marketing sebagai Peningkatan Pemasaran pada Kelompok Usaha Tirta Soya di Pekon Dadapan, Kecamatan Sumberejo Tanggamus",,"HT, HV",,2020,
,Peningkatan Kapasitas Masyarakat Pesisir Melalui Literasi Digital,"Literasi informasi merupakan kunci untuk meningkatkan kualitas sumberdaya manusia masyarakat pesisir. Literasi informasi menjadi satusatunya cara untuk memperluas ilmu pengetahuan dan skill. Sehingga masyarakat dengan kemampuan literasi informasi dapat memanfaatkan teknologi, mengetahui strategi dalam kegiatan ekonomi - termasuk menguasai pasar dan modal, mengetahui pola hidup sehat, dan pengetahuan lainnya. Pendapat di atas menunjukkan bahwa literasi informasi memiliki peran yang penting dalam mencapai tujuan program pemberdayaan masyarakat di kawasan pesisir. Desa Margasari merupakan desa yang berada di pesisir timur lampung yang telah lama memiliki satu objek literasi yaitu rumah pintar. Rumh Pintar dibentuk pada tahun 2015 oleh Universitas Lampung, khusunya oleh LPPM Unila. Sejak awal didirikannya sebuah rumah pintar masyarakat tentulah memiliki rancangan kegiatan yang bertujuan untuk meningkatkan minat baca masyarakat. Taman baca masyarakat pula memiliki kegiatan utama yakni mengumpulkan informasi-informasi berupa buku, majalah, Koran dan lain-lain untuk disajikan kepada masyarakat yang menjadi target dari rumah pintar tersebut. Perkembangan Teknologi Informasi dan Komunikasi (TIK) merupakan suatu hal yang tidak terelakkan, dan salah satu sektor yang terkena dampak perkembangannya ialah sektor pendidikan. Merespon hal tersebut, peningkatan kemampuan literasi digital masyarakat merupakan hal yang sangat mendesak. Kemampuan literasi digital juga sangat penting untuk dimiliki oleh masyarakat pesisir. Tujuan dari kegiatan pengabdian desa binaan adalah meningkatkan kapasitas masyarakat pesisir dalam pengunaan dan pengelolan literasi digital.","HT, L1",Jurnal Sumbangsih,2022-09-22,
FISIP2,"Pemetaan Potensi Desa Berbasis Asset Based Community Development di Desa Kotabatu, Pubian, Lampung Tengah","The purpose of this community service activity was to increase the knowledge and experience of local communities at village potential mapping based on asset based community development in Kotabatu Village. The activities carried out are in the form of focus group discussion (FGD), training that accompanied by assistance in the context of mapping of village potential and increasing the institutional capacity of community groups, namely: Community Forestry Group and Tourism Awareness Group. The methods used in this activity included: the cognitive aspect enhancement stage, the mentoring and empowerment stage, and the advocacy stage. In particular, this community service activity has led to several objectives, including: building a commitment among village officials to focus on village development of the three potential Kotabatu Village has had, including (1) optimizing the potential of natural resources, (2) potential agricultural products, and (3) tourism potential.","H1, HT",Bakti Budaya: Jurnal Pengabdian kepada Masyarakat,2021-10-02,
FISIP2,"Pendampingan Pemetaan Sosial Masyarakat Pekon Kiluan Negeri, Kec. Kelumbayan, Kab. Tanggamus dalam Mendukung Pencapaian SDSs Desa","Pekon Kiluan Negeri merupakan salah satu desa yang berada di Kecamatan Kelumbayan, Kabupaten Tanggamus yang status Indeks Desa Membangun (IDM)-nya di tahun 2022 berada pada kategori “Berkembang”. Hal ini dapat dikatakan cukup ironi mengingat desa di wilayah pesisir Lampung ini memiliki banyak potensi sumber daya alam (SDA) dan sumber daya manusia (SDM). Pembangunan Pekon Kiluan Negeri dengan mengedepankan SDGs Desa sebagai ""arus utama"" diharapkan mampu meningkatkan kualitas masyarakat desa setempat.  Hal tersebutlah yang melatarbelakangi aktivitas pengabdian oleh Tim PkM Desa Binaan Universitas Lampung dalam melakukan pendampingan pemetaan sosial aspek lingkungan, sosial, dan ekonomi masyarakat Pekon Kiluan Negeri dalam mendukung pencapaian SDGs Desa. Metode kegiatan yang dilakukan mencakup aktivitas sosialisasi, penyuluhan, hingga pendampingan pemetaan sosial yang dilakukan secara bersama-sama dengan para partisipan. Secara khusus kegiatan pengabdian ini telah mengarah pada beberapa capaian tujuan yang diharapkan. Tim PkM Desa Binaan bersama masyarakat lokal telah berhasil memetakan potensi Pekon Kiluan Negeri yang mencakup aspek lingkungan, sosial, dan ekonomi. Hasil pemetaan tersebut menunjukkan bahwa potensi Pekon Kiluan Negeri cukup menunjang dalam mendukung pencapaian SDGs Desa. 

Kata Kunci: pendampingan, pemetaan sosial, Kiluan Negeri, SDGs Desa","H1, HM, HT",JPDW Jurnal Pengabdian Dharma Wacana,2022-12,
FP26,"Peranan Penyuluh Pertanian Dalam Meningkatkan Kinerja
Kelembagaan Kelompok Tani Padi Sawah Penerima Bantuan Rice
Milling Unit (RMU) Di Kota Bandar Lampung","This study aims to analyze: 1) the level of the role of agricultural agents; 2) the level of
institutional performance of farmer groups; 3) the relationship between the level of the role
of agricultural extension agents and the institutional performance of rice farmer groups in
the use of RMU in Bandar Lampung City. This research was conducted in the city of Bandar
Lampung with 56 farmer respondents. Methods of data collection using a survey method,
with descriptive analysis and using a non-parametric rank spearman correlation statistical
test to test the hypothesis. The results showed that the role of agricultural extension agents in
improving the institutionalization of rice farmer groups receiving RMU assistance was in the
medium category, the institutional level of farmer groups in the use of RMU was in the
medium category, and the role of agricultural instructors had a significant relationship with
the institutional performance of farmer groups.
Key words: role, extension agent, institutional, farmers","H1, HT",Journal of Food System and Agribusiness,2021,
,"Publikasi LKTI Mahasiswa ""Foruner""",,"BP, HT",Jurnal Manajemen Kewirausahaan,,
