division,title,abstract,subjects,publication,date,keywords
FISIP2,"PENINGKATAN KAPASITAS DAN PEMBERDAYAAN KELOMPOK
PEREMPUAN PKK (PEMBINAAN KESEJAHTERAAN KELUARGA)
MELALUI PENCIPTAAN USAHA STRATEGIS BERBASIS POTENSI 
DAERAH (STUDI PADA KELOMPOK PEREMPUAN PKK DESA SUKAJAYA 
LEMPASING KECAMATAN TELUK PANDAN KABUPATEN PESAWARAN)","ujuan umum yang dicapai dalam kegiatan ini adalah untuk menyebarluaskan hasil-hasil penelitian/kajian kepada
masyarakat sebagai bagian dari upaya utuk memberdayakan dan meningkatkan kesejahteraan masyarakat, membangun
kerjasama dan kemitraan dengan masyarakat sebagai perwujudan dan pengembangan kompetensi sosial di kalangan
para dosen. Sedangakan tujuan khususnya adalah untuk meningkatkan kapasitas pengetahuan dan memberdayaan
kelompok perempuan PKK Desa Sukajaya Lempasing Kecamatan Teluk Pandan Kabupaten Pesawaran untuk
menciptakan usaha strategisnya berbasis potensi daerah sehingga usaha tersebut berkelanjutan dan dapat
meningkatkan perekonomian perempuan serta bermanfaat bagi pembangunan desanya. Dalam pelaksanaan kegiatan
akan menggunakan metode ceramah dan diskusi. Metode ceramah dan diskusi serta FGD di dalam ruangan yang
digunakan untuk menyajikan materi. Adapun khalayak sasaran kegiatan seminar tentang penciptaan usaha strategis
yang berkelanjutan dengan menggunakan analisis SWOT adalah kelompok perempuan yang termasuk dalam PKK.
Tetapi kegiatan ini tidak menutup kemungkinan untuk pihak pengamat lain dalam mengikuti kegiatan.

Lokasi kegiatan pengabdian ini adalah di Desa Sukajaya Lempasing Kecamatan Teluk Pandan Kabupaten Pesawaran. 
Dengan adanya kegiatan pengabdian ini diharapkan dapat memberikan manfaat bagi khalayak sasaran yaitu
memahami potensi daerahnya, memahami usaha strategis dan menciptakan langkah untuk memulai usaha tersebut.
Hasil kegiatan pengabdian membawa peningkatan kemampuan dasar peserta.  Peningkatan terendah sebesar 5% dan
peningkatan tertinggi sebesar 40%.  Rata-rata peningkatan adalah sebesar 17,5%.  Berdasarkan hasil dan evaluasi
pelaksanaan pengabdian kepada masyarakat dapat disimpulkan beberapa hal sebagai berikut: 1). Kemampuan peserta
pelatihan pada aspek kognetif dan afektif mengalami peningkatan dengan rata-rata sebesar 17,8%., 2). Hasil evaluasi menunjukan peserta memiliki persepsi positif dan motivasi yang tinggi untuk menjalankan point penting dalam
penciptaan usaha strategis berbasis potensi daerahnya, 3).Peserta menghendaki adanya pelatihan lanjutan.","H1, HT",Sakai Sembayan,2019-07,
FISIP2,PENERAPAN CHIKI KEIBI SEBAGAI IMPLEMENTASI COMMUNITY POLICING DI JEPANG,"This article will discuss on what kind of chiiki keibi (地域警備1
) or community policing applied in Japan
nowadays. Interviews and observations have been conducted on Naka police station and Tagami Koban, Kanazawa,
Ishikawa, Japan. The debate on why many countries, including Indonesia, implemented Japanese community policing
becomes an interesting topic to be discussed. By identifying the characteristic of Japanese Community Policing, we
will have the basic understandings to investigate the reasons how community policing in Japan can be adopted then
implemented in many others countries, especially in Indonesia.","H1, HM, HT",MetaCommunication; Journal Of Communication Studies,2017-03,
FKIP12,"EKSISTENSI PERKAWINAN ADAT JAWA DI DESA 
KALIBALANGAN KECAMATAN ABUNG SELATAN 
KABUPATEN LAMPUNG UTARA","Penelitian ini bertujuan untuk menjelaskan dan mendeskripsikan eksistensi perkawinan adat Jawa di Desa 
Kalibalangan Kecamatan Abung Selatan Kabupaten Lampung Uatara. Metode penelitian yang digunakan 
dalam penelitian ini adalah deskriptif pendekatan kualitatif dengan subjek penelitian yaitu tokoh adat, 
tokoh masyarakat, tokoh pemuda, keluarga yang melangsungkan perkawinan dan pasangan pengantin. 
Teknik pengumpulan data menggunakan wawancara, observasi, dan dokumentasi sedangkan keabsahan 
data menggunakan uji kredibilitas dan triangulasi. Berdasarkan hasil penelitian menunjukan bahwa 
sebagian besar masyarakat melakukan perkawinan adat Jawa dengan motivasi untuk melestarikan budaya 
yang sudah ada, menunjukan identias orang Jawa, agar dihormati, mendapat dukungan, menunjukan 
mampu melaksanakan perkawinan adat Jawa, mendapat kepuasan. Kemudian adanya nilai-nilai yang 
terkandung dalam kelima tahapan prosesi perkawinan adat Jawa, nilai tersebut didukung adanya nilai 
kemanusiaan seperti gotong royong, tolong menolong sesama masyarakat, nilai persatuan diantara 
masyarakat dengan adanya hubungan harmonis sesama masyarakat dan solidaritas diantara masyarakat 
sebagai bagian dari warga negara, nilai ketuhanan yang ada dimasyarakat dengan mengharapkan 
keberkahan acara, kelancaran acara dari Tuhan Yang Maha Esa. Sedangkan tantangan kepada upaya 
untuk melaksanakan perkawinan dengan adat Jawa dimasa sekarang yaitu dengan tetap melaksanakan 
perkawinan adat Jawa, serta menyederhanakan prosesinya untuk menyingkat waktu dalam pelaksanaan 
adat Jawa tersebut.",HT,Jurnal PEKAN,2021-11,
FKIP12,PERSEPSI MASYARAKAT TERHADAP KEBIJAKAN ZONASI DI DESA BALI AGUNG KECAMATAN PALAS LAMPUNG SELATAN,"Penelitian ini bertujuan untuk mengetahui dan menjelaskan persepsi masyarakat desa Bali Agung terhadap kebijakan sistem zonasi sekolah dalam penerimaan peserta didik baru tingkat SMP. Penelitian ini menggunakan metode deskriptif dengan pendekatan kuantitatif. Populasi dalam penelitian ini adalah masyarakat desa Bali Agung yang memiliki anak kelas VII SMP. Instrumen pengumpulan data menggunakan angket dan analisis data menggunakan rumus interval dan persentase. Berdasarkan hasil penelitian pada indikator pemahaman masyarakat terhadap kebijakan zonasi dikatakan paham diperoleh sebanyak (47,61%) masyarakat memiliki kepahaman terhadap kebijakan zonasi sebagai aturan baru dalam proses penerimaan peserta didik baru sebagai salah satu upaya dalam pemerataan pendidikan. Tanggapan masyarakat terhadap kebijakan zonasi dikatakan setuju diperoleh sebanyak (42,85%) karena dengan adanya kebijakan masyarakat percaya pemerataan di Indonesia akan tercapai dan juga untuk mepercepat proses pembangunan. Harapan masyarakat terhadap kebijakan zonasi dikatakan setuju diperoleh sebanyak (52,83%) dengan adanya kebijakan zonasi sekolah diharapkan mampu melakukan pembaharuan sebagaimana yang dibutuhkan masyarakat.","H1, HT",Jurnal Pendidikan Kewarganegaraan,2021-11,
FISIP2,"Information Needs Analysis for Rural Tourism
Application Design in Lampung Province, Indonesia","More growing interest in traveling to villages has made the village have to be embraced as a partner in the start-up of village tourism service applications so that they have clarity in the production chain and are able to
move the wheels of village tourism activities more clearly. However, the main challenge for local tourism service start-ups is the analysis of potential customers needed to develop applications with a variety of features in them. There are two forms of tourism service applications, namely in the form of website applications and applications based on android / IOS. In the first part, it seems that the information needs analysis of the village tourist destination application is the right choice to do. The results of the study identified that the main profile of potential application users is a group of women who are in the age group of 20-31 years and live in urban areas. In addition, substantially the information needs of respondents are parallel to the main profile of potential
application users, they need more information on tourist destinations that have visual appeal, are concise and not far from urban areas so that they can support
their existence in social media activities",HT,,2022-03-29,
FISIP4,Pengaruh Kredibilitas Pendamping Terhadap Sikap dan Perilaku Anak-Anak Jalanan Di Kota Bandung,"Penelitian ini bertujuan menganalisis kredibilitas pendamping terhadap prilaku anak-anak jalanan dalam aktifitasnya di jalanan melalui perubahan sikap anak-anak jalanan di lingkungan jalanan maupun dalam kehidupan sosial masyarakat. Metode penelitian yang yang digunakan yakni survey eksplanotari. Unit sampling adalah anak-anak jalanan yang telah mendapatkan penyuluhan dan bimbingan sosial dirumah Singgah Yayasan Masyarakat Sehat, Yayasa Bina Budaya Bangsa dan Saudara Sejiwa. Teknik sampling yang digunakan adalah Cluster Sampling Sedangkan sample 100 anak yang dipilih melalui cara acak sederhana (Random Sampling) Teknik Analisis data yang digunakan adalah teknik analisis jalur (Path Analisis). Hasil Penelitian ini menyimpulkan bahwa dari empat hipotesis yang di uji menunjukkan signifikan, pengaruh X1 terhadap Y1 secara parsial adalah signifikan dengan pengaruh sebesar 48,5%, pengaruh X2 terhadap Y1 secara parsial adalah signifikan dengan pengaruh sebesar 35,9% sedangkan pengaruh X1, X2 dan X3 terhadap Y1 (sikap) secara simultan sebesar 81,3%. Pengaruh Y1 (sikap) terhadap Y2 (perilaku) sebesar 65,3% dan yang relatif signifikan, pengaruh X1 terhadap Y1 dengan pengaruh sebesar 65,3% dan X1, X2, X3 dan Y1 secara simultan 18,09%. Hasil penelitian menunjukkan bahwa kredibilitas pendamping (keahlian, kepercayaan dan dinamisme) dalam penyuluhan dan bimbingan sosial anak jalanan di kota Bandung, pendamping sebagai komunikator memiliki tingkat kredibilitas yang relatif tinggi dalam merubah sikap dan perilaku anak jalanan sebagai komunikan. Rekomendasi diharapkan segenap lapisan masyarakat, instansi terkaitdan pendamping diharapkan lebih intropeksi diri dalam menangani anak-anak jalanan sehingga dalam menatap masa depan yang cerah dapat lebih terlaksana dengan baik.

Kata kunci: Kredibilitas, pendamping, sikap, perilaku, anak jalanan",HT,Sosiologi: Jurnal Ilmiah Kajian Ilmu Sosial dan Ilmu Budaya,2016-03-01,
FISIP2,George Floyd’s and Racism Issue as Political Agenda in U.S Presidential Election as Depicted on Digital Media,"George Floyd’s death by Minneapolis officer as depicted in both digital media (huffpost.com and cnn.com) during May,25- June,9,2020 has triggered public opinion among U.S Presidential Nominee between Donald Trump and John Biden during U.S Presidential Election in 2020. Media, with its power has put Gorge Floyd’s and Racism issue as political agenda to gain public opinion toward the U.S Presidential Nominee in 2020 as depicted on both popular media (huffpostcom and cnn.com) based on themes and news articles. Based on themes, Goerge Floyd and racism have become political agendas in both digital news, where politics issue in huffingtonpost was 77 theme (77%), and CNN was 68 theme (68%) from 100 samples in each media. Based on news articles, George Floyd and racism put as political agenda in U.S Presidential Nominee during Presidential Election in 2020 as depicted on both digital media based on each variable: Police brutality towards black people on huffingtonpost was 92% and CNN was 89%, power abuse toward to black people on huffingtonpost was 55% and CNN was 59%, U.S systemic racism on huffingtonpost was 68% and CNN was 61%, Democrats and Republican’s view on racism on huffingtonpost was 94% and CNN was 87%, injustice between the white and the black on huffingtonpost was 84% and CNN was 82%, Public trust/distrust on American Symbol on huffingtonpost was 41% and CNN was 45%. Based on themes and articles as depicted on both media, George floyd’s death and racism have gained public opinion toward U.S Presidential nominee in U.S Presidential Election 2020.",HT,,2021-12-07,
FISIP2,Hasil Uji Similarity Efektivitas Program Prukades di Desa Jatibaru Kecamatan Tanjung Bintang Kabupaten Lampung Selatan,"Permasalahan kemiskinan diwilayah pedesaan cukup kompleks dan membutuhkan intervensi semua pihak secara
bersama. Berbagai upaya telah dilakukan oleh pemerintah Indonesia untuk mengentaskan kemiskinan di wilayah
pedesaan. Salah satu upayanya adalah Program Prukades (Produk Unggulan Kawasan Pedesaan). Tujuan
penelitian ini adalah untuk menganalisis efektivitas Program Prukades Di Desa Jatibaru Kecamatan Tanjung
Bintang Kabupaten Lampung Selatan sebagai upaya pemecahan masalah kemiskinan di wilayah pedesaan dengan
menggunakan teori efektivitas. Jenis penelitian ini adalah penelitian deskriptif dengan pendekatan kualitatif. Data
dikumpulkan melalui wawancara, observasi dan dokumentasi. Analaisis data dilakukan dengan reduksi data,
penyajian data dan penarikan kesimpulan. Efektivitas Program Prukades di Desa Jatibaru Kecamatan Tanjung
Bintang Kabupaten Lampung selatan kurang efektif. Hal ini ditinjau dari indikator efektivitas yaitu pencapaian
tujuan yang belum tercapai secara maksimal, tidak ada peningkatan kuantitas dan kualitas SDM setelah diadakan
sosialisasi dan pelatihan serta masyarakat desa masih belum bisa beradaptasi dengan kecanggihan teknologi.
Kendala dalam menjalankan Program Prukades Di Desa Jatibaru Kecamatan Tanjung Bintang Kabupaten Lampung
Selatan adalah belum optimalnya partisipasi masyarakat, anggaran dana desa tidak mencukupi serta sarana dan
prasarana yang tidak memadai.","H1, HT",,2020,
FISIP2,STRATEGI PENGEMBANGAN POTENSI PARIWISATA BAHARI KABUPATEN PESAWARAN (STUDI PADA PANTAI KETAPANG DALAM/CUKU UPAS PESAWARAN),"Kabupaten Pesawaran sedang fokus mengembangkan Potensi Wisata Bahari khususnya Pantai Ketapang 
Dalam/Cuku Upas. Pengembangan yang dilakukan oleh kabupaten Pesawaran yakni dengan strategi pencapaian 
tujuan dan sasaran pengembangan pariwisata Pesawaran. Permasalahan mendasar yang ada dalam Dinas 
Pariwisata dan Kebudayaan Pesawaran adalah belum maksimalnya pada tahapan analisis lingkungan baik internal 
maupun eksternal, khususnya karena minimnya sarana pendukung wisata di Pesawaran yaitu terhambat dengan 
pendanaan dan pola pikir masyarakat sekitar (pelaku eksternal), sehingga perlu dukungan dari berbagai pihak 
untuk pengembangan potensi wisata bahari. Tujuan penelitian ini untuk melakukan analisis lingkungan internal 
dan eksternal pengembangan wisata bahari Pantai Cuku Upas yang meliputi kekuatan, kelemahan, peluang, dan 
ancaman untuk merumuskan beberapa alternatif strategi.Metode yang digunakan adalah pendekatan kualitatif 
dengan teknik pengumpulan data wawancara, observasi, dan dokumentasi. Hasil dan pembahasan menunjukkan 
bahwa dalam pengembangan wisata bahari Pantai Cuku Upas Kabupaten Pesawaran, kekuatan dari analisis 
lingkungan internal Dinas Pariwisata dan Kebudayaan Pesawaran memiliki SDM yang berloyalitas tinggi, 
kemampuan koordinasi dengan seluruh pihak pengelola, pelatihan SDM secara intensif, serta keindahan 
lingkungan sosial budaya yang dimiliki Pantai Cuku Upas. Sedangkan, kelemahannya adalah SDM sulit berinovasi, 
tidak adanya sistem reward dan punishment, dan tidak ada dana khusus untuk wisata bahari. Analisis lingkungan 
eksternal menunjukkan wisata bahari Pantai Cuku Upas Pesawaran memiliki peluang dari peran Pokdarwis dan 
masyarakat setempat, peran pelaku bisnis, dan kemajuan teknologi,.Sedangkan, ancamannya yaitu adanya 
persaingan antar objek wisata lainnya di Pesawaran, ketidakstabilan keadaan ekonomi masyarakat, minimnya 
pengelolaan sampah, serta kurangnya sarana dan prasarana.","H1, HT","Administrativa: Jurnal Birokrasi, Kebijakan dan Pelayanan Publik",2021-01,
FKIP7,Stereotypes of non-Lampung ethnic groups towards Lampung ethnicity,"Background: Stereotypes of non-Lampung ethnic groups against Lampung ethnicity. Stereotype is a form of prejudice that can cause obstacles in an intercultural communication related to cultural differences. Stereotypes occur not because of something that is brought by an individual from birth, or arises because of instinct. Stereotypes can occur because of certain factors. First, stereotypes can arise from parents, siblings or anyone who interacts with individuals. The experiences of the closest people from an individual create a stereotypical attitude towards other individuals. Second, there is encouragement from personal experience that creates a stereotypical attitude towards other individuals.
Material and Methods: this study uses qualitative research methods and uses the theory of symbolic interaction.
Results:The results of this study indicate that the stereotypes of non-Lampung ethnic groups against Lampung ethnicity are very balanced between positive and negative stereotypes.
Conclusion: The implication of this research can be used as reference in society behavior and it can be used as effort to preserve oral literary product, especially stereotypes of non-Lampung ethnic groups against Lampung ethnicity.","HT, P1",IOSR Journal of Research & Method in Education (IOSR-JRME),2021,
FISIP3,Transformasi Kelompok Wanita Tani Menjadi Kelompok Sadar Wisata di Kecamatan Punggur Lampung Tengah,"Middle Lampung  district  has  potential  various  tourism  object  attractions  to  develop  in  order  to improve  public  welfare.  However,  they  are  not  yet  utilized  optimally  because  of  weak institutional  supports  in  village  level.  Various  local  institutions  (such  as  female  farmer group)  in  Badran  Sari  village  (Middle  Lampung)  so  far  had  showed  performances  in developing distinctive local fishery/agriculture products, but they were all still packaged in household economy objectives, so that not yet able to attract public attention for tourism objectives. The objective of this service was to form a Tourism-aware Group growing from public  awareness  that  would  be  supported and  developed  with  proper  assistance  and education  by  coordinating  with  tourism  sector  stakeholders.  Methods  to  obtain  the objective were socialization, assistance, and education to existing female farmer group so that it would transform into “Semenanjung Badran” Tourism-aware Group that was able to operate tourism functions to develop a real Tourism Village and able to improve tourism visits. Post-service evaluation result showed that this service had obtained its objective in the  context  of  understanding and  attitude  changes  of  public  and  commitment  from Tourism-aware  Group  administrators.  Quantitatively,  pre-test  and  post-test  comparison suggested participants’ understanding, knowledge, and will improvements by 96.06%. Qualitatively,    the    service    result    succeeded    to    convince    Tourism-aware    Group administrators that tourism sector was an activity touching and involving public directly and potentially affecting public welfare improvement directly in Badran Sari village.",HT,JURNAL PENGABDIAN PADA MASYARAKAT,2020-05-18,
FP5,"Pemanfaatan Satwaliar oleh Masyarakat Sekitar Hutan Desa Beringin Tinggi, Kabupaten Merangin, Provinsi Jambi","The existential relationship between nature and humans can be assessed from the number of plant and animal species utilized to their family or its customs daily needs. The community around the Hutan Desa (HD) Beringin Tinggi Jambi Province which is classified as Malay ethnic and always lived side by side the forest is also suspected of having it. However, the close and important relationship is often not realized, so there is a concern that we will lose traditional knowledge and wisdom in natural resources utilization, especially wildlife in the future. Thus, research aimed to explore the wildlife species diversity utilized by communities around HD Beringin Tinggi is needed. Data collection was carried out by open interviews to community who live and doing activities around the HD Beringin Tinggi purposively and ended until the data-saturated. Other interviews were also conducted with village institutions, adat institutions, and KKI Warsi NGO staff who active there. The results showed that the number of wildlife species utilized by the people living around the HD Beringin Tinggi was not enough compared to other communities in Jambi Province. Of the 18 species utilized, Symphalangus syndactylus and Argusianus argus should be the main attention because it has important implications for the protected species conservation.","HT, SD",Jurnal Silva Tropika,2019-12,
FP5,"Wildlife Utilization on Community’s Around Hutan Desa Beringin Tinggi, Merangin Regency, Jambi Province","The existential relationship between nature and humans can be assessed from the number of plants and animals species utilized to their family or its customs daily needs. The community around the Hutan Desa Beringin Tinggi Jambi Province which is classified as Malay ethnic and always lived side by side the forest is also suspected of having it. However, the close and important relationship is often not realized, so there is a concern that we will lose traditional knowledge and wisdom in natural resources utilization, especially wildlife in the future. Thus, research aimed to explore the wildlife species diversity utilized by communities around HD Beringin Tinggi is needed. Data collection was carried out by open interviews with the general communities who live and doing activities around the HD Beringin Tinggi purposively and ended until the data-saturated. Other interviews were also conducted with village institutions, adat institutions, and KKI Warsi NGO staff who active there. The results showed that the number of wildlife species utilized by the people living around the HD Beringin Tinggi was not enough compared to other communities in Jambi Province. Of the 18 species utilized, Symphalangus syndactylus and Argusianus argus should be the main attention because it has important implications for the protected species conservation.","HT, SD",Jurnal Silva Tropika,2019-12-31,
FT9,"The Role of Traditional Settlement Branding as a Part of Design Process and Place-Making Approach in Adaptable Future Cities, with Case Study: Wana Village","Indonesia has a variety of history that is rich in cultural values, including architecture. The beauty of heritage architectural can be seen, studied, even still can be used today and it is interesting to be reviewed further. Because all of these architecture are built to meet an expression the ways of living developed by a community and passed on from generation to generation, including customs, practices, places, objects, artistic expressions and values. This architecture has serves as a residence, and is compound, adjacent to each other, and still remains its traditional cosmological elements, where the elements create the image of settlement and have a variety of supporting life facilities. When compared with other countries that do not consider traditional elements in development, social problems usually will arise. For this reason, it is very important to pay attention to traditional elements in development. One of the traditional settlements that can be found today is Wana Village, which is part of Melinting Kingdom and is located in East Lampung and have branding “Real Estate of Paper Businessman”. The settlement still maintains its traditional values, although it has undergone time, transmigration, and other factors that lead to a number of different types of settlement. This paper investigate paradigm the role of Traditional Settlement Branding in design process, and become an important approach in develop innovation of place-making. With this paper, we proposes the first step of an innovative methodological approach to develop an information system, and to stimulate identification of “neighbourhood characteristic such as socio economic factor, residential pattern, social value, and stressful life events and insufficient resources” which can be constructed by knowing elements of the constituent settlement branding in order to adapt the development, without loss of identity. So, it becomes a unique attraction that has a more value with its traditional identities and able to maintain normative developmental task that occur at various stage of live in adaptable future cities.
Keywords: Traditional Settlement Branding, Design Process, Place-Making Approach, Adaptable Future Cities, Wana Village","HT, NA",,2020-08-31,"Traditional Settlement Branding, Design Process, Place-Making Approach, Adaptable Future Cities, Wana Village"
FISIP7,BELANTARA FOUNDATION SEBAGAI MEDIA KOMUNIKASI LINGKUNGAN,"Informasi dan berita di media mainstream mengenai lingkungan sering kali tidak mendapatkan intensitas maupun durasi yang sama jika dibandingkan dengan berita politik dan ekonomi. Hal ini menyebabkan masyarakat tidak maksimal dalam mendapatkan informasi mengenai kerusakan, antisipasi, dan pelestarian lingkungan. Tujuan penelitian ini adalah untuk mendeskripsikan peran Belantara Fondation baik sebagai Lembaga kemasyarakatan maupun sebagai media dalam memberikan informasi mengenai lingkungan. Metode yang digunakan dalam penelitian ini adalah deskriptif kualitatif. Peneliti mengumpulkan data dengan melakukan observasi di media sosial. Melalui observasi tersebut, peneliti mencermati informasi yang disebarkan media sosial Belantara Fondation dan digunakan sebagai data. Penelitian ini mampu menjelasakan bahwa Belantara Fondation sebagai salah satu organisasi yang memiliki media sosial untuk menyadarkan masyarakat terkait kerusakan dan pelestarain lingkungan memiliki potensi yang sangat besar untuk mengawal kepentingan bersama terkait isu lingkungan. Pada dasarnya, media sosial yang dimiliki Belantara Fondation telah melakukan tugas-tugas informatif dan mengenai lingkungan. Hal yang patut dilakukan ke depan oleh Belantara Fondation adalah konsistensi dalam memberikan informasi mengenai lingkungan. Selain itu, kerjasama dengan ilmuan lingkungan untuk memberikan informasi kepada masyarakat harus terus dilakukan guna menjaga validitas informasi mengenai kerusakan, antisipasi dan pelestarian lingkungan.","H1, HE, HM, HT",Belantara Foundation sebagai Media Komunikasi Lingkungan,2020,
